year,title,authors,venue,publicationDate,citationCount,category,keywordTags,doi,sourceId,url,workType,language,relevanceScore,relevanceReason,abstractSnippet
2005,"LIS1 RNA interference blocks neural stem cell division, morphogenesis, and motility at multiple stages","J. Tsai, Yu Chen, A. Kriegstein, R. Vallee",Journal of Cell Biology,2005-09-12,408,"EEG, MEG, and Electrophysiology",human;non-human,10.1083/jcb.200505166,1b14ead82425fb8dfede96dc008c10b143a6157b,https://doi.org/10.1083/jcb.200505166,JournalArticle; Study,unknown,3,brain; neural; glia,Mutations in the human LIS1 gene cause the smooth brain disease classical lissencephaly.
2005,"Taste, olfactory, and food texture processing in the brain, and the control of food intake.",E. Rolls,Physiology and Behavior,2005-05-19,408,Cognitive and Systems Neuroscience,,10.1016/J.PHYSBEH.2005.04.012,1dd61f5827eab9f8ebd98fca82f3f0f945983497,https://doi.org/10.1016/J.PHYSBEH.2005.04.012,Review; JournalArticle,unknown,4,brain; brain in title,
2005,Endocannabinoid signaling system and brain reward: emphasis on dopamine.,E. Gardner,"Pharmacology, Biochemistry and Behavior",2005-06-01,407,Cognitive and Systems Neuroscience,,10.1016/J.PBB.2005.01.032,f1f1d90062ea4a3ba227436541d1118edbfc12da,https://doi.org/10.1016/J.PBB.2005.01.032,Review; JournalArticle,unknown,4,brain; brain in title,
2005,MR-based automatic delineation of volumes of interest in human brain PET images using probability maps,"C. Svarer, K. Madsen, S. Hasselbalch, L. Pinborg, S. Haugbol, V. Frokjaer, et al.",NeuroImage,2005-02-15,407,Neuroimaging and Brain Mapping,human,10.1016/J.NEUROIMAGE.2004.10.017,a3af1f0476de8d1615153b9bed2cfc1a4b87ab00,https://doi.org/10.1016/J.NEUROIMAGE.2004.10.017,JournalArticle; ClinicalTrial,unknown,4,brain; brain in title,
2005,Cognitive functions correlate with white matter architecture in a normal pediatric population: A diffusion tensor MRI study,"V. Schmithorst, M. Wilke, B. Dardzinski, S. Holland",Human Brain Mapping,2005-10-01,406,Neuroimaging and Brain Mapping,MRI;human,10.1002/hbm.20149,ac46c8d40464710d6d8a56369fc8d3dd372f4681,https://doi.org/10.1002/hbm.20149,JournalArticle; Study,unknown,1,mri,
2005,Neural pathways mediating bilateral interactions between the upper limbs.,"R. Carson, R. Carson",Brain research. Brain research reviews,2005-11-01,406,General Brain Science and Reviews,,10.1016/J.BRAINRESREV.2005.03.005,b4b9ed25ca350a3094cc82a2fb092ffa4d8932af,https://doi.org/10.1016/J.BRAINRESREV.2005.03.005,Review; JournalArticle,unknown,1,neural,
2005,Distinguishable brain activation networks for short- and long-term motor skill learning.,"A. Floyer-Lea, Paul M. Matthews",Journal of Neurophysiology,2005-07-01,405,Cognitive and Systems Neuroscience,connectome,10.1152/JN.00717.2004,a732c8295a5c9537002514a71dded12ff242d118,https://doi.org/10.1152/JN.00717.2004,JournalArticle; Study,unknown,4,brain; brain in title,
2005,Monocyte Chemoattractant Protein-1 Regulation of Blood-Brain Barrier Permeability,"S. Stamatovic, P. Shakui, R. Keep, B. Moore, S. Kunkel, N. Van Rooijen, et al.",Journal of Cerebral Blood Flow and Metabolism,2005-05-01,404,"Cerebrovascular, Metabolism, and Brain Injury",,10.1038/sj.jcbfm.9600055,34ade6ae01b5c726d6d0e2be8cbc2dd00f5bf0c4,https://doi.org/10.1038/sj.jcbfm.9600055,JournalArticle,unknown,4,brain; brain in title,
2005,Integration of touch and sound in auditory cortex.,"C. Kayser, C. Petkov, M. Augath, N. Logothetis",Neuron,2005-10-20,403,"Cellular, Molecular, and Synaptic Neuroscience",non-human,10.1016/J.NEURON.2005.09.018,2d6f9a5b78ddb1105cf7791000ec6d9c570bbfd1,https://doi.org/10.1016/J.NEURON.2005.09.018,JournalArticle; Study,unknown,4,cortex; neuroscience term,
2005,Magnetic resonance imaging (MRI) measurement of hippocampal volume in posttraumatic stress disorder: a meta-analysis.,"N. Kitayama, V. Vaccarino, M. Kutner, Paul Weiss, J. Bremner",Journal of Affective Disorders,2005-09-01,403,Neuroimaging and Brain Mapping,MRI,10.1016/J.JAD.2005.05.014,692a88f6518d00d3ebe49efb3f984c624d7631d6,https://doi.org/10.1016/J.JAD.2005.05.014,MetaAnalysis; JournalArticle,unknown,1,mri,
2005,Release of extracellular membrane particles carrying the stem cell marker prominin-1 (CD133) from neural progenitors and other epithelial cells,"A. Marzesco, Peggy Janich, Michaela Wilsch-Bräuninger, Véronique Dubreuil, K. Langenfeld, D. Corbeil, et al.",Journal of Cell Science,2005-07-01,403,General Brain Science and Reviews,,10.1242/jcs.02439,967e9eaf17f19f9e93b5d04dc781e7368771b941,https://doi.org/10.1242/jcs.02439,JournalArticle,unknown,1,neural,
2005,Developmental changes in human cerebral functional organization for word generation.,"T. Brown, H. Lugar, R. Coalson, F. Miezin, S. Petersen, B. Schlaggar",Cerebral Cortex,2005-03-01,402,"Brain Development, Plasticity, and Connectomics",human;non-human,10.1093/CERCOR/BHH129,7e3dd1b30bf3040c07cc1a3e0841fad18bbf3b60,https://doi.org/10.1093/CERCOR/BHH129,JournalArticle; ClinicalTrial,unknown,1,cerebral,
2005,Dopaminergic neurons.,"Shankar J. Chinta, J. Andersen",International Journal of Biochemistry and Cell Biology,2005-05-01,402,"Cellular, Molecular, and Synaptic Neuroscience",,10.1016/J.BIOCEL.2004.09.009,4200835d0166c7a8c7c18450176aa0a7e7292350,https://doi.org/10.1016/J.BIOCEL.2004.09.009,Review; JournalArticle,unknown,4,neuron; neuroscience term,
2005,Phase locking of single neuron activity to theta oscillations during working memory in monkey extrastriate visual cortex.,"Han Lee, G. V. Simpson, N. Logothetis, G. Rainer",Neuron,2005-01-06,402,Cognitive and Systems Neuroscience,non-human,10.1016/J.NEURON.2004.12.025,8985da5aefd157a3e667ce41fc83d79e74a95d75,https://doi.org/10.1016/J.NEURON.2004.12.025,JournalArticle,unknown,5,cortex; neuron; neuroscience term,
2005,Sortilin Controls Intracellular Sorting of Brain-Derived Neurotrophic Factor to the Regulated Secretory Pathway,"Zhe-Yu Chen, A. Ieraci, Henry K Teng, H.E.T. Dall, Chui-Xiang Meng, D. G. Herrera, et al.",Journal of Neuroscience,2005-06-29,402,"Cellular, Molecular, and Synaptic Neuroscience",human,10.1523/JNEUROSCI.1017-05.2005,227b4e228e5df1cbc65d09f558f4e2a9b044161e,https://doi.org/10.1523/JNEUROSCI.1017-05.2005,JournalArticle,unknown,8,brain; neuron; brain in title; neuroscience term,"Brain-derived neurotrophic factor (BDNF), after activity-dependent secretion from neurons, modulates critical nervous system functions."
2005,The influence of age on apoptotic and other mechanisms of cell death after cerebral hypoxia-ischemia,"Changlian Zhu, Changlian Zhu, Xiaoyang Wang, Xiaoyang Wang, Falin Xu, Falin Xu, et al.",Cell Death and Differentiation,2005-02-01,402,"Cerebrovascular, Metabolism, and Brain Injury",,10.1038/sj.cdd.4401545,a2d3ee77d365befc7ab940a1754a83a2f4785c85,https://doi.org/10.1038/sj.cdd.4401545,JournalArticle,unknown,1,cerebral,
2005,Exploring the unity and diversity of the neural substrates of executive functioning,"F. Collette, M. Van der Linden, Steven Laureys, G. Delfiore, C. Degueldre, A. Luxen, et al.",Human Brain Mapping,2005-08-01,401,Neuroimaging and Brain Mapping,human;non-human,10.1002/hbm.20118,a8f6ad62fc8443127bcf582a6cc5021fb255b47e,https://doi.org/10.1002/hbm.20118,JournalArticle,unknown,1,neural,
2005,Mitochondrial permeability transition in CNS trauma: Cause or effect of neuronal cell death?,"P. Sullivan, Alexander Sasha Rabchevsky, P. Waldmeier, J. Springer",Journal of Neuroscience Research,2005,401,"Cellular, Molecular, and Synaptic Neuroscience",,10.1002/jnr.20292,b9799fd4e750f5528229877722f892e091547ac4,https://doi.org/10.1002/jnr.20292,Review; JournalArticle,unknown,4,neuron; neuroscience term,
2005,Gliosis and brain remodeling after treatment of stroke in rats with marrow stromal cells,"Yi Li, Jieli Chen, Chunling Zhang, Lei Wang, Dunyue Lu, M. Katakowski, et al.",Glia,2005-02-01,400,"Cellular, Molecular, and Synaptic Neuroscience",non-human,10.1002/glia.20126,580272d9ef7bab27a80318af4a30ec930fee0ecf,https://doi.org/10.1002/glia.20126,JournalArticle; Study,unknown,4,brain; brain in title,
2005,Words in the brain's language: an experimental investigation.,"Patrizia Setola, R. Reilly",Brain and Language,2005-09-01,399,General Brain Science and Reviews,,10.1016/J.BANDL.2004.12.007,76e958b7c5c75e032a9a301b17a7a6ce98333a8f,https://doi.org/10.1016/J.BANDL.2004.12.007,JournalArticle,unknown,4,brain; brain in title,
2005,A brain-liver circuit regulates glucose homeostasis.,"A. Pocai, S. Obici, G. Schwartz, L. Rossetti",Cell Metabolism,2005,398,"Cerebrovascular, Metabolism, and Brain Injury",,10.1016/J.CMET.2004.11.001,6fa7b65c9702c2096b590b2b5392f6cfe0755079,https://doi.org/10.1016/J.CMET.2004.11.001,JournalArticle,unknown,4,brain; brain in title,
2005,Expression pattern of the transcription factor Olig2 in response to brain injuries: implications for neuronal repair.,"A. Buffo, M. Vosko, Dilek Ertürk, G. Hamann, M. Jucker, D. Rowitch, et al.",Proceedings of the National Academy of Sciences of the United States of America,2005-12-13,397,"Cellular, Molecular, and Synaptic Neuroscience",,10.1073/PNAS.0506535102,5fd5e578606d56eade4a0b5f6f040c4528a1029c,https://doi.org/10.1073/PNAS.0506535102,JournalArticle; Study,unknown,8,brain; neuron; brain in title; neuroscience term,
2005,Forty-five years of split-brain research and still going strong,M. Gazzaniga,Nature Reviews Neuroscience,2005-08-01,397,General Brain Science and Reviews,,10.1038/nrn1723,1e66f9922f222b9bd0cff79ab5ba558f2935c639,https://doi.org/10.1038/nrn1723,Review; JournalArticle,unknown,4,brain; brain in title,
2005,Hypermethylation of the reelin (RELN) promoter in the brain of schizophrenic patients: A preliminary report,"H. Abdolmaleky, Kuang-Hung Cheng, Andrea L. Russo, Cassandra L. Smith, S. Faraone, M. Wilcox, et al.",American Journal of Medical Genetics Part B: Neuropsychiatric Genetics,2005-04-05,397,Clinical Neurology and Neurodegeneration,human,10.1002/ajmg.b.30140,cd88952897055325fad5ff0b3a41d88f3ff6d7b2,https://doi.org/10.1002/ajmg.b.30140,JournalArticle; Study,unknown,4,brain; brain in title,
2005,INVOKING AFFECT,Clare Hemmings,A Museum Studies Approach to Heritage,2005-09-01,397,"EEG, MEG, and Electrophysiology",EEG;non-human,10.1080/09502380500365473,3ef9ac3c6a7defc757bf08041f299f7cb52d3609,https://doi.org/10.1080/09502380500365473,paper,unknown,1,brain,This article interrogates the contemporary emergence of affect as critical object and perspective through which to understand the social world and our place within it.
2005,"The Neurosteroids Progesterone and Allopregnanolone Reduce Cell Death, Gliosis, and Functional Deficits after Traumatic Brain Injury in Rats","M. Djebaili, Qingmin Guo, E. H. Pettus, S. Hoffman, D. Stein",Journal of Neurotrauma,2005-01-01,397,"Cerebrovascular, Metabolism, and Brain Injury",non-human,10.1089/neu.2005.22.106,ad9bbec205df3822177308226b88d6983bfb40d1,https://doi.org/10.1089/neu.2005.22.106,JournalArticle,unknown,4,brain; brain in title,
2005,Chemokine receptor CCR5 promotes leukocyte trafficking to the brain and survival in West Nile virus infection,"W. Glass, Jean K. Lim, R. Cholera, A. Pletnev, Ji-Liang Gao, P. Murphy",Journal of Experimental Medicine,2005-10-17,396,"Cellular, Molecular, and Synaptic Neuroscience",non-human,10.1084/jem.20042530,33b0ab25a7f430e62a32538b60d25814053a110c,https://doi.org/10.1084/jem.20042530,JournalArticle; Study,unknown,4,brain; brain in title,The molecular immunopathogenesis of West Nile virus (WNV) infection is poorly understood.
2005,Cortical local field potential encodes movement intentions in the posterior parietal cortex.,"H. Scherberger, M. Jarvis, R. Andersen",Neuron,2005-04-21,396,"Cellular, Molecular, and Synaptic Neuroscience",,10.1016/J.NEURON.2005.03.004,930280003cb2e7a55a4445bf1c6f5b10bf2c7adb,https://doi.org/10.1016/J.NEURON.2005.03.004,JournalArticle; Study,unknown,5,cortex; cortical; neuroscience term,
2005,Modeling sleep and wakefulness in the thalamocortical system.,"Sean L. Hill, G. Tononi",Journal of Neurophysiology,2005-03-01,396,Computational Neuroscience and AI,,10.1152/JN.00915.2004,b671b168b98c96ac42dc10cf0a3329c1e5e36611,https://doi.org/10.1152/JN.00915.2004,JournalArticle; Study,unknown,1,cortical,
2005,Role of retinoid signalling in the adult brain.,"M. Lane, S. Bailey",Progress in neurobiology,2005-03-01,396,General Brain Science and Reviews,human,10.1016/J.PNEUROBIO.2005.03.002,33cbd7842301be595b0fcb1815febbbd4f05f104,https://doi.org/10.1016/J.PNEUROBIO.2005.03.002,Review; JournalArticle,unknown,4,brain; brain in title,
2005,Selective Lengthening of the Cell Cycle in the Neurogenic Subpopulation of Neural Progenitor Cells during Mouse Brain Development,"F. Calegari, W. Haubensak, Christiane Haffner, W. Huttner",Journal of Neuroscience,2005-07-13,396,"Cellular, Molecular, and Synaptic Neuroscience",non-human,10.1523/JNEUROSCI.0778-05.2005,109cd2004f1b781fa74d8c0c3c48bfdf9cd4e586,https://doi.org/10.1523/JNEUROSCI.0778-05.2005,JournalArticle; Study,unknown,10,brain; cortex; neuron; neural; brain in title; neuroscience term,"During embryonic development of the mammalian brain, the average cell-cycle length of progenitor cells in the ventricular zone is known to increase."
2005,Strange feelings: do amygdala abnormalities dysregulate the emotional brain in schizophrenia?,"A. Aleman, R. Kahn",Progress in neurobiology,2005-12-01,396,General Brain Science and Reviews,,10.1016/J.PNEUROBIO.2005.11.005,97aa769005ae0984237d3d3e9f900adbb4fb230e,https://doi.org/10.1016/J.PNEUROBIO.2005.11.005,Review; JournalArticle,unknown,5,brain; amygdala; brain in title,
2005,Uncovering regulatory pathways that affect hematopoietic stem cell function using 'genetical genomics',"L. Bystrykh, Ellen Weersing, B. Dontje, S. Sutton, M. Pletcher, T. Wiltshire, et al.",Nature Genetics,2005-03-01,396,General Brain Science and Reviews,non-human,10.1038/ng1497,07d1536b8df0e4fa18856d7241f493ca21061099,https://doi.org/10.1038/ng1497,JournalArticle,unknown,1,brain,We combined large-scale mRNA expression analysis and gene mapping to identify genes and loci that control hematopoietic stem cell (HSC) function.
2005,Speech perception as a window for understanding plasticity and commitment in language systems of the brain.,"J. Werker, R. C. Tees",Developmental Psychobiology,2005-04-01,395,"Brain Development, Plasticity, and Connectomics",,10.1002/DEV.20060,fd9095b3d6c8f1350bc39d14fae8f74fc6cb57a8,https://doi.org/10.1002/DEV.20060,Review; JournalArticle,unknown,4,brain; brain in title,
2005,Brain-derived neurotrophic factor Val66met polymorphism and volume of the hippocampal formation,"P. Szeszko, Robert Lipsky, C. Mentschel, D. Robinson, H. Gunduz-Bruce, S. Sevy, et al.",Molecular Psychiatry,2005-07-01,394,"Cellular, Molecular, and Synaptic Neuroscience",human,10.1038/sj.mp.4001656,3c9b6c3402b2d1a64a96e845afd7b3a2e1ce1da4,https://doi.org/10.1038/sj.mp.4001656,JournalArticle; ClinicalTrial,unknown,4,brain; brain in title,
2005,Comparison and validation of tissue modelization and statistical classification methods in T1-weighted MR brain images,"M. Cuadra, L. Cammoun, T. Butz, O. Cuisenaire, J. Thiran",IEEE Transactions on Medical Imaging,2005-12-05,394,"Brain Development, Plasticity, and Connectomics",,10.1109/TMI.2005.857652,1049e2d6170e6181cf702b87ac1cd7b935ac0e8c,https://doi.org/10.1109/TMI.2005.857652,Study; JournalArticle,unknown,4,brain; brain in title,
2005,Multi-disciplinary rehabilitation for acquired brain injury in adults of working age.,"L. Turner-Stokes, Anton Pick, Ajoy Nair, P. Disler, D. Wade",Cochrane Database of Systematic Reviews,2005,394,General Brain Science and Reviews,human,10.1002/14651858.cd004170,55fbc84b038108e826332e99999c35d92edebbf6,https://doi.org/10.1002/14651858.cd004170,Review; JournalArticle,unknown,4,brain; brain in title,
2005,Validity of the Patient Health Questionnaire-9 in Assessing Depression Following Traumatic Brain Injury,"J. Fann, C. Bombardier, S. Dikmen, P. Esselman, C. Warms, E. Pelzer, et al.",The journal of head trauma rehabilitation,2005-11-01,394,Clinical Neurology and Neurodegeneration,human,10.1097/00001199-200511000-00003,a920c1726842ec3b857c871d3352a1d5ebbdd537,https://doi.org/10.1097/00001199-200511000-00003,Study; JournalArticle,unknown,4,brain; brain in title,
2005,"White matter lesion progression, brain atrophy, and cognitive decline: The Austrian stroke prevention study","R. Schmidt, S. Ropele, C. Enzinger, K. Petrovic, Stephen M. Smith, H. Schmidt, et al.",Annals of Neurology,2005-10-01,394,Clinical Neurology and Neurodegeneration,,10.1002/ana.20630,fd8c2f3ac2de0746b781a70bade478d02f70ee38,https://doi.org/10.1002/ana.20630,JournalArticle; Study,unknown,4,brain; brain in title,
2005,"Chronic stress, as well as acute stress, reduces BDNF mRNA expression in the rat hippocampus but less robustly.","Shuji Murakami, H. Imbe, Y. Morikawa, C. Kubo, E. Senba",Neurosciences research,2005-10-01,392,Cognitive and Systems Neuroscience,non-human,10.1016/J.NEURES.2005.06.008,d313ab2835776a67b71005e2ca7eff39ed2ad832,https://doi.org/10.1016/J.NEURES.2005.06.008,JournalArticle; Study,unknown,4,hippocampus; neuroscience term,
2005,"Estradiol Activates Group I and II Metabotropic Glutamate Receptor Signaling, Leading to Opposing Influences on cAMP Response Element-Binding Protein","Marissa I. Boulware, J. Weick, Bryan R. Becklund, Sidney P. Kuo, R. Groth, P. Mermelstein",Journal of Neuroscience,2005-05-18,392,"Cellular, Molecular, and Synaptic Neuroscience",non-human;stimulation,10.1523/JNEUROSCI.1427-05.2005,b93491081e1c8d5f74ee63b47b4d2fb9032f4c77,https://doi.org/10.1523/JNEUROSCI.1427-05.2005,JournalArticle; Study,unknown,5,brain; neuron; neuroscience term,"In addition to mediating sexual maturation and reproduction through stimulation of classical intracellular receptors that bind DNA and regulate gene expression, estradiol is also thought to influence various brain functions by acting on receptors localized to the neuronal membrane surface."
2005,Prospect theory on the brain? Toward a cognitive neuroscience of decision under risk.,"C. Trepel, C. Fox, R. Poldrack",Brain research. Cognitive brain research,2005-04-01,392,General Brain Science and Reviews,,10.1016/J.COGBRAINRES.2005.01.016,510d5648c2742c99d3ea0a58bde3067c5ba7b0e8,https://doi.org/10.1016/J.COGBRAINRES.2005.01.016,Review; JournalArticle,unknown,8,brain; neuroscience; brain in title; neuroscience term,
2005,"Ongoing Adaptive Evolution of ASPM, a Brain Size Determinant in Homo sapiens","N. Mekel-Bobrov, S. L. Gilbert, P. Evans, E. Vallender, Jeffrey R. Anderson, R. Hudson, et al.",Science,2005-09-09,390,General Brain Science and Reviews,,10.1126/SCIENCE.1116815,d4431c6002499407edc2ac256fb65e199e410dfb,https://doi.org/10.1126/SCIENCE.1116815,JournalArticle,unknown,4,brain; brain in title,
2005,Serotonin and Depression: A Disconnect between the Advertisements and the Scientific Literature,"Jeffrey R. Lacasse, J. Leo",PLoS Medicine,2005-11-08,390,General Brain Science and Reviews,non-human,10.1371/journal.pmed.0020392,f94b89da98adba929d99aac04f00a9401a530531,https://doi.org/10.1371/journal.pmed.0020392,Review; JournalArticle,unknown,1,brain,Many ads for SSRI antidepressants claim that the drugs boost brain serotonin levels.
2005,The effect of Bcrp1 (Abcg2) on the in vivo pharmacokinetics and brain penetration of imatinib mesylate (Gleevec): implications for the use of breast cancer resistance protein and P-glycoprotein inhibitors to enable the brain penetration of imatinib in patients.,"P. Breedveld, D. Pluim, G. Cipriani, P. Wielinga, O. van Tellingen, A. Schinkel, et al.",Cancer Research,2005-04-01,390,Clinical Neurology and Neurodegeneration,human;non-human,10.1158/0008-5472.CAN-04-2416,31a9e7e9d14e1a45fa757c5a42aac6940ce9883c,https://doi.org/10.1158/0008-5472.CAN-04-2416,JournalArticle,unknown,4,brain; brain in title,
2005,Effect of treatment on serum brain-derived neurotrophic factor levels in depressed patients,"Dr. A. Saffet Gonul, Dr. F. Akdeniz, Dr. F. Taneli, Dr. O. Donat, Dr. Ç. Eker, Dr. S. Vahip",European Archives of Psychiatry and Clinical Neuroscience,2005-04-06,389,Clinical Neurology and Neurodegeneration,human,10.1007/s00406-005-0578-6,5b409f1af2beac1067404dfe177e625734befd05,https://doi.org/10.1007/s00406-005-0578-6,JournalArticle,unknown,4,brain; brain in title,
2005,Brain waste? Educated immigrants in the U.S. labor market,"A. Mattoo, Ileana Cristina Neagu, C. Ozden",Unknown venue,2005-04-01,388,"EEG, MEG, and Electrophysiology",ECoG;human;non-human,10.1016/J.JDEVECO.2007.05.001,31f84799dfa5ef37b8a33f03dfc410a5f4c51b1b,https://doi.org/10.1016/J.JDEVECO.2007.05.001,paper,unknown,5,brain; ecog; brain in title,The authors investigate the occupational placement of immigrants in the U.S.
2005,Imaging of the brain in acute ischaemic stroke: comparison of computed tomography and magnetic resonance diffusion-weighted imaging,"P. Barber, Michael D. Hill, M. Eliasziw, A. Demchuk, J. H. Pexman, M. Hudon, et al.",Journal of Neurology Neurosurgery & Psychiatry,2005-10-14,388,Clinical Neurology and Neurodegeneration,MRI,10.1136/jnnp.2004.059261,0c17a8b74201a1016ea7923e73c38675d1917757,https://doi.org/10.1136/jnnp.2004.059261,Study; JournalArticle,unknown,4,brain; brain in title,
2005,Posterior parietal cortex activity predicts individual differences in visual short-term memory capacity,"Pashler Becker, Bruce Funahashi","Cognitive, Affective, & Behavioral Neuroscience",2005-06-01,388,Cognitive and Systems Neuroscience,MRI;fMRI;human;non-human,10.3758/CABN.5.2.144,71f3dbb8df7be00bd9d6ce380fbbe5f219c9bceb,https://doi.org/10.3758/CABN.5.2.144,JournalArticle; Study,unknown,6,brain; cortex; neural; neuroscience term,Humans show a severe capacity limit in the number of objects they can store in visual short-term memory (VSTM).
2005,Krebs Cycle Intermediates Modulate Thiobarbituric Acid Reactive Species (TBARS) Production in Rat Brain In Vitro,"R. Puntel, C. W. Nogueira, J. Rocha",Neurochemical Research,2005-02-01,387,General Brain Science and Reviews,non-human,10.1007/s11064-004-2445-7,6554eb686cd5168039a5b086bdd4b105f7adaa98,https://doi.org/10.1007/s11064-004-2445-7,JournalArticle,unknown,4,brain; brain in title,
2005,Multiagent chemotherapy and deferred radiotherapy in infants with malignant brain tumors: a report from the Children's Cancer Group.,"J. Geyer, R. Sposto, M. Jennings, J. Boyett, R. Axtell, D. Breiger, et al.",Journal of Clinical Oncology,2005-10-20,387,Clinical Neurology and Neurodegeneration,human,10.1200/JCO.2005.09.095,b1e899f47461fabd21fcdf32b1b1d268e9a71a27,https://doi.org/10.1200/JCO.2005.09.095,JournalArticle; ClinicalTrial,unknown,4,brain; brain in title,
2005,Neural substrates of faulty decision-making in abstinent marijuana users,"K. Bolla, D. Eldreth, J. Matochik, J. Cadet",NeuroImage,2005-06-01,386,Cognitive and Systems Neuroscience,human;non-human,10.1016/j.neuroimage.2005.02.012,1ae499e13782d1435b25e293488b7876d6273059,https://doi.org/10.1016/j.neuroimage.2005.02.012,JournalArticle; ClinicalTrial,unknown,1,neural,
2005,Risk of second brain tumor after conservative surgery and radiotherapy for pituitary adenoma: update after an additional 10 years.,"G. Minniti, D. Traish, S. Ashley, A. Gonsalves, M. Brada",Journal of Clinical Endocrinology and Metabolism,2005-02-01,386,Clinical Neurology and Neurodegeneration,human,10.1210/JC.2004-1152,fac8ef59b6c124ecf0650f5c7612f15ee6e59062,https://doi.org/10.1210/JC.2004-1152,JournalArticle,unknown,4,brain; brain in title,
2005,Targeted nanoparticles for drug delivery through the blood-brain barrier for Alzheimer's disease.,"C. Roney, P. Kulkarni, V. Arora, P. Antich, F. Bonte, Aimei Wu, et al.",Journal of Controlled Release,2005-11-28,385,Clinical Neurology and Neurodegeneration,,10.1016/J.JCONREL.2005.07.024,56606147b64bb12283886bc2d6988a79758c51d7,https://doi.org/10.1016/J.JCONREL.2005.07.024,Review; JournalArticle,unknown,4,brain; brain in title,
2005,The efficacy of playing a virtual reality game in modulating pain for children with acute burn injuries: A randomized controlled trial [ISRCTN87413556],"Debashis Das, K. Grimmer, A. Sparnon, S. McRae, B. Thomas",BMC Pediatrics,2005-03-03,385,"Brain Development, Plasticity, and Connectomics",human,10.1186/1471-2431-5-1,f85ddff62527ef1d5d851af3eaa3c6078e517603,https://doi.org/10.1186/1471-2431-5-1,JournalArticle,unknown,1,brain,"BackgroundThe management of burn injuries is reported as painful, distressing and a cause of anxiety in children and their parents."
2005,Binding of the Positron Emission Tomography Tracer Pittsburgh Compound-B Reflects the Amount of Amyloid-β in Alzheimer's Disease Brain But Not in Transgenic Mouse Brain,"W. Klunk, B. Lopresti, M. Ikonomovic, I. Lefterov, R. Koldamova, E. Abrahamson, et al.",Journal of Neuroscience,2005-11-16,384,"Brain Development, Plasticity, and Connectomics",non-human,10.1523/JNEUROSCI.2990-05.2005,a9c6d9d96e8ca1a981772bb9f630504b84a3af74,https://doi.org/10.1523/JNEUROSCI.2990-05.2005,JournalArticle; Study,unknown,4,brain; brain in title,"g the development of in vivo amyloid imaging agents, an effort was made to use micro-positron emission tomography (PET) imaging in the presenilin-1 (PS1)/amyloid precursor protein (APP) transgenic mouse model of CNS amyloid deposition to screen new compounds and further study Pittsburgh Compound-B (PIB), a PET tracer that has been shown to be retained well in amyloid-containing areas of Alzheimer's disease (AD) brain."
2005,"Complete rescue of obesity, diabetes, and infertility in db/db mice by neuron-specific LEPR-B transgenes.","C. de Luca, T. Kowalski, Yiying Zhang, J. Elmquist, Charlotte E. Lee, M. Kilimann, et al.",Journal of Clinical Investigation,2005-12-01,384,"Cellular, Molecular, and Synaptic Neuroscience",human;non-human,10.1172/JCI24059,ae507e6bcf0d9e5dd19ee3919fc4ab2b98659460,https://doi.org/10.1172/JCI24059,JournalArticle,unknown,4,neuron; neuroscience term,
