year,title,authors,venue,publicationDate,citationCount,category,keywordTags,doi,sourceId,url,workType,language,relevanceScore,relevanceReason,abstractSnippet
1946,Connections of the cerebral cortex. I. The albino rat. A. Topography of the cortical areas,W. Krieg,Unknown venue,1946-04-01,1012,General Brain Science and Reviews,non-human,10.1002/cne.900840205,fe0b78b1fd51b37b7e5984913f2262a90d808a95,https://doi.org/10.1002/cne.900840205,paper,unknown,6,cerebral; cortex; cortical; neuroscience term,
1946,THE RAPID PRODUCTION OF ACUTE DISSEMINATED ENCEPHALOMYELITIS IN RHESUS MONKEYS BY INJECTION OF HETEROLOGOUS AND HOMOLOGOUS BRAIN TISSUE WITH ADJUVANTS,"E. Kabat, A. Wolf, A. Bezer",Journal of Experimental Medicine,1946-12-31,397,General Brain Science and Reviews,human;non-human,10.1084/jem.85.1.117,31a25d05ad97235f3cb09f9701bc10e6d04f0149,https://doi.org/10.1084/jem.85.1.117,JournalArticle,unknown,4,brain; brain in title,1. A picture resembling acute disseminated encephalomyelitis in the human being has been regularly and rapidly produced in rhesus monkeys by injection of emulsions of adult rabbit and monkey brain administered with adjuvants.
1946,"Contralateral, ipsilateral, and bilateral representation of cutaneous receptors in somatic areas I and II of the cerebral cortex of pig, sheep, and other mammals.","C. Woolsey, D. Fairman",Surgery,1946-05-01,298,General Brain Science and Reviews,,10.5555/URI:PII:003960604690061X,508a8fb6134a50f8a30e6842ee8835a2bd18966a,https://doi.org/10.5555/URI:PII:003960604690061X,JournalArticle,unknown,5,cerebral; cortex; neuroscience term,
1946,The Lucite Calvarium-A Method for Direct Observation of the Brain: II. Cranial Trauma and Brain Movement,"R. Pudenz, C. Shelden",Unknown venue,1946-11-01,241,General Brain Science and Reviews,,10.3171/JNS.1946.3.6.0487,8c365cba66a8505d19656075216029825f7a5c3e,https://doi.org/10.3171/JNS.1946.3.6.0487,paper,unknown,4,brain; brain in title,
1946,"Physiology of insect diapause; the role of the brain in the production and termination of pupal dormancy in the giant silkworm, Platysamia cecropia.",C. Williams,The Biological Bulletin,1946-06-01,227,Neuroimaging and Brain Mapping,human;non-human;stimulation,10.2307/1538121,8a6e8568dd83fc7c1fe333a84d3fa354308ae7e8,https://doi.org/10.2307/1538121,JournalArticle,unknown,4,brain; brain in title,"1. The physiological control of pupal diapause has been studied on a total of approximately 1200 pupae of the giant silkworms, Platysamia cecropia, Telca polyphemus, Samia walkeri, and Callosamia promethea.2."
1946,The cytoarchitecture of the cerebral cortex of ateles: A critical examination of architectonic studies,"K. Lashley, G. Clark",The Journal of comparative neurology,1946-10-01,217,Clinical Neurology and Neurodegeneration,non-human,10.1002/cne.900850207,907be9616039e6b6a0e5a5c41f9178a490ccd1d2,https://doi.org/10.1002/cne.900850207,JournalArticle,unknown,5,cerebral; cortex; neuroscience term,
1946,Brain stem facilitation of cortical motor response.,"R. Rhines, H. Magoun",Journal of Neurophysiology,1946-05-01,210,General Brain Science and Reviews,,10.1152/JN.1946.9.3.219,64f9bacea747a28f5c63df5f401ed11c249404f2,https://doi.org/10.1152/JN.1946.9.3.219,JournalArticle,unknown,5,brain; cortical; brain in title,
1946,Analysis of the Electrical Response of the Human Cortex to Photic Stimulation,"W. Walter, V. Dovey, H. Shipton",Nature,1946-10-19,190,General Brain Science and Reviews,human;stimulation,10.1038/158540A0,11fa2283e1f553128dd7b70a240381118d12825b,https://doi.org/10.1038/158540A0,JournalArticle,unknown,4,cortex; neuroscience term,
1946,The lucite calvarium; a method for direct observation of the brain; cranial trauma and brain movement.,"Lieut. C. Hunter Shelden, Lieut. Robert H. Pudenz, Lt. Comdr. Joseph S. Restarski, C. Craig",Journal of Neurosurgery,1946,158,General Brain Science and Reviews,,10.3171/JNS.1944.1.1.0067,4c626b6c0546c126161847782818be22cb4a9fa1,https://doi.org/10.3171/JNS.1944.1.1.0067,JournalArticle,unknown,4,brain; brain in title,
1946,Accurate placement of minute lesions in the brain of the albino rat.,W. Krieg,"Quarterly bulletin. Northwestern University (Evanston, Ill.). Medical School",1946,146,General Brain Science and Reviews,non-human,,1974a0ed9af2a0f3bc06a089b7a0232c05de826b,https://www.semanticscholar.org/paper/1974a0ed9af2a0f3bc06a089b7a0232c05de826b,JournalArticle,unknown,4,brain; brain in title,
1946,Presence and action of acetylcholine in experimental brain trauma.,M. Bornstein,Journal of Neurophysiology,1946-09-01,107,General Brain Science and Reviews,,10.1152/JN.1946.9.5.349,614ff580be8a5345fa028304a83dc9465ddeabe4,https://doi.org/10.1152/JN.1946.9.5.349,JournalArticle,unknown,4,brain; brain in title,
1946,The toxic effects of oxygen on brain metabolism and on tissue enzymes: 1. Brain metabolism.,F. Dickens,Biochemical Journal,1946,105,"Cerebrovascular, Metabolism, and Brain Injury",,10.1042/BJ0400145,58783d703f083c501dd00250c4eae0a46d41e36d,https://doi.org/10.1042/BJ0400145,JournalArticle,unknown,4,brain; brain in title,
1946,Rapid Production of Acute Disseminated Encephalomyelitis in Rhesus Monkeys by Injection of Brain Tissue With Adjuvants,"E. Kabat, A. Wolf, A. Bezer",Science,1946-10-18,103,General Brain Science and Reviews,non-human,10.1126/science.104.2703.362,991ff8aa25e330036efdefe01a05b736186923e3,https://doi.org/10.1126/science.104.2703.362,JournalArticle,unknown,4,brain; brain in title,
1946,The mammalian midbrain and isthmus regions. Part II. The fiber connections. A. The relations of the tegmentum of the midbrain with the basal ganglia in Macaca mulatta,"R. T. Woodburne, E. Crosby, R. E. McCotter",Unknown venue,1946-08-01,100,"Cellular, Molecular, and Synaptic Neuroscience",,10.1002/CNE.900850107,c9a0281aef03af54c9834d373b29572b1ad50749,https://doi.org/10.1002/CNE.900850107,paper,unknown,6,brain; basal ganglia; glia; brain in title,
1946,"Motility, behavior, and the brain.",Y. Pi,Unknown venue,1946-02-01,87,Cognitive and Systems Neuroscience,,,d3500b5a57f2170d241573e5b97fcdc37e80b64f,https://www.semanticscholar.org/paper/d3500b5a57f2170d241573e5b97fcdc37e80b64f,paper,unknown,4,brain; brain in title,
1946,Protection of cholinesterase against irreversible inactivation by di-isopropyl fluorophosphate in vitro.,G. Koelle,Journal of Pharmacology and Experimental Therapeutics,1946-11-01,77,Neuroimaging and Brain Mapping,non-human,10.1016/s0022-3565(25)05920-8,57f338ad62b43ba8cd5d08b53e15d4dba53eea7a,https://doi.org/10.1016/s0022-3565(25)05920-8,JournalArticle,unknown,1,brain,"1. Eserine, by combining reversibly with rat brain cholinesterase, has been shown to protect the enzyme against irreversible inactivation by DFP in vitro ."
1946,The in vivo inactivation by cyanide of brain cytochrome oxidase and its effect on glycolysis and on the high energy phosphorus compounds in brain.,"H. Albaum, J. Tepperman, O. Bodansky",Journal of Biological Chemistry,1946-07-01,77,"Cellular, Molecular, and Synaptic Neuroscience",non-human,10.1016/s0021-9258(18)43046-3,4d379c5cde1b12f42ece9977873a9a0349405a85,https://doi.org/10.1016/s0021-9258(18)43046-3,JournalArticle,unknown,4,brain; brain in title,The symptomatology Jf cyanide poisoning has been known for well )ver 100 years.
1946,Histologic Studies of the Brain Following Head Trauma: II. Post-traumatic Petechial and Massive Intracerebral Hemorrhage,"Joseph P. Evans, I. Mark Scheinker",Unknown venue,1946-03-01,68,Neuroimaging and Brain Mapping,,10.3171/JNS.1946.3.2.0101,1f7ffd09ea3374548d1d5c80e5d02278909534a8,https://doi.org/10.3171/JNS.1946.3.2.0101,paper,unknown,5,brain; cerebral; brain in title,
1946,Toxic effects of oxygen and of hydrogen peroxide on brain metabolism.,"P. J. Mann, J. H. Quastel",Biochemical Journal,1946,66,"Cerebrovascular, Metabolism, and Brain Injury",,10.1042/BJ0400139,5b0eac05b2ae3e05fb3377554a64e04b47c2005a,https://doi.org/10.1042/BJ0400139,JournalArticle,unknown,4,brain; brain in title,
1946,Histologic changes in the brain in cases of fatal injury to the head; alterations in nerve cells.,"C. W. Rand, C. Courville",Archives of Neurology And Psychiatry,1946-02-01,59,Clinical Neurology and Neurodegeneration,non-human,10.1001/ARCHNEURPSYC.1946.02300130003001,bf8926339bef43d70651cab7e395a0ca50a893b6,https://doi.org/10.1001/ARCHNEURPSYC.1946.02300130003001,JournalArticle,unknown,4,brain; brain in title,
1946,Performance of brain-damaged cases on a memory-for-designs test.,"Graham Fk, Kendall Bs",Unknown venue,1946-07-01,59,Cognitive and Systems Neuroscience,,10.1037/H0056410,aec648610f1b5645869bb8f1c7818cb9e4ee5719,https://doi.org/10.1037/H0056410,paper,unknown,4,brain; brain in title,
1946,Effect of Anesthetics and Convulsants on Brain Acetylcholine Content,"Julian M. Tobias, M. Lipton, A. Lepinat",Proceedings of the Society for Experimental Biology and Medicine. Society for Experimental Biology and Medicine,1946-01-01,57,General Brain Science and Reviews,,10.3181/00379727-61-15223,70e527114c40fd31630f9fa88ce8d40a29b2b16a,https://doi.org/10.3181/00379727-61-15223,JournalArticle,unknown,4,brain; brain in title,
1946,MORPHOLOGIC CHANGES IN THE BRAIN OF MONKEYS FOLLOWING CONVULSIONS ELECTRICALLY INDUCED,"A. Ferraro, L. Roizin, M. Helfand",Journal of Neuropathology and Experimental Neurology,1946-10-01,57,Clinical Neurology and Neurodegeneration,non-human,10.1097/00005072-194610000-00002,9f3d152469b35a84b9f5670702d4cbad2e24ea04,https://doi.org/10.1097/00005072-194610000-00002,JournalArticle,unknown,4,brain; brain in title,
1946,The antennal centers and their connections within the brain of Drosophila melanogaster,M. E. Power,The Journal of comparative neurology,1946-12-01,55,Clinical Neurology and Neurodegeneration,non-human,10.1002/cne.900850307,30100f3ec0cc65ef2b4d7447d04893af52b242d1,https://doi.org/10.1002/cne.900850307,JournalArticle,unknown,4,brain; brain in title,
1946,The toxic effects of oxygen on brain metabolism and on tissue enzymes: 2. Tissue enzymes.,F. Dickens,Biochemical Journal,1946,53,"Cerebrovascular, Metabolism, and Brain Injury",,10.1042/BJ0400171,7573233c2d759a76bcac13c7f7e187b74e1f6a06,https://doi.org/10.1042/BJ0400171,JournalArticle,unknown,4,brain; brain in title,
1946,Pyruvic acid exchange of the brain.,"W. Himwich, H. Himwich",Journal of Neurophysiology,1946-03-01,51,General Brain Science and Reviews,,10.1152/JN.1946.9.2.133,bc29e4aa7faa69dd86729dcfd3108d6181691568,https://doi.org/10.1152/JN.1946.9.2.133,JournalArticle,unknown,4,brain; brain in title,
1946,LABORATORY TRANSMISSION OF JAPANESE B ENCEPHALITIS VIRUS BY SEVEN SPECIES (THREE GENERA) OF NORTH AMERICAN MOSQUITOES,"W. Reeves, W. Hammon, C. Espana",Journal of Experimental Medicine,1946-02-28,48,General Brain Science and Reviews,non-human,10.1084/JEM.83.3.185,1f7b8b1e9cbc65b2d01959360246db7b736a3876,https://doi.org/10.1084/JEM.83.3.185,JournalArticle,unknown,1,brain,In the present studies ten common species of Western North American mosquitoes have been tested for their ability to act as vectors of Japanese B encephalitis virus (see summary Table XII).
1946,"A bacteriologic study of penetrating wounds of the brain, from the surgical point of view.",A. Ecker,Journal of Neurosurgery,1946,45,General Brain Science and Reviews,non-human,10.3171/JNS.1946.3.1.0001,92cffdaf730253c3228d2395712f94542e8e704d,https://doi.org/10.3171/JNS.1946.3.1.0001,JournalArticle,unknown,4,brain; brain in title,
1946,Mid-line anomalies of the brain; their diagnosis by pneumoencephalography.,"A. P. Echternacht, J. Campbell",Radiology,1946-02-01,42,General Brain Science and Reviews,,10.1148/46.2.119,2d64d7988cd6ea9f7e43dd909664c02db80c17af,https://doi.org/10.1148/46.2.119,JournalArticle; Review,unknown,4,brain; brain in title,
1946,"Histochemical changes associated with aging; liver, brain, and kidney in the rat.","O. H. Lowry, A. B. Hastings",Journal of Gerontology,1946-07-01,40,"Brain Development, Plasticity, and Connectomics",non-human,10.1093/GERONJ/1.3_PART_1.345,792145928c2dcc04a43dd5f9b150b4271516e65d,https://doi.org/10.1093/GERONJ/1.3_PART_1.345,JournalArticle,unknown,4,brain; brain in title,
1946,Effect of pentothal anesthesia on canine cerebral cortex.,"E. Homburger, W. Himwich, B. Etsten, G. York, R. Maresca, H. E. Himwich",Federation proceedings,1946-10-01,37,General Brain Science and Reviews,non-human,10.1152/AJPLEGACY.1946.147.2.343,79993921b93b4d04ce3671d00cc443f5a6803ffb,https://doi.org/10.1152/AJPLEGACY.1946.147.2.343,JournalArticle,unknown,5,cerebral; cortex; neuroscience term,
1946,Radical surgery and penicillin in brain abscess; a method of treatment in one stage with special reference to the cure of three thoracogenic cases.,J. Lebeau,Journal of Neurosurgery,1946-09-01,35,General Brain Science and Reviews,,10.3171/JNS.1946.3.5.0359,d778c14a50d21789cb8d3366118274e1c5f02118,https://doi.org/10.3171/JNS.1946.3.5.0359,JournalArticle,unknown,4,brain; brain in title,
1946,Penetrating wounds of the brain; management in an evacuation hospital.,"E. W. Shearburn, E. Mulford",American Journal of Surgery,1946-09-01,34,General Brain Science and Reviews,non-human,10.1016/0002-9610(46)90334-0,92b6fb7275d044f77c18317a0dd39d0e06ef86a0,https://doi.org/10.1016/0002-9610(46)90334-0,JournalArticle,unknown,4,brain; brain in title,
1946,THE TOXIC EFFECTS OF PROLONGED INGESTION OF DDT ON DOGS WITH SPECIAL REFERENCE TO LESIONS IN THE BRAIN,"W. Haymaker, A. M. Ginzler, R. L. Ferguson",American Journal of the Medical Sciences,1946-10-01,34,General Brain Science and Reviews,,10.1097/00000441-194610000-00006,dd05b900d7657d567322b3ddaacb35cc08011821,https://doi.org/10.1097/00000441-194610000-00006,JournalArticle,unknown,4,brain; brain in title,
1946,What Is Faith?,J. Machen,Unknown venue,1946-08-07,34,Cognitive and Systems Neuroscience,EEG;human;non-human;connectome,10.1017/9781316941270.002,8cfebb05b16571a4a86c80917ede21eb28b35050,https://doi.org/10.1017/9781316941270.002,paper,unknown,1,brain,"In lieu of an abstract, below is the essay's first paragraph."
1946,Observations on early type of brain abscess following penetrating wounds of the brain.,"J. E. Webster, R. Schneider, J. E. Lofstrom",Journal of Neurosurgery,1946,31,General Brain Science and Reviews,non-human,10.3171/JNS.1946.3.1.0007,65ab29ff0f276e05fefb2f2430e9def47d05673e,https://doi.org/10.3171/JNS.1946.3.1.0007,JournalArticle,unknown,4,brain; brain in title,
1946,"Motility, behavior, and the brain.",P. Yakovlev,Abstracts and translations from the science library. Institute of Living,1946,30,Cognitive and Systems Neuroscience,,,424c595a963272e251305c9f4339fe8c9727410a,https://www.semanticscholar.org/paper/424c595a963272e251305c9f4339fe8c9727410a,JournalArticle,unknown,4,brain; brain in title,
1946,The location of the conscious center in the brain; the corpus striatum.,W. Dandy,Bulletin of the Johns Hopkins Hospital,1946-07-01,29,General Brain Science and Reviews,,,9a016a068b0fab88f59f37dc5763dee96bceac04,https://www.semanticscholar.org/paper/9a016a068b0fab88f59f37dc5763dee96bceac04,JournalArticle,unknown,4,brain; brain in title,
1946,Distribution of intravenously injected fructose and glucose between blood and brain.,"J. Klein, R. Hurwitz, N. S. Olsen",Journal of Biological Chemistry,1946-08-01,27,General Brain Science and Reviews,,10.1016/s0021-9258(17)41253-1,dc8f2cf9801b76d07d7d95e9581918d62f9aefea,https://doi.org/10.1016/s0021-9258(17)41253-1,JournalArticle,unknown,4,brain; brain in title,
1946,Hematomas associated with penetrating wounds of the brain.,"D. D. Matson, J. Wolkin",Journal of Neurosurgery,1946,27,General Brain Science and Reviews,non-human,10.3171/JNS.1946.3.1.0046,12a11a12c85d33b262a5ff3f11462764ba07f644,https://doi.org/10.3171/JNS.1946.3.1.0046,JournalArticle,unknown,4,brain; brain in title,
1946,Brain modelling.,M. L. Barr,University of Western Ontario Medical Journal,1946,26,Computational Neuroscience and AI,,,3ff627dcb0ef2e5ef0674dbe469cd6efd258d57e,https://www.semanticscholar.org/paper/3ff627dcb0ef2e5ef0674dbe469cd6efd258d57e,JournalArticle,unknown,4,brain; brain in title,
1946,The site of action of narcotics on brain metabolism.,M. E. Greig,Journal of Pharmacology and Experimental Therapeutics,1946-06-01,26,"Cerebrovascular, Metabolism, and Brain Injury",non-human,10.1016/s0022-3565(25)05979-8,16851c65c449e1d1416394b8676d07541c2b6a47,https://doi.org/10.1016/s0022-3565(25)05979-8,JournalArticle,unknown,4,brain; brain in title,Previous experiments have shown that the dehydrogenases and that part of the cytochrome system involved in the oxidation of succinate are relatively insensitive to narcotics.
1946,Electrical manifestations of the cerebellum and cerebral cortex following DDT administration in cats and monkeys.,"F. Crescitelli, A. Gilman",American Journal of Physiology,1946-09-01,25,General Brain Science and Reviews,non-human,10.1152/AJPLEGACY.1946.147.1.127,acf067b52c76148da5fec7cab5784456cc805546,https://doi.org/10.1152/AJPLEGACY.1946.147.1.127,JournalArticle,unknown,6,cerebral; cortex; cerebellum; neuroscience term,
1946,Primary Hodgkin's sarcoma of the brain.,"Sparling Hj, Adams Rd",Unknown venue,1946-09-01,25,General Brain Science and Reviews,,,f86f8e6e1f60e021854fdb9e5d61c7a90e288111,https://www.semanticscholar.org/paper/f86f8e6e1f60e021854fdb9e5d61c7a90e288111,paper,unknown,4,brain; brain in title,
1946,Studies on the metabolism of brain suspensions; respiration at low oxygen tension.,"K. Elliott, M. Henry",Journal of Biological Chemistry,1946-05-01,25,"Cerebrovascular, Metabolism, and Brain Injury",non-human,,5d73d8c8b5b6f9d56a43f27853c40eaf4599da12,https://www.semanticscholar.org/paper/5d73d8c8b5b6f9d56a43f27853c40eaf4599da12,JournalArticle,unknown,4,brain; brain in title,
1946,Swelling of Brain Slices and the Permeability of Brain Cells to Glucose,K. Elliott,Proceedings of the Society for Experimental Biology and Medicine. Society for Experimental Biology and Medicine,1946-11-01,25,General Brain Science and Reviews,,10.3181/00379727-63-15559,336dfb49029af597ee7184d936b68c158226bfdf,https://doi.org/10.3181/00379727-63-15559,JournalArticle,unknown,4,brain; brain in title,
1946,The toxic effects of oxygen on brain metabolism and on tissue enzymes; brain metabolism.,F. Dickens,Biochemical Journal,1946,25,"Cerebrovascular, Metabolism, and Brain Injury",,,98d18b81ff737ce62ce75f208752c5bd736d9ba7,https://www.semanticscholar.org/paper/98d18b81ff737ce62ce75f208752c5bd736d9ba7,JournalArticle,unknown,4,brain; brain in title,
1946,Experimental Evidence on the Cerebral Origin of Muscle Spasticity in Acute Poliomyelitis.∗,D. Bodian,Proceedings of the Society for Experimental Biology and Medicine. Society for Experimental Biology and Medicine,1946-02-01,24,General Brain Science and Reviews,,10.3181/00379727-61-15262,9fee4caeec3c2f046f77287bafa985e13634b49e,https://doi.org/10.3181/00379727-61-15262,JournalArticle,unknown,1,cerebral,
1946,FURTHER STUDIES ON EFFECTS OF TISSUE EXTRACTS ON STAPHYLOCOCCUS AUREUS,"L. G. Nutini, Sister Eva Maria Lynch",Journal of Experimental Medicine,1946-08-31,24,General Brain Science and Reviews,non-human,10.1084/JEM.84.3.247,46d4844aff18b8fe73cd36c07d63a5ce1bc8ba6d,https://doi.org/10.1084/JEM.84.3.247,JournalArticle,unknown,1,brain,"1. The ability of alcoholic-precipitated extracts of beef tissue-brain, spleen, heart, and kidney-to stimulate the growth of Staphylococcus aureus, in vitro, and to convert the yellow S form to a white R variant with altered biochemical characteristics conforming to those of an avirulent organism, has been confirmed."
1946,Convulsive Effects of Antibiotic Agents on the Cerebral Cortex.,"A. Walker, H. C. Johnson, T. J. Case, J. J. Kollros",Science,1946-01-25,22,General Brain Science and Reviews,,10.1126/SCIENCE.103.2665.116,a92bc704e189fb8b72127c37c0820d2257467522,https://doi.org/10.1126/SCIENCE.103.2665.116,JournalArticle,unknown,5,cerebral; cortex; neuroscience term,
1946,CRANIOTOMY AND TOTAL DISSECTION AS A METHOD IN THE TREATMENT OF ABSCESS OF THE BRAIN,E. Fincher,Annals of Surgery,1946-05-01,22,General Brain Science and Reviews,,10.1097/00000658-194605000-00006,f11397c6ee9b829dd49271b207993d2f01b915d0,https://doi.org/10.1097/00000658-194605000-00006,JournalArticle,unknown,4,brain; brain in title,
1946,Terminal degeneration in the frontal cortex of the rabbit following the interruption of afferent fibres.,"P. Glees, A. Meyer, M. Meyer",Journal of Anatomy,1946-04-01,22,General Brain Science and Reviews,non-human,,26d49cecaf689e0884279c28a5ea98c5f2eadcbc,https://www.semanticscholar.org/paper/26d49cecaf689e0884279c28a5ea98c5f2eadcbc,JournalArticle,unknown,4,cortex; neuroscience term,
1946,Tissue cultures of the brain. Intercellular granules,M. J. Hogue,The Journal of comparative neurology,1946-12-01,22,Clinical Neurology and Neurodegeneration,non-human,10.1002/cne.900850308,4c7922f2a42861422fdf68cd53b6a3a628c8f6da,https://doi.org/10.1002/cne.900850308,JournalArticle,unknown,4,brain; brain in title,
1946,Biochemical and physiological differentiation during morphogenesis; succinic dehydrogenase and succinoxidase in the cerebral cortex of the fetal pig.,"L. B. Flexner, J. B. Flexner",Journal of Cellular and Comparative Physiology,1946-02-01,21,General Brain Science and Reviews,non-human,10.1002/JCP.1030270106,ae70ffde5d8768ffc6dad9bd9a0c41347f4ae65a,https://doi.org/10.1002/JCP.1030270106,JournalArticle,unknown,5,cerebral; cortex; neuroscience term,
1946,Metastatic tumours of brain.,M. Tom,Canadian Medical Association journal,1946-03-01,21,General Brain Science and Reviews,,,e4da58d32892ee8756b2918de744c55f12e21b9d,https://www.semanticscholar.org/paper/e4da58d32892ee8756b2918de744c55f12e21b9d,JournalArticle,unknown,4,brain; brain in title,
1946,THE CEREBRAL CORTEX IN THE VERY OLD HUMAN BRAIN,W. Riese,Journal of Neuropathology and Experimental Neurology,1946-04-01,21,Clinical Neurology and Neurodegeneration,human,10.1097/00005072-194604000-00006,7e395700bc2736dc95f5c6c1e17d3cc6cb823772,https://doi.org/10.1097/00005072-194604000-00006,JournalArticle,unknown,9,brain; cerebral; cortex; brain in title; neuroscience term,
1946,Observations on the relation between sulphydryl groups and pyruvate oxidation in brain tissue.,"R. Peters, R. Wakelin",Biochemical Journal,1946,20,General Brain Science and Reviews,,10.1042/BJ0400513,d4caff8d6cf491473813f8a9b4fd0de2bc994615,https://doi.org/10.1042/BJ0400513,JournalArticle,unknown,4,brain; brain in title,
1946,The tissue-distribution and excretion of four organic antimonials after single or repeated administration to normal hamsters.,"A. Gellhorn, N. Tupikova, H. B. Dyke",Journal of Pharmacology and Experimental Therapeutics,1946-06-01,19,General Brain Science and Reviews,non-human,10.1016/s0022-3565(25)05977-4,7a3616dd8fd3d5be9a87052b3205639c4bdb7289,https://doi.org/10.1016/s0022-3565(25)05977-4,JournalArticle,unknown,1,brain,"rapeutically important organic antimonials, tartar emetic, Anthiomaline, Stibanose and Neostibosan, it was found that the antimony is localized to the greatest extent in the liver with all drugs; a high concentration of antimony is attained in the spleen in the case of the quinquevalent compounds, Stibanose and Neostibosan, whereas the antimony of the tervalent antimonials can only be detected in traces in this organ."
1946,Treatment of cerebral palsy.,"F. B. House, W. Zeiter",Cleveland Clinic quarterly,1946-10-01,19,General Brain Science and Reviews,,10.3949/CCJM.13.4.213,6edc5b5b8e33915ecc9f792c458cd49d51489ba4,https://doi.org/10.3949/CCJM.13.4.213,JournalArticle,unknown,1,cerebral,
1946,Brain abscess associated with congenital heart disease; report of a case with complete recovery.,"E. A. Smolik, R. Blattner, F. Heys",Journal of the American Medical Association,1946-01-19,18,General Brain Science and Reviews,,,6dc51f15b2077248f9207eb5a6a436a13d7f9c4d,https://www.semanticscholar.org/paper/6dc51f15b2077248f9207eb5a6a436a13d7f9c4d,JournalArticle,unknown,4,brain; brain in title,
1946,The development of the forebrain of the American water snake (Natrix sipedon),F. J. Warner,The Journal of comparative neurology,1946-06-01,18,Clinical Neurology and Neurodegeneration,non-human,10.1002/cne.900840305,1c438d99a1b1ba83ef94ba4d3b00ea74b06cfb46,https://doi.org/10.1002/cne.900840305,JournalArticle; Review,unknown,4,brain; brain in title,
1946,AN ANALYSIS OF BRAIN ABSCESSES OBSERVED DURING THE PAST THIRTY YEARS,E. Sachs,Annals of Surgery,1946-05-01,17,General Brain Science and Reviews,,10.1097/00000658-194605000-00005,b8d75ab0ae5d1718cfb4517b3c1c068e51e5bf07,https://doi.org/10.1097/00000658-194605000-00005,JournalArticle,unknown,4,brain; brain in title,
1946,Reversibility of cerebral ventricular dilatation.,"H. Shenkin, C. Perryman",Journal of Neurosurgery,1946-05-01,17,General Brain Science and Reviews,,10.3171/JNS.1946.3.3.0234,e9715d701b340b131c4f737c7384fb5c184fba1c,https://doi.org/10.3171/JNS.1946.3.3.0234,JournalArticle,unknown,1,cerebral,
1946,A case of tetralogy of Fallot with absence of cerebellar vermis; termination by brain abscess.,"S. S. Sidenberg, M. M. Kessler, R. Wolpaw",Jornal de Pediatria,1946-06-01,16,General Brain Science and Reviews,,10.1016/S0022-3476(46)80069-6,a11d89b7801717a8d77e0b2a26cd5dd483f9be50,https://doi.org/10.1016/S0022-3476(46)80069-6,JournalArticle,unknown,4,brain; brain in title,
1946,METASTATIC TUMOURS OF BRAIN.,M. Tom,Canadian Medical Association journal,1946,15,General Brain Science and Reviews,,,f97e00c3960dcf5ce557c96fe0a7445af9985039,https://www.semanticscholar.org/paper/f97e00c3960dcf5ce557c96fe0a7445af9985039,JournalArticle,unknown,4,brain; brain in title,
1946,Penetrating Brain Wounds,W. Haynes,Unknown venue,1946-12-01,15,General Brain Science and Reviews,non-human,10.1097/00005053-194612000-00014,95ad560e686a938bcba808a9151fda47a966b6a9,https://doi.org/10.1097/00005053-194612000-00014,paper,unknown,4,brain; brain in title,
