year,title,authors,venue,publicationDate,citationCount,category,keywordTags,doi,sourceId,url,workType,language,relevanceScore,relevanceReason,abstractSnippet
1911,SUCCESSFUL REMOVAL OF BRAIN TUMORS: A CEREBELLAR TUMOR AND AN ENDOTHELIOMA OF THE PREFRONTAL DURA MATER,"L. Newmark, H. Kugeler, H. Sherman",Unknown venue,1911-04-22,0,Clinical Neurology and Neurodegeneration,human;non-human,10.1001/JAMA.1911.02560160022006,3cfd9aa7559a8fb59a4d27f916afa43a1da184d1,https://doi.org/10.1001/JAMA.1911.02560160022006,paper,unknown,5,brain; prefrontal; brain in title,The fortunate outcome in these cases of cerebellar tumor and endothelioma of the dura is offset by an unhappy termination of our endeavors in a considerable number of instances of intracranial growths.
1911,SYMPTOMS SUGGESTIVE OF BRAIN TUMOR RELIEVED BY THE CORRECTION OF A REFRACTIVE ERROR,T. Diller,Unknown venue,1911-02-04,0,Clinical Neurology and Neurodegeneration,human,10.1001/JAMA.1911.02560050033013,05123d2d6289039f3f643882cf23ad3c7e5dcabb,https://doi.org/10.1001/JAMA.1911.02560050033013,paper,unknown,4,brain; brain in title,"The case is that of a man 50 years of age, a railroader by occupation, who consulted me Aug."
1911,The Book World of Medicine and Science,N. Macnamara,The Hospital,1911-06-24,0,"Brain Development, Plasticity, and Connectomics",human;non-human,,8d6fadb0066335845855f3d31ccf64136c3fb147,https://www.semanticscholar.org/paper/8d6fadb0066335845855f3d31ccf64136c3fb147,paper,unknown,1,brain,The Evolution and Function of Living Purtosive Matter.
1911,The Book World of Medicine and Science,Unknown authors,The Hospital,1911-09-09,0,General Brain Science and Reviews,non-human,,1c4b412cc67b7807f750067ac13bc99aa7d49ca6,https://www.semanticscholar.org/paper/1c4b412cc67b7807f750067ac13bc99aa7d49ca6,paper,unknown,1,brain,"viewer can do is to read selections from these articles, *lr,d thereby form a judgment on the whole."
1911,The Brain of a Patient Who Died from Cerebellar Abscess,W. Kelson,Proceedings of the Royal Society of Medicine,1911-05-01,0,Clinical Neurology and Neurodegeneration,human,10.1177/003591571100401012,a8b1f8c3669d48f91f93025418ef7f8b39c355db,https://doi.org/10.1177/003591571100401012,JournalArticle,unknown,4,brain; brain in title,
1911,"The Brain of the Fossil Man of Chapelle-Aux-Saints, Correze",Unknown authors,Buffalo Medical Journal,1911-10-01,0,General Brain Science and Reviews,,,bd3ac1591011b7a893362a08df6b065c2d2cf937,https://www.semanticscholar.org/paper/bd3ac1591011b7a893362a08df6b065c2d2cf937,paper,unknown,4,brain; brain in title,
1911,The Clinical Tests for Apraxia and Their Value in the Diagnosis of Brain Disease,I. H. Coriat,Unknown venue,1911-07-20,0,Clinical Neurology and Neurodegeneration,human,10.1056/NEJM191107201650304,ccd4933ab5c60bd058fd9e8f73fa492f68368cca,https://doi.org/10.1056/NEJM191107201650304,paper,unknown,4,brain; brain in title,
1911,"THE OCULAR CONJUGATE AND FUSION BRAIN CENTERS: ONLY TWO AXES OF OCULAR ROTATIONS, AND ONLY TWO PLANES OF REFERENCE",G. C. Savage.,Unknown venue,1911-08-05,0,General Brain Science and Reviews,,10.1001/JAMA.1911.04260080031009,083a9d0add005c34f1b69a275ffd0000a8b38b25,https://doi.org/10.1001/JAMA.1911.04260080031009,paper,unknown,4,brain; brain in title,
1911,"The opening of the cranial cavity and exposure of the brain by way of the nasal accessory cavities. a. onodi, ztschr. f. laryngol., rhinol. u. ihre grensgeb., bd. 4, heft 1, 1911",Glogau,Unknown venue,1911-11-01,0,General Brain Science and Reviews,,10.1288/00005537-191111000-00011,7f963f91b688fc33dcd7a2bf5c7a699eb1df6b0a,https://doi.org/10.1288/00005537-191111000-00011,paper,unknown,4,brain; brain in title,
1911,The Present Status of Surgery of the Brain and Spinal Cord,A. W. Fly,Texas medical journal,1911-11-01,0,General Brain Science and Reviews,,,0dba4be9fca39efd6c8c9a773c62ea933eb7dacc,https://www.semanticscholar.org/paper/0dba4be9fca39efd6c8c9a773c62ea933eb7dacc,JournalArticle; Review,unknown,4,brain; brain in title,"s and Selections. The Present Status of Surgery of the Brain and Spinal Cord.* *Read before the State Medical Association of Texas, at Amarillo, Texas, May 9-11, 1911."
1911,"Two unusual cases of brain abscess-left hemisphere. e.j. moure. rev. hebd. de laryngol. d'otol. et de rhinol., jan. 14, and 21, 1911",É. Moure,Unknown venue,1911-09-01,0,General Brain Science and Reviews,,10.1288/00005537-191109000-00009,9f6cace00f504a74683fdeb97235bc853e825a03,https://doi.org/10.1288/00005537-191109000-00009,paper,unknown,4,brain; brain in title,
1911,XXIII. Subdural Drainage in Purulent Meningitis and Brain Abscess. Reports of Two Cases with Autopsies,Ewing W. Day,Unknown venue,1911-06-01,0,General Brain Science and Reviews,ECoG,10.1177/000348941102000204,383e3bb0baf29b06f5891d580bbf6247639cd644,https://doi.org/10.1177/000348941102000204,JournalArticle,unknown,4,brain; brain in title,
