year,title,authors,venue,publicationDate,citationCount,category,keywordTags,doi,sourceId,url,workType,language,relevanceScore,relevanceReason,abstractSnippet
1903,"THE BLOOD-PRESSURE REACTION OF ACUTE CEREBRAL COMPRESSION, ILLUSTRATED BY CASES OF INTRACRANIAL HEMORRHAGE.: A SEQUEL TO THE MÜTTER LECTURE FOR 1901",H. Cushing,Unknown venue,1903-06-01,145,"Cerebrovascular, Metabolism, and Brain Injury",non-human,10.1097/00000441-190306000-00006,f20c9429a9f1425dfd4c0654ed9a868894d80e0f,https://doi.org/10.1097/00000441-190306000-00006,paper,unknown,1,cerebral,
1903,The Croonian Lectures ON MUSCULAR MOVEMENTS AND THEIR REPRESENTATION IN THE CENTRAL NERVOUS SYSTEM,C. Beevor,British medical journal,1903-06-20,46,General Brain Science and Reviews,,10.1136/bmj.1.2216.1417,a2cfa29f50584a791fc20f99abb65dcb1b49a632,https://doi.org/10.1136/bmj.1.2216.1417,JournalArticle,unknown,1,central nervous system,
1903,"X. On the Morphology of the Brain in the Mammalia, with Special Reference to that of the Lemurs, Recent and Extinct.",G. E. Smith,Unknown venue,1903-02-01,43,General Brain Science and Reviews,,10.1111/J.1096-3642.1903.TB00497.X,78e9eb81ed09f670dcd00cfd85555849835a9b83,https://doi.org/10.1111/J.1096-3642.1903.TB00497.X,paper,unknown,4,brain; brain in title,
1903,"XII. On the Morphology of the Cerebral Commissures in the Vertebrata, with Special Reference to an Aberrant Commissure found in the Forebrain of certain Reptiles.",M. Smith,Unknown venue,1903-07-01,27,General Brain Science and Reviews,non-human,10.1111/J.1096-3642.1903.TB00499.X,df300faa2827584cdc5840121988c5544b61c554,https://doi.org/10.1111/J.1096-3642.1903.TB00499.X,paper,unknown,6,brain; cerebral; forebrain; brain in title,
1903,A REPORT OF TWO CASES OF MULTIPLE SARCOMATOSIS OF THE CENTRAL NERVOUS SYSTEM AND OF ONE CASE OF INTRAMEDULLARY PRIMARY SARCOMA OF THE SPINAL CORD,"W. G. Spiller, William Hendrickson",Unknown venue,1903-07-01,25,General Brain Science and Reviews,,10.1097/00000441-190307000-00002,aaec056000d67b696874f4293bcf5849058604d9,https://doi.org/10.1097/00000441-190307000-00002,paper,unknown,1,central nervous system,
1903,On the medullated nerve fibers crossing the site of lesions in the brain of the white rat,S. W. Ranson,Unknown venue,1903-10-01,25,General Brain Science and Reviews,non-human,10.1002/cne.910130304,bc9e339cab8969a93388139627f877970b55c719,https://doi.org/10.1002/cne.910130304,Review,unknown,4,brain; brain in title,
1903,The CROONIAN LECTURES on MUSCULAR MOVEMENTS and their REPRESENTATION in the CENTRAL NERVOUS SYSTEM,C. Beevor,British medical journal,1903-06-27,24,General Brain Science and Reviews,non-human,10.1136/bmj.1.2217.1480,e92646c974b887aad52247dc363c24ecbb73f8ae,https://doi.org/10.1136/bmj.1.2217.1480,JournalArticle,unknown,1,central nervous system,recorded (at least by Apuleius) that anything happened to the dog (Fig.
1903,Notes on the Morphology of the Cerebellum,S. Ge,Unknown venue,1903-07-01,17,General Brain Science and Reviews,,,92da07015acc8531fdafc1e7044a65017aa60c06,https://www.semanticscholar.org/paper/92da07015acc8531fdafc1e7044a65017aa60c06,paper,unknown,1,cerebellum,
1903,ON AMAUROTIC FAMILY IDIOCY. A DISEASE CHIEFLY OF THE GRAY MATTER OF THE CENTRAL NERVOUS SYSTEM,B. Sachs,Unknown venue,1903-01-01,17,General Brain Science and Reviews,,10.1097/00005053-190301000-00001,2ec33827e7a38db771ccbbb8335494bc4ae73e63,https://doi.org/10.1097/00005053-190301000-00001,paper,unknown,1,central nervous system,
1903,The Croonian Lectures ON MUSCULAR MOVEMENTS AND THEIR REPRESENTATION IN THE CENTRAL NERVOUS SYSTEM,C. Beevor,British medical journal,1903-06-13,15,General Brain Science and Reviews,,10.1136/bmj.1.2215.1357,a0d56221d6272cd4281356a7596e4e6f2eb103e0,https://doi.org/10.1136/bmj.1.2215.1357,JournalArticle,unknown,1,central nervous system,
1903,Brain-weights of animals with special reference to the weight of the brain in the Macaque monkey,E. A. Spitzka,Unknown venue,1903-04-01,12,General Brain Science and Reviews,non-human,10.1002/CNE.910130103,6a26c4682aa1f0fe032fdd5c1a3f6ae0a2f59c10,https://doi.org/10.1002/CNE.910130103,paper,unknown,4,brain; brain in title,
1903,Factors in heteromorphosis in planarians,C. R. Bardeen,Archiv für Entwicklungsmechanik der Organismen,1903-03-01,12,General Brain Science and Reviews,non-human,10.1007/BF02152933,71d9dd8d1ab926fff13e6a537326849c24b12eac,https://doi.org/10.1007/BF02152933,paper,unknown,1,central nervous system,Summary1)The generalizations previously reached concerning the regeneration of normal individuals (p.
1903,ON THE DISCOVERY OF A SPECIES OF TRYPANOSOMA IN THE CEREBROSPINAL FLUID OF CASES OF SLEEPING SICKNESS.,A. Castellani,Unknown venue,1903-06-20,10,General Brain Science and Reviews,,10.1016/S0140-6736(01)70338-8,ca2cb1846ccf039a86e8ffc0d071d87b00dbe20d,https://doi.org/10.1016/S0140-6736(01)70338-8,paper,unknown,1,cerebrospinal,
1903,Surgery of the Brain and Spinal Cord,Unknown authors,The Hospital,1903-05-09,10,General Brain Science and Reviews,,,f4fec884282ffd4885e885a9ad6a53c2e62b3fbb,https://www.semanticscholar.org/paper/f4fec884282ffd4885e885a9ad6a53c2e62b3fbb,JournalArticle,unknown,4,brain; brain in title,
1903,Cerebrale Muskelatrophie,H. Steinert,Deutsche Zeitschrift für Nervenheilkunde,1903-07-01,8,General Brain Science and Reviews,,10.1007/BF01666265,3477a5a8078ddc5361d6a6f5b646172d3e7caa92,https://doi.org/10.1007/BF01666265,paper,unknown,1,cerebral,
1903,Cortex cerebri and iris,N. Mislawsky,Journal of Physiology,1903-02-23,8,General Brain Science and Reviews,,10.1113/jphysiol.1903.sp000943,1596ae4a8e54f4301768bbc5d56d7d851420984f,https://doi.org/10.1113/jphysiol.1903.sp000943,JournalArticle,unknown,4,cortex; neuroscience term,
1903,The brain of the Archæoceti,G. E. Smith,Proceedings of the Royal Society of London,1903-04-01,6,General Brain Science and Reviews,,10.1098/rspl.1902.0101,01785ec8ea23072e8ac669e5c9e90170bc42ec01,https://doi.org/10.1098/rspl.1902.0101,paper,unknown,4,brain; brain in title,"So far as I have been able to ascertain, nothing whatever is known of the form of the brain or, more strictly, of the cranial cavity in the Archæoceti."
1903,The microscopic structure of cortical areas in man and some mammals,M. Schlapp,Unknown venue,1903-03-28,6,General Brain Science and Reviews,,10.1002/AJA.1000020207,f28996fff3e4c6bd9594d23853bf76d3c88ce5e6,https://doi.org/10.1002/AJA.1000020207,paper,unknown,1,cortical,
1903,Hemianopsia,E. Jackson,The Hospital,1903-03-28,5,Clinical Neurology and Neurodegeneration,human,,5c097df5d0e21bbd92bf808e3842ddc0f996e7ca,https://www.semanticscholar.org/paper/5c097df5d0e21bbd92bf808e3842ddc0f996e7ca,JournalArticle,unknown,1,cerebral,"definite, localised cerebral injuries. In one of these patients the half-blindness was complete, in the other it took the form of a partial right hemianopsia, affecting the right lower quadrants of the fields of vision only."
1903,The Croonian Lectures ON MUSCULAR MOVEMENTS AND THEIR REPRESENTATION IN THE CENTRAL NERVOUS SYSTEM,C. Beevor,British medical journal,1903-07-04,5,General Brain Science and Reviews,,10.1136/bmj.2.2218.12,8c891828ca4425ac2ceed9f73840e7a06989a124,https://doi.org/10.1136/bmj.2.2218.12,JournalArticle,unknown,1,central nervous system,
1903,Ueber die Betheiligung der Neuroglia an der Narbenbildung im Gehirn,E. Müller,Deutsche Zeitschrift für Nervenheilkunde,1903-03-01,5,"Cellular, Molecular, and Synaptic Neuroscience",non-human,10.1007/BF01665145,e8783e716dc06232a864640a7fd7dd03c627ca9e,https://doi.org/10.1007/BF01665145,paper,unknown,2,neuroglia; glia,"Das Stadium der histologischen Vorgiinge bei der tteilang yon Gehirnwunden hat hinsichtlich der Eigenart der reparatorischen Processe zu einwandsfreien, al]gemein anerkann~en Ergebnissen nicht gefiihrt und insbesondere die Frage naeh dem histologisehen Aufbau der Gehirnnarben keineswegs definitiv gelSst."
1903,A CASE OF LARGE BLOOD CYST IN THE ARACHNOID SPACE SIMULATING BRAIN TUMOUR; OPERATION; RECOVERY.,"James Taylor, C. Ballance",Unknown venue,1903-08-29,4,General Brain Science and Reviews,non-human,10.1016/S0140-6736(01)50561-9,c091eeacd2f9b1dd94798996db87cb61e35d71dc,https://doi.org/10.1016/S0140-6736(01)50561-9,paper,unknown,4,brain; brain in title,
1903,A Case of Cerebral Tumour complicated with Alcoholic Confusional Insanity,"H. E. Ridewood, Robert Jones",Unknown venue,1903-07-01,3,General Brain Science and Reviews,,10.1192/BJP.49.206.511,dc51d9c1e876793b9b49f08e596140ff2c9a41c1,https://doi.org/10.1192/BJP.49.206.511,paper,unknown,1,cerebral,
1903,A STUDY OF THE BRAIN OF THE LATE MAJOR J. W. POWELL,E. A. Spitzka,Unknown venue,1903-10-12,3,General Brain Science and Reviews,,10.1525/AA.1903.5.4.02A00020,055618a7558d3f3f6e256457dd876ca3b73a402a,https://doi.org/10.1525/AA.1903.5.4.02A00020,paper,unknown,4,brain; brain in title,
1903,DETERMINATE FACTORS IN THE CAUSE OF INSANITY.,E. Carpenter,Unknown venue,1903-01-24,3,Clinical Neurology and Neurodegeneration,human,10.1001/JAMA.1903.92490040036001H,dea47c91b9da3cf34db48d776c6e182e12e5f164,https://doi.org/10.1001/JAMA.1903.92490040036001H,paper,unknown,1,brain,It is questionable if there is any problem which has occupied the thought of medical men so diligently as that of the etiology of disease.
1903,"Further Notes on the Lemurs, with especial Reference to the Brain",G. E. Smith,Unknown venue,1903-10-01,3,General Brain Science and Reviews,,10.1111/J.1096-3642.1903.TB00427.X,107b7ef8831c527d9e4d5e4668e8e080ab84af8b,https://doi.org/10.1111/J.1096-3642.1903.TB00427.X,paper,unknown,4,brain; brain in title,
1903,On the transitory or artificial fissures of the human cerebrum,F. Mall,Unknown venue,1903-07-01,3,General Brain Science and Reviews,human,10.1002/AJA.1000020305,27a5f906539f5a594350304f07d429129916fea4,https://doi.org/10.1002/AJA.1000020305,paper,unknown,1,cerebrum,
1903,THE RESULTS OF SURGICAL TREATMENT OF BRAIN TUMORS,M. Starr,Unknown venue,1903-07-01,3,Clinical Neurology and Neurodegeneration,,10.1097/00005053-190307000-00002,4c71621615acdba44b408cdbf759b17e601957af,https://doi.org/10.1097/00005053-190307000-00002,paper,unknown,4,brain; brain in title,
1903,Ueber die Wirkung der Labyrinthe und des Thalamus opticus auf die Zugcurve des Frosches,G. Emanuel,Archiv für die gesamte Physiologie des Menschen und der Tiere,1903-10-01,3,General Brain Science and Reviews,,10.1007/BF01791322,3ef81bcc254a67fcb667fd216e42354c04687b52,https://doi.org/10.1007/BF01791322,paper,unknown,1,thalamus,
1903,Abscess of the Spleen,Walter M. Spear,Unknown venue,1903-08-01,2,Clinical Neurology and Neurodegeneration,human;non-human,10.1001/JAMA.1903.04480020012004,6f1a795ee10b46564a53040bb2a29b8c275908a7,https://doi.org/10.1001/JAMA.1903.04480020012004,paper,unknown,1,brain,"Abscess of the spleen is rare, and when a case falls into our hands and is operated on successfully, it is worthy of record."
1903,"Actinomycosis of the Central Nervous System, with the Report of a Case, Due to an unidentified Member of the Actinomyces Group.",Howard Wt,Unknown venue,1903-05-01,2,General Brain Science and Reviews,,,5fc5d78e53639ef377b6c1daa7a09aa5f96a77d1,https://www.semanticscholar.org/paper/5fc5d78e53639ef377b6c1daa7a09aa5f96a77d1,paper,unknown,1,central nervous system,
1903,"Brain-Weight, Cranial Capacity and the Form of the Head, and Their Relations to the Mental Powers of Man(",E. A. Spitzka,Science,1903-05-08,2,General Brain Science and Reviews,,10.1126/science.17.436.753.b,3cdd7f19e6cc3a4f4aeae83a883fc77882dcdbd6,https://doi.org/10.1126/science.17.436.753.b,paper,unknown,4,brain; brain in title,
1903,Observations on the Relations of the Deeper Parts of the Brain to the Surface.,J. Symington,Journal of anatomy and physiology,1903-04-01,2,General Brain Science and Reviews,,,6f20488c8fbf7f1b8aa56934406c4bda37e864c9,https://www.semanticscholar.org/paper/6f20488c8fbf7f1b8aa56934406c4bda37e864c9,JournalArticle,unknown,4,brain; brain in title,
1903,ON CHOREA IN PREGNANCY. *,"C. Wall, H. Russell Andrews",Unknown venue,1903-06-01,2,"Brain Development, Plasticity, and Connectomics",human;non-human,10.1111/j.1471-0528.1903.tb06927.x,36333225079427d3f4f4374003371510cd9fbe69,https://doi.org/10.1111/j.1471-0528.1903.tb06927.x,paper,unknown,5,cerebral; cortex; neuroscience term,IT is our object to-night to invite discussion upon a few problems which arise from a consideration of a series of cases of chorea occurring in association with pregnancy.
1903,RESULTS OF BRAIN SURGERY IN EPILEPSY AND CONGENITAL MENTAL DEFECT,W. Spratling,Unknown venue,1903-07-01,2,Clinical Neurology and Neurodegeneration,non-human,10.1176/AJP.60.1.27,8b396e91cdc1ba759f4b148485c9f94bf7b8eebc,https://doi.org/10.1176/AJP.60.1.27,paper,unknown,4,brain; brain in title,"Used without qualification, the word ""epilepsy"" carries little meaning to the analytical student of the disease."
1903,SPONTANEOUS HEMORRHAGES IN NEWBORN CHILDREN.,I. A. Abt,Unknown venue,1903-01-31,2,"Brain Development, Plasticity, and Connectomics",human,10.1001/JAMA.1903.92490050006001B,b0b874c56eaab24efd247b10267a0a22244c2ce2,https://doi.org/10.1001/JAMA.1903.92490050006001B,paper,unknown,1,brain,Hemorrhages into various tissues and organs and from mucous surfaces are observed in newborn children.
1903,The Brain-Weight of the Japanese,E. A. Spitzka,Science,1903-09-18,2,General Brain Science and Reviews,,10.1126/science.18.455.371,d1461fe27a64ab140489734c37c27fe5704b710e,https://doi.org/10.1126/science.18.455.371,JournalArticle,unknown,4,brain; brain in title,"a large and comfortable tug makes regular trips twice a week to and fro between the Tortugas and Key West, leaving at 8 AM."
1903,The Cortical Localization of the Auditory Area,A. Campbell,The Journal of Laryngology Rhinology and Otology,1903-07-01,2,General Brain Science and Reviews,human;non-human,10.1017/S1755146300173172,49125021257df232426e9887a62caf1747895921,https://doi.org/10.1017/S1755146300173172,paper,unknown,2,brain; cortical,and it affords me great pleasure to now place before the Otological Society a brief outline of the results of my researches in so far as the auditory centre is concerned.
1903,The fore-brain of Macacus,W. W. Lesem,Unknown venue,1903-04-01,2,General Brain Science and Reviews,,10.1002/CNE.910130102,06cd8ae6d6fe9a4da63c76736ec912543bbf1035,https://doi.org/10.1002/CNE.910130102,paper,unknown,4,brain; brain in title,
1903,THE SYMPTOMATOLOGY AND TREATMENT OF TRAUMATIC INSANITY,A. B. Richardson,Unknown venue,1903-07-01,2,"Brain Development, Plasticity, and Connectomics",,10.1176/AJP.60.1.19,da9c06f113a4b1ca17285a7674bda025eba2970b,https://doi.org/10.1176/AJP.60.1.19,paper,unknown,1,brain,"The forms of diseases of the mind that have their origin in the effect of injury to the brain, direct or indirect, are quite varied, and I attempt a description of them with much hesitation and a consciousness of my inability to fully, or, I fear, satisfactorily accomplish it."
1903,A CASE OF BRAIN ABSCESS: DUE TO LATENT TYPHOID INFECTION; OPERATION; DEATH FROM CARDIAC COMPLICATION.,"G. Mccaskey, M. F. Porter",Unknown venue,1903-05-02,1,General Brain Science and Reviews,non-human,10.1001/JAMA.1903.92490180023001H,7f490d11af9a063a1380c88fa6e18ccd99cdd35f,https://doi.org/10.1001/JAMA.1903.92490180023001H,paper,unknown,4,brain; brain in title,MEDICAL HISTORY AND DIAGNOSIS BY DR. M'CASKEY.
1903,A CONTRIBUTION TO THE SURGERY OF CEREBRAL TUMORS,G. Woolsey,Unknown venue,1903-12-01,1,General Brain Science and Reviews,,10.1097/00000441-190312000-00002,6405d9a3915ac048246d85554a44c1b97a606dc3,https://doi.org/10.1097/00000441-190312000-00002,paper,unknown,1,cerebral,
1903,"BRAIN-WEIGHT, CRANIAL CAPACITY AND THE FORM OF THE HEAD, AND THEIR RELATIONS TO THE MEENTAL POWERS OF MAN.",E. A. Spitzka,Science,1903-05-08,1,General Brain Science and Reviews,,10.1126/SCIENCE.17.436.753-A,26df248faa9e0a81b1e293c949e9764067789be8,https://doi.org/10.1126/SCIENCE.17.436.753-A,JournalArticle,unknown,4,brain; brain in title,
1903,BRAIN-WEIGHTS OF BROTHERS.,E. A. Spitzka,Science,1903-11-27,1,General Brain Science and Reviews,,10.1126/SCIENCE.18.465.699,daf9db26703fe38ac836a60a1bb14d5763264f42,https://doi.org/10.1126/SCIENCE.18.465.699,JournalArticle,unknown,4,brain; brain in title,
1903,Discussion of some Points in connection with the Suprarenal Glands-Cortical and Medullary.,S. Vincent,Journal of anatomy and physiology,1903-10-01,1,General Brain Science and Reviews,,,a04b0d8e5513101d079ae80fb9c1985458d95239,https://www.semanticscholar.org/paper/a04b0d8e5513101d079ae80fb9c1985458d95239,JournalArticle,unknown,1,cortical,
1903,Essai sur la Psycho-physiologie des Monstres Humains,C. Myers,Nature,1903-10-01,1,"EEG, MEG, and Electrophysiology",EEG;non-human,10.1038/068570A0,2e4b6d1d2e51ad1b6d6edf9bc0a25947abbf3403,https://doi.org/10.1038/068570A0,paper,unknown,5,brain; cerebral; neuroglia; cerebellum; glia,THE substance of two-thirds of this book has already appeared in various scientific and medical journals.
1903,"Extensive Cavity Formation in the Central Nervous System, Presumably Due to Bacillus Aerogenes Capsulatus",Emma W. Mooers,Unknown venue,1903-03-26,1,General Brain Science and Reviews,,10.1056/NEJM190303261481301,94f680f2b889e0c258823b12b57da18d43a4ba6b,https://doi.org/10.1056/NEJM190303261481301,paper,unknown,1,central nervous system,
1903,HISTORY OF A CASE OF CEREBRAL TUMOUR EIGHT AND A-HALF YEARS AFTER REMOVAL,T. Oliver,British medical journal,1903-07-11,1,General Brain Science and Reviews,,10.1136/bmj.2.2219.72,0e1d9a8ff5192f00990f13512d855132ea3d6788,https://doi.org/10.1136/bmj.2.2219.72,JournalArticle,unknown,1,cerebral,
1903,Physical Education and Brain Building,W. Krohn,Unknown venue,1903-07-01,1,General Brain Science and Reviews,,10.1177/002205740305800514,034718dfd829e296649dadfe5bec38c5fb642407,https://doi.org/10.1177/002205740305800514,JournalArticle,unknown,4,brain; brain in title,
1903,"Report of cases of pyogenic brain diseases, associated with or caused by acute and chronic nasal suppuration",Thomas Hubbard,Unknown venue,1903-09-01,1,General Brain Science and Reviews,non-human,10.1288/00005537-190309000-00005,1fb9c16a006387946961b2189e264ea68fa5036d,https://doi.org/10.1288/00005537-190309000-00005,paper,unknown,4,brain; brain in title,
1903,THE BRAIN OF PROFESSOR LABORDE.,E. A. Spitzka,Science,1903-09-11,1,General Brain Science and Reviews,,10.1126/SCIENCE.18.454.346,3c4985f9b3d1211536e4fd5b9d2ab4910b96349a,https://doi.org/10.1126/SCIENCE.18.454.346,JournalArticle,unknown,4,brain; brain in title,
1903,V. Instrument to Protect the Brain while doing Craniotomy with Gigli Saw.,F. C. Schaefer,Annals of Surgery,1903-04-01,1,General Brain Science and Reviews,,,f96620db6c63a933281232271cc135fae9c8cf71,https://www.semanticscholar.org/paper/f96620db6c63a933281232271cc135fae9c8cf71,JournalArticle,unknown,4,brain; brain in title,
1903,Weitere experimentelle Untersuchungen über die Beziehungen der Medulla oblongata zur Pupille,"L. Bach, H. Meyer",Albrecht von Graefe's Archiv fur Ophthalmologie,1903-06-01,1,General Brain Science and Reviews,,10.1007/BF01946266,08b83d624b1e386fb787c0ee7133ed98b156326d,https://doi.org/10.1007/BF01946266,paper,unknown,1,medulla oblongata,"In Band LV, Abteilung 3 dieses Archives haben wir fiber eine Anzahl yon Versuchen beriehtet, deren wesentliehstes Ergebnis in der Feststellung eines an dem spinalen Ende der Medulla oblongata gelegenen Hemmungszentrums ftir den Liehtreflex der Pupille bestand."
1903,A Brain Hardened by Kaiserling's Method Showing the Track of a Bullet,W. F. Whitney,Unknown venue,1903-12-31,0,General Brain Science and Reviews,,10.1056/NEJM190312311492705,e6144a21afdf723fde81ce11a16d5ba071f16895,https://doi.org/10.1056/NEJM190312311492705,paper,unknown,4,brain; brain in title,
1903,"A CASE OF BULLET WOUND OF THE BRAIN, WITH PARTIAL MOTOR PARESIS AND HEMIANOPSIA.","N. Harman, A. Bradburne",Unknown venue,1903-05-01,0,General Brain Science and Reviews,,10.1016/S0140-6736(01)70464-3,80c9b47436fd3773241bbc2e49ce97da7e3ececd,https://doi.org/10.1016/S0140-6736(01)70464-3,paper,unknown,4,brain; brain in title,
1903,A Case of Cerebral Abscess,Satis Chander Banerjee,The Indian medical gazette,1903-09-01,0,General Brain Science and Reviews,,,cb31b6deee17fe8953fcde4f3bcb8836a4925b14,https://www.semanticscholar.org/paper/cb31b6deee17fe8953fcde4f3bcb8836a4925b14,JournalArticle,unknown,1,cerebral,
1903,A Case of Raynaud's Disease with Cerebral Symptoms,R. Stockman,Edinburgh medical journal,1903-09-01,0,General Brain Science and Reviews,,,09b4b477ecd9ca14a8ef2a5c3ff251456dfe2e42,https://www.semanticscholar.org/paper/09b4b477ecd9ca14a8ef2a5c3ff251456dfe2e42,paper,unknown,2,brain; cerebral,"The occurrence of cerebral symptoms is not very common in Raynaud's disease, and hence it may be of interest to record the following case."
1903,A Clinical Lecture on Abscess of the Brain,H. F. Mole,The Hospital,1903-04-18,0,Clinical Neurology and Neurodegeneration,human,,46aad3315e4277405bb49031b5ef3c7ea0397e46,https://www.semanticscholar.org/paper/46aad3315e4277405bb49031b5ef3c7ea0397e46,JournalArticle,unknown,4,brain; brain in title,
1903,"A CONTRIBUTION TO THE SURGERY OF THE BRAIN, WITH THE REPORT OF TWO CASES OF TUMORS OF THE CEREBELLUM WHICH WERE LOCATED AND ON WHICH OPERATIONS WERE PERFORMED",W. H. Hudson,Unknown venue,1903-09-01,0,General Brain Science and Reviews,non-human,10.1097/00000441-190309000-00015,f7dbca2c3370a1daead14f30fb81c04829095fe1,https://doi.org/10.1097/00000441-190309000-00015,paper,unknown,5,brain; cerebellum; brain in title,
1903,A METHOD FOR THE RELIEF OF PAIN IN TUMORS OF THE BRAIN,W. Browning,Unknown venue,1903-11-01,0,General Brain Science and Reviews,,10.1097/00005053-190311000-00002,cbaf8743c990bba579569e609632a08fa77d0535,https://doi.org/10.1097/00005053-190311000-00002,paper,unknown,4,brain; brain in title,
1903,A Study Of Sensations In Motor Paralysis Of Cerebral Origin Based Upon Thirty-five Cases,A. Gordon,Unknown venue,1903-03-01,0,General Brain Science and Reviews,,10.1097/00005053-190303000-00002,80f1a84e8f616bcc3128b95681433fbb56b46724,https://doi.org/10.1097/00005053-190303000-00002,paper,unknown,1,cerebral,
1903,About the back cephalomachs,D. I. Tatarinov,Kazan medical journal,1903-05-10,0,General Brain Science and Reviews,non-human,10.17816/kazmj47650,88b4c34f6ce539649ce58c00fed7786c80d89a82,https://doi.org/10.17816/kazmj47650,paper,unknown,2,brain; cerebral,"Abstracts. Surgery.""Surgery"" v. XIII. No."
1903,About the commissural systems of the cerebral cortex,A. Yanishevsky,Neurology Bulletin,1903-02-15,0,Clinical Neurology and Neurodegeneration,,10.17816/nb83019,1664cf2753ef546fa1997b921e30fd7461e83e02,https://doi.org/10.17816/nb83019,paper,unknown,5,cerebral; cortex; neuroscience term,The anterior commissure was first indicated by Eustach and described by Riolan under the name funiculus transversus.
1903,Abstract: Brain concussion,E. Andrews,Unknown venue,1903-03-01,0,General Brain Science and Reviews,,,8a39b078b2dcf04e40d3f83458e6fafd9986ea1a,https://www.semanticscholar.org/paper/8a39b078b2dcf04e40d3f83458e6fafd9986ea1a,paper,unknown,4,brain; brain in title,
1903,Annotations,Unknown authors,The Hospital,1903-11-28,0,Clinical Neurology and Neurodegeneration,human;non-human,10.1136/bmj.1.4966.562,eea67566117b55162e52d7032867f96dfe8f57f9,https://doi.org/10.1136/bmj.1.4966.562,JournalArticle,unknown,1,brain,"marked differences between benign tertiary syphilis in the study group of males as a whole, 15.4%, and in those who later developed cardiovascular and neurosyphilis, and so concludes that benign tertiary syphilis has no protective influence."
1903,Annotations,John O. Knott,The Hospital,1903-05-16,0,Neuroimaging and Brain Mapping,non-human,10.1136/bmj.1.5033.1467,26a084cc4d0b8332c05bc583d0875b7563cfb01d,https://doi.org/10.1136/bmj.1.5033.1467,JournalArticle,unknown,1,brain,"he, That I receive the general food at first, Which you do live upon ; and fit it is, Because I am the store-house and the shop Of the whole body ; but if you do remember, I send it through the rivers of your blood, Even to the court, the heart, to the seat o' the brain, And through the cranks and offices of man ; The strongest nerves and small inferior veins Krom me receive that natural competency Whereby they live."
1903,Annotations,Unknown authors,The Hospital,1903-03-07,0,Clinical Neurology and Neurodegeneration,human;non-human,10.1136/bmj.1.4185.445-a,ee1808eb3127c53ba2b84a43e6cde689b20c0259,https://doi.org/10.1136/bmj.1.4185.445-a,JournalArticle,unknown,1,cortical,Wars have a habit of throwing up new medical problems or putting old problems in a new perspective.
1903,Annotations,Unknown authors,The Hospital,1903-01-24,0,"Brain Development, Plasticity, and Connectomics",human;non-human,10.1136/bmj.2.5103.1027,bb8cb2adf41d10b122aac71c5568822112ee4c8b,https://doi.org/10.1136/bmj.2.5103.1027,JournalArticle,unknown,1,central nervous system,officers have taken great interest in the subject and more and more clinics are being set up where children suspected of deafness can be tested at ages from under 1 year onwards.4 Dr.
1903,"Bemerkungen zu dem Aufsatze von Dr. M. Felsch über „zwei Fälle von cerebraler Kinderlähmung"" (Dieses Archiv 36. Bd. 3. Heft, S. 895 u. f.).",Sommer,European Archives of Psychiatry and Neurological Sciences,1903-04-01,0,General Brain Science and Reviews,,10.1007/BF02227704,df29be0843709127b4a66723dff496ecdadedcca,https://doi.org/10.1007/BF02227704,paper,unknown,1,cerebral,
1903,Brain-Weights of Brothers,E. A. Spitzka,Science,1903-11-27,0,General Brain Science and Reviews,,10.1126/science.18.465.699.a,136079c1686bdf58ef35204d69068c4ccf1fd300,https://doi.org/10.1126/science.18.465.699.a,paper,unknown,4,brain; brain in title,
1903,Brain-Weights of Brothers and Sisters,E. A. Spitzka,Science,1903-03-27,0,General Brain Science and Reviews,,10.1126/science.17.430.516.a,b75f8358603b85af67c61b6dcda21a3d6c6b0cc9,https://doi.org/10.1126/science.17.430.516.a,paper,unknown,4,brain; brain in title,
