rank,year,title,authors,venue,publicationDate,citationCount,influentialCitationCount,importanceScore,category,keywordTags,keyIdea,strengths,limitations,doi,sourceId,url,semanticScholarUrl,openAccessPdf,githubUrl,workType,language,relevanceReason,abstract
27,2009,Chronic Traumatic Encephalopathy in Athletes: Progressive Tauopathy following Repetitive Head Injury,"A. Mckee, R. Cantu, Christopher J. Nowinski, E. Hedley-Whyte, B. Gavett, A. Budson, et al.",Journal of Neuropathology and Experimental Neurology,2009-07-01,2160,165,161.61,Clinical Neurology and Neurodegeneration,human;non-human,"Since the 1920s, it has been known that the repetitive brain trauma associated with boxing may produce a progressive neurological deterioration, originally termed dementia pugilistica, and more recently, chronic traumatic encephalopathy (CTE).","high citation signal (2,160); recognized venue; open-access PDF metadata; human evidence signal","Clinical cohorts often differ in disease stage, comorbidity, treatment history, and follow-up duration.; Biomarkers may not transfer cleanly across populations, scanners, care settings, or diagnostic criteria.; Non-human findings need careful translation to human brain organization and clinical outcomes.",10.1097/NEN.0b013e3181a9d503,7fb8ae8737940e02bb81c6e93e26a1513ff58b60,https://doi.org/10.1097/nen.0b013e3181a9d503,https://www.semanticscholar.org/paper/7fb8ae8737940e02bb81c6e93e26a1513ff58b60,,,Review; JournalArticle; CaseReport,unknown,brain; cerebral; cortical,"Since the 1920s, it has been known that the repetitive brain trauma associated with boxing may produce a progressive neurological deterioration, originally termed dementia pugilistica, and more recently, chronic traumatic encephalopathy (CTE). We review 48 cases of neuropathologically verified CTE recorded in the literature and document the detailed findings of CTE in 3 professionalathletes, 1 football player and 2 boxers. Clinically, CTE is associated with memory disturbances, behavioral and personality changes, parkinsonism, and speech and gait abnormalities. Neuropathologically, CTE is characterized by atrophy of the cerebral hemispheres, medial temporal lobe, thalamus, mammillary bodies, and brainstem, with ventricular dilatation and a fenestrated cavum septum pellucidum. Microscopically, there are extensive tau-immunoreactive neurofibrillary tangles, astrocytic tangles, and spindle-shaped and threadlike neurites throughout the brain. The neurofibrillary degeneration of CTE is distinguished from other tauopathies by preferential involvement of the superficial cortical layers, irregular patchy distribution in the frontal and temporal cortices, propensity for sulcal depths, prominent perivascular, periventricular, and subpial distribution, and marked accumulation of tau-immunoreactive astrocytes. Deposition of &bgr;-amyloid, most commonly as diffuse plaques, occurs in fewer than half the cases. Chronic traumatic encephalopathy is a neuropathologically distinct slowly progressive tauopathy with a clear environmental etiology."
28,2009,"The Common Neural Basis of Autobiographical Memory, Prospection, Navigation, Theory of Mind, and the Default Mode: A Quantitative Meta-analysis","R. N. Spreng, R. Mar, A. Kim",Journal of Cognitive Neuroscience,2009-03-01,2146,123,171.49,Cognitive and Systems Neuroscience,non-human;connectome,"A core brain network has been proposed to underlie a number of different processes, including remembering, prospection, navigation, and theory of mind [Buckner, R.","high citation signal (2,146); recognized venue; open-access PDF metadata","Task designs can simplify cognition enough that ecological validity becomes uncertain.; Cross-species alignment between circuits, behavior, and subjective experience remains imperfect.; Non-human findings need careful translation to human brain organization and clinical outcomes.",10.1162/jocn.2008.21029,65ab3415072bded398074af8ecc57f410ed75b07,https://doi.org/10.1162/jocn.2008.21029,https://www.semanticscholar.org/paper/65ab3415072bded398074af8ecc57f410ed75b07,,,JournalArticle,unknown,brain; cortex; neural; neuroimaging; prefrontal; neuroscience term,"A core brain network has been proposed to underlie a number of different processes, including remembering, prospection, navigation, and theory of mind [Buckner, R. L., & Carroll, D. C. Self-projection and the brain. Trends in Cognitive Sciences, 11, 49-57, 2007]. This purported network-medial prefrontal, medial-temporal, and medial and lateral parietal regions-is similar to that observed during default-mode processing and has been argued to represent self-projection [Buckner, R. L., & Carroll, D. C. Self-projection and the brain. Trends in Cognitive Sciences, 11, 49-57, 2007] or scene-construction [Hassabis, D., & Maguire, E. A. Deconstructing episodic memory with construction. Trends in Cognitive Sciences, 11, 299-306, 2007]. To date, no systematic and quantitative demonstration of evidence for this common network has been presented. Using the activation likelihood estimation (ALE) approach, we conducted four separate quantitative meta-analyses of neuroimaging studies on: (a) autobiographical memory, (b) navigation, (c) theory of mind, and (d) default mode. A conjunction analysis between these domains demonstrated a high degree of correspondence. We compared these findings to a separate ALE analysis of prospection studies and found additional correspondence. Across all domains, and consistent with the proposed network, correspondence was found within the medial-temporal lobe, precuneus, posterior cingulate, retrosplenial cortex, and the temporo-parietal junction. Additionally, this study revealed that the core network extends to lateral prefrontal and occipital cortices. Autobiographical memory, prospection, theory of mind, and default mode demonstrated further reliable involvement of the medial prefrontal cortex and lateral temporal cortices. Autobiographical memory and theory of mind, previously studied as distinct, exhibited extensive functional overlap. These findings represent quantitative evidence for a core network underlying a variety of cognitive domains."
29,2009,EFFECT OF CHLORPROMAZINE OR HALOPERIDOL ON FORMATION OF 3METHOXYTYRAMINE AND NORMETANEPHRINE IN MOUSE BRAIN.,"A. Carlsson, M. Lindqvist",Acta Pharmacologica et Toxicologica,2009-03-13,2099,23,146.89,General Brain Science and Reviews,non-human,Positions EFFECT OF CHLORPROMAZINE OR HALOPERIDOL ON FORMATION OF 3METHOXYTYRAMINE AND NORMETANEPHRINE IN MOUSE BRAIN. within General Brain Science and Reviews.,"high citation signal (2,099)","Broad reviews can dominate citation-ranked lists while obscuring narrower empirical advances.; Taxonomy boundaries are imperfect because many brain papers combine methods, scales, and diseases.; Non-human findings need careful translation to human brain organization and clinical outcomes.",10.1111/J.1600-0773.1963.TB01730.X,587790c37aef83a3cbb833c19ba3fc0d99e0c5b3,https://doi.org/10.1111/j.1600-0773.1963.tb01730.x,https://www.semanticscholar.org/paper/587790c37aef83a3cbb833c19ba3fc0d99e0c5b3,,,JournalArticle,unknown,brain; brain in title,
30,2009,Unbiased nonlinear average age-appropriate brain templates from birth to adulthood,"V. Fonov, A. Evans, RC McKinstry, C. Almli, D. Collins",Unknown venue,2009-07-01,2029,165,146.28,General Brain Science and Reviews,human,Positions Unbiased nonlinear average age-appropriate brain templates from birth to adulthood within General Brain Science and Reviews.,"high citation signal (2,029); human evidence signal","Broad reviews can dominate citation-ranked lists while obscuring narrower empirical advances.; Taxonomy boundaries are imperfect because many brain papers combine methods, scales, and diseases.; Human cohort effects can depend on recruitment, demographics, comorbidity, and measurement context.",10.1016/S1053-8119(09)70884-5,a43fb952240a3042629aa9187e380d39828b9d96,https://doi.org/10.1016/s1053-8119(09)70884-5,https://www.semanticscholar.org/paper/a43fb952240a3042629aa9187e380d39828b9d96,,,paper,unknown,brain; brain in title,
31,2009,The Expanded Biology of Serotonin,"Miles Berger, J. A. Gray, B. Roth",Annual Review of Medicine,2009-03-25,1911,61,149.01,Clinical Neurology and Neurodegeneration,,"Serotonin is perhaps best known as a neurotransmitter that modulates neural activity and a wide range of neuropsychological processes, and drugs that target serotonin receptors are used widely in psychiatry and neurology.","high citation signal (1,911); open-access PDF metadata","Clinical cohorts often differ in disease stage, comorbidity, treatment history, and follow-up duration.; Biomarkers may not transfer cleanly across populations, scanners, care settings, or diagnostic criteria.; Metadata-level ranking should be complemented with full-text expert review before strong claims are made.",10.1146/annurev.med.60.042307.110802,baab5bfde580a4e4aca396cea54813f39e102b68,https://doi.org/10.1146/annurev.med.60.042307.110802,https://www.semanticscholar.org/paper/baab5bfde580a4e4aca396cea54813f39e102b68,,,Review; JournalArticle,unknown,brain; neural; neuroscience term,"Serotonin is perhaps best known as a neurotransmitter that modulates neural activity and a wide range of neuropsychological processes, and drugs that target serotonin receptors are used widely in psychiatry and neurology. However, most serotonin is found outside the central nervous system, and virtually all of the 15 serotonin receptors are expressed outside as well as within the brain. Serotonin regulates numerous biological processes including cardiovascular function, bowel motility, ejaculatory latency, and bladder control. Additionally, new work suggests that serotonin may regulate some processes, including platelet aggregation, by receptor-independent, transglutaminase-dependent covalent linkage to cellular proteins. We review this new ""expanded serotonin biology"" and discuss how drugs targeting specific serotonin receptors are beginning to help treat a wide range of diseases."
32,2009,Claude Bernard and the heart-brain connection: further elaboration of a model of neurovisceral integration.,"J. Thayer, R. Lane",Neuroscience and Biobehavioral Reviews,2009-02-01,1910,141,157.2,General Brain Science and Reviews,non-human,Positions Claude Bernard and the heart-brain connection: further elaboration of a model of neurovisceral integration. within General Brain Science and Reviews.,"high citation signal (1,910); recognized venue","Broad reviews can dominate citation-ranked lists while obscuring narrower empirical advances.; Taxonomy boundaries are imperfect because many brain papers combine methods, scales, and diseases.; Non-human findings need careful translation to human brain organization and clinical outcomes.",10.1016/j.neubiorev.2008.08.004,a9e52cdf3f0b10cf71a962d7a1ac84e87a804e1c,https://doi.org/10.1016/j.neubiorev.2008.08.004,https://www.semanticscholar.org/paper/a9e52cdf3f0b10cf71a962d7a1ac84e87a804e1c,,,Review; JournalArticle,unknown,brain; brain in title,
33,2009,The global signal and observed anticorrelated resting state brain networks.,"M. Fox, Dongyang Zhang, A. Snyder, M. Raichle",Journal of Neurophysiology,2009-04-01,1901,122,148.11,"Brain Development, Plasticity, and Connectomics",connectome,"Positions The global signal and observed anticorrelated resting state brain networks. within Brain Development, Plasticity, and Connectomics.","high citation signal (1,901); open-access PDF metadata","Developmental and aging studies are sensitive to cohort composition, attrition, and longitudinal sampling intervals.; Network measures can depend heavily on parcellation, thresholding, and acquisition choices.; Metadata-level ranking should be complemented with full-text expert review before strong claims are made.",10.1152/jn.90777.2008,ddfb014761b5293d68914df8a0ad8b2e5af23438,https://doi.org/10.1152/jn.90777.2008,https://www.semanticscholar.org/paper/ddfb014761b5293d68914df8a0ad8b2e5af23438,,,JournalArticle,unknown,brain; brain in title,
34,2009,Experience-dependent structural synaptic plasticity in the mammalian brain,"A. Holtmaat, K. Svoboda",Nature Reviews Neuroscience,2009-09-01,1877,85,158.68,General Brain Science and Reviews,,Positions Experience-dependent structural synaptic plasticity in the mammalian brain within General Brain Science and Reviews.,"high citation signal (1,877); recognized venue; open-access PDF metadata","Broad reviews can dominate citation-ranked lists while obscuring narrower empirical advances.; Taxonomy boundaries are imperfect because many brain papers combine methods, scales, and diseases.; Metadata-level ranking should be complemented with full-text expert review before strong claims are made.",10.1038/nrn2699,90d02e6c7307cfcd30f779576673149491f84b9f,https://doi.org/10.1038/nrn2699,https://www.semanticscholar.org/paper/90d02e6c7307cfcd30f779576673149491f84b9f,https://www.nature.com/articles/nrn2721.pdf,,Review; JournalArticle,unknown,brain; brain in title,
35,2009,Coordinate-based ALE meta-analysis of neuroimaging data: A random-effects approach based on empirical estimates of spatial uncertainty,"Simon B. Eickhoff, Angela R. Laird, C. Grefkes, Ling E. Wang, K. Zilles, Peter T. Fox",Human Brain Mapping,2009-01-26,1876,374,162.27,Neuroimaging and Brain Mapping,fMRI;human;non-human,A widely used technique for coordinate-based meta-analyses of neuroimaging data is activation likelihood estimation (ALE).,"high citation signal (1,876); recognized venue; open-access PDF metadata; human evidence signal","Scanner, protocol, site, and preprocessing variation can limit reproducibility across cohorts.; Associational imaging biomarkers often need stronger longitudinal or intervention evidence before causal claims are made.; Non-human findings need careful translation to human brain organization and clinical outcomes.",10.1002/hbm.20718,9b9a6489172c1f564927c29b243276ad5ec131a8,https://doi.org/10.1002/hbm.20718,https://www.semanticscholar.org/paper/9b9a6489172c1f564927c29b243276ad5ec131a8,,,JournalArticle,unknown,brain; neuroimaging; fmri; mri,"A widely used technique for coordinate-based meta-analyses of neuroimaging data is activation likelihood estimation (ALE). ALE assesses the overlap between foci based on modeling them as probability distributions centered at the respective coordinates. In this Human Brain Project/Neuroinformatics research, the authors present a revised ALE algorithm addressing drawbacks associated with former implementations. The first change pertains to the size of the probability distributions, which had to be specified by the used. To provide a more principled solution, the authors analyzed fMRI data of 21 subjects, each normalized into MNI space using nine different approaches. This analysis provided quantitative estimates of between-subject and between-template variability for 16 functionally defined regions, which were then used to explicitly model the spatial uncertainty associated with each reported coordinate. Secondly, instead of testing for an above-chance clustering between foci, the revised algorithm assesses above-chance clustering between experiments. The spatial relationship between foci in a given experiment is now assumed to be fixed and ALE results are assessed against a null-distribution of random spatial association between experiments. Critically, this modification entails a change from fixed- to random-effects inference in ALE analysis allowing generalization of the results to the entire population of studies analyzed. By comparative analysis of real and simulated data, the authors showed that the revised ALE-algorithm overcomes conceptual problems of former meta-analyses and increases the specificity of the ensuing results without loosing the sensitivity of the original approach. It may thus provide a methodologically improved tool for coordinate-based meta-analyses on functional imaging data. Hum Brain Mapp 2009. © 2009 Wiley-Liss, Inc."
36,2009,Plasticity during stroke recovery: from synapse to behaviour,"T. Murphy, D. Corbett",Nature Reviews Neuroscience,2009-12-01,1875,102,155.66,"Cellular, Molecular, and Synaptic Neuroscience",,"Positions Plasticity during stroke recovery: from synapse to behaviour within Cellular, Molecular, and Synaptic Neuroscience.","high citation signal (1,875); recognized venue","Cellular mechanisms can be difficult to connect directly to whole-brain dynamics or human behavior.; Single-cell sampling, dissociation, alignment, and batch effects can bias inferred cell populations.; Metadata-level ranking should be complemented with full-text expert review before strong claims are made.",10.1038/nrn2735,1c462751c69086925438ddb7b34e630b33a875f8,https://doi.org/10.1038/nrn2735,https://www.semanticscholar.org/paper/1c462751c69086925438ddb7b34e630b33a875f8,,,Review; JournalArticle,unknown,synapse; neuroscience term,
37,2009,"The FGF family: biology, pathophysiology and therapy","A. Beenken, M. Mohammadi",Nature reviews. Drug discovery,2009-03-01,1848,97,152.4,"Brain Development, Plasticity, and Connectomics",,"The family of fibroblast growth factors (FGFs) regulates a plethora of developmental processes, including brain patterning, branching morphogenesis and limb development.","high citation signal (1,848); recognized venue; open-access PDF metadata","Developmental and aging studies are sensitive to cohort composition, attrition, and longitudinal sampling intervals.; Network measures can depend heavily on parcellation, thresholding, and acquisition choices.; Metadata-level ranking should be complemented with full-text expert review before strong claims are made.",10.1038/nrd2792,8e6d18e58bf57b2e0f053b8663d9c2301c707820,https://doi.org/10.1038/nrd2792,https://www.semanticscholar.org/paper/8e6d18e58bf57b2e0f053b8663d9c2301c707820,,,Review; JournalArticle,unknown,brain,"The family of fibroblast growth factors (FGFs) regulates a plethora of developmental processes, including brain patterning, branching morphogenesis and limb development. Several mitogenic, cytoprotective and angiogenic therapeutic applications of FGFs are already being explored, and the recent discovery of the crucial roles of the endocrine-acting FGF19 subfamily in bile acid, glucose and phosphate homeostasis has sparked renewed interest in the pharmacological potential of this family. This Review discusses traditional applications of recombinant FGFs and small-molecule FGF receptor kinase inhibitors in the treatment of cancer and cardiovascular disease and their emerging potential in the treatment of metabolic syndrome and hypophosphataemic diseases."
38,2009,Genes that mediate breast cancer metastasis to the brain,"Paula D. Bos, X. Zhang, C. Nadal, Weiping Shu, R. Gomis, D. Nguyen, et al.",Nature,2009-05-06,1818,103,162.51,Clinical Neurology and Neurodegeneration,human;non-human,The molecular basis for breast cancer metastasis to the brain is largely unknown.,"high citation signal (1,818); recognized venue; open-access PDF metadata; human evidence signal","Clinical cohorts often differ in disease stage, comorbidity, treatment history, and follow-up duration.; Biomarkers may not transfer cleanly across populations, scanners, care settings, or diagnostic criteria.; Non-human findings need careful translation to human brain organization and clinical outcomes.",10.1038/nature08021,1808cdb45986ed94966315bf25bc850a64df2e72,https://doi.org/10.1038/nature08021,https://www.semanticscholar.org/paper/1808cdb45986ed94966315bf25bc850a64df2e72,,,JournalArticle,unknown,brain; cerebral; brain in title,"The molecular basis for breast cancer metastasis to the brain is largely unknown. Brain relapse typically occurs years after the removal of a breast tumour, suggesting that disseminated cancer cells must acquire specialized functions to take over this organ. Here we show that breast cancer metastasis to the brain involves mediators of extravasation through non-fenestrated capillaries, complemented by specific enhancers of blood-brain barrier crossing and brain colonization. We isolated cells that preferentially infiltrate the brain from patients with advanced disease. Gene expression analysis of these cells and of clinical samples, coupled with functional analysis, identified the cyclooxygenase COX2 (also known as PTGS2), the epidermal growth factor receptor (EGFR) ligand HBEGF, and the α2,6-sialyltransferase ST6GALNAC5 as mediators of cancer cell passage through the blood-brain barrier. EGFR ligands and COX2 were previously linked to breast cancer infiltration of the lungs, but not the bones or liver, suggesting a sharing of these mediators in cerebral and pulmonary metastases. In contrast, ST6GALNAC5 specifically mediates brain metastasis. Normally restricted to the brain, the expression of ST6GALNAC5 in breast cancer cells enhances their adhesion to brain endothelial cells and their passage through the blood-brain barrier. This co-option of a brain sialyltransferase highlights the role of cell-surface glycosylation in organ-specific metastatic interactions."
39,2009,Time-frequency dynamics of resting-state brain connectivity measured with fMRI,"Catie Chang, G. Glover",NeuroImage,2009-12-16,1812,128,173.65,Neuroimaging and Brain Mapping,fMRI;non-human;connectome,"Most studies of resting-state functional connectivity using fMRI employ methods that assume temporal stationarity, such as correlation and data-driven decompositions computed across the duration of the scan.","high citation signal (1,812); recognized venue; open-access PDF metadata","Scanner, protocol, site, and preprocessing variation can limit reproducibility across cohorts.; Associational imaging biomarkers often need stronger longitudinal or intervention evidence before causal claims are made.; Non-human findings need careful translation to human brain organization and clinical outcomes.",10.1016/j.neuroimage.2009.12.011,3c39636a812fc04d3bed7104958fb75b12f33cb4,https://doi.org/10.1016/j.neuroimage.2009.12.011,https://www.semanticscholar.org/paper/3c39636a812fc04d3bed7104958fb75b12f33cb4,,,JournalArticle,unknown,brain; cortex; fmri; mri; brain in title; neuroscience term,"Most studies of resting-state functional connectivity using fMRI employ methods that assume temporal stationarity, such as correlation and data-driven decompositions computed across the duration of the scan. However, evidence from both task-based fMRI studies and animal electrophysiology suggests that functional connectivity may exhibit dynamic changes within time scales of seconds to minutes. In the present study, we investigated the dynamic behavior of resting-state connectivity across the course of a single scan, performing a time-frequency coherence analysis based on the wavelet transform. We focused on the connectivity of the posterior cingulate cortex (PCC), a primary node of the default-mode network, examining its relationship with both the ""anticorrelated"" (""task-positive"") network as well as other nodes of the default-mode network. It was observed that coherence and phase between the PCC and the anticorrelated network was variable in time and frequency, and statistical testing based on Monte Carlo simulations revealed the presence of significant scale-dependent temporal variability. In addition, a sliding-window correlation procedure identified other regions across the brain that exhibited variable connectivity with the PCC across the scan, which included areas previously implicated in attention and salience processing. Although it is unclear whether the observed coherence and phase variability can be attributed to residual noise or modulation of cognitive state, the present results illustrate that resting-state functional connectivity is not static, and it may therefore prove valuable to consider measures of variability, in addition to average quantities, when characterizing resting-state networks."
40,2009,"Microglial physiology: unique stimuli, specialized responses.","R. Ransohoff, V. Perry",Annual Review of Immunology,2009-03-20,1809,108,139.02,"Cellular, Molecular, and Synaptic Neuroscience",,"Positions Microglial physiology: unique stimuli, specialized responses. within Cellular, Molecular, and Synaptic Neuroscience.","high citation signal (1,809)","Cellular mechanisms can be difficult to connect directly to whole-brain dynamics or human behavior.; Single-cell sampling, dissociation, alignment, and batch effects can bias inferred cell populations.; Metadata-level ranking should be complemented with full-text expert review before strong claims are made.",10.1146/annurev.immunol.021908.132528,310278f19db789cdf662cd5a5ccad60d054156a7,https://doi.org/10.1146/annurev.immunol.021908.132528,https://www.semanticscholar.org/paper/310278f19db789cdf662cd5a5ccad60d054156a7,,,Review; JournalArticle,unknown,glia; microglia,
41,2009,The free-energy principle: a rough guide to the brain?,Karl J. Friston,Trends in Cognitive Sciences,2009-07-01,1771,161,154.64,General Brain Science and Reviews,,Positions The free-energy principle: a rough guide to the brain? within General Brain Science and Reviews.,"high citation signal (1,771); recognized venue","Broad reviews can dominate citation-ranked lists while obscuring narrower empirical advances.; Taxonomy boundaries are imperfect because many brain papers combine methods, scales, and diseases.; Metadata-level ranking should be complemented with full-text expert review before strong claims are made.",10.1016/j.tics.2009.04.005,a878886efacc6a5d742bf98bfc25c0734ce502b1,https://doi.org/10.1016/j.tics.2009.04.005,https://www.semanticscholar.org/paper/a878886efacc6a5d742bf98bfc25c0734ce502b1,,,JournalArticle; Review,unknown,brain; brain in title,
