rank,year,title,authors,venue,publicationDate,citationCount,influentialCitationCount,importanceScore,category,keywordTags,keyIdea,strengths,limitations,doi,sourceId,url,semanticScholarUrl,openAccessPdf,githubUrl,workType,language,relevanceReason,abstract
1,1981,A cortical network for directed attention and unilateral neglect,M. Mesulam,Annals of Neurology,1981-10-01,2545,102,156.36,Cognitive and Systems Neuroscience,connectome,Positions A cortical network for directed attention and unilateral neglect within Cognitive and Systems Neuroscience.,"high citation signal (2,545); recognized venue","Task designs can simplify cognition enough that ecological validity becomes uncertain.; Cross-species alignment between circuits, behavior, and subjective experience remains imperfect.; Metadata-level ranking should be complemented with full-text expert review before strong claims are made.",10.1002/ANA.410100402,3aa1081f001166d135f992ad4dc6451182581787,https://doi.org/10.1002/ana.410100402,https://www.semanticscholar.org/paper/3aa1081f001166d135f992ad4dc6451182581787,,,Review; JournalArticle,unknown,cortical,
2,1981,The influence of immaturity on hypoxic-ischemic brain damage in the rat,"J. Rice, R. Vannucci, J. Brierley",Annals of Neurology,1981-02-01,2188,80,159.64,Clinical Neurology and Neurodegeneration,non-human,Positions The influence of immaturity on hypoxic-ischemic brain damage in the rat within Clinical Neurology and Neurodegeneration.,"high citation signal (2,188); recognized venue","Clinical cohorts often differ in disease stage, comorbidity, treatment history, and follow-up duration.; Biomarkers may not transfer cleanly across populations, scanners, care settings, or diagnostic criteria.; Non-human findings need careful translation to human brain organization and clinical outcomes.",10.1002/ana.410090206,62cafdb36fe5cc23e883d391b802d08cc64dc2db,https://doi.org/10.1002/ana.410090206,https://www.semanticscholar.org/paper/62cafdb36fe5cc23e883d391b802d08cc64dc2db,,,JournalArticle,unknown,brain; brain in title,
3,1981,Cell Damage in the Brain: A Speculative Synthesis,B. Siesjö,Journal of Cerebral Blood Flow and Metabolism,1981-06-01,1668,16,144.56,"Cerebrovascular, Metabolism, and Brain Injury",,"Positions Cell Damage in the Brain: A Speculative Synthesis within Cerebrovascular, Metabolism, and Brain Injury.","high citation signal (1,668); open-access PDF metadata","Acute injury studies can be sensitive to timing, severity, comorbidity, and treatment heterogeneity.; Animal models may not capture human vascular risk, injury complexity, or rehabilitation context.; Metadata-level ranking should be complemented with full-text expert review before strong claims are made.",10.1038/jcbfm.1981.18,96e9c99dcc9ea72449fc967a42c170d75d4b8125,https://doi.org/10.1038/jcbfm.1981.18,https://www.semanticscholar.org/paper/96e9c99dcc9ea72449fc967a42c170d75d4b8125,,,Review; JournalArticle,unknown,brain; brain in title,
4,1981,Electric fields of the brain,"P. Nunez, R. Srinivasan",Unknown venue,1981,1560,99,140.36,General Brain Science and Reviews,,Positions Electric fields of the brain within General Brain Science and Reviews.,"high citation signal (1,560)","Broad reviews can dominate citation-ranked lists while obscuring narrower empirical advances.; Taxonomy boundaries are imperfect because many brain papers combine methods, scales, and diseases.; Metadata-level ranking should be complemented with full-text expert review before strong claims are made.",10.2307/2530855,1a1c9eb8c63810a17134261881b7d2b97eecfcc9,https://doi.org/10.2307/2530855,https://www.semanticscholar.org/paper/1a1c9eb8c63810a17134261881b7d2b97eecfcc9,,,paper,unknown,brain; brain in title,
5,1981,Focal Cerebral Ischaemia in the Rat: 1. Description of Technique and Early Neuropathological Consequences following Middle Cerebral Artery Occlusion,"A. Tamura, D. Graham, J. Mcculloch, G. Teasdale",Journal of Cerebral Blood Flow and Metabolism,1981-03-01,1452,28,137.26,"Cerebrovascular, Metabolism, and Brain Injury",non-human,"Positions Focal Cerebral Ischaemia in the Rat: 1. Description of Technique and Early Neuropathological Consequences following Middle Cerebral Artery Occlusion within Cerebrovascular, Metabolism, and Brain Injury.","high citation signal (1,452); open-access PDF metadata","Acute injury studies can be sensitive to timing, severity, comorbidity, and treatment heterogeneity.; Animal models may not capture human vascular risk, injury complexity, or rehabilitation context.; Non-human findings need careful translation to human brain organization and clinical outcomes.",10.1038/jcbfm.1981.6,5b08606df348cd2158234876c243d430e782634f,https://doi.org/10.1038/jcbfm.1981.6,https://www.semanticscholar.org/paper/5b08606df348cd2158234876c243d430e782634f,,,JournalArticle,unknown,cerebral,
6,1981,Thresholds of focal cerebral ischemia in awake monkeys.,"T. Jones, R. Morawetz, R. Crowell, F. Marcoux, S. Fitzgibbon, U. Degirolami, et al.",Journal of Neurosurgery,1981-06-01,1211,39,131.0,"Cerebrovascular, Metabolism, and Brain Injury",non-human,"Positions Thresholds of focal cerebral ischemia in awake monkeys. within Cerebrovascular, Metabolism, and Brain Injury.","high citation signal (1,211)","Acute injury studies can be sensitive to timing, severity, comorbidity, and treatment heterogeneity.; Animal models may not capture human vascular risk, injury complexity, or rehabilitation context.; Non-human findings need careful translation to human brain organization and clinical outcomes.",10.3171/JNS.1981.54.6.0773,b1f4cb588b4987021e0d9c3bb2286b3c834a510a,https://doi.org/10.3171/jns.1981.54.6.0773,https://www.semanticscholar.org/paper/b1f4cb588b4987021e0d9c3bb2286b3c834a510a,,,JournalArticle,unknown,cerebral,
7,1981,Sexual differentiation of the brain,B. McEwen,Nature,1981-06-25,1015,24,147.63,General Brain Science and Reviews,,Positions Sexual differentiation of the brain within General Brain Science and Reviews.,"high citation signal (1,015); recognized venue; open-access PDF metadata","Broad reviews can dominate citation-ranked lists while obscuring narrower empirical advances.; Taxonomy boundaries are imperfect because many brain papers combine methods, scales, and diseases.; Metadata-level ranking should be complemented with full-text expert review before strong claims are made.",10.1038/291610A0,5de6183b8a8e19e540c721ea2690709be74991f9,https://doi.org/10.1038/291610a0,https://www.semanticscholar.org/paper/5de6183b8a8e19e540c721ea2690709be74991f9,https://www.nature.com/articles/291610a0.pdf,,News,unknown,brain; brain in title,
8,1981,3H-baclofen and 3H-GABA bind to bicuculline-insensitive GABAB sites in rat brain,"D. Hill, N. Bowery",Nature,1981-03-12,979,8,145.18,General Brain Science and Reviews,non-human,Positions 3H-baclofen and 3H-GABA bind to bicuculline-insensitive GABAB sites in rat brain within General Brain Science and Reviews.,high citation signal (979); recognized venue,"Broad reviews can dominate citation-ranked lists while obscuring narrower empirical advances.; Taxonomy boundaries are imperfect because many brain papers combine methods, scales, and diseases.; Non-human findings need careful translation to human brain organization and clinical outcomes.",10.1038/290149A0,df904e123a61a4a415418806d56de24bad8bfab2,https://doi.org/10.1038/290149a0,https://www.semanticscholar.org/paper/df904e123a61a4a415418806d56de24bad8bfab2,,,JournalArticle,unknown,brain; brain in title,
9,1981,New and revised data on volumes of brain structures in insectivores and primates.,"H. Stephan, Frahm Hd, G. Baron",Folia primatologica; international journal of primatology,1981,870,85,131.05,General Brain Science and Reviews,non-human,Positions New and revised data on volumes of brain structures in insectivores and primates. within General Brain Science and Reviews.,high citation signal (870),"Broad reviews can dominate citation-ranked lists while obscuring narrower empirical advances.; Taxonomy boundaries are imperfect because many brain papers combine methods, scales, and diseases.; Non-human findings need careful translation to human brain organization and clinical outcomes.",10.1159/000155963,ff9bc49061152df9b4963ce659598e8a9fa92d56,https://doi.org/10.1159/000155963,https://www.semanticscholar.org/paper/ff9bc49061152df9b4963ce659598e8a9fa92d56,,,JournalArticle,unknown,brain; brain in title,
10,1981,Behavioral enhancement of visual responses in monkey cerebral cortex. I. Modulation in posterior parietal cortex related to selective visual attention.,"M. Bushnell, M. Goldberg, D. Robinson",Journal of Neurophysiology,1981-10-01,858,20,132.8,Cognitive and Systems Neuroscience,non-human,Positions Behavioral enhancement of visual responses in monkey cerebral cortex. I. Modulation in posterior parietal cortex related to selective visual attention. within Cognitive and Systems Neuroscience.,high citation signal (858),"Task designs can simplify cognition enough that ecological validity becomes uncertain.; Cross-species alignment between circuits, behavior, and subjective experience remains imperfect.; Non-human findings need careful translation to human brain organization and clinical outcomes.",10.1152/JN.1981.46.4.755,2835118ccfc5c2500a53c8e42447a72217b1f636,https://doi.org/10.1152/jn.1981.46.4.755,https://www.semanticscholar.org/paper/2835118ccfc5c2500a53c8e42447a72217b1f636,,,JournalArticle,unknown,cerebral; cortex; neuroscience term,
11,1981,Electrophysiology of mammalian inferior olivary neurones in vitro. Different types of voltage-dependent ionic conductances.,"R. Llinás, Y. Yarom",Journal of Physiology,1981-06-01,842,20,132.27,"EEG, MEG, and Electrophysiology",,"Positions Electrophysiology of mammalian inferior olivary neurones in vitro. Different types of voltage-dependent ionic conductances. within EEG, MEG, and Electrophysiology.",high citation signal (842); open-access PDF metadata,"Low signal-to-noise ratio, artifacts, and source-localization uncertainty complicate interpretation.; Many studies rely on controlled tasks and may not generalize to everyday behavior or clinical monitoring.; Metadata-level ranking should be complemented with full-text expert review before strong claims are made.",10.1113/jphysiol.1981.sp013763,8e7b79caceb39cae336c56d5b666bedc74060c46,https://doi.org/10.1113/jphysiol.1981.sp013763,https://www.semanticscholar.org/paper/8e7b79caceb39cae336c56d5b666bedc74060c46,https://www.ncbi.nlm.nih.gov/pmc/articles/PMC1249398,,JournalArticle,unknown,neuron; neuroscience term,
12,1981,Ion diffusion modified by tortuosity and volume fraction in the extracellular microenvironment of the rat cerebellum.,"C. Nicholson, J. M. Phillips",Journal of Physiology,1981-12-01,842,61,127.47,General Brain Science and Reviews,non-human,Positions Ion diffusion modified by tortuosity and volume fraction in the extracellular microenvironment of the rat cerebellum. within General Brain Science and Reviews.,high citation signal (842); open-access PDF metadata,"Broad reviews can dominate citation-ranked lists while obscuring narrower empirical advances.; Taxonomy boundaries are imperfect because many brain papers combine methods, scales, and diseases.; Non-human findings need careful translation to human brain organization and clinical outcomes.",10.1113/jphysiol.1981.sp013981,b565986f247cba8de8f68ae29f3270b297f9bcf8,https://doi.org/10.1113/jphysiol.1981.sp013981,https://www.semanticscholar.org/paper/b565986f247cba8de8f68ae29f3270b297f9bcf8,,,JournalArticle,unknown,cerebellum,
13,1981,Some morphometric aspects of the brain in senile dementia of the alzheimer type,"R. Terry, A. Peck, R. Deteresa, R. Schechter, D. Horoupian",Annals of Neurology,1981-08-01,829,11,140.99,Clinical Neurology and Neurodegeneration,,Positions Some morphometric aspects of the brain in senile dementia of the alzheimer type within Clinical Neurology and Neurodegeneration.,high citation signal (829); recognized venue,"Clinical cohorts often differ in disease stage, comorbidity, treatment history, and follow-up duration.; Biomarkers may not transfer cleanly across populations, scanners, care settings, or diagnostic criteria.; Metadata-level ranking should be complemented with full-text expert review before strong claims are made.",10.1002/ana.410100209,7bc36035254b6dc377b8a8a22d3ac68200585428,https://doi.org/10.1002/ana.410100209,https://www.semanticscholar.org/paper/7bc36035254b6dc377b8a8a22d3ac68200585428,,,JournalArticle,unknown,brain; brain in title,
14,1981,Cortical blood vessels of the human brain.,"H. Duvernoy, S. Delon, J. L. Vannson",Brain Research Bulletin,1981-11-01,828,78,144.16,General Brain Science and Reviews,human,Positions Cortical blood vessels of the human brain. within General Brain Science and Reviews.,high citation signal (828); recognized venue; human evidence signal,"Broad reviews can dominate citation-ranked lists while obscuring narrower empirical advances.; Taxonomy boundaries are imperfect because many brain papers combine methods, scales, and diseases.; Human cohort effects can depend on recruitment, demographics, comorbidity, and measurement context.",10.1016/0361-9230(81)90007-1,d0314c1a650b700fc48d029a0842ab44d6f9317e,https://doi.org/10.1016/0361-9230(81)90007-1,https://www.semanticscholar.org/paper/d0314c1a650b700fc48d029a0842ab44d6f9317e,,,JournalArticle,unknown,brain; cortical; brain in title,
15,1981,A brain for all seasons: cyclical anatomical changes in song control nuclei of the canary brain.,F. Nottebohm,Science,1981-12-18,751,26,139.21,General Brain Science and Reviews,,Positions A brain for all seasons: cyclical anatomical changes in song control nuclei of the canary brain. within General Brain Science and Reviews.,high citation signal (751); recognized venue,"Broad reviews can dominate citation-ranked lists while obscuring narrower empirical advances.; Taxonomy boundaries are imperfect because many brain papers combine methods, scales, and diseases.; Metadata-level ranking should be complemented with full-text expert review before strong claims are made.",10.1126/SCIENCE.7313697,c0fd70d58616f33bc471e142c7c0fdd93e7ee2d3,https://doi.org/10.1126/science.7313697,https://www.semanticscholar.org/paper/c0fd70d58616f33bc471e142c7c0fdd93e7ee2d3,,,JournalArticle,unknown,brain; brain in title,
16,1981,"Left brain, right brain","S. P. Springer, G. Deutsch",Unknown venue,1981,726,4,126.6,General Brain Science and Reviews,,"Positions Left brain, right brain within General Brain Science and Reviews.",high citation signal (726),"Broad reviews can dominate citation-ranked lists while obscuring narrower empirical advances.; Taxonomy boundaries are imperfect because many brain papers combine methods, scales, and diseases.; Metadata-level ranking should be complemented with full-text expert review before strong claims are made.",10.2307/1422672,01bd295a28515022dde5717ea8e1efb10b46519a,https://doi.org/10.2307/1422672,https://www.semanticscholar.org/paper/01bd295a28515022dde5717ea8e1efb10b46519a,,,Review,unknown,brain; brain in title,
17,1981,"Lateral brain function, emotion, and conceptualization.",D. Tucker,Psychological bulletin,1981,710,27,126.2,General Brain Science and Reviews,,"Positions Lateral brain function, emotion, and conceptualization. within General Brain Science and Reviews.",high citation signal (710),"Broad reviews can dominate citation-ranked lists while obscuring narrower empirical advances.; Taxonomy boundaries are imperfect because many brain papers combine methods, scales, and diseases.; Metadata-level ranking should be complemented with full-text expert review before strong claims are made.",10.1037/0033-2909.89.1.19,83532cd5ac85d16892b9936fc6dbf24831f583dc,https://doi.org/10.1037/0033-2909.89.1.19,https://www.semanticscholar.org/paper/83532cd5ac85d16892b9936fc6dbf24831f583dc,,,JournalArticle; Review,unknown,brain; brain in title,
18,1981,"Immunohistochemical support for three putative transmitters in one neuron: coexistence of 5-hydroxytryptamine, substance P- and thyrotropin releasing hormone-like immunoreactivity in medullary neurons projecting to the spinal cord.","O. Johansson, T. Hökfelt, B. Pernow, S. Jeffcoate, N. White, H. Steinbusch, et al.",Neuroscience,1981-10-01,702,1,138.0,"Cellular, Molecular, and Synaptic Neuroscience",,"Positions Immunohistochemical support for three putative transmitters in one neuron: coexistence of 5-hydroxytryptamine, substance P- and thyrotropin releasing hormone-like immunoreactivity in medullary neurons projecting to the spinal cord. within Cellular, Molecular, and Synaptic Neuroscience.",high citation signal (702); recognized venue,"Cellular mechanisms can be difficult to connect directly to whole-brain dynamics or human behavior.; Single-cell sampling, dissociation, alignment, and batch effects can bias inferred cell populations.; Metadata-level ranking should be complemented with full-text expert review before strong claims are made.",10.1016/0306-4522(81)90028-2,4a618f6a4976336a0857fdc9f4ddf0132c4c520f,https://doi.org/10.1016/0306-4522(81)90028-2,https://www.semanticscholar.org/paper/4a618f6a4976336a0857fdc9f4ddf0132c4c520f,,,JournalArticle,unknown,neuron; neuroscience term,
19,1981,"Reversal of Focal ""Misery-Perfusion Syndrome"" By Extra-Intracranial Arterial Bypass in Hemodynamic Cerebral Ischemia: A Case Study with 15O Positron Emission Tomography","J. Baron, M. Bousser, A. Rey, A. Guillard, D. Comar, P. Castaigne",Stroke,1981-07-01,702,13,123.0,"Cerebrovascular, Metabolism, and Brain Injury",,"Positions Reversal of Focal ""Misery-Perfusion Syndrome"" By Extra-Intracranial Arterial Bypass in Hemodynamic Cerebral Ischemia: A Case Study with 15O Positron Emission Tomography within Cerebrovascular, Metabolism, and Brain Injury.",high citation signal (702); open-access PDF metadata,"Acute injury studies can be sensitive to timing, severity, comorbidity, and treatment heterogeneity.; Animal models may not capture human vascular risk, injury complexity, or rehabilitation context.; Metadata-level ranking should be complemented with full-text expert review before strong claims are made.",10.1161/01.STR.12.4.454,80437d45105ffed7e5e9e2ef21e6678585df01f7,https://doi.org/10.1161/01.str.12.4.454,https://www.semanticscholar.org/paper/80437d45105ffed7e5e9e2ef21e6678585df01f7,,,JournalArticle; CaseReport,unknown,cerebral,
20,1981,Characterization and measurement of dehydroepiandrosterone sulfate in rat brain.,"C. Corpéchot, P. Robel, M. Axelson, J. Sjövall, E. Baulieu",Proceedings of the National Academy of Sciences of the United States of America,1981-08-01,684,23,141.73,General Brain Science and Reviews,non-human,Positions Characterization and measurement of dehydroepiandrosterone sulfate in rat brain. within General Brain Science and Reviews.,high citation signal (684); recognized venue; open-access PDF metadata,"Broad reviews can dominate citation-ranked lists while obscuring narrower empirical advances.; Taxonomy boundaries are imperfect because many brain papers combine methods, scales, and diseases.; Non-human findings need careful translation to human brain organization and clinical outcomes.",10.1073/PNAS.78.8.4704,fb255d168a6176af3bf30f345090efcd2461b833,https://doi.org/10.1073/pnas.78.8.4704,https://www.semanticscholar.org/paper/fb255d168a6176af3bf30f345090efcd2461b833,,,JournalArticle,unknown,brain; brain in title,
21,1981,"Behavioral depression produced by an uncontrollable stressor: Relationship to norepinephrine, dopamine, and serotonin levels in various regions of rat brain","J. Weiss, P. Goodman, B. Losito, Sheila Corrigan, J. Charry, W. Bailey",Unknown venue,1981-10-01,676,15,126.52,Cognitive and Systems Neuroscience,non-human,"Positions Behavioral depression produced by an uncontrollable stressor: Relationship to norepinephrine, dopamine, and serotonin levels in various regions of rat brain within Cognitive and Systems Neuroscience.",high citation signal (676),"Task designs can simplify cognition enough that ecological validity becomes uncertain.; Cross-species alignment between circuits, behavior, and subjective experience remains imperfect.; Non-human findings need careful translation to human brain organization and clinical outcomes.",10.1016/0165-0173(81)90005-9,f0c6844835f38ed408fc56ac3d6bfe3e28d193f9,https://doi.org/10.1016/0165-0173(81)90005-9,https://www.semanticscholar.org/paper/f0c6844835f38ed408fc56ac3d6bfe3e28d193f9,,,paper,unknown,brain; brain in title,
22,1981,Brain of the Firm,C. Elphick,Unknown venue,1981-09-01,672,100,125.21,General Brain Science and Reviews,,Positions Brain of the Firm within General Brain Science and Reviews.,high citation signal (672),"Broad reviews can dominate citation-ranked lists while obscuring narrower empirical advances.; Taxonomy boundaries are imperfect because many brain papers combine methods, scales, and diseases.; Metadata-level ranking should be complemented with full-text expert review before strong claims are made.",10.1057/JORS.1981.168,3c3aca0ed774d82922ad8d98028d09898f491def,https://doi.org/10.1057/jors.1981.168,https://www.semanticscholar.org/paper/3c3aca0ed774d82922ad8d98028d09898f491def,,,paper,unknown,brain; brain in title,
23,1981,Developing nervous tissue induces formation of blood-brain barrier characteristics in invading endothelial cells: a study using quail--chick transplantation chimeras.,"P. Stewart, M. Wiley",Developmental Biology,1981-05-01,670,7,125.16,"Brain Development, Plasticity, and Connectomics",,"Positions Developing nervous tissue induces formation of blood-brain barrier characteristics in invading endothelial cells: a study using quail--chick transplantation chimeras. within Brain Development, Plasticity, and Connectomics.",high citation signal (670),"Developmental and aging studies are sensitive to cohort composition, attrition, and longitudinal sampling intervals.; Network measures can depend heavily on parcellation, thresholding, and acquisition choices.; Metadata-level ranking should be complemented with full-text expert review before strong claims are made.",10.1016/0012-1606(81)90382-1,9519d62e30124662f7d57ec095a798da0925bd48,https://doi.org/10.1016/0012-1606(81)90382-1,https://www.semanticscholar.org/paper/9519d62e30124662f7d57ec095a798da0925bd48,,,JournalArticle,unknown,brain; brain in title,
24,1981,Activation of adenylate cyclase by the diterpene forskolin does not require the guanine nucleotide regulatory protein.,"K. Seamon, J. Daly",Journal of Biological Chemistry,1981-10-10,656,3,132.18,"EEG, MEG, and Electrophysiology",EEG;non-human,"Forskolin, a novel diterpene activator of adenylate cyclase in membranes and intact cells, activates the enzyme in membranes from mutant cyc-S49 murine lymphoma cells and the soluble enzyme from rat testes.",high citation signal (656); open-access PDF metadata,"Low signal-to-noise ratio, artifacts, and source-localization uncertainty complicate interpretation.; Many studies rely on controlled tasks and may not generalize to everyday behavior or clinical monitoring.; Non-human findings need careful translation to human brain organization and clinical outcomes.",10.1016/s0021-9258(19)68694-1,fe9c54f5552bbae81017d5595bf81c533c9ade19,https://doi.org/10.1016/s0021-9258(19)68694-1,https://www.semanticscholar.org/paper/fe9c54f5552bbae81017d5595bf81c533c9ade19,,,JournalArticle,unknown,cerebral; cortex; neuroscience term,"Forskolin, a novel diterpene activator of adenylate cyclase in membranes and intact cells, activates the enzyme in membranes from mutant cyc-S49 murine lymphoma cells and the soluble enzyme from rat testes. Each of these enzymes consists only of the catalytic subunit and does not have a functional guanine nucleotide-binding protein. In both cases forskolin converts the manganese-dependent enzymes to a form which does not require manganese for activity. Forskolin can also stimulate a detergent-solubilized preparation of adenylate cyclase from rat cerebral cortex. Activation of adenylate cyclase by forskolin is therefore not dependent on a perturbation of membrane structure nor does it require a functional guanine nucleotide-binding subunit."
25,1981,Relative brain size and basal metabolic rate in terrestrial vertebrates,Robert D. Martin,Nature,1981-09-03,651,47,137.84,General Brain Science and Reviews,non-human,Positions Relative brain size and basal metabolic rate in terrestrial vertebrates within General Brain Science and Reviews.,high citation signal (651); recognized venue,"Broad reviews can dominate citation-ranked lists while obscuring narrower empirical advances.; Taxonomy boundaries are imperfect because many brain papers combine methods, scales, and diseases.; Non-human findings need careful translation to human brain organization and clinical outcomes.",10.1038/293057A0,97a5d105d22bc64420d8a5d997598da3a96bed8a,https://doi.org/10.1038/293057a0,https://www.semanticscholar.org/paper/97a5d105d22bc64420d8a5d997598da3a96bed8a,,,JournalArticle; Study,unknown,brain; brain in title,
