rank,year,title,authors,venue,publicationDate,citationCount,influentialCitationCount,importanceScore,category,keywordTags,keyIdea,strengths,limitations,doi,sourceId,url,openAccessPdf,workType,language,relevanceReason,abstract
1,1925,THE EFFECT OF LESIONS OF THE HIND- AND MID-BRAIN ON MICTURITION IN THE CAT,F. Barrington,Unknown venue,1925-03-15,385,7,118.21,General Brain Science and Reviews,,Positions THE EFFECT OF LESIONS OF THE HIND- AND MID-BRAIN ON MICTURITION IN THE CAT within General Brain Science and Reviews.,high citation signal (385); open-access PDF metadata,"Broad reviews can dominate citation-ranked lists while obscuring narrower empirical advances.; Taxonomy boundaries are imperfect because many brain papers combine methods, scales, and diseases.; Metadata-level ranking should be complemented with full-text expert review before strong claims are made.",10.1113/EXPPHYSIOL.1925.SP000345,9b0d62064bc54a861b55b65a3883d725547f5f8a,https://doi.org/10.1113/EXPPHYSIOL.1925.SP000345,https://onlinelibrary.wiley.com/doi/pdfdirect/10.1113/expphysiol.1925.sp000345,paper,unknown,brain; brain in title,
2,1925,MICROSCOPICAL OBSERVATIONS ON THE CIRCULATION OF THE BLOOD IN THE CEREBRAL CORTEX,H. Florey,Unknown venue,1925-03-01,163,2,101.8,General Brain Science and Reviews,,Positions MICROSCOPICAL OBSERVATIONS ON THE CIRCULATION OF THE BLOOD IN THE CEREBRAL CORTEX within General Brain Science and Reviews.,high citation signal (163),"Broad reviews can dominate citation-ranked lists while obscuring narrower empirical advances.; Taxonomy boundaries are imperfect because many brain papers combine methods, scales, and diseases.; Metadata-level ranking should be complemented with full-text expert review before strong claims are made.",10.1093/BRAIN/48.1.43,7618f12ead9aa27cd1cb574b86e5b6d955d894ef,https://doi.org/10.1093/BRAIN/48.1.43,,paper,unknown,cerebral; cortex; neuroscience term,
3,1925,POINTS OF VIEW CONCERNING FORE-BRAIN MORPHOLOGY IN HIGHER VERTEBRATES,Nils Holmgren,Unknown venue,1925-09-01,112,5,94.29,General Brain Science and Reviews,non-human,Positions POINTS OF VIEW CONCERNING FORE-BRAIN MORPHOLOGY IN HIGHER VERTEBRATES within General Brain Science and Reviews.,high citation signal (112),"Broad reviews can dominate citation-ranked lists while obscuring narrower empirical advances.; Taxonomy boundaries are imperfect because many brain papers combine methods, scales, and diseases.; Non-human findings need careful translation to human brain organization and clinical outcomes.",10.1111/J.1463-6395.1925.TB00271.X,b1ef3ee5a6db0c82f3a002b0a500c5becc5b2be1,https://doi.org/10.1111/J.1463-6395.1925.TB00271.X,,paper,unknown,brain; brain in title,
4,1925,CONTRIBUTION TO THE MORPHOLOGY OF THE BRAIN OF CERATODUS,"Nils Holmgren, C. Horst",Unknown venue,1925-06-01,94,3,91.17,General Brain Science and Reviews,non-human,Positions CONTRIBUTION TO THE MORPHOLOGY OF THE BRAIN OF CERATODUS within General Brain Science and Reviews.,high citation signal (94),"Broad reviews can dominate citation-ranked lists while obscuring narrower empirical advances.; Taxonomy boundaries are imperfect because many brain papers combine methods, scales, and diseases.; Non-human findings need careful translation to human brain organization and clinical outcomes.",10.1111/J.1463-6395.1925.TB00262.X,e027fb221aef6fe353e825cef437f1de587b1525,https://doi.org/10.1111/J.1463-6395.1925.TB00262.X,,paper,unknown,brain; brain in title,
5,1925,STUDIES ON THE ETIOLOGY OF HEARTWATER,E. V. Cowdry,Journal of Experimental Medicine,1925-07-31,88,4,95.0,General Brain Science and Reviews,non-human,"A Gram-negative, intracellular, coccus-like microorganism was found in cases of heartwater in the three species which are susceptible to the disease; namely, goats, sheep, and cattle.",high citation signal (88); open-access PDF metadata,"Broad reviews can dominate citation-ranked lists while obscuring narrower empirical advances.; Taxonomy boundaries are imperfect because many brain papers combine methods, scales, and diseases.; Non-human findings need careful translation to human brain organization and clinical outcomes.",10.1084/jem.42.2.231,6bbe0a2c28eb567e2d6a63fc0c53da4b84dd5bfd,https://doi.org/10.1084/jem.42.2.231,https://rupress.org/jem/article-pdf/42/2/231/1139703/231.pdf,JournalArticle,unknown,cerebral; cortex; neuroscience term,"A Gram-negative, intracellular, coccus-like microorganism was found in cases of heartwater in the three species which are susceptible to the disease; namely, goats, sheep, and cattle. It was absent in the case of control animals, both normal ones and those dying of some. other diseases. The presence of this microorganism was definitely related to the febrile reaction. It was most easily detected in the renal glomeruli and in the small capillaries of the cerebral cortex but probably occurred throughout the body. The microorganism was a typical endothelial parasite, being restricted in distribution to the endothelial cells of the smaller blood vessels and to portions of such elements which had broken off into the blood stream. It was never observed to cause injury to the cells other than those incident to mechanical distention through accumulation within them of many individuals in large densely packed masses which were characteristically spherical. A typical attribute was the presence of several of these masses within the cytoplasm of a single endothelial cell. In view of the association of this microorganism with heartwater, a disease of ruminants, and thus far the only one in which microorganisms resembling Rickettsiœ have been reported, the designation Rickettsia ruminantium is proposed."
6,1925,CLINICAL AND ANATOMICAL CONTRIBUTIONS ON BRAIN PATHOLOGY,"S. Henschen, W. F. Schaller",Unknown venue,1925-02-01,81,1,88.52,Clinical Neurology and Neurodegeneration,human,Positions CLINICAL AND ANATOMICAL CONTRIBUTIONS ON BRAIN PATHOLOGY within Clinical Neurology and Neurodegeneration.,high citation signal (81); human evidence signal,"Clinical cohorts often differ in disease stage, comorbidity, treatment history, and follow-up duration.; Biomarkers may not transfer cleanly across populations, scanners, care settings, or diagnostic criteria.; Human cohort effects can depend on recruitment, demographics, comorbidity, and measurement context.",10.1001/ARCHNEURPSYC.1925.02200080073006,9dfd977127ec02b612ca288335ddec230252f804,https://doi.org/10.1001/ARCHNEURPSYC.1925.02200080073006,,Review,unknown,brain; brain in title,
7,1925,SPONGIOBLASTOMA MULTIFORME: A PRIMARY MALIGNANT FORM OF BRAIN NEOPLASM: ITS CLINICAL AND ANATOMIC FEATURES,"J. Globus, I. Strauss",Unknown venue,1925-08-01,78,1,87.85,Clinical Neurology and Neurodegeneration,human,Positions SPONGIOBLASTOMA MULTIFORME: A PRIMARY MALIGNANT FORM OF BRAIN NEOPLASM: ITS CLINICAL AND ANATOMIC FEATURES within Clinical Neurology and Neurodegeneration.,high citation signal (78); human evidence signal,"Clinical cohorts often differ in disease stage, comorbidity, treatment history, and follow-up duration.; Biomarkers may not transfer cleanly across populations, scanners, care settings, or diagnostic criteria.; Human cohort effects can depend on recruitment, demographics, comorbidity, and measurement context.",10.1001/ARCHNEURPSYC.1925.02200140002001,9cf5e29d6b25bfd162f59149c90ed688a98e0829,https://doi.org/10.1001/ARCHNEURPSYC.1925.02200140002001,,paper,unknown,brain; brain in title,
8,1925,THE ANTIRACHITIC VALUE OF IRRADIATED PHYTOSTEROL AND CHOLESTEROL. I,"A. Hess, M. Weinstock, F. Helman",Unknown venue,1925-03-01,65,1,81.61,General Brain Science and Reviews,non-human,"getable oils acquire antirachitic potency by means of irradiation with the quartz mercury vapor lamp and, furthermore, that this quality is present in the non-saponifiable fraction and lacking in the saponifiable fracti0n.l As the main constituent of the nonsaponifiable fraction consists of phytosterol, the next step in this investigation was to ascertain whether phytosterol could be activated by means of irradiation.",high citation signal (65); open-access PDF metadata,"Broad reviews can dominate citation-ranked lists while obscuring narrower empirical advances.; Taxonomy boundaries are imperfect because many brain papers combine methods, scales, and diseases.; Non-human findings need careful translation to human brain organization and clinical outcomes.",10.1016/s0021-9258(18)84999-7,2a266d16a717e4cc955c2ed1687497a9d5a6e0b5,https://doi.org/10.1016/s0021-9258(18)84999-7,https://doi.org/10.1016/s0021-9258(18)84999-7,paper,unknown,brain,"In previous communications it has been shown that vegetable oils acquire antirachitic potency by means of irradiation with the quartz mercury vapor lamp and, furthermore, that this quality is present in the non-saponifiable fraction and lacking in the saponifiable fracti0n.l As the main constituent of the nonsaponifiable fraction consists of phytosterol, the next step in this investigation was to ascertain whether phytosterol could be activated by means of irradiation. Accordingly, phytosterol was prepared from cottonseed oil. The unsaponifiable matter from 1 liter of oil was obtained by repeated saponification and dissolving with acetone. This product was then extracted with 95 per cent hot alcohol and the phytosterol repeatedly recrystallized in order to render it as pure as possible. In spite of numerous recrystallizations it could not be rendered absolutely pure. A 1 per cent suspension of this phytosterol in water was irradiated for a hour at a distance of 1 foot. It was then fed in 0.25 cc. per capita amounts to rats which were receiving the standard low phosphorus diet. As will be seen from Table I the irradiated preparation conferred protection, whereas the nonirradiated phytosterol did not protect against rickets. In the same way, experiments were carried out with cholesterol. The cholesterol was a crystalline preparation extracted from brain tissue. It had been repeatedly recrystallized; its crystals were sharply outlined and its melting point was about 147.5""C. These"
9,1925,Observations on the Specific Part of the Heterogenetic Antigen,"K. Landsteiner, P. Levene",Journal of Immunology,1925-07-01,32,0,69.14,General Brain Science and Reviews,non-human,The following are some preliminary results of studies on the heterogenetic antigen.,high citation signal (32); open-access PDF metadata,"Broad reviews can dominate citation-ranked lists while obscuring narrower empirical advances.; Taxonomy boundaries are imperfect because many brain papers combine methods, scales, and diseases.; Non-human findings need careful translation to human brain organization and clinical outcomes.",10.4049/jimmunol.10.4.731,bf5059f05a70f08e400a65c03da1d38816551b51,https://doi.org/10.4049/jimmunol.10.4.731,https://journals.aai.org/jimmunol/article-pdf/10/4/731/985698/ji0100040731.pdf,paper,unknown,brain,"The following are some preliminary results of studies on the heterogenetic antigen. It is known that the specific part of the antigen can be extracted with alcohol from the organs of various animals. The chemical nature of this substance has been studied by Kurt Meyer (1), and by Wernicke and Sordelli (2). Kurt Meyer regarded the active substance as one of the group of unsaturated phosphatides (lecithin, cephalin), whereas Wernicke and Sordelli considered it a cerebroside. In a recent communication, however, Sordelli, Wernicke and Deulafeu (3) report that after purifications with pyridine and afterwards with diluted acetone, the fractions correponding to the cerebrosides-phrenosine and cerasine-were the less active ones. In connection with these contentions, two facts are of interest. These are: In the first place the generally weaker content in heterogenetic substance of the white substance of the brain, as compared with the content of several other organs (4, 5), and second, the failure of the pure cerobrosides phrenosine and cerasine and of pure sphyngomyelin to react with Forssman's heterogenetic antibodies in the same manner as the active extracts."
10,1925,Weight of the brain and of the internal organs in American monkeys. With data on brain weight in other apes,A. Hrdlička,Unknown venue,1925-04-01,29,1,70.42,General Brain Science and Reviews,non-human,Positions Weight of the brain and of the internal organs in American monkeys. With data on brain weight in other apes within General Brain Science and Reviews.,high citation signal (29),"Broad reviews can dominate citation-ranked lists while obscuring narrower empirical advances.; Taxonomy boundaries are imperfect because many brain papers combine methods, scales, and diseases.; Non-human findings need careful translation to human brain organization and clinical outcomes.",10.1002/AJPA.1330080207,f04932db65acf1c36c93319bd2db9243fbdef166,https://doi.org/10.1002/AJPA.1330080207,,paper,unknown,brain; brain in title,
11,1925,LIPOIDS AS THE GROWTH-INHIBITING FACTOR IN SERUM,"L. E. Baker, A. Carrel",Journal of Experimental Medicine,1925-07-31,25,1,63.65,General Brain Science and Reviews,,The growth-inhibiting action of serum has been shown to be due largely to the lipoids.,high citation signal (25); open-access PDF metadata,"Broad reviews can dominate citation-ranked lists while obscuring narrower empirical advances.; Taxonomy boundaries are imperfect because many brain papers combine methods, scales, and diseases.; Metadata-level ranking should be complemented with full-text expert review before strong claims are made.",10.1084/jem.42.2.143,b607439d711a36ef9ed06359131e009c4777d1ce,https://doi.org/10.1084/jem.42.2.143,https://rupress.org/jem/article-pdf/42/2/143/1139656/143.pdf,JournalArticle,unknown,brain,"The growth-inhibiting action of serum has been shown to be due largely to the lipoids. Serum from which the lipoids have been removed is much less inhibiting to the growth of fibroblasts in vitro than is the original serum, and only slightly more inhibiting than Tyrode solution. The lipoids extracted from the serum are toxic and more inhibiting to the growth of fibroblasts than the original serum. Lipoids extracted from chicken brain, chicken liver, egg, and embryonic tissue have likewise an inhibiting action."
12,1925,THE CEREBRAL VASCULATURE: PRELIMINARY REPORT OF STUDY BY MEANS OF ROENTGEN RAY,T. Fay,Unknown venue,1925-06-06,25,0,60.65,General Brain Science and Reviews,,Positions THE CEREBRAL VASCULATURE: PRELIMINARY REPORT OF STUDY BY MEANS OF ROENTGEN RAY within General Brain Science and Reviews.,high citation signal (25),"Broad reviews can dominate citation-ranked lists while obscuring narrower empirical advances.; Taxonomy boundaries are imperfect because many brain papers combine methods, scales, and diseases.; Metadata-level ranking should be complemented with full-text expert review before strong claims are made.",10.1001/JAMA.1925.02660490019008,80fc6b1077d0ea3d70820393efcafa87a2809dd7,https://doi.org/10.1001/JAMA.1925.02660490019008,,paper,unknown,cerebral,
13,1925,DEVELOPMENTAL STUDY OF EXCITATORY AREAS IN THE CEREBRAL CORTEX OF THE OPOSSUM,"L. H. Weed, O. Langworthy",Unknown venue,1925-03-01,24,0,70.94,"Brain Development, Plasticity, and Connectomics",,"Positions DEVELOPMENTAL STUDY OF EXCITATORY AREAS IN THE CEREBRAL CORTEX OF THE OPOSSUM within Brain Development, Plasticity, and Connectomics.",high citation signal (24); open-access PDF metadata,"Developmental and aging studies are sensitive to cohort composition, attrition, and longitudinal sampling intervals.; Network measures can depend heavily on parcellation, thresholding, and acquisition choices.; Metadata-level ranking should be complemented with full-text expert review before strong claims are made.",10.1152/AJPLEGACY.1925.72.1.8,24328aed432c2874694862f6d3789d7e00958b47,https://doi.org/10.1152/AJPLEGACY.1925.72.1.8,https://www.physiology.org/pb-assets/PDFs/2017-Legacy-1516816496183.pdf,paper,unknown,cerebral; cortex; neuroscience term,
14,1925,THE PROBLEM OF THE ETIOLOGY OF HERPES ZOSTER,"R. Cole, A. Kuttner",Journal of Experimental Medicine,1925-11-30,24,0,68.54,Neuroimaging and Brain Mapping,EEG;human;non-human,Attempts were made to produce lesions in.,high citation signal (24); open-access PDF metadata; human evidence signal,"Scanner, protocol, site, and preprocessing variation can limit reproducibility across cohorts.; Associational imaging biomarkers often need stronger longitudinal or intervention evidence before causal claims are made.; Non-human findings need careful translation to human brain organization and clinical outcomes.",10.1084/jem.42.6.799,3b020f4c44604a5b0129f99c1115e75f512f00c5,https://doi.org/10.1084/jem.42.6.799,http://jem.rupress.org/content/42/6/799.full.pdf,JournalArticle; Review,unknown,brain; cerebral,"Attempts were made to produce lesions in. animals by the injection of material obtained from the vesicles and involved skin of nine cases of herpes zoster. All the cases, with the exception of one (Case II), were characteristic cases of idiopathic herpes zoster and the question of their being cases of so called zosteriform herpes or symptomatic herpes zoster can hardly be raised. As regards Case II, if this case occurred alone, there might be some doubt as to its nature on account of the mildness of the symptoms and the small area of skin involvement. Taken in connection with Cases III and IV, however, which occurred in the same ward and in patients who were quite closely in contact with Patient II, it seems fairly reasonable to assume that they were all of the same character. Cases of herpes zoster have been extremely rare in this hospital and the occurrence of three cases in the same ward within a very short period of time suggests very strongly a transference of infection from one case to the other. That Case II was not one of herpes simplex also seems fairly certain from the negative results obtained by inoculation of rabbits' eyes with vesicle material. In making the animal experiments we employed various methods which were suggested largely by the technique used by previous observers, especially by those who have reported results which were considered positive. In making inoculations into the corneas the technique recommended by Lipschütz was employed as far as possible. Young rabbits were used and the material was obtained from fresh vesicles early in the disease and inoculated with as little delay as possible. The material injected into rabbits' eyes was obtained from seven cases and twenty-four rabbits were used. In judging of the results obtained in this kind of experimentation great caution must be observed. Our experience convinces us that slight opacities occurring along the lines of scarification and mild conjunctivitis cannot be held to indicate the effect of a specific virus. As regards the interpretation of the microscopic changes found, we were quite familiar with the appearance of intranuclear inclusion bodies as seen in the lesions of experimental herpes simplex and the filterable virus (Virus III) indigenous to rabbits described by Rivers and Tillett (5). We also had no difficulty in imding intranuclear inclusions in the sections of skin removed from patients. It is not likely, therefore, that these structures were overlooked in our study of the sections. Briefly stated, although the material studied was satisfactory and in spite of the fact that a considerable number of animals were used for each case, we have been unable to confirm the observations of Lipschütz regarding the experimental production of specific lesions in the corneas of rabbits. We realize that this is only negative evidence and therefore not of conclusive importance in view of Lipschütz's observations. It indicates, however, that the production of specific lesions in rabbits' eyes with material from herpes zoster vesicles is extremely difficult and that successful results may be a matter of chance, depending, possibly, on peculiar susceptibility on the part of the rabbits. In view of the fact, however, that a careful analysis of the positive results reported by other observers shows that the conclusions were based on insufficient evidence, we believe that further work is necessary before the successful inoculation of the rabbits' corneas with herpes zoster virus can be accepted as fully demonstrated. To make the evidence convincing specific lesions should be obtained with a fair degree of regularity and the virus should be successfully transmitted through at least two generations. Apparently the latter was not attempted by Lipschütz. Intracerebral inoculations into three rabbits with material from two cases (Nos. I and IV) were made. Two rabbits were also inoculated intraspinally with material from one case (No. IV). None of these animals showed any reaction. In the case of one of the animals inoculated into the brain (Case I) although this rabbit showed no symptoms, we thought it conceivable that the susceptibility of the species for the virus might be so slight that no obvious lesion had been produced. Nevertheless it was thought that the virus might possibly remain alive at the seat of inoculation and by repeated transfers become adapted to the rabbit. This phenomenon has been observed by Noguchi with vaccine virus, and by Rivers and Tillett with the rabbit virus isolated by these workers. This possibility was tested by us by making serial corneal and brain inoculations. Corneal transfers were carried through fourteen animals in series, and brain transfers through ten. No specific lesions developed in any of the animals. The work of Teague and Goodpasture suggested that the skin might be rendered more susceptible to infection by previous treatment with tar. Material from two cases (Nos. I and VIII) was inoculated into the tarred skin of guinea pigs and rabbits. The material was injected intracutaneously and also rubbed into the scarified skin. No reaction was obtained in any of the animals. Finally, the transmission of herpes zoster to monkeys was attempted. Blanc and Caminopetros, and Bastai and Busacca, as discussed in the review of the literature, inoculated monkeys (Macacus) in various ways, without success. It was thought possible that although monkeys of the genus Macacus might be refractory, monkeys of another genus might prove susceptible. Consequently, besides the inoculation of two Macacus monkeys, attempts were made to infect five vervets. Moreover, in view of the fact that the virus of vaccinia and the rabbit virus of Rivers and Tillett could be successfully cultivated in the testicle, intratesticular inoculations were employed. The testicles were removed at varying periods following inoculation. Numerous sections of these testicles were made and examined, but in no instance were any lesions found which could be interpreted as specific. No cells containing intranuclear inclusion bodies were found. These experiments, therefore, have also led to purely negative results. This report of our work is made at the present time because a considerable amount of literature has been published which gives the impression that herpes zoster has been successfully transmitted to animals. Although the observations of Lipschütz are suggestive, it is important that they be confirmed by further investigations. Until herpes zoster can be regularly transmitted to animals and cross-immunity tests be carried out, the relation of the virus of herpes zoster to that of herpes simplex remains a matter of speculation. In view of the fact that herpes simplex can be easily and regularly transmitted to rabbits, whereas in the hands of a large number of investigators similar experiments with herpes zoster are completely negative, it does not seem likely that the etiological agent concerned in these two diseases can be absolutely identical. The question of the identity or non-identity of herpes zoster and varicella is even more difficult to answer, because at present neither of these infections is readily transmissible to animals. The work of Kundratitz is extremely interesting. His observations, aside from indicating a close immunological relationship between herpes zoster and varicella, are important in that they seem to show the presence of a transmissible virus in the vesicles of herpes zoster. The only question that arises is whether the cases of herpes zoster from which Kundratitz was able to make successful transfers were true cases of idiopathic herpes zoster."
15,1925,CEREBRAL PNEUMOGRAPHY: ITS DANGERS AND USES,W. Penfield,Unknown venue,1925-05-01,23,0,59.2,General Brain Science and Reviews,,Positions CEREBRAL PNEUMOGRAPHY: ITS DANGERS AND USES within General Brain Science and Reviews.,high citation signal (23),"Broad reviews can dominate citation-ranked lists while obscuring narrower empirical advances.; Taxonomy boundaries are imperfect because many brain papers combine methods, scales, and diseases.; Metadata-level ranking should be complemented with full-text expert review before strong claims are made.",10.1001/ARCHNEURPSYC.1925.02200110037003,c97b1d28f8dc43500f949b8beae900cd51da2eba,https://doi.org/10.1001/ARCHNEURPSYC.1925.02200110037003,,paper,unknown,cerebral,
