rank,year,title,authors,venue,publicationDate,citationCount,influentialCitationCount,importanceScore,category,keywordTags,keyIdea,strengths,limitations,doi,sourceId,url,semanticScholarUrl,openAccessPdf,githubUrl,workType,language,relevanceReason,abstract
67,2009,The relation between inflammation and neurodegeneration in multiple sclerosis brains,"J. Frischer, S. Bramow, A. Dal-Bianco, C. Lucchinetti, H. Rauschka, M. Schmidbauer, et al.",Brain : a journal of neurology,2009-03-31,1423,48,156.1,Clinical Neurology and Neurodegeneration,human;non-human,"Some recent studies suggest that in progressive multiple sclerosis, neurodegeneration may occur independently from inflammation.","high citation signal (1,423); recognized venue; open-access PDF metadata; human evidence signal","Clinical cohorts often differ in disease stage, comorbidity, treatment history, and follow-up duration.; Biomarkers may not transfer cleanly across populations, scanners, care settings, or diagnostic criteria.; Non-human findings need careful translation to human brain organization and clinical outcomes.",10.1093/brain/awp070,e634418a98c9f0c0f850cf97b1c73edf25e27d4c,https://doi.org/10.1093/brain/awp070,https://www.semanticscholar.org/paper/e634418a98c9f0c0f850cf97b1c73edf25e27d4c,,,JournalArticle,unknown,brain; brain in title,"Some recent studies suggest that in progressive multiple sclerosis, neurodegeneration may occur independently from inflammation. The aim of our study was to analyse the interdependence of inflammation, neurodegeneration and disease progression in various multiple sclerosis stages in relation to lesional activity and clinical course, with a particular focus on progressive multiple sclerosis. The study is based on detailed quantification of different inflammatory cells in relation to axonal injury in 67 multiple sclerosis autopsies from different disease stages and 28 controls without neurological disease or brain lesions. We found that pronounced inflammation in the brain is not only present in acute and relapsing multiple sclerosis but also in the secondary and primary progressive disease. T- and B-cell infiltrates correlated with the activity of demyelinating lesions, while plasma cell infiltrates were most pronounced in patients with secondary progressive multiple sclerosis (SPMS) and primary progressive multiple sclerosis (PPMS) and even persisted, when T- and B-cell infiltrates declined to levels seen in age matched controls. A highly significant association between inflammation and axonal injury was seen in the global multiple sclerosis population as well as in progressive multiple sclerosis alone. In older patients (median 76 years) with long-disease duration (median 372 months), inflammatory infiltrates declined to levels similar to those found in age-matched controls and the extent of axonal injury, too, was comparable with that in age-matched controls. Ongoing neurodegeneration in these patients, which exceeded the extent found in normal controls, could be attributed to confounding pathologies such as Alzheimer's or vascular disease. Our study suggests a close association between inflammation and neurodegeneration in all lesions and disease stages of multiple sclerosis. It further indicates that the disease processes of multiple sclerosis may die out in aged patients with long-standing disease."
68,2009,Frequency of gamma oscillations routes flow of information in the hippocampus,"L. Colgin, Tobias Denninger, M. Fyhn, T. Hafting, Tora Bonnevie, O. Jensen, et al.",Nature,2009-11-19,1403,168,150.45,"EEG, MEG, and Electrophysiology",,"Positions Frequency of gamma oscillations routes flow of information in the hippocampus within EEG, MEG, and Electrophysiology.","high citation signal (1,403); recognized venue","Low signal-to-noise ratio, artifacts, and source-localization uncertainty complicate interpretation.; Many studies rely on controlled tasks and may not generalize to everyday behavior or clinical monitoring.; Metadata-level ranking should be complemented with full-text expert review before strong claims are made.",10.1038/nature08573,659e73c80b9f40f7c9d9769f362b9f8d449a3233,https://doi.org/10.1038/nature08573,https://www.semanticscholar.org/paper/659e73c80b9f40f7c9d9769f362b9f8d449a3233,,,JournalArticle,unknown,hippocampus; neuroscience term,
69,2009,Noninvasive cortical stimulation enhances motor skill acquisition over multiple days through an effect on consolidation,"J. Reis, Heidi M. Schambra, Leonardo G. Cohen, Ethan R. Buch, B. Fritsch, E. Zarahn, et al.",Proceedings of the National Academy of Sciences of the United States of America,2009-02-03,1374,67,148.27,General Brain Science and Reviews,stimulation,Positions Noninvasive cortical stimulation enhances motor skill acquisition over multiple days through an effect on consolidation within General Brain Science and Reviews.,"high citation signal (1,374); recognized venue; open-access PDF metadata","Broad reviews can dominate citation-ranked lists while obscuring narrower empirical advances.; Taxonomy boundaries are imperfect because many brain papers combine methods, scales, and diseases.; Metadata-level ranking should be complemented with full-text expert review before strong claims are made.",10.1073/pnas.0805413106,4d392eac7567f8033c33ffd42b15b6e6ba634d0d,https://doi.org/10.1073/pnas.0805413106,https://www.semanticscholar.org/paper/4d392eac7567f8033c33ffd42b15b6e6ba634d0d,,,JournalArticle,unknown,cortical,
70,2009,A probabilistic MR atlas of the human cerebellum,"J. Diedrichsen, J. Balsters, J. Flavell, E. Cussans, N. Ramnani",NeuroImage,2009-05-15,1367,106,146.38,General Brain Science and Reviews,human;connectome,Positions A probabilistic MR atlas of the human cerebellum within General Brain Science and Reviews.,"high citation signal (1,367); recognized venue; human evidence signal","Broad reviews can dominate citation-ranked lists while obscuring narrower empirical advances.; Taxonomy boundaries are imperfect because many brain papers combine methods, scales, and diseases.; Human cohort effects can depend on recruitment, demographics, comorbidity, and measurement context.",10.1016/j.neuroimage.2009.01.045,2458780b3c6323cb49b25a37288d127eb8c9a222,https://doi.org/10.1016/j.neuroimage.2009.01.045,https://www.semanticscholar.org/paper/2458780b3c6323cb49b25a37288d127eb8c9a222,,,JournalArticle,unknown,cerebellum,
71,2009,The mismatch negativity: A review of underlying mechanisms,"M. Garrido, J. Kilner, K. Stephan, Karl J. Friston",Clinical Neurophysiology,2009-03-01,1366,99,153.37,"Cellular, Molecular, and Synaptic Neuroscience",human;non-human,"The mismatch negativity (MMN) is a brain response to violations of a rule, established by a sequence of sensory stimuli (typically in the auditory domain) [Näätänen R.","high citation signal (1,366); open-access PDF metadata; synthesis or review value; human evidence signal","Cellular mechanisms can be difficult to connect directly to whole-brain dynamics or human behavior.; Single-cell sampling, dissociation, alignment, and batch effects can bias inferred cell populations.; Non-human findings need careful translation to human brain organization and clinical outcomes.",10.1016/j.clinph.2008.11.029,ad1fb331b219b79a3c2ea98f1241675c7c1f33bf,https://doi.org/10.1016/j.clinph.2008.11.029,https://www.semanticscholar.org/paper/ad1fb331b219b79a3c2ea98f1241675c7c1f33bf,,,Review; JournalArticle,unknown,brain; neuron; neuroscience term,"The mismatch negativity (MMN) is a brain response to violations of a rule, established by a sequence of sensory stimuli (typically in the auditory domain) [Näätänen R. Attention and brain function. Hillsdale, NJ: Lawrence Erlbaum; 1992]. The MMN reflects the brain's ability to perform automatic comparisons between consecutive stimuli and provides an electrophysiological index of sensory learning and perceptual accuracy. Although the MMN has been studied extensively, the neurophysiological mechanisms underlying the MMN are not well understood. Several hypotheses have been put forward to explain the generation of the MMN; amongst these accounts, the ""adaptation hypothesis"" and the ""model adjustment hypothesis"" have received the most attention. This paper presents a review of studies that focus on neuronal mechanisms underlying the MMN generation, discusses the two major explanatory hypotheses, and proposes predictive coding as a general framework that attempts to unify both."
72,2009,What does the retrosplenial cortex do?,"S. Vann, J. Aggleton, E. Maguire",Nature Reviews Neuroscience,2009-11-01,1354,58,149.81,General Brain Science and Reviews,,Positions What does the retrosplenial cortex do? within General Brain Science and Reviews.,"high citation signal (1,354); recognized venue","Broad reviews can dominate citation-ranked lists while obscuring narrower empirical advances.; Taxonomy boundaries are imperfect because many brain papers combine methods, scales, and diseases.; Metadata-level ranking should be complemented with full-text expert review before strong claims are made.",10.1038/nrn2733,ac9b5a7ded4922818ad01c5504b403d4e3786d2d,https://doi.org/10.1038/nrn2733,https://www.semanticscholar.org/paper/ac9b5a7ded4922818ad01c5504b403d4e3786d2d,,,Review; JournalArticle,unknown,cortex; neuroscience term,
73,2009,Uniquely hominid features of adult human astrocytes,"N. Oberheim, T. Takano, Xiaoning Han, Wei He, J. Lin, Fushun Wang, et al.",Journal of Neuroscience,2009-03-11,1327,123,164.05,"Cellular, Molecular, and Synaptic Neuroscience",EEG;human;non-human,Defining the microanatomic differences between the human brain and that of other mammals is key to understanding its unique computational power.,"high citation signal (1,327); recognized venue; open-access PDF metadata; human evidence signal","Cellular mechanisms can be difficult to connect directly to whole-brain dynamics or human behavior.; Single-cell sampling, dissociation, alignment, and batch effects can bias inferred cell populations.; Non-human findings need careful translation to human brain organization and clinical outcomes.",10.1523/JNEUROSCI.4707-08.2009,d7ab8e4768329cd667607316f8cd5e5d1e98a9d9,https://doi.org/10.1523/jneurosci.4707-08.2009,https://www.semanticscholar.org/paper/d7ab8e4768329cd667607316f8cd5e5d1e98a9d9,,,JournalArticle; Study,unknown,brain; cortex; cortical; neuron; glia; neuroscience term,"Defining the microanatomic differences between the human brain and that of other mammals is key to understanding its unique computational power. Although much effort has been devoted to comparative studies of neurons, astrocytes have received far less attention. We report here that protoplasmic astrocytes in human neocortex are 2.6-fold larger in diameter and extend 10-fold more GFAP (glial fibrillary acidic protein)-positive primary processes than their rodent counterparts. In cortical slices prepared from acutely resected surgical tissue, protoplasmic astrocytes propagate Ca2+ waves with a speed of 36 μm/s, approximately fourfold faster than rodent. Human astrocytes also transiently increase cystosolic Ca2+ in response to glutamatergic and purinergic receptor agonists. The human neocortex also harbors several anatomically defined subclasses of astrocytes not represented in rodents. These include a population of astrocytes that reside in layers 5-6 and extend long fibers characterized by regularly spaced varicosities. Another specialized type of astrocyte, the interlaminar astrocyte, abundantly populates the superficial cortical layers and extends long processes without varicosities to cortical layers 3 and 4. Human fibrous astrocytes resemble their rodent counterpart but are larger in diameter. Thus, human cortical astrocytes are both larger, and structurally both more complex and more diverse, than those of rodents. On this basis, we posit that this astrocytic complexity has permitted the increased functional competence of the adult human brain."
74,2009,Tumor self-seeding by circulating cancer cells,"Mi-Young Kim, Thordur Oskarsson, Swarnali Acharyya, D. Nguyen, X. Zhang, L. Norton, et al.",Cell,2009-12-24,1315,34,147.48,Computational Neuroscience and AI,non-human,Summary The dissemination of cancer cells from a primary tumor is conventionally viewed as a unidirectional process that culminates with the metastatic colonization of distant organs.,"high citation signal (1,315); recognized venue; open-access PDF metadata","Predictive performance does not necessarily identify causal neural mechanisms.; Models can inherit dataset bias, preprocessing artifacts, and task constraints.; Non-human findings need careful translation to human brain organization and clinical outcomes.",10.1016/j.cell.2009.11.025,89164c1fe12fb75883239dc64bea848d1fa4ab90,https://doi.org/10.1016/j.cell.2009.11.025,https://www.semanticscholar.org/paper/89164c1fe12fb75883239dc64bea848d1fa4ab90,,,JournalArticle,unknown,brain,"Summary The dissemination of cancer cells from a primary tumor is conventionally viewed as a unidirectional process that culminates with the metastatic colonization of distant organs. Here we show that circulating tumor cells (CTCs) can also colonize their tumors of origin, in a process that we call ""tumor self-seeding"". Self-seeding of breast cancer, colon cancer, and melanoma tumors in mice is preferentially mediated by aggressive CTCs, including those with bone, lung or brain metastatic tropism. The tumor-derived cytokines IL-6 and IL-8 acted as CTC attractants and the poor-prognosis markers MMP1/collagenase-1 and the actin cytoskeleton component fascin-1 as mediators of CTC infiltration into mammary tumors. Self-seeding can accelerate tumor growth, angiogenesis, and stromal recruitment through seed-derived factors including, in a breast cancer model, the chemokine CXCL1. Tumor self-seeding could explain the relationships between anaplasia, tumor size, vascularity and prognosis, and local recurrence seeded by disseminated cells following ostensibly complete tumor excision."
75,2009,Distinct genetic influences on cortical surface area and cortical thickness.,"M. Panizzon, C. Fennema-Notestine, L. Eyler, T. Jernigan, E. Prom-Wormley, M. Neale, et al.",Cerebral Cortex,2009-11-01,1305,70,146.15,General Brain Science and Reviews,,Positions Distinct genetic influences on cortical surface area and cortical thickness. within General Brain Science and Reviews.,"high citation signal (1,305); recognized venue; open-access PDF metadata","Broad reviews can dominate citation-ranked lists while obscuring narrower empirical advances.; Taxonomy boundaries are imperfect because many brain papers combine methods, scales, and diseases.; Metadata-level ranking should be complemented with full-text expert review before strong claims are made.",10.1093/cercor/bhp026,cb55817422872088a352c2db83f0c68ca65383a8,https://doi.org/10.1093/cercor/bhp026,https://www.semanticscholar.org/paper/cb55817422872088a352c2db83f0c68ca65383a8,,,Study; JournalArticle,unknown,cortical,
76,2009,Neurobiological Basis of Failure to Recall Extinction Memory in Posttraumatic Stress Disorder,"M. Milad, R. Pitman, Cameron B. Ellis, Andrea L. Gold, L. Shin, N. Lasko, et al.",Biological Psychiatry,2009-09-12,1290,89,154.34,Cognitive and Systems Neuroscience,fMRI;human,Background: A clinical characteristic of posttraumatic stress disorder (PTSD) is persistently elevated fear responses to stimuli associated with the traumatic event.,"high citation signal (1,290); open-access PDF metadata; human evidence signal","Task designs can simplify cognition enough that ecological validity becomes uncertain.; Cross-species alignment between circuits, behavior, and subjective experience remains imperfect.; Human cohort effects can depend on recruitment, demographics, comorbidity, and measurement context.",10.1016/j.biopsych.2009.06.026,de830eacb1d0db3f530dae9b6b8c1a3fa73638bc,https://doi.org/10.1016/j.biopsych.2009.06.026,https://www.semanticscholar.org/paper/de830eacb1d0db3f530dae9b6b8c1a3fa73638bc,,,JournalArticle,unknown,brain; cortex; hippocampus; amygdala; prefrontal; fmri; mri; neuroscience term,"Background: A clinical characteristic of posttraumatic stress disorder (PTSD) is persistently elevated fear responses to stimuli associated with the traumatic event. The objective herein is to determine whether extinction of fear responses is impaired in PTSD and whether such impairment is related to dysfunctional activation of brain regions known to be involved in fear extinction, viz., amygdala, hippocampus, ventromedial prefrontal cortex (vmPFC), and dorsal anterior cingulate cortex (dACC). Methods: Sixteen individuals diagnosed with PTSD and 15 trauma-exposed non-PTSD controls (TENCs) underwent a two-day fear conditioning and extinction protocol in a 3T fMRI scanner. Conditioning and extinction training were conducted on day 1. Extinction recall (or extinction memory) test was conducted on day 2 (extinguished conditioned stimuli presented in the absence of shock). Skin conductance response (SCR) was scored throughout the experiment as an index of the conditioned response. Results: SCR data revealed no significant differences between groups during acquisition and extinction of conditioned fear on day 1. On day 2, however, PTSD subjects showed impaired recall of extinction memory. Analysis of fMRI data showed greater amygdala activation in the PTSD group during day 1 extinction learning. During extinction recall, lesser activation in hippocampus and vmPFC, and greater activation in dACC, was observed in the PTSD group. The magnitude of extinction memory across all subjects was correlated with activation of hippocampus and vmPFC during extinction recall testing. Conclusions: These findings support the hypothesis that fear extinction is impaired in PTSD. They further suggest that dysfunctional activation in brain structures that mediate fear extinction learning, and especially its recall, underlie this impairment."
77,2009,Principles and clinical implications of the brain-gut-enteric microbiota axis,"S. Rhee, C. Pothoulakis, E. Mayer",Nature Reviews Gastroenterology &Hepatology,2009-05-01,1267,31,165.21,"Cellular, Molecular, and Synaptic Neuroscience",ECoG;human;stimulation,"While bidirectional brain-gut interactions are well known mechanisms for the regulation of gut function in both healthy and diseased states, a role of the enteric flora-including both commensal and pathogenic organisms-in these interactions has only been recognized in the past few years.","high citation signal (1,267); recognized venue; open-access PDF metadata; human evidence signal","Cellular mechanisms can be difficult to connect directly to whole-brain dynamics or human behavior.; Single-cell sampling, dissociation, alignment, and batch effects can bias inferred cell populations.; Human cohort effects can depend on recruitment, demographics, comorbidity, and measurement context.",10.1038/nrgastro.2009.35,8d46dbee61595ddb88b690b9979d376a39c691fe,https://doi.org/10.1038/nrgastro.2009.35,https://www.semanticscholar.org/paper/8d46dbee61595ddb88b690b9979d376a39c691fe,,,Review; JournalArticle,unknown,brain; neuron; ecog; brain in title; neuroscience term,"While bidirectional brain-gut interactions are well known mechanisms for the regulation of gut function in both healthy and diseased states, a role of the enteric flora-including both commensal and pathogenic organisms-in these interactions has only been recognized in the past few years. The brain can influence commensal organisms (enteric microbiota) indirectly, via changes in gastrointestinal motility and secretion, and intestinal permeability, or directly, via signaling molecules released into the gut lumen from cells in the lamina propria (enterochromaffin cells, neurons, immune cells). Communication from enteric microbiota to the host can occur via multiple mechanisms, including epithelial-cell, receptor-mediated signaling and, when intestinal permeability is increased, through direct stimulation of host cells in the lamina propria. Enterochromaffin cells are important bidirectional transducers that regulate communication between the gut lumen and the nervous system. Vagal, afferent innervation of enterochromaffin cells provides a direct pathway for enterochromaffin-cell signaling to neuronal circuits, which may have an important role in pain and immune-response modulation, control of background emotions and other homeostatic functions. Disruption of the bidirectional interactions between the enteric microbiota and the nervous system may be involved in the pathophysiology of acute and chronic gastrointestinal disease states, including functional and inflammatory bowel disorders."
78,2009,How do emotion and motivation direct executive control?,L. Pessoa,Trends in Cognitive Sciences,2009-03-13,1262,91,159.94,Cognitive and Systems Neuroscience,human;non-human,Emotion and motivation have crucial roles in determining human behavior.,"high citation signal (1,262); recognized venue; open-access PDF metadata; human evidence signal","Task designs can simplify cognition enough that ecological validity becomes uncertain.; Cross-species alignment between circuits, behavior, and subjective experience remains imperfect.; Non-human findings need careful translation to human brain organization and clinical outcomes.",10.1016/j.tics.2009.01.006,077e7dd4d4da3ffbc3c40c2c0ada6101f0aa20a0,https://doi.org/10.1016/j.tics.2009.01.006,https://www.semanticscholar.org/paper/077e7dd4d4da3ffbc3c40c2c0ada6101f0aa20a0,,,JournalArticle,unknown,brain; cortex; amygdala; prefrontal; neuroscience term,"Emotion and motivation have crucial roles in determining human behavior. Yet, how they interact with cognitive control functions is less understood. Here, the basic elements of a conceptual framework for understanding how they interact are introduced. More broadly, the `dual competition' framework proposes that emotion and motivation affect both perceptual and executive competition. In particular, the anterior cingulate cortex is hypothesized to be engaged in attentional/effortful control mechanisms and to interact with several other brain structures, including the amygdala and nucleus accumbens, in integrating affectively significant signals with control signals in prefrontal cortex. An implication of the proposal is that emotion and motivation can either enhance or impair behavioral performance depending on how they interact with control functions."
79,2009,"High-frequency, long-range coupling between prefrontal and visual cortex during attention","G. Gregoriou, S. Gotts, Huihui Zhou, R. Desimone",Science,2009-05-01,1260,79,163.91,Cognitive and Systems Neuroscience,human;non-human,Attention and Synchrony Neural activity in the visual cortex becomes synchronized with attention and other behavioral states.,"high citation signal (1,260); recognized venue; open-access PDF metadata; human evidence signal","Task designs can simplify cognition enough that ecological validity becomes uncertain.; Cross-species alignment between circuits, behavior, and subjective experience remains imperfect.; Non-human findings need careful translation to human brain organization and clinical outcomes.",10.1126/science.1171402,cc7bfbcc4d7061450c279f2f970550a053ded931,https://doi.org/10.1126/science.1171402,https://www.semanticscholar.org/paper/cc7bfbcc4d7061450c279f2f970550a053ded931,,,JournalArticle,unknown,brain; cortex; cortical; neuron; neural; prefrontal; neuroscience term,"Attention and Synchrony Neural activity in the visual cortex becomes synchronized with attention and other behavioral states. However, the source of this synchrony is still unknown. Gregoriou et al. (p. 1207) tested the hypothesis that synchronized activity from the frontal eye field is one of the causes of the synchrony in monkey visual cortical area V4 during attention. With attention, neural activity in area V4 synchronized with frontal eye field activity when a stimulus fell in a joint receptive field, but did not do so when the fields were not overlapping. Synchrony in neuronal firing within a specific frequency range may regulate interactions between brain structures. Electrical recordings in humans and monkeys show attentional enhancement of evoked responses and gamma synchrony in ventral stream cortical areas. Does this synchrony result from intrinsic activity in visual cortex or from inputs from other structures? Using paired recordings in the frontal eye field (FEF) and area V4, we found that attention to a stimulus in their joint receptive field leads to enhanced oscillatory coupling between the two areas, particularly at gamma frequencies. This coupling appeared to be initiated by FEF and was time-shifted by about 8 to 13 milliseconds across a range of frequencies. Considering the expected conduction and synaptic delays between the areas, this time-shifted coupling at gamma frequencies may optimize the postsynaptic impact of spikes from one area upon the other, improving cross-area communication with attention."
