rank,year,title,authors,venue,publicationDate,citationCount,influentialCitationCount,importanceScore,category,keywordTags,keyIdea,strengths,limitations,doi,sourceId,url,openAccessPdf,githubUrl,workType,language,relevanceReason,abstract
22,1985,Immunohistochemical localization of macrophages and microglia in the adult and developing mouse brain.,"V. Perry, D. Hume, S. Gordon",Neuroscience,1985-06-01,914,23,149.14,"Cellular, Molecular, and Synaptic Neuroscience",human;non-human,"Positions Immunohistochemical localization of macrophages and microglia in the adult and developing mouse brain. within Cellular, Molecular, and Synaptic Neuroscience.",high citation signal (914); recognized venue; human evidence signal,"Cellular mechanisms can be difficult to connect directly to whole-brain dynamics or human behavior.; Single-cell sampling, dissociation, alignment, and batch effects can bias inferred cell populations.; Non-human findings need careful translation to human brain organization and clinical outcomes.",10.1016/0306-4522(85)90215-5,94e97422e2f459c4c974258c2329030bfecf6e34,https://doi.org/10.1016/0306-4522(85)90215-5,,,JournalArticle,unknown,brain; glia; microglia; brain in title,
23,1985,Human cerebral malaria. A quantitative ultrastructural analysis of parasitized erythrocyte sequestration.,"G. Macpherson, M. Warrell, N. White, S. Looareesuwan, D. Warrell",American Journal of Pathology,1985-06-01,891,30,126.68,General Brain Science and Reviews,human;non-human,Positions Human cerebral malaria. A quantitative ultrastructural analysis of parasitized erythrocyte sequestration. within General Brain Science and Reviews.,high citation signal (891); human evidence signal,"Broad reviews can dominate citation-ranked lists while obscuring narrower empirical advances.; Taxonomy boundaries are imperfect because many brain papers combine methods, scales, and diseases.; Non-human findings need careful translation to human brain organization and clinical outcomes.",,0bdce06e4054e71a26244b0359ebda0ee437ad41,https://www.semanticscholar.org/paper/0bdce06e4054e71a26244b0359ebda0ee437ad41,,,JournalArticle,unknown,cerebral,
24,1985,Basal Ganglia and Limbic System Pathology in Schizophrenia: A Morphometric Study of Brain Volume and Shrinkage,"B. Bogerts, E. Meertz, R. Schönfeldt-Bausch",Unknown venue,1985-08-01,888,12,134.22,"Cellular, Molecular, and Synaptic Neuroscience",,"Positions Basal Ganglia and Limbic System Pathology in Schizophrenia: A Morphometric Study of Brain Volume and Shrinkage within Cellular, Molecular, and Synaptic Neuroscience.",high citation signal (888),"Cellular mechanisms can be difficult to connect directly to whole-brain dynamics or human behavior.; Single-cell sampling, dissociation, alignment, and batch effects can bias inferred cell populations.; Metadata-level ranking should be complemented with full-text expert review before strong claims are made.",10.1001/ARCHPSYC.1985.01790310046006,b5d32d0a3cf328b59f3eeb58b182c1194c27fd6e,https://doi.org/10.1001/ARCHPSYC.1985.01790310046006,,,paper,unknown,brain; basal ganglia; glia; brain in title,
25,1985,"The suprachiasmatic nucleus of the human brain in relation to sex, age and senile dementia.","D. Swaab, E. Fliers, T. Partiman",Brain Research,1985-09-02,857,23,142.78,Clinical Neurology and Neurodegeneration,human,"Positions The suprachiasmatic nucleus of the human brain in relation to sex, age and senile dementia. within Clinical Neurology and Neurodegeneration.",high citation signal (857); recognized venue; human evidence signal,"Clinical cohorts often differ in disease stage, comorbidity, treatment history, and follow-up duration.; Biomarkers may not transfer cleanly across populations, scanners, care settings, or diagnostic criteria.; Human cohort effects can depend on recruitment, demographics, comorbidity, and measurement context.",10.1016/0006-8993(85)91350-2,75dcf7da37e2d1d42587eba48f55bc9583de64a9,https://doi.org/10.1016/0006-8993(85)91350-2,,,JournalArticle; Study,unknown,brain; brain in title,
26,1985,Interleukin-1 stimulation of astroglial proliferation after brain injury.,"D. Giulian, L. Lachman",Science,1985-04-26,827,7,145.34,"Cellular, Molecular, and Synaptic Neuroscience",non-human;stimulation,"Positions Interleukin-1 stimulation of astroglial proliferation after brain injury. within Cellular, Molecular, and Synaptic Neuroscience.",high citation signal (827); recognized venue,"Cellular mechanisms can be difficult to connect directly to whole-brain dynamics or human behavior.; Single-cell sampling, dissociation, alignment, and batch effects can bias inferred cell populations.; Non-human findings need careful translation to human brain organization and clinical outcomes.",10.1126/SCIENCE.3872478,d26213f40477104684e35bd2186bcb91db92c960,https://doi.org/10.1126/SCIENCE.3872478,,,JournalArticle,unknown,brain; glia; brain in title,
27,1985,Organizational and activational effects of sex steroids on brain and behavior: a reanalysis.,"A. Arnold, S. M. Breedlove",Hormones and Behavior,1985-12-01,793,14,128.19,Cognitive and Systems Neuroscience,,Positions Organizational and activational effects of sex steroids on brain and behavior: a reanalysis. within Cognitive and Systems Neuroscience.,high citation signal (793),"Task designs can simplify cognition enough that ecological validity becomes uncertain.; Cross-species alignment between circuits, behavior, and subjective experience remains imperfect.; Metadata-level ranking should be complemented with full-text expert review before strong claims are made.",10.1016/0018-506X(85)90042-X,4bfee1ca097bd89f38e24fe585554b9168fc309a,https://doi.org/10.1016/0018-506X(85)90042-X,,,Review; JournalArticle; Study,unknown,brain; brain in title,
28,1985,Selective sparing of a class of striatal neurons in Huntington's disease.,"R. Ferrante, N. Kowall, Beal Mf, E. Richardson, E. Bird, Jens Martin",Science,1985-11-01,792,5,140.16,"Cellular, Molecular, and Synaptic Neuroscience",,"Positions Selective sparing of a class of striatal neurons in Huntington's disease. within Cellular, Molecular, and Synaptic Neuroscience.",high citation signal (792); recognized venue,"Cellular mechanisms can be difficult to connect directly to whole-brain dynamics or human behavior.; Single-cell sampling, dissociation, alignment, and batch effects can bias inferred cell populations.; Metadata-level ranking should be complemented with full-text expert review before strong claims are made.",10.1126/SCIENCE.2931802,7bfc3b03791228dc5f2389c55ace7efff5ab47c0,https://doi.org/10.1126/SCIENCE.2931802,,,JournalArticle,unknown,neuron; neuroscience term,
29,1985,What is the Correct Value for the Brain-Blood Partition Coefficient for Water?,"P. Herscovitch, M. Raichle",Journal of Cerebral Blood Flow and Metabolism,1985-03-01,761,117,130.45,"Cerebrovascular, Metabolism, and Brain Injury",,"Positions What is the Correct Value for the Brain-Blood Partition Coefficient for Water? within Cerebrovascular, Metabolism, and Brain Injury.",high citation signal (761); open-access PDF metadata,"Acute injury studies can be sensitive to timing, severity, comorbidity, and treatment heterogeneity.; Animal models may not capture human vascular risk, injury complexity, or rehabilitation context.; Metadata-level ranking should be complemented with full-text expert review before strong claims are made.",10.1038/jcbfm.1985.9,a19ef046198da6b2b118ef7adfc2852327abea70,https://doi.org/10.1038/jcbfm.1985.9,https://journals.sagepub.com/doi/pdf/10.1038/jcbfm.1985.9,,JournalArticle,unknown,brain; brain in title,
30,1985,Glutamate stimulates inositol phosphate formation in striatal neurones,"F. Sladeczek, J. Pin, M. Récasens, J. Bockaert, S. Weiss",Nature,1985-10-24,759,12,139.4,"Cellular, Molecular, and Synaptic Neuroscience",,"Positions Glutamate stimulates inositol phosphate formation in striatal neurones within Cellular, Molecular, and Synaptic Neuroscience.",high citation signal (759); recognized venue,"Cellular mechanisms can be difficult to connect directly to whole-brain dynamics or human behavior.; Single-cell sampling, dissociation, alignment, and batch effects can bias inferred cell populations.; Metadata-level ranking should be complemented with full-text expert review before strong claims are made.",10.1038/317717A0,56c8b6e5a909fb102185000e6425dc428279f8d7,https://doi.org/10.1038/317717A0,,,JournalArticle,unknown,neuron; neuroscience term,
31,1985,"Evidence for a 'paravascular' fluid circulation in the mammalian central nervous system, provided by the rapid distribution of tracer protein throughout the brain from the subarachnoid space.","M. Rennels, Thomas F. Gregory, Blaumanis Or, K. Fujimoto, P. A. Grady",Brain Research,1985-02-04,739,25,138.92,General Brain Science and Reviews,,"Positions Evidence for a 'paravascular' fluid circulation in the mammalian central nervous system, provided by the rapid distribution of tracer protein throughout the brain from the subarachnoid space. within General Brain Science and Reviews.",high citation signal (739); recognized venue,"Broad reviews can dominate citation-ranked lists while obscuring narrower empirical advances.; Taxonomy boundaries are imperfect because many brain papers combine methods, scales, and diseases.; Metadata-level ranking should be complemented with full-text expert review before strong claims are made.",10.1016/0006-8993(85)91383-6,73572b7c454652ed713a7ca283391c98d07ea34a,https://doi.org/10.1016/0006-8993(85)91383-6,,,JournalArticle,unknown,brain; brain in title,
32,1985,Loss of M2 muscarine receptors in the cerebral cortex in Alzheimer's disease and experimental cholinergic denervation.,"D. Mash, D. D. Flynn, L. Potter",Science,1985-05-31,708,4,140.15,Clinical Neurology and Neurodegeneration,,Positions Loss of M2 muscarine receptors in the cerebral cortex in Alzheimer's disease and experimental cholinergic denervation. within Clinical Neurology and Neurodegeneration.,high citation signal (708); recognized venue,"Clinical cohorts often differ in disease stage, comorbidity, treatment history, and follow-up duration.; Biomarkers may not transfer cleanly across populations, scanners, care settings, or diagnostic criteria.; Metadata-level ranking should be complemented with full-text expert review before strong claims are made.",10.1126/SCIENCE.3992249,3574be9d5461aabc6a5e40731635553deaf5eb3c,https://doi.org/10.1126/SCIENCE.3992249,,,JournalArticle,unknown,cerebral; cortex; neuroscience term,
33,1985,Glucocorticoids potentiate ischemic injury to neurons: therapeutic implications.,"R. Sapolsky, W. Pulsinelli",Science,1985-09-27,703,11,138.02,"Cellular, Molecular, and Synaptic Neuroscience",,"Positions Glucocorticoids potentiate ischemic injury to neurons: therapeutic implications. within Cellular, Molecular, and Synaptic Neuroscience.",high citation signal (703); recognized venue,"Cellular mechanisms can be difficult to connect directly to whole-brain dynamics or human behavior.; Single-cell sampling, dissociation, alignment, and batch effects can bias inferred cell populations.; Metadata-level ranking should be complemented with full-text expert review before strong claims are made.",10.1126/SCIENCE.4035356,847abaa273cc58174211e8ae5e24297fbf975cd9,https://doi.org/10.1126/SCIENCE.4035356,,,JournalArticle,unknown,neuron; neuroscience term,
34,1985,Ten Percent Electrode System for Topographic Studies of Spontaneous and Evoked EEG Activities,"G. Chatrian, E. Lettich, P. L. Nelson",Unknown venue,1985-06-01,697,14,121.07,"EEG, MEG, and Electrophysiology",EEG,"Positions Ten Percent Electrode System for Topographic Studies of Spontaneous and Evoked EEG Activities within EEG, MEG, and Electrophysiology.",high citation signal (697),"Low signal-to-noise ratio, artifacts, and source-localization uncertainty complicate interpretation.; Many studies rely on controlled tasks and may not generalize to everyday behavior or clinical monitoring.; Metadata-level ranking should be complemented with full-text expert review before strong claims are made.",10.1080/00029238.1985.11080163,f7144858d2b3c842f217f68ceaef0cc84e0c4e13,https://doi.org/10.1080/00029238.1985.11080163,,,paper,unknown,eeg,
35,1985,The brain connection: the corpus callosum is larger in left-handers.,S. F. Witelson,Science,1985-08-16,692,31,137.74,General Brain Science and Reviews,,Positions The brain connection: the corpus callosum is larger in left-handers. within General Brain Science and Reviews.,high citation signal (692); recognized venue,"Broad reviews can dominate citation-ranked lists while obscuring narrower empirical advances.; Taxonomy boundaries are imperfect because many brain papers combine methods, scales, and diseases.; Metadata-level ranking should be complemented with full-text expert review before strong claims are made.",10.1126/SCIENCE.4023705,cac1fdd4abeabcb7781891ad4d02051b7fa93186,https://doi.org/10.1126/SCIENCE.4023705,,,JournalArticle,unknown,brain; brain in title,
36,1985,Primary structure of bovine pituitary basic fibroblast growth factor (FGF) and comparison with the amino-terminal sequence of bovine brain acidic FGF.,"F. Esch, A. Baird, N. Ling, N. Ueno, Fred Hill, L. Denoroy, et al.",Proceedings of the National Academy of Sciences of the United States of America,1985-10-01,653,23,139.7,General Brain Science and Reviews,,Positions Primary structure of bovine pituitary basic fibroblast growth factor (FGF) and comparison with the amino-terminal sequence of bovine brain acidic FGF. within General Brain Science and Reviews.,high citation signal (653); recognized venue; open-access PDF metadata,"Broad reviews can dominate citation-ranked lists while obscuring narrower empirical advances.; Taxonomy boundaries are imperfect because many brain papers combine methods, scales, and diseases.; Metadata-level ranking should be complemented with full-text expert review before strong claims are made.",10.1073/PNAS.82.19.6507,0753d1af7047df084d1f02cf8fe52689a1f9f640,https://doi.org/10.1073/PNAS.82.19.6507,https://europepmc.org/articles/pmc390746?pdf=render,,JournalArticle; Study,unknown,brain; brain in title,
37,1985,The neostriatal mosaic: compartmental distribution of calcium-binding protein and parvalbumin in the basal ganglia of the rat and monkey.,"C. Gerfen, Kenneth G. BAIMBRIDGEt, James J. MILLERt",Proceedings of the National Academy of Sciences of the United States of America,1985-12-01,649,29,136.79,"Cellular, Molecular, and Synaptic Neuroscience",non-human,"Positions The neostriatal mosaic: compartmental distribution of calcium-binding protein and parvalbumin in the basal ganglia of the rat and monkey. within Cellular, Molecular, and Synaptic Neuroscience.",high citation signal (649); recognized venue; open-access PDF metadata,"Cellular mechanisms can be difficult to connect directly to whole-brain dynamics or human behavior.; Single-cell sampling, dissociation, alignment, and batch effects can bias inferred cell populations.; Non-human findings need careful translation to human brain organization and clinical outcomes.",10.1073/PNAS.82.24.8780,d4470f2b813f844023248c0e117788985dfe9044,https://doi.org/10.1073/PNAS.82.24.8780,https://europepmc.org/articles/pmc391521?pdf=render,,JournalArticle,unknown,basal ganglia; glia,
38,1985,Evidence of Chaotic Dynamics of Brain Activity During the Sleep Cycle,"A. Babloyantz, J. Salazar, C. Nicolis",Unknown venue,1985-09-02,634,12,124.17,General Brain Science and Reviews,,Positions Evidence of Chaotic Dynamics of Brain Activity During the Sleep Cycle within General Brain Science and Reviews.,high citation signal (634),"Broad reviews can dominate citation-ranked lists while obscuring narrower empirical advances.; Taxonomy boundaries are imperfect because many brain papers combine methods, scales, and diseases.; Metadata-level ranking should be complemented with full-text expert review before strong claims are made.",10.1016/0375-9601(85)90444-X,58dd2e8d91e31b94654099b8bb3f4ce2ebcce12f,https://doi.org/10.1016/0375-9601(85)90444-X,,,paper,unknown,brain; brain in title,
39,1985,Regional distribution of type II Ca2+/calmodulin-dependent protein kinase in rat brain,"N. Erondu, M. Kennedy",Journal of Neuroscience,1985-12-01,633,28,156.34,"Cellular, Molecular, and Synaptic Neuroscience",non-human,The distribution of type II Ca2+/calmodulin-dependent protein kinase has been mapped in rat brain by immunochemical and immunohistochemical methods using an antibody against its alpha-subunit.,high citation signal (633); recognized venue; open-access PDF metadata,"Cellular mechanisms can be difficult to connect directly to whole-brain dynamics or human behavior.; Single-cell sampling, dissociation, alignment, and batch effects can bias inferred cell populations.; Non-human findings need careful translation to human brain organization and clinical outcomes.",10.1523/JNEUROSCI.05-12-03270.1985,95e469358c72695a6a4e364bee37f7b2215024d6,https://doi.org/10.1523/JNEUROSCI.05-12-03270.1985,https://www.jneurosci.org/content/jneuro/5/12/3270.full.pdf,,JournalArticle,unknown,brain; cortex; cortical; neuron; hippocampus; cerebellum; brain in title; neuroscience term,"The distribution of type II Ca2+/calmodulin-dependent protein kinase has been mapped in rat brain by immunochemical and immunohistochemical methods using an antibody against its alpha-subunit. The concentration of the kinase, measured by radioimmunoassay, varies markedly in different brain regions. It is most highly concentrated in the telencephalon where it comprises approximately 2% of the total hippocampal protein, 1.3% of cortical protein, and 0.7% of striatal protein. It is less concentrated in lower brain structures, ranging from about 0.3% of hypothalamic protein to 0.1% of protein in the pons/medulla. The gradient of staining intensity observed in brain sections by immunohistochemistry corroborates this distribution. Neurons and neuropil of the hippocampus are densely stained, whereas little staining is observed in lower brain regions such as the superior colliculus. Within the diencephalon and midbrain, dense staining is observed only in thalamic nuclei and the substantia nigra. The skewed distribution of alpha-subunit appears to be due in part to the occurrence in the cerebellum and pons/medulla of forms of the kinase with a high ratio of beta- to alpha-subunits. However, most of the variation is due to the extremely high concentration of the kinase in particular neurons, especially those of the hippocampus, cortex and striatum. The unusually high expression of the kinase in these neurons is likely to confer upon them specialized responses to calcium ion that are different from those of neurons in lower brain regions."
40,1985,Localization of cortical areas activated by thinking.,"P. Roland, L. Friberg",Journal of Neurophysiology,1985-05-01,620,7,117.76,General Brain Science and Reviews,,Positions Localization of cortical areas activated by thinking. within General Brain Science and Reviews.,high citation signal (620),"Broad reviews can dominate citation-ranked lists while obscuring narrower empirical advances.; Taxonomy boundaries are imperfect because many brain papers combine methods, scales, and diseases.; Metadata-level ranking should be complemented with full-text expert review before strong claims are made.",10.1152/JN.1985.53.5.1219,51e6e957853a42dad95695a46b8e8360cdc56e1f,https://doi.org/10.1152/JN.1985.53.5.1219,,,JournalArticle,unknown,cortical,
41,1985,Expression in brain of a messenger RNA encoding a novel neuropeptide homologous to calcitonin gene-related peptide.,"S. Amara, J. Arriza, S. Leff, L. Swanson, R. Evans, M. Rosenfeld",Science,1985-09-13,619,19,135.73,General Brain Science and Reviews,,Positions Expression in brain of a messenger RNA encoding a novel neuropeptide homologous to calcitonin gene-related peptide. within General Brain Science and Reviews.,high citation signal (619); recognized venue,"Broad reviews can dominate citation-ranked lists while obscuring narrower empirical advances.; Taxonomy boundaries are imperfect because many brain papers combine methods, scales, and diseases.; Metadata-level ranking should be complemented with full-text expert review before strong claims are made.",10.1126/SCIENCE.2994212,c15bb02f3c6f4cb3308f22a54592a4887862b68d,https://doi.org/10.1126/SCIENCE.2994212,,,JournalArticle,unknown,brain; brain in title,
42,1985,A novel brain ATPase with properties expected for the fast axonal transport motor,S. Brady,Nature,1985,607,22,135.38,General Brain Science and Reviews,,Positions A novel brain ATPase with properties expected for the fast axonal transport motor within General Brain Science and Reviews.,high citation signal (607); recognized venue,"Broad reviews can dominate citation-ranked lists while obscuring narrower empirical advances.; Taxonomy boundaries are imperfect because many brain papers combine methods, scales, and diseases.; Metadata-level ranking should be complemented with full-text expert review before strong claims are made.",10.1038/317073A0,581cc2a5ae7dca39fb9c170465cb1ee5771b082a,https://doi.org/10.1038/317073A0,,,JournalArticle,unknown,brain; brain in title,
43,1985,Cerebral metabolic rates for glucose in mood disorders. Studies with positron emission tomography and fluorodeoxyglucose F 18.,"L. Baxter, M. Phelps, J. Mazziotta, Jeffrey M. Schwartz, R. Gerner, C. Selin, et al.",Archives of General Psychiatry,1985-05-01,592,6,118.13,General Brain Science and Reviews,non-human,Positions Cerebral metabolic rates for glucose in mood disorders. Studies with positron emission tomography and fluorodeoxyglucose F 18. within General Brain Science and Reviews.,high citation signal (592),"Broad reviews can dominate citation-ranked lists while obscuring narrower empirical advances.; Taxonomy boundaries are imperfect because many brain papers combine methods, scales, and diseases.; Non-human findings need careful translation to human brain organization and clinical outcomes.",10.1001/ARCHPSYC.1985.01790280019002,bb2aa972d6179f100fcece0c94ccc9df4c7f9f1f,https://doi.org/10.1001/ARCHPSYC.1985.01790280019002,,,JournalArticle; Study,unknown,cerebral,
44,1985,"Isolation, sequencing, synthesis, and pharmacological characterization of two brain neuropeptides that modulate the action of morphine.","H. Y. Yang, W. Fratta, E. Majane, E. Costa",Proceedings of the National Academy of Sciences of the United States of America,1985-11-01,584,21,137.69,General Brain Science and Reviews,,"Positions Isolation, sequencing, synthesis, and pharmacological characterization of two brain neuropeptides that modulate the action of morphine. within General Brain Science and Reviews.",high citation signal (584); recognized venue; open-access PDF metadata,"Broad reviews can dominate citation-ranked lists while obscuring narrower empirical advances.; Taxonomy boundaries are imperfect because many brain papers combine methods, scales, and diseases.; Metadata-level ranking should be complemented with full-text expert review before strong claims are made.",10.1073/PNAS.82.22.7757,fdb2afd133386fbbd580b1867259d9d4aeee0449,https://doi.org/10.1073/PNAS.82.22.7757,https://europepmc.org/articles/pmc391413?pdf=render,,JournalArticle,unknown,brain; brain in title,
