rank,year,title,authors,venue,publicationDate,citationCount,influentialCitationCount,importanceScore,category,keywordTags,keyIdea,strengths,limitations,doi,sourceId,url,openAccessPdf,workType,language,relevanceReason,abstract
66,2010,Sleep State Switching,"C. Saper, P. Fuller, N. Pedersen, Jun Lu, T. Scammell",Neuron,2010-12-22,1274,60,153.71,"Cellular, Molecular, and Synaptic Neuroscience",,"We take for granted the ability to fall asleep or to snap out of sleep into wakefulness, but these changes in behavioral state require specific switching mechanisms in the brain that allow well-defined state transitions.","high citation signal (1,274); recognized venue; open-access PDF metadata","Cellular mechanisms can be difficult to connect directly to whole-brain dynamics or human behavior.; Single-cell sampling, dissociation, alignment, and batch effects can bias inferred cell populations.; Metadata-level ranking should be complemented with full-text expert review before strong claims are made.",10.1016/j.neuron.2010.11.032,274b4663466f5349a696a128d6820eeb21ec9dbb,https://doi.org/10.1016/j.neuron.2010.11.032,https://doi.org/10.1016/j.neuron.2010.11.032,Review; JournalArticle,unknown,brain; neuron; neuroscience term,"We take for granted the ability to fall asleep or to snap out of sleep into wakefulness, but these changes in behavioral state require specific switching mechanisms in the brain that allow well-defined state transitions. In this review, we examine the basic circuitry underlying the regulation of sleep and wakefulness, and discuss a theoretical framework wherein the interactions between reciprocal neuronal circuits enable relatively rapid and complete state transitions. We also review how homeostatic, circadian, and allostatic drives help regulate sleep state switching, and discuss how breakdown of the switching mechanism may contribute to sleep disorders such as narcolepsy."
67,2010,Pallidal versus subthalamic deep-brain stimulation for Parkinson's disease.,"K. Follett, F. Weaver, M. Stern, K. Hur, C. Harris, Ping Luo, et al.",New England Journal of Medicine,2010-06-03,1274,85,140.91,Clinical Neurology and Neurodegeneration,stimulation,Positions Pallidal versus subthalamic deep-brain stimulation for Parkinson's disease. within Clinical Neurology and Neurodegeneration.,"high citation signal (1,274); open-access PDF metadata","Clinical cohorts often differ in disease stage, comorbidity, treatment history, and follow-up duration.; Biomarkers may not transfer cleanly across populations, scanners, care settings, or diagnostic criteria.; Metadata-level ranking should be complemented with full-text expert review before strong claims are made.",10.1056/NEJMoa0907083,c287abdeecc6a22074df3a40a508a4f3e0fcd00b,https://doi.org/10.1056/NEJMoa0907083,https://www.nejm.org/doi/pdf/10.1056/NEJMoa0907083?articleTools=true,Study; JournalArticle,unknown,brain; brain in title,
68,2010,Normal Development of Brain Circuits,"G. Tau, B. Peterson",Neuropsychopharmacology,2010,1272,42,139.68,"Brain Development, Plasticity, and Connectomics",,"Positions Normal Development of Brain Circuits within Brain Development, Plasticity, and Connectomics.","high citation signal (1,272); open-access PDF metadata","Developmental and aging studies are sensitive to cohort composition, attrition, and longitudinal sampling intervals.; Network measures can depend heavily on parcellation, thresholding, and acquisition choices.; Metadata-level ranking should be complemented with full-text expert review before strong claims are made.",10.1038/npp.2009.115,71048f489b9644a12e4679e999f9368f6233bf24,https://doi.org/10.1038/npp.2009.115,https://www.nature.com/articles/npp2009115.pdf,Review; JournalArticle,unknown,brain; brain in title,
69,2010,Effects of Mindfulness-Based Stress Reduction (MBSR) on Emotion Regulation in Social Anxiety Disorder,"P. Goldin, J. Gross",Emotion,2010-02-01,1246,56,141.71,Neuroimaging and Brain Mapping,MRI;human,"Mindfulness-based stress reduction (MBSR) is an established program shown to reduce symptoms of stress, anxiety, and depression.","high citation signal (1,246); open-access PDF metadata; human evidence signal","Scanner, protocol, site, and preprocessing variation can limit reproducibility across cohorts.; Associational imaging biomarkers often need stronger longitudinal or intervention evidence before causal claims are made.; Human cohort effects can depend on recruitment, demographics, comorbidity, and measurement context.",10.1037/a0018441,a00e2f31b476bbfff0dddabcb1850d21b549115a,https://doi.org/10.1037/a0018441,https://europepmc.org/articles/pmc4203918?pdf=render,JournalArticle; ClinicalTrial,unknown,brain; neuroimaging; amygdala; mri,"Mindfulness-based stress reduction (MBSR) is an established program shown to reduce symptoms of stress, anxiety, and depression. MBSR is believed to alter emotional responding by modifying cognitive-affective processes. Given that social anxiety disorder (SAD) is characterized by emotional and attentional biases as well as distorted negative self-beliefs, we examined MBSR-related changes in the brain-behavior indices of emotional reactivity and regulation of negative self-beliefs in patients with SAD. Sixteen patients underwent functional MRI while reacting to negative self-beliefs and while regulating negative emotions using 2 types of attention deployment emotion regulation-breath-focused attention and distraction-focused attention. Post-MBSR, 14 patients completed neuroimaging assessments. Compared with baseline, MBSR completers showed improvement in anxiety and depression symptoms and self-esteem. During the breath-focused attention task (but not the distraction-focused attention task), they also showed (a) decreased negative emotion experience, (b) reduced amygdala activity, and (c) increased activity in brain regions implicated in attentional deployment. MBSR training in patients with SAD may reduce emotional reactivity while enhancing emotion regulation. These changes might facilitate reduction in SAD-related avoidance behaviors, clinical symptoms, and automatic emotional reactivity to negative self-beliefs in adults with SAD."
70,2010,"Neural syntax: cell assemblies, synapsembles and readers",G. Buzsáki,Neuron,2010-11-04,1240,94,160.43,"Cellular, Molecular, and Synaptic Neuroscience",non-human,"Summary A widely discussed hypothesis in neuroscience is that transiently active ensembles of neurons, known as 'cell assemblies', underlie numerous operations of the brain, from encoding memories to reasoning.","high citation signal (1,240); recognized venue; open-access PDF metadata","Cellular mechanisms can be difficult to connect directly to whole-brain dynamics or human behavior.; Single-cell sampling, dissociation, alignment, and batch effects can bias inferred cell populations.; Non-human findings need careful translation to human brain organization and clinical outcomes.",10.1016/j.neuron.2010.09.023,8544441fc25ec27e88a1b4ccc88272679652a19c,https://doi.org/10.1016/j.neuron.2010.09.023,http://www.cell.com/article/S0896627310007658/pdf,Review; JournalArticle,unknown,brain; neuron; neural; neuroscience; synapse; neuroscience term,"Summary A widely discussed hypothesis in neuroscience is that transiently active ensembles of neurons, known as 'cell assemblies', underlie numerous operations of the brain, from encoding memories to reasoning. However, the mechanisms responsible for the formation and disbanding of cell assemblies and temporal evolution of cell assembly sequences are not well understood. I introduce and review three interconnected topics, which could facilitate progress in defining cell assemblies, identifying their neuronal organization and revealing causal relationships between assembly organization and behavior. First, I hypothesize that cell assemblies are best understood in light of their output product, as detected by 'reader-actuator' mechanisms. Second, I suggest that the hierarchical organization of cell assemblies may be regarded as a neural syntax. Third, constituents of the neural syntax are linked together by dynamically changing constellations of synaptic weights ('synapsembles'). Existing support for this tripartite framework is reviewed and strategies for experimental testing of its predictions are discussed."
71,2010,MRI quantification of non-Gaussian water diffusion by kurtosis analysis,"J. Jensen, J. Helpern",NMR in Biomedicine,2010-08-01,1231,91,134.3,Neuroimaging and Brain Mapping,MRI,Positions MRI quantification of non-Gaussian water diffusion by kurtosis analysis within Neuroimaging and Brain Mapping.,"high citation signal (1,231); open-access PDF metadata","Scanner, protocol, site, and preprocessing variation can limit reproducibility across cohorts.; Associational imaging biomarkers often need stronger longitudinal or intervention evidence before causal claims are made.; Imaging conclusions can depend on acquisition, preprocessing, and model specification.",10.1002/nbm.1518,3f30e62fa076b9f61bc8d80c767ebae960ddd27f,https://doi.org/10.1002/nbm.1518,https://europepmc.org/articles/pmc2997680?pdf=render,Review; JournalArticle,unknown,mri,
72,2010,A link between the systems: functional differentiation and integration within the human insula revealed by meta-analysis,"F. Kurth, K. Zilles, P. Fox, A. Laird, S. Eickhoff",Brain Structure and Function,2010-05-29,1229,69,158.67,"Brain Development, Plasticity, and Connectomics",human;non-human;connectome,"Whether we feel sympathy for another, listen to our heartbeat, experience pain or negotiate, the insular cortex is thought to integrate perceptions, emotions, thoughts, and plans into one subjective image of ""our world"".","high citation signal (1,229); recognized venue; open-access PDF metadata; human evidence signal","Developmental and aging studies are sensitive to cohort composition, attrition, and longitudinal sampling intervals.; Network measures can depend heavily on parcellation, thresholding, and acquisition choices.; Non-human findings need careful translation to human brain organization and clinical outcomes.",10.1007/s00429-010-0255-z,0d43bd90e1f26e45fe901e51fa116b56851ec840,https://doi.org/10.1007/s00429-010-0255-z,https://www.ncbi.nlm.nih.gov/pmc/articles/PMC4801482,MetaAnalysis; JournalArticle,unknown,brain; cortex; neuroimaging; neuroscience term,"Whether we feel sympathy for another, listen to our heartbeat, experience pain or negotiate, the insular cortex is thought to integrate perceptions, emotions, thoughts, and plans into one subjective image of ""our world"". The insula has hence been ascribed an integrative role, linking information from diverse functional systems. Nevertheless, various anatomical and functional studies in humans and non-human primates also indicate a functional differentiation of this region. In order to investigate this functional differentiation as well as the mechanisms of the functional integration in the insula, we performed activation-likelihood-estimation (ALE) meta-analyses of 1,768 functional neuroimaging experiments. The analysis revealed four functionally distinct regions on the human insula, which map to the social-emotional, the sensorimotor, the olfacto-gustatory, and the cognitive network of the brain. Sensorimotor tasks activated the mid-posterior and social-emotional tasks the anterior-ventral insula. In the central insula activation by olfacto-gustatory stimuli was found, and cognitive tasks elicited activation in the anterior-dorsal region. A conjunction analysis across these domains revealed that aside from basic somatosensory and motor processes all tested functions overlapped on the anterior-dorsal insula. This overlap might constitute a correlate for a functional integration between different functional systems and thus reflect a link between them necessary to integrate different qualities into a coherent experience of the world and setting the context for thoughts and actions."
73,2010,How Learning to Read Changes the Cortical Networks for Vision and Language,"S. Dehaene, F. Pegado, L. Braga, P. Ventura, Gilberto Nunes Filho, A. Jobert, et al.",Science,2010-12-03,1228,79,146.25,Cognitive and Systems Neuroscience,connectome,Positions How Learning to Read Changes the Cortical Networks for Vision and Language within Cognitive and Systems Neuroscience.,"high citation signal (1,228); recognized venue; open-access PDF metadata","Task designs can simplify cognition enough that ecological validity becomes uncertain.; Cross-species alignment between circuits, behavior, and subjective experience remains imperfect.; Metadata-level ranking should be complemented with full-text expert review before strong claims are made.",10.1126/science.1194140,c96d730adacc64ee98e282653b749729f2cfb06e,https://doi.org/10.1126/science.1194140,https://www.science.org/cms/asset/3a2063eb-4202-4bf4-9979-cb10f53f65d8/pap.pdf,JournalArticle,unknown,cortical,
74,2010,"Default network activity, coupled with the frontoparietal control network, supports goal-directed cognition","R. N. Spreng, W. Stevens, Jon Chamberlain, Adrian W. Gilmore, D. Schacter",NeuroImage,2010-06-18,1207,69,155.54,Neuroimaging and Brain Mapping,MRI;fMRI;EEG;connectome,Tasks that demand externalized attention reliably suppress default network activity while activating the dorsal attention network.,"high citation signal (1,207); recognized venue; open-access PDF metadata","Scanner, protocol, site, and preprocessing variation can limit reproducibility across cohorts.; Associational imaging biomarkers often need stronger longitudinal or intervention evidence before causal claims are made.; Imaging conclusions can depend on acquisition, preprocessing, and model specification.",10.1016/j.neuroimage.2010.06.016,1513fa7fff54cc2660e1df45429a09f49e5162eb,https://doi.org/10.1016/j.neuroimage.2010.06.016,https://europepmc.org/articles/pmc2914129?pdf=render,JournalArticle,unknown,brain; cortical; fmri; mri,"Tasks that demand externalized attention reliably suppress default network activity while activating the dorsal attention network. These networks have an intrinsic competitive relationship; activation of one suppresses activity of the other. Consequently, many assume that default network activity is suppressed during goal-directed cognition. We challenge this assumption in an fMRI study of planning. Recent studies link default network activity with internally focused cognition, such as imagining personal future events, suggesting a role in autobiographical planning. However, it is unclear how goal-directed cognition with an internal focus is mediated by these opposing networks. A third anatomically interposed 'frontoparietal control network' might mediate planning across domains, flexibly coupling with either the default or dorsal attention network in support of internally versus externally focused goal-directed cognition, respectively. We tested this hypothesis by comparing brain activity during autobiographical versus visuospatial planning. Autobiographical planning engaged the default network, whereas visuospatial planning engaged the dorsal attention network, consistent with the anti-correlated domains of internalized and externalized cognition. Critically, both planning tasks engaged the frontoparietal control network. Task-related activation of these three networks was anatomically consistent with independently defined resting-state functional connectivity MRI maps. Together, our findings suggest that the default network can be involved in goal-directed cognition when its activity is coupled with the frontoparietal control network. Additionally, the frontoparietal control network may flexibly couple with the default and dorsal attention networks according to task domain, serving as a cortical mediator linking the two networks in support of goal-directed cognitive processes."
75,2010,Effects of Aerobic Exercise on Mild Cognitive Impairment,"L. Baker, L. Frank, K. Foster-Schubert, P. Green, C. Wilkinson, A. McTiernan, et al.",Archives of Neurology,2010-01-01,1204,80,147.1,Clinical Neurology and Neurodegeneration,human;non-human,"Objectives To examine the effects of aerobic exercise on cognition and other biomarkers associated with Alzheimer disease pathology for older adults with mild cognitive impairment, and assess the role of sex as a predictor of response.","high citation signal (1,204); recognized venue; open-access PDF metadata; human evidence signal","Clinical cohorts often differ in disease stage, comorbidity, treatment history, and follow-up duration.; Biomarkers may not transfer cleanly across populations, scanners, care settings, or diagnostic criteria.; Non-human findings need careful translation to human brain organization and clinical outcomes.",10.1001/archneurol.2009.307,59cc6da2b60b66b9a1c526c946b86f3ddc4b8804,https://doi.org/10.1001/archneurol.2009.307,https://jamanetwork.com/journals/jamaneurology/articlepdf/799013/noc90059_71_79.pdf,JournalArticle,unknown,brain,"Objectives To examine the effects of aerobic exercise on cognition and other biomarkers associated with Alzheimer disease pathology for older adults with mild cognitive impairment, and assess the role of sex as a predictor of response. Design Six-month, randomized, controlled, clinical trial. Setting Veterans Affairs Puget Sound Health Care System clinical research unit. Participants Thirty-three adults (17 women) with amnestic mild cognitive impairment ranging in age from 55 to 85 years (mean age,70 years). Intervention Participants were randomized either to a high-intensity aerobic exercise or stretching control group. The aerobic group exercised under the supervision of a fitness trainer at 75% to 85% of heart rate reserve for 45 to 60 min/d, 4 d/wk for 6 months. The control group carried out supervised stretching activities according to the same schedule but maintained their heart rate at or below 50% of their heart rate reserve. Before and after the study, glucometabolic and treadmill tests were performed and fat distribution was assessed using dual-energy x-ray absorptiometry. At baseline, month 3, and month 6, blood was collected for assay and cognitive tests were administered. Main Outcome Measures Performance measures on Symbol-Digit Modalities, Verbal Fluency, Stroop, Trails B, Task Switching, Story Recall, and List Learning. Fasting plasma levels of insulin, cortisol, brain-derived neurotrophic factor, insulinlike growth factor-I, and β-amyloids 40 and 42. Results Six months of high-intensity aerobic exercise had sex-specific effects on cognition, glucose metabolism, and hypothalamic-pituitary-adrenal axis and trophic activity despite comparable gains in cardiorespiratory fitness and body fat reduction. For women, aerobic exercise improved performance on multiple tests of executive function, increased glucose disposal during the metabolic clamp, and reduced fasting plasma levels of insulin, cortisol, and brain-derived neurotrophic factor. For men, aerobic exercise increased plasma levels of insulinlike growth factor I and had a favorable effect only on Trails B performance. Conclusions This study provides support, using rigorous controlled methodology, for a potent nonpharma-cologic intervention that improves executive control processes for older women at high risk of cognitive decline. Moreover, our results suggest that a sex bias in cognitive response may relate to sex-based differences in glucometabolic and hypothalamic-pituitary-adrenal axis responses to aerobic exercise."
76,2010,Genome Remodeling in a Basal-like Breast Cancer Metastasis and Xenograft,"L. Ding, M. Ellis, Shunqiang Li, D. Larson, Ken Chen, J. Wallis, et al.",Nature,2010-04-15,1204,24,145.9,Clinical Neurology and Neurodegeneration,human,Massively parallel DNA sequencing technologies provide an unprecedented ability to screen entire genomes for genetic changes associated with tumour progression.,"high citation signal (1,204); recognized venue; open-access PDF metadata; human evidence signal","Clinical cohorts often differ in disease stage, comorbidity, treatment history, and follow-up duration.; Biomarkers may not transfer cleanly across populations, scanners, care settings, or diagnostic criteria.; Human cohort effects can depend on recruitment, demographics, comorbidity, and measurement context.",10.1038/nature08989,a125cde146760b1e6630d452c359264a4a7cb87d,https://doi.org/10.1038/nature08989,https://www.nature.com/articles/nature08989.pdf,JournalArticle,unknown,brain,"Massively parallel DNA sequencing technologies provide an unprecedented ability to screen entire genomes for genetic changes associated with tumour progression. Here we describe the genomic analyses of four DNA samples from an African-American patient with basal-like breast cancer: peripheral blood, the primary tumour, a brain metastasis and a xenograft derived from the primary tumour. The metastasis contained two de novo mutations and a large deletion not present in the primary tumour, and was significantly enriched for 20 shared mutations. The xenograft retained all primary tumour mutations and displayed a mutation enrichment pattern that resembled the metastasis. Two overlapping large deletions, encompassing CTNNA1, were present in all three tumour samples. The differential mutation frequencies and structural variation patterns in metastasis and xenograft compared with the primary tumour indicate that secondary tumours may arise from a minority of cells within the primary tumour."
77,2010,Resting-state functional MRI in depression unmasks increased connectivity between networks via the dorsal nexus,"Y. Sheline, J. Price, Zhizi Yan, M. Mintun",Proceedings of the National Academy of Sciences of the United States of America,2010-06-01,1202,111,148.27,"Brain Development, Plasticity, and Connectomics",MRI;fMRI;connectome,"Positions Resting-state functional MRI in depression unmasks increased connectivity between networks via the dorsal nexus within Brain Development, Plasticity, and Connectomics.","high citation signal (1,202); recognized venue; open-access PDF metadata","Developmental and aging studies are sensitive to cohort composition, attrition, and longitudinal sampling intervals.; Network measures can depend heavily on parcellation, thresholding, and acquisition choices.; Imaging conclusions can depend on acquisition, preprocessing, and model specification.",10.1073/pnas.1000446107,b53712da3f27fd60407bee652706e0add8893b5b,https://doi.org/10.1073/pnas.1000446107,https://europepmc.org/articles/pmc2890754?pdf=render,JournalArticle,unknown,mri,
78,2010,Modular and Hierarchically Modular Organization of Brain Networks,"D. Meunier, R. Lambiotte, E. Bullmore",Frontiers in Neuroscience,2010-10-17,1185,38,158.01,"Brain Development, Plasticity, and Connectomics",human;non-human;connectome,"Brain networks are increasingly understood as one of a large class of information processing systems that share important organizational principles in common, including the property of a modular community structure.","high citation signal (1,185); recognized venue; open-access PDF metadata; human evidence signal","Developmental and aging studies are sensitive to cohort composition, attrition, and longitudinal sampling intervals.; Network measures can depend heavily on parcellation, thresholding, and acquisition choices.; Non-human findings need careful translation to human brain organization and clinical outcomes.",10.3389/fnins.2010.00200,6938d305ee3a51b4197580d1174c355248d2c0ff,https://doi.org/10.3389/fnins.2010.00200,https://www.frontiersin.org/articles/10.3389/fnins.2010.00200/pdf,JournalArticle; Review,unknown,brain; cortical; neuroimaging; brain in title,"Brain networks are increasingly understood as one of a large class of information processing systems that share important organizational principles in common, including the property of a modular community structure. A module is topologically defined as a subset of highly inter-connected nodes which are relatively sparsely connected to nodes in other modules. In brain networks, topological modules are often made up of anatomically neighboring and/or functionally related cortical regions, and inter-modular connections tend to be relatively long distance. Moreover, brain networks and many other complex systems demonstrate the property of hierarchical modularity, or modularity on several topological scales: within each module there will be a set of sub-modules, and within each sub-module a set of sub-sub-modules, etc. There are several general advantages to modular and hierarchically modular network organization, including greater robustness, adaptivity, and evolvability of network function. In this context, we review some of the mathematical concepts available for quantitative analysis of (hierarchical) modularity in brain networks and we summarize some of the recent work investigating modularity of structural and functional brain networks derived from analysis of human neuroimaging data."
