rank,year,title,authors,venue,publicationDate,citationCount,influentialCitationCount,importanceScore,category,keywordTags,keyIdea,strengths,limitations,doi,sourceId,url,openAccessPdf,githubUrl,workType,language,relevanceReason,abstract
54,1936,THE USE OF STANDARDIZED MOUSE BRAIN ANTIGEN: FOR THE PERFORMANCE OF THE FREI TEST FOR LYMPHOGRANULOMA INGUINALE,"A. Grace, F. H. Suskind",Unknown venue,1936-10-24,19,0,63.12,General Brain Science and Reviews,non-human,Positions THE USE OF STANDARDIZED MOUSE BRAIN ANTIGEN: FOR THE PERFORMANCE OF THE FREI TEST FOR LYMPHOGRANULOMA INGUINALE within General Brain Science and Reviews.,high citation signal (19),"Broad reviews can dominate citation-ranked lists while obscuring narrower empirical advances.; Taxonomy boundaries are imperfect because many brain papers combine methods, scales, and diseases.; Non-human findings need careful translation to human brain organization and clinical outcomes.",10.1001/JAMA.1936.02770430009004,0b9a8bdfb6d5ef124111d07a99fabe5c0b1c0790,https://doi.org/10.1001/JAMA.1936.02770430009004,,,paper,unknown,brain; brain in title,
55,1936,Effect of Dichlor-diethyl-sulphone on Brain Respiration,R. Peters,Nature,1936-08-01,18,0,74.2,General Brain Science and Reviews,non-human,Positions Effect of Dichlor-diethyl-sulphone on Brain Respiration within General Brain Science and Reviews.,high citation signal (18); recognized venue,"Broad reviews can dominate citation-ranked lists while obscuring narrower empirical advances.; Taxonomy boundaries are imperfect because many brain papers combine methods, scales, and diseases.; Non-human findings need careful translation to human brain organization and clinical outcomes.",10.1038/138327B0,84ff55a4e678264f26a80cf30e6749eb75f3e350,https://doi.org/10.1038/138327B0,,,paper,unknown,brain; brain in title,
56,1936,The Spleen and Resistance,"David Rerla, J. Marmorston, D. Marine",The Indian medical gazette,1936-03-01,18,1,59.4,"EEG, MEG, and Electrophysiology",ECoG;non-human,The absence of pain in embolism of the spleen and brain is adduced as evidence that muscle is the source of the pain in embolism in the limbs.,high citation signal (18),"Low signal-to-noise ratio, artifacts, and source-localization uncertainty complicate interpretation.; Many studies rely on controlled tasks and may not generalize to everyday behavior or clinical monitoring.; Non-human findings need careful translation to human brain organization and clinical outcomes.",10.5694/j.1326-5377.1936.tb106737.x,b69e06ac8417874ed258a541ed7a3825a2dd328b,https://doi.org/10.5694/j.1326-5377.1936.tb106737.x,,,paper,unknown,brain; ecog,"The absence of pain in embolism of the spleen and brain is adduced as evidence that muscle is the source of the pain in embolism in the limbs. The hypothesis which postulates sensory nerves in arteries transmitting painful impulses is thus rendered unnecessary. In suitable cases of thrombo-angiitis, lumbar sympathectomy is recommended. Conservative amputation is advised in gangrene due to this disease. The author states that there is no known permanent vaso-dilator. A most valuable chapter on vaso-constriction will appeal to readers. Sir Thomas Lewis is the recognized authority on this subject, and his masterly account of the reactions of arteries, veins and arterio-venous anastomoses to various reagents, including external cold, is especially interesting, since he himself is an original and major contributor to our present knowledge of the subject. In Raynaud's disease sympathectomy is advised in cases of severe degree, but before operation is recommended the disfigurement resulting from the unilateral cervical operation must be weighed carefully with the nutritional changes occurring. Erythrocyanosis of the legs is stated to have come in with short skirts, and the treatment is advised accordingly. As the book is the work of a physician, little can be expected on operative technique. Mention might have been made of peripheral nerve section in thrombo-angiitis and of scalenectomy in cervical rib. Such omissions are pardonable, however, in a small handbook. The book is unique in that it is the first attempt made by an English writer to present this subject in condensed and up-to-date form. No progressive practitioner should be without it."
57,1936,SOME ASPECTS OF THE ELECTRICAL ACTIVITY OF THE CEREBRAL CORTEX,H. Davis,Unknown venue,1936,17,0,62.03,General Brain Science and Reviews,,Positions SOME ASPECTS OF THE ELECTRICAL ACTIVITY OF THE CEREBRAL CORTEX within General Brain Science and Reviews.,high citation signal (17),"Broad reviews can dominate citation-ranked lists while obscuring narrower empirical advances.; Taxonomy boundaries are imperfect because many brain papers combine methods, scales, and diseases.; Metadata-level ranking should be complemented with full-text expert review before strong claims are made.",10.1101/SQB.1936.004.01.030,0e5999d3a3497a3a4f98cb044c9509b864e50eb0,https://doi.org/10.1101/SQB.1936.004.01.030,,,paper,unknown,cerebral; cortex; neuroscience term,
58,1936,The Selective Regional Vulnerability of the Brain and its Relation to Psychiatric Problems,A. Meyer,Proceedings of the Royal Society of Medicine,1936-07-01,17,0,63.03,General Brain Science and Reviews,,Positions The Selective Regional Vulnerability of the Brain and its Relation to Psychiatric Problems within General Brain Science and Reviews.,high citation signal (17); open-access PDF metadata,"Broad reviews can dominate citation-ranked lists while obscuring narrower empirical advances.; Taxonomy boundaries are imperfect because many brain papers combine methods, scales, and diseases.; Metadata-level ranking should be complemented with full-text expert review before strong claims are made.",10.1177/003591573602900927,560b3a63a0f0e1a0d5bbc406d14980a4462d18b1,https://doi.org/10.1177/003591573602900927,https://journals.sagepub.com/doi/pdf/10.1177/003591573602900927,,JournalArticle,unknown,brain; brain in title,
59,1936,ARHINENCEPHALY WITH EXTREME EVERSION OF THE END-BRAIN: AN ANATOMIC STUDY,"H. Kuhlenbeck, J. Globus",Unknown venue,1936-07-01,15,1,57.91,General Brain Science and Reviews,,Positions ARHINENCEPHALY WITH EXTREME EVERSION OF THE END-BRAIN: AN ANATOMIC STUDY within General Brain Science and Reviews.,high citation signal (15),"Broad reviews can dominate citation-ranked lists while obscuring narrower empirical advances.; Taxonomy boundaries are imperfect because many brain papers combine methods, scales, and diseases.; Metadata-level ranking should be complemented with full-text expert review before strong claims are made.",10.1001/ARCHNEURPSYC.1936.02260070066006,599d3bf95c9edb1573ad3821914dfcef8a772286,https://doi.org/10.1001/ARCHNEURPSYC.1936.02260070066006,,,paper,unknown,brain; brain in title,
60,1936,"The Spleen, the Liver, and the Brain",B. Brouwer,Unknown venue,1936-04-01,15,0,60.91,General Brain Science and Reviews,,"Positions The Spleen, the Liver, and the Brain within General Brain Science and Reviews.",high citation signal (15); open-access PDF metadata,"Broad reviews can dominate citation-ranked lists while obscuring narrower empirical advances.; Taxonomy boundaries are imperfect because many brain papers combine methods, scales, and diseases.; Metadata-level ranking should be complemented with full-text expert review before strong claims are made.",10.1177/003591573602900602,a87679bc7942abda3fbeec6d63a4fe3dea519bae,https://doi.org/10.1177/003591573602900602,https://journals.sagepub.com/doi/pdf/10.1177/003591573602900602,,paper,unknown,brain; brain in title,
61,1936,General and Cerebral Anaphylaxis in the Monkey (Macacus Rhesus),"N. Kopeloff, L. Davidoff, L. Kopeloff",Journal of Immunology,1936-06-01,15,0,55.11,General Brain Science and Reviews,non-human,Fatal anaphylactic shock has been produced at will in monkeys following single or multiple preparatory intravenous injections of liberal amounts of fresh undiluted egg-white and in one instance by sensitization through the gastro-intestinal route.,high citation signal (15),"Broad reviews can dominate citation-ranked lists while obscuring narrower empirical advances.; Taxonomy boundaries are imperfect because many brain papers combine methods, scales, and diseases.; Non-human findings need careful translation to human brain organization and clinical outcomes.",10.1016/s0021-8707(36)90514-2,7a81206aa89a8924011017c9bdbd4b66d4b5b1f3,https://doi.org/10.1016/s0021-8707(36)90514-2,,,paper,unknown,brain; cerebral,Fatal anaphylactic shock has been produced at will in monkeys following single or multiple preparatory intravenous injections of liberal amounts of fresh undiluted egg-white and in one instance by sensitization through the gastro-intestinal route. Passive transfer of rabbit anti-egg-white serum to a single monkey resulted in anaphylactic death upon injection of antigen. Local cerebral anaphylaxis as evidenced by contralateral focal symptoms and pathologic brain changes including necrosis have been observed in sensitized monkeys upon subsequent injection of the specific antigen. The pathologic picture of fatal anaphylaxis in monkeys is markedly different from that seen in any of the usual laboratory animals.
62,1936,ALCOHOL INJECTION IN THE TREATMENT OF MAJOR TRIGEMINAL NEURALGIA,F. Grant,Unknown venue,1936-09-05,15,0,51.91,General Brain Science and Reviews,,Positions ALCOHOL INJECTION IN THE TREATMENT OF MAJOR TRIGEMINAL NEURALGIA within General Brain Science and Reviews.,high citation signal (15),"Broad reviews can dominate citation-ranked lists while obscuring narrower empirical advances.; Taxonomy boundaries are imperfect because many brain papers combine methods, scales, and diseases.; Metadata-level ranking should be complemented with full-text expert review before strong claims are made.",10.1001/JAMA.1936.02770360017006,524ed6d6820040ba5265d460a02f864954da6e14,https://doi.org/10.1001/JAMA.1936.02770360017006,,,paper,unknown,neural,
63,1936,"The Motor Cortex in Man in the Light of Hughlings Jackson's Doctrines. (Brain, vol. lix, p. 135, June, 1936.) Foerster, O.",G. Fleming,Unknown venue,1936-09-01,14,1,64.74,General Brain Science and Reviews,,"Positions The Motor Cortex in Man in the Light of Hughlings Jackson's Doctrines. (Brain, vol. lix, p. 135, June, 1936.) Foerster, O. within General Brain Science and Reviews.",high citation signal (14),"Broad reviews can dominate citation-ranked lists while obscuring narrower empirical advances.; Taxonomy boundaries are imperfect because many brain papers combine methods, scales, and diseases.; Metadata-level ranking should be complemented with full-text expert review before strong claims are made.",10.1192/BJP.82.340.677-A,b39810a6d94af5ef34ca750cdbad5770ebd9b593,https://doi.org/10.1192/BJP.82.340.677-A,,,paper,unknown,brain; cortex; brain in title; neuroscience term,
64,1936,THE FREI TEST FOR LYMPHOGRANULOMA INGUINALE: EXPERIENCES WITH ANTIGENS MADE FROM MOUSE BRAIN,"M. J. Strauss, M. E. Howard",Unknown venue,1936-02-15,14,0,57.94,General Brain Science and Reviews,non-human,Positions THE FREI TEST FOR LYMPHOGRANULOMA INGUINALE: EXPERIENCES WITH ANTIGENS MADE FROM MOUSE BRAIN within General Brain Science and Reviews.,high citation signal (14),"Broad reviews can dominate citation-ranked lists while obscuring narrower empirical advances.; Taxonomy boundaries are imperfect because many brain papers combine methods, scales, and diseases.; Non-human findings need careful translation to human brain organization and clinical outcomes.",10.1001/JAMA.1936.02770070013005,f7146c4ae1d774302115b22bcf21f8f00eee03c0,https://doi.org/10.1001/JAMA.1936.02770070013005,,,paper,unknown,brain; brain in title,
65,1936,MACULAR VISION FOLLOWING CEREBRAL RESECTION,"J. C. Fox, W. J. German",Unknown venue,1936-04-01,14,0,50.74,General Brain Science and Reviews,,Positions MACULAR VISION FOLLOWING CEREBRAL RESECTION within General Brain Science and Reviews.,high citation signal (14),"Broad reviews can dominate citation-ranked lists while obscuring narrower empirical advances.; Taxonomy boundaries are imperfect because many brain papers combine methods, scales, and diseases.; Metadata-level ranking should be complemented with full-text expert review before strong claims are made.",10.1001/ARCHNEURPSYC.1936.02260040116008,3d3cc815aaec104c9a73cca12e00911b2613e715,https://doi.org/10.1001/ARCHNEURPSYC.1936.02260040116008,,,paper,unknown,cerebral,
66,1936,THE CORTICAL INNERVATION OF OCULAR MOVEMENTS,"E. Spiegel, N. Scala",Unknown venue,1936-12-01,14,0,50.74,General Brain Science and Reviews,,Positions THE CORTICAL INNERVATION OF OCULAR MOVEMENTS within General Brain Science and Reviews.,high citation signal (14),"Broad reviews can dominate citation-ranked lists while obscuring narrower empirical advances.; Taxonomy boundaries are imperfect because many brain papers combine methods, scales, and diseases.; Metadata-level ranking should be complemented with full-text expert review before strong claims are made.",10.1001/ARCHOPHT.1936.00840240067006,c9a03bf60f7410162825d08125bf2d2e9523ca14,https://doi.org/10.1001/ARCHOPHT.1936.00840240067006,,,paper,unknown,cortical,
67,1936,The External Configuration of the Cerebral Hemispheres of the Chimpanzee.,"A. Walker, J. F. Fulton",Journal of Anatomy,1936-10-01,14,1,51.94,General Brain Science and Reviews,non-human,Positions The External Configuration of the Cerebral Hemispheres of the Chimpanzee. within General Brain Science and Reviews.,high citation signal (14),"Broad reviews can dominate citation-ranked lists while obscuring narrower empirical advances.; Taxonomy boundaries are imperfect because many brain papers combine methods, scales, and diseases.; Non-human findings need careful translation to human brain organization and clinical outcomes.",,ec92d7cb9590cb8bf3ff0ed32c034ddeea683c66,https://www.semanticscholar.org/paper/ec92d7cb9590cb8bf3ff0ed32c034ddeea683c66,,,JournalArticle,unknown,cerebral,
68,1936,Heterophyidiasis: III. Ova associated with a Fatal Hemorrhage in the Right Basal Ganglia of the Brain.,"C. Africa, W. Leon, E. Y. Garcia",Unknown venue,1936,12,0,58.17,"Cellular, Molecular, and Synaptic Neuroscience",,"Positions Heterophyidiasis: III. Ova associated with a Fatal Hemorrhage in the Right Basal Ganglia of the Brain. within Cellular, Molecular, and Synaptic Neuroscience.",high citation signal (12),"Cellular mechanisms can be difficult to connect directly to whole-brain dynamics or human behavior.; Single-cell sampling, dissociation, alignment, and batch effects can bias inferred cell populations.; Metadata-level ranking should be complemented with full-text expert review before strong claims are made.",,3a56be6dd9a2492e96ff0a9cb036e9890f0e6d0d,https://www.semanticscholar.org/paper/3a56be6dd9a2492e96ff0a9cb036e9890f0e6d0d,,,paper,unknown,brain; basal ganglia; glia; brain in title,
69,1936,VASCULAR CHANGES IN THE LATERAL GENICULATE BODY FOLLOWING EXTIRPATION OF THE VISUAL CORTEX,Y. Tsang,Unknown venue,1936-09-01,12,0,54.17,Cognitive and Systems Neuroscience,,Positions VASCULAR CHANGES IN THE LATERAL GENICULATE BODY FOLLOWING EXTIRPATION OF THE VISUAL CORTEX within Cognitive and Systems Neuroscience.,high citation signal (12),"Task designs can simplify cognition enough that ecological validity becomes uncertain.; Cross-species alignment between circuits, behavior, and subjective experience remains imperfect.; Metadata-level ranking should be complemented with full-text expert review before strong claims are made.",10.1001/ARCHNEURPSYC.1936.02260090122007,5e4eb9a880dd20a0bfe809b314c59bcbf5a3f8e4,https://doi.org/10.1001/ARCHNEURPSYC.1936.02260090122007,,,paper,unknown,cortex; neuroscience term,
70,1936,Carbohydrate catabolism in cerebral cortex.,K. Dixon,Biochemical Journal,1936-08-01,11,0,58.93,General Brain Science and Reviews,non-human,Positions Carbohydrate catabolism in cerebral cortex. within General Brain Science and Reviews.,high citation signal (11); open-access PDF metadata,"Broad reviews can dominate citation-ranked lists while obscuring narrower empirical advances.; Taxonomy boundaries are imperfect because many brain papers combine methods, scales, and diseases.; Non-human findings need careful translation to human brain organization and clinical outcomes.",10.1042/BJ0301479,73bfa63656ad116ab0420925eb5f207011c222fc,https://doi.org/10.1042/BJ0301479,https://europepmc.org/articles/pmc1263207?pdf=render,,JournalArticle,unknown,cerebral; cortex; neuroscience term,
71,1936,Metabolism of normal and tumour tissue: The respiratory quotient of brain cortex.,F. Dickens,Biochemical Journal,1936-04-01,10,0,63.36,"Cerebrovascular, Metabolism, and Brain Injury",non-human,"Positions Metabolism of normal and tumour tissue: The respiratory quotient of brain cortex. within Cerebrovascular, Metabolism, and Brain Injury.",high citation signal (10); open-access PDF metadata,"Acute injury studies can be sensitive to timing, severity, comorbidity, and treatment heterogeneity.; Animal models may not capture human vascular risk, injury complexity, or rehabilitation context.; Non-human findings need careful translation to human brain organization and clinical outcomes.",10.1042/BJ0300661,6a7c9f9441562c4b15408dd2f8247dbb5672588f,https://doi.org/10.1042/BJ0300661,https://europepmc.org/articles/pmc1263073?pdf=render,,JournalArticle,unknown,brain; cortex; brain in title; neuroscience term,
72,1936,ELECTRICAL BRAIN WAVES AND TEMPERATURE.,H. Hoagland,Science,1936-08-07,10,0,64.36,General Brain Science and Reviews,non-human,Positions ELECTRICAL BRAIN WAVES AND TEMPERATURE. within General Brain Science and Reviews.,high citation signal (10); recognized venue,"Broad reviews can dominate citation-ranked lists while obscuring narrower empirical advances.; Taxonomy boundaries are imperfect because many brain papers combine methods, scales, and diseases.; Non-human findings need careful translation to human brain organization and clinical outcomes.",10.1126/SCIENCE.84.2171.139,c467ed1868ad3a6fb48628db8d53d6405b7b65c6,https://doi.org/10.1126/SCIENCE.84.2171.139,,,JournalArticle,unknown,brain; brain in title,
73,1936,Brain weight of the Korean,I. Shibata,Unknown venue,1936-10-01,9,0,49.45,General Brain Science and Reviews,,Positions Brain weight of the Korean within General Brain Science and Reviews.,high citation signal (9),"Broad reviews can dominate citation-ranked lists while obscuring narrower empirical advances.; Taxonomy boundaries are imperfect because many brain papers combine methods, scales, and diseases.; Metadata-level ranking should be complemented with full-text expert review before strong claims are made.",10.1002/AJPA.1330220103,d541a130d1f10649353f827914338d0cea3d4bb8,https://doi.org/10.1002/AJPA.1330220103,,,paper,unknown,brain; brain in title,
74,1936,Functional Boundaries in the Sensori-Motor Cortex of the Monkey.∗,"J. G. D. de Barenne, W. McCulloch",Unknown venue,1936-11-01,9,0,50.65,General Brain Science and Reviews,non-human,Positions Functional Boundaries in the Sensori-Motor Cortex of the Monkey.∗ within General Brain Science and Reviews.,high citation signal (9),"Broad reviews can dominate citation-ranked lists while obscuring narrower empirical advances.; Taxonomy boundaries are imperfect because many brain papers combine methods, scales, and diseases.; Non-human findings need careful translation to human brain organization and clinical outcomes.",10.3181/00379727-35-8961P,57f42f8929974022e599a69552fcb810422e3fa9,https://doi.org/10.3181/00379727-35-8961P,,,JournalArticle,unknown,cortex; neuroscience term,
75,1936,HISTOLOGIC STUDIES OF THE BRAIN IN CASES OF FATAL INJURY TO THE HEAD: VI. CYTO-ARCHITECTONIC ALTERATIONS,"C. W. Rand, C. Courville",Unknown venue,1936-12-01,9,0,50.65,General Brain Science and Reviews,non-human,Positions HISTOLOGIC STUDIES OF THE BRAIN IN CASES OF FATAL INJURY TO THE HEAD: VI. CYTO-ARCHITECTONIC ALTERATIONS within General Brain Science and Reviews.,high citation signal (9),"Broad reviews can dominate citation-ranked lists while obscuring narrower empirical advances.; Taxonomy boundaries are imperfect because many brain papers combine methods, scales, and diseases.; Non-human findings need careful translation to human brain organization and clinical outcomes.",10.1001/ARCHNEURPSYC.1936.02260120124008,668cb1c1dace4d58072cd47866a558a962389575,https://doi.org/10.1001/ARCHNEURPSYC.1936.02260120124008,,,paper,unknown,brain; brain in title,
76,1936,CEREBRAL FRONTAL AGENESIS IN ASSOCIATION WITH EPILEPSY,J. Bateman,Unknown venue,1936-09-01,9,0,43.45,Clinical Neurology and Neurodegeneration,,Positions CEREBRAL FRONTAL AGENESIS IN ASSOCIATION WITH EPILEPSY within Clinical Neurology and Neurodegeneration.,high citation signal (9),"Clinical cohorts often differ in disease stage, comorbidity, treatment history, and follow-up duration.; Biomarkers may not transfer cleanly across populations, scanners, care settings, or diagnostic criteria.; Metadata-level ranking should be complemented with full-text expert review before strong claims are made.",10.1001/ARCHNEURPSYC.1936.02260090131008,c15e3ac73ad37522925b50633c3dfb88fe03870c,https://doi.org/10.1001/ARCHNEURPSYC.1936.02260090131008,,,Review,unknown,cerebral,
77,1936,THE PREVENTION OF NUTRITIONAL ENCEPHALOMALACIA IN CHICKS BY VEGETABLE OILS AND THEIR FRACTIONS,"M. Goettsch, A. M. Pappenheimer, A. Hart",Unknown venue,1936-07-01,9,0,47.65,"Brain Development, Plasticity, and Connectomics",non-human,One of the disorders occurring in young chicks upon synthetic diets is characterized by severe pathological changes in the central nervous system (l-3).,high citation signal (9); open-access PDF metadata,"Developmental and aging studies are sensitive to cohort composition, attrition, and longitudinal sampling intervals.; Network measures can depend heavily on parcellation, thresholding, and acquisition choices.; Non-human findings need careful translation to human brain organization and clinical outcomes.",10.1016/s0021-9258(18)74797-2,7da3f3776620b4b34eb79aa2b1865e92ca89c215,https://doi.org/10.1016/s0021-9258(18)74797-2,https://doi.org/10.1016/s0021-9258(18)74797-2,,paper,unknown,brain,"One of the disorders occurring in young chicks upon synthetic diets is characterized by severe pathological changes in the central nervous system (l-3). This disease, for which we have suggested the term nutritional encephalomalacia, has no correlation with body weight, sex, or breed of chick (4) and develops only during the period of active brain growth (5). The disease is not infectious nor transmissible by inoculation. Since the disorder was observed but rarely upon diets of natural foods, experimentation on the possible dietary factors was begun by incorporating in the synthetic diet various natural foods, such as grains, grain products, green foodstuffs, animal tissues, or animal products. The ineffectiveness of these supplements led to further experiments in which the content of mineral, fat, carbohydrate, and vitamin of the synthetic diet was varied. A high proportion of lard in the diet seemed to favor the development of the disease. When the lard was replaced by vegetable oils, these were found to provide complete protection (6). We wish to report experiments demonstrating this protective effect of vegetable oils. It will be shown also that the preventive factor is contained in the non-saponifiable fracti0n.l Care and Examination of Animal-White Leghorn chicks of accredited stock were obtained from Hall Brothers, Wallingford,"
78,1936,CORTICIFUGAL CONNECTIONS OF THE CEREBRAL CORTEX: A RÉSUMÉ OF EXPERIMENTAL INVESTIGATIONS,F. Mettler,Unknown venue,1936-06-01,8,0,49.55,General Brain Science and Reviews,,Positions CORTICIFUGAL CONNECTIONS OF THE CEREBRAL CORTEX: A RÉSUMÉ OF EXPERIMENTAL INVESTIGATIONS within General Brain Science and Reviews.,high citation signal (8),"Broad reviews can dominate citation-ranked lists while obscuring narrower empirical advances.; Taxonomy boundaries are imperfect because many brain papers combine methods, scales, and diseases.; Metadata-level ranking should be complemented with full-text expert review before strong claims are made.",10.1001/ARCHNEURPSYC.1936.02260060180014,be0dda2aa6e35643fbdabc21e689cd57ed048b30,https://doi.org/10.1001/ARCHNEURPSYC.1936.02260060180014,,,paper,unknown,cerebral; cortex; neuroscience term,
79,1936,VASCULAR CHANGES FOLLOWING EXPERIMENTAL LESIONS IN THE CEREBRAL CORTEX,Y. Tsang,Unknown venue,1936-06-01,8,0,49.55,General Brain Science and Reviews,,Positions VASCULAR CHANGES FOLLOWING EXPERIMENTAL LESIONS IN THE CEREBRAL CORTEX within General Brain Science and Reviews.,high citation signal (8),"Broad reviews can dominate citation-ranked lists while obscuring narrower empirical advances.; Taxonomy boundaries are imperfect because many brain papers combine methods, scales, and diseases.; Metadata-level ranking should be complemented with full-text expert review before strong claims are made.",10.1001/ARCHNEURPSYC.1936.02260060122010,031a572723fd2ceab69f7e48dc31ab560d3532ff,https://doi.org/10.1001/ARCHNEURPSYC.1936.02260060122010,,,paper,unknown,cerebral; cortex; neuroscience term,
80,1936,BRAIN SIZE AND MENTALITY,R. J. Berry,British medical journal,1936-07-11,8,0,50.55,General Brain Science and Reviews,,Positions BRAIN SIZE AND MENTALITY within General Brain Science and Reviews.,high citation signal (8); open-access PDF metadata,"Broad reviews can dominate citation-ranked lists while obscuring narrower empirical advances.; Taxonomy boundaries are imperfect because many brain papers combine methods, scales, and diseases.; Metadata-level ranking should be complemented with full-text expert review before strong claims are made.",10.1136/bmj.2.3940.62,3e242d818ac1c6fa9f0eddce17761e9dcc59d506,https://doi.org/10.1136/bmj.2.3940.62,https://europepmc.org/articles/pmc2457195?pdf=render,,JournalArticle,unknown,brain; brain in title,
