rank,year,title,authors,venue,publicationDate,citationCount,influentialCitationCount,importanceScore,category,keywordTags,keyIdea,strengths,limitations,doi,sourceId,url,openAccessPdf,githubUrl,workType,language,relevanceReason,abstract
81,1936,Hemiconstriction of the vascular system associated with cerebral disease,"W. Kerr, F. J. Underwood",Unknown venue,1936-12-01,8,0,41.55,General Brain Science and Reviews,,Positions Hemiconstriction of the vascular system associated with cerebral disease within General Brain Science and Reviews.,high citation signal (8),"Broad reviews can dominate citation-ranked lists while obscuring narrower empirical advances.; Taxonomy boundaries are imperfect because many brain papers combine methods, scales, and diseases.; Metadata-level ranking should be complemented with full-text expert review before strong claims are made.",10.1016/S0002-8703(36)91006-2,416971a8978bc75245e1d5d997ccff429a1080db,https://doi.org/10.1016/S0002-8703(36)91006-2,,,paper,unknown,cerebral,
82,1936,The cerebral cortex of the ostrich (Struthio),E. Craigie,Unknown venue,1936-10-01,7,0,47.43,General Brain Science and Reviews,,Positions The cerebral cortex of the ostrich (Struthio) within General Brain Science and Reviews.,high citation signal (7),"Broad reviews can dominate citation-ranked lists while obscuring narrower empirical advances.; Taxonomy boundaries are imperfect because many brain papers combine methods, scales, and diseases.; Metadata-level ranking should be complemented with full-text expert review before strong claims are made.",10.1002/cne.900640304,16129795d293803bb4ee93592a395f40aeba8444,https://doi.org/10.1002/cne.900640304,,,paper,unknown,cerebral; cortex; neuroscience term,
83,1936,The effect of rise in temperature on the carbohydrate catabolism of cerebral cortex.,K. C. Dixon,Biochemical Journal,1936-08-01,7,1,51.63,General Brain Science and Reviews,non-human,Positions The effect of rise in temperature on the carbohydrate catabolism of cerebral cortex. within General Brain Science and Reviews.,high citation signal (7); open-access PDF metadata,"Broad reviews can dominate citation-ranked lists while obscuring narrower empirical advances.; Taxonomy boundaries are imperfect because many brain papers combine methods, scales, and diseases.; Non-human findings need careful translation to human brain organization and clinical outcomes.",10.1042/BJ0301483,21723cc1d93dede0cbf69ab04bd5a2ef391f8451,https://doi.org/10.1042/BJ0301483,https://europepmc.org/articles/pmc1263208?pdf=render,,JournalArticle,unknown,cerebral; cortex; neuroscience term,
84,1936,Antigenic Properties of Brain Tumors,"A. Weil, E. Liebert",Journal of Immunology,1936-04-01,7,0,49.63,Clinical Neurology and Neurodegeneration,human,"Following intraperitoneal injections into guinea pigs and intravenous injections into white rabbits, saline emulsions of gliomas and brain tissue in combination with dog serum as a carrier stimulated the production of specific antibodies.",high citation signal (7); open-access PDF metadata; human evidence signal,"Clinical cohorts often differ in disease stage, comorbidity, treatment history, and follow-up duration.; Biomarkers may not transfer cleanly across populations, scanners, care settings, or diagnostic criteria.; Human cohort effects can depend on recruitment, demographics, comorbidity, and measurement context.",10.4049/jimmunol.30.4.291,b51a8e01741323c9523989271dd8240bca2c1661,https://doi.org/10.4049/jimmunol.30.4.291,https://journals.aai.org/jimmunol/article-pdf/30/4/291/1465981/ji0300040291.pdf,,paper,unknown,brain; brain in title,"Following intraperitoneal injections into guinea pigs and intravenous injections into white rabbits, saline emulsions of gliomas and brain tissue in combination with dog serum as a carrier stimulated the production of specific antibodies. A higher titer of the antiserum was obtained following intravenous injections into white rabbits of alcoholic extracts of formalin fixed brains and gliomas. Alcoholic extracts of meningiomas did not stimulate the production of specific antibodies. The serum of a patient with glioblastoma multiforme contained antibodies against glioblastoma together with antibodies against human brain."
85,1936,Brain Tumors in Children.,Scott Aj,California and western medicine,1936,7,2,46.63,Clinical Neurology and Neurodegeneration,human,Positions Brain Tumors in Children. within Clinical Neurology and Neurodegeneration.,high citation signal (7); human evidence signal,"Clinical cohorts often differ in disease stage, comorbidity, treatment history, and follow-up duration.; Biomarkers may not transfer cleanly across populations, scanners, care settings, or diagnostic criteria.; Human cohort effects can depend on recruitment, demographics, comorbidity, and measurement context.",,e08c5d1518c6e318d348e99e39a42544f689467b,https://www.semanticscholar.org/paper/e08c5d1518c6e318d348e99e39a42544f689467b,,,JournalArticle,unknown,brain; brain in title,
86,1936,Glycolysis and phosphate metabolism in cell free brain extracts of normal mammals.,"H. Euler, G. Gunther, B. Vestin",Unknown venue,1936,7,0,45.43,"Cerebrovascular, Metabolism, and Brain Injury",,"Positions Glycolysis and phosphate metabolism in cell free brain extracts of normal mammals. within Cerebrovascular, Metabolism, and Brain Injury.",high citation signal (7),"Acute injury studies can be sensitive to timing, severity, comorbidity, and treatment heterogeneity.; Animal models may not capture human vascular risk, injury complexity, or rehabilitation context.; Metadata-level ranking should be complemented with full-text expert review before strong claims are made.",10.1515/BCHM2.1936.240.5-6.265,f80488724dcf3233dd2640a145eae8e85fa9dd58,https://doi.org/10.1515/BCHM2.1936.240.5-6.265,,,paper,unknown,brain; brain in title,
87,1936,REACTING CELLS IN THE BRAIN IN THE PRESENCE OF A FOREIGN BODY,G. B. Hassin,Unknown venue,1936-08-01,7,0,45.43,General Brain Science and Reviews,,Positions REACTING CELLS IN THE BRAIN IN THE PRESENCE OF A FOREIGN BODY within General Brain Science and Reviews.,high citation signal (7),"Broad reviews can dominate citation-ranked lists while obscuring narrower empirical advances.; Taxonomy boundaries are imperfect because many brain papers combine methods, scales, and diseases.; Metadata-level ranking should be complemented with full-text expert review before strong claims are made.",10.1001/ARCHNEURPSYC.1936.02260080003001,620e946a1984210ad7ca05790825945365b5f35e,https://doi.org/10.1001/ARCHNEURPSYC.1936.02260080003001,,,paper,unknown,brain; brain in title,
88,1936,ALTERATIONS IN THE VISUAL FIELDS FOLLOWING CRANIOCEREBRAL INJURIES,C. W. Rand,Unknown venue,1936-06-01,7,0,40.63,General Brain Science and Reviews,non-human,Positions ALTERATIONS IN THE VISUAL FIELDS FOLLOWING CRANIOCEREBRAL INJURIES within General Brain Science and Reviews.,high citation signal (7),"Broad reviews can dominate citation-ranked lists while obscuring narrower empirical advances.; Taxonomy boundaries are imperfect because many brain papers combine methods, scales, and diseases.; Non-human findings need careful translation to human brain organization and clinical outcomes.",10.1001/ARCHSURG.1936.01180240033003,c989d55697e093514bef5be1c3e1f86261477214,https://doi.org/10.1001/ARCHSURG.1936.01180240033003,,,paper,unknown,cerebral,
89,1936,General and Cerebral Anaphylaxis in the Monkey,"N. Kopeloff, L. Davidoff, L. Kopeloff",Unknown venue,1936-03-01,7,0,40.63,General Brain Science and Reviews,non-human,Positions General and Cerebral Anaphylaxis in the Monkey within General Brain Science and Reviews.,high citation signal (7),"Broad reviews can dominate citation-ranked lists while obscuring narrower empirical advances.; Taxonomy boundaries are imperfect because many brain papers combine methods, scales, and diseases.; Non-human findings need careful translation to human brain organization and clinical outcomes.",10.3181/00379727-34-8539P,adb661696deadb71db398074e81e6487a1ae59b8,https://doi.org/10.3181/00379727-34-8539P,,,JournalArticle,unknown,cerebral,
90,1936,"Brain Reaction in Guinea Pigs infected with Endemic Typhus, Epidemic (European) Typhus, and Rocky Mountain Spotted Fever, Eastern and Western Types.","R. Lillie, R. E. Dyer",Unknown venue,1936,6,0,43.03,General Brain Science and Reviews,,"Positions Brain Reaction in Guinea Pigs infected with Endemic Typhus, Epidemic (European) Typhus, and Rocky Mountain Spotted Fever, Eastern and Western Types. within General Brain Science and Reviews.",high citation signal (6),"Broad reviews can dominate citation-ranked lists while obscuring narrower empirical advances.; Taxonomy boundaries are imperfect because many brain papers combine methods, scales, and diseases.; Metadata-level ranking should be complemented with full-text expert review before strong claims are made.",10.2307/4581953,fd58a74b867f5510e103520506bb6b96786ac199,https://doi.org/10.2307/4581953,,,paper,unknown,brain; brain in title,
91,1936,LYMPHOGRANULOMA INGUINALE: III. THE USE OF LYMPHOGRANULOMATOUS MOUSE BRAINS FOR DIAGNOSIS,"A. Grace, F. H. Suskind",Unknown venue,1936-07-01,6,0,44.23,General Brain Science and Reviews,non-human,Positions LYMPHOGRANULOMA INGUINALE: III. THE USE OF LYMPHOGRANULOMATOUS MOUSE BRAINS FOR DIAGNOSIS within General Brain Science and Reviews.,high citation signal (6),"Broad reviews can dominate citation-ranked lists while obscuring narrower empirical advances.; Taxonomy boundaries are imperfect because many brain papers combine methods, scales, and diseases.; Non-human findings need careful translation to human brain organization and clinical outcomes.",10.1001/ARCHDERM.1936.01470130068005,32999369963e461756f2e7596310274201bbc18e,https://doi.org/10.1001/ARCHDERM.1936.01470130068005,,,paper,unknown,brain; brain in title,
92,1936,"METABOLISM OF BRAIN, SPINAL CORD AND MENINGEAL TISSUE",S. Wortis,Unknown venue,1936-07-01,6,0,43.03,"Cerebrovascular, Metabolism, and Brain Injury",,"Positions METABOLISM OF BRAIN, SPINAL CORD AND MENINGEAL TISSUE within Cerebrovascular, Metabolism, and Brain Injury.",high citation signal (6),"Acute injury studies can be sensitive to timing, severity, comorbidity, and treatment heterogeneity.; Animal models may not capture human vascular risk, injury complexity, or rehabilitation context.; Metadata-level ranking should be complemented with full-text expert review before strong claims are made.",10.1176/AJP.93.1.87,10ecd3311eeccce41a2234b004d2fd5fb7c5ea4d,https://doi.org/10.1176/AJP.93.1.87,,,paper,unknown,brain; brain in title,
93,1936,The effect of the growth hormone upon the brain and brain weight-body weight relations,H. S. Rubinstein,Unknown venue,1936-10-01,6,1,43.03,General Brain Science and Reviews,,Positions The effect of the growth hormone upon the brain and brain weight-body weight relations within General Brain Science and Reviews.,high citation signal (6),"Broad reviews can dominate citation-ranked lists while obscuring narrower empirical advances.; Taxonomy boundaries are imperfect because many brain papers combine methods, scales, and diseases.; Metadata-level ranking should be complemented with full-text expert review before strong claims are made.",10.1002/cne.900640308,831b666d16f14f5261045dbaa2141cfb7c188393,https://doi.org/10.1002/cne.900640308,,,paper,unknown,brain; brain in title,
94,1936,"The Frontal Lobe in Man: A Clinical Study of Maximum Removals. (Brain, vol. lviii, p. 115, March, 1935.) Penfield, W., and Evans, J.",G. Fleming,Unknown venue,1936,6,0,44.23,Clinical Neurology and Neurodegeneration,human,"Positions The Frontal Lobe in Man: A Clinical Study of Maximum Removals. (Brain, vol. lviii, p. 115, March, 1935.) Penfield, W., and Evans, J. within Clinical Neurology and Neurodegeneration.",high citation signal (6); human evidence signal,"Clinical cohorts often differ in disease stage, comorbidity, treatment history, and follow-up duration.; Biomarkers may not transfer cleanly across populations, scanners, care settings, or diagnostic criteria.; Human cohort effects can depend on recruitment, demographics, comorbidity, and measurement context.",10.1192/BJP.82.336.76-B,7232e71187be57e9dd2f960b16e4eee2fade5869,https://doi.org/10.1192/BJP.82.336.76-B,,,paper,unknown,brain; brain in title,
95,1936,Interpolation Formulae for the Growth of the Human Brain and Its Major Parts in the First Year of Postnatal Life,R. Scammon,Unknown venue,1936-09-01,5,0,42.65,"EEG, MEG, and Electrophysiology",EEG;human,"Positions Interpolation Formulae for the Growth of the Human Brain and Its Major Parts in the First Year of Postnatal Life within EEG, MEG, and Electrophysiology.",high citation signal (5); human evidence signal,"Low signal-to-noise ratio, artifacts, and source-localization uncertainty complicate interpretation.; Many studies rely on controlled tasks and may not generalize to everyday behavior or clinical monitoring.; Human cohort effects can depend on recruitment, demographics, comorbidity, and measurement context.",10.1111/J.1467-8624.1936.TB05478.X,36fc9f0e61b06a15bb4b6ff9a20e0157f0510e08,https://doi.org/10.1111/J.1467-8624.1936.TB05478.X,,,paper,unknown,brain; brain in title,
96,1936,Medicolegal role of trauma in brain tumors,R. H. Fowler,Unknown venue,1936-08-01,5,0,40.25,Clinical Neurology and Neurodegeneration,,Positions Medicolegal role of trauma in brain tumors within Clinical Neurology and Neurodegeneration.,high citation signal (5),"Clinical cohorts often differ in disease stage, comorbidity, treatment history, and follow-up duration.; Biomarkers may not transfer cleanly across populations, scanners, care settings, or diagnostic criteria.; Metadata-level ranking should be complemented with full-text expert review before strong claims are made.",10.1016/S0002-9610(36)90705-5,27fe2d7fbea21a5570cc693b47f9407fbbb892d9,https://doi.org/10.1016/S0002-9610(36)90705-5,,,paper,unknown,brain; brain in title,
97,1936,STUDIES IN BRAIN INJURY: -INCREASED CEREBROSPINAL FLUID PRESSURE FROM BLOOD IN THE CEREBROSPINAL FLUID: AN EXPERIMENTAL STUDY.,"W. H. Parker, E. Lehman",Annals of Surgery,1936-10-01,5,0,43.25,"Cerebrovascular, Metabolism, and Brain Injury",,"Positions STUDIES IN BRAIN INJURY: -INCREASED CEREBROSPINAL FLUID PRESSURE FROM BLOOD IN THE CEREBROSPINAL FLUID: AN EXPERIMENTAL STUDY. within Cerebrovascular, Metabolism, and Brain Injury.",high citation signal (5); open-access PDF metadata,"Acute injury studies can be sensitive to timing, severity, comorbidity, and treatment heterogeneity.; Animal models may not capture human vascular risk, injury complexity, or rehabilitation context.; Metadata-level ranking should be complemented with full-text expert review before strong claims are made.",10.1097/00000658-193610440-00002,c6d01ba76915121f91de230cfb6527d625235d31,https://doi.org/10.1097/00000658-193610440-00002,https://www.ncbi.nlm.nih.gov/pmc/articles/PMC1390698,,JournalArticle,unknown,brain; brain in title,
98,1936,STUDIES ON THE ETIOLOGY OF RABBIT POX,"L. Pearce, P. D. Rosahn, Chuanyi Hu",Journal of Experimental Medicine,1936-03-31,5,1,38.45,"Brain Development, Plasticity, and Connectomics",non-human,"The white mouse, the guinea pig, the calf, and probably the rat, were found to be susceptible to infection with the virus of rabbit pox.",high citation signal (5); open-access PDF metadata,"Developmental and aging studies are sensitive to cohort composition, attrition, and longitudinal sampling intervals.; Network measures can depend heavily on parcellation, thresholding, and acquisition choices.; Non-human findings need careful translation to human brain organization and clinical outcomes.",10.1084/jem.63.4.491,231c13e0b9fdbf9f0d4f8e1695de695dd681c098,https://doi.org/10.1084/jem.63.4.491,https://rupress.org/jem/article-pdf/63/4/491/1180641/491.pdf,,JournalArticle,unknown,brain,"The white mouse, the guinea pig, the calf, and probably the rat, were found to be susceptible to infection with the virus of rabbit pox. Serial transmission of the virus in mice by brain to brain passage was characterized by a fatal outcome usually on the 5th or 6th day after inoculation. Infection of the guinea pig was accomplished by intratesticular injection and the virus was continued to the 2nd passage in this species. Guinea pigs developed a well marked cutaneous reaction from the intradermal injection of both rabbit and guinea pig tissue virus. Active virus was demonstrated in the testicles of rats 8 days after intratesticular injection by rabbit subinoculation. In the calf inoculation of the scarified skin was followed by the development of large papular lesions with marked hemorrhage and necrosis. The results of the investigations on the etiology of rabbit pox and of the experimentally induced infection reported in this and the four preceding papers (1-4) are discussed with special reference to the relation of pox virus to other viruses and of rabbit pox to other pock diseases."
99,1936,A Study of the Effect of Different Anesthetics On The Electrical Potential of the Brain Cortex.,"W. E. Barge, G. C. Wickwire, H. M. Schamp",Unknown venue,1936,4,0,44.97,General Brain Science and Reviews,,Positions A Study of the Effect of Different Anesthetics On The Electrical Potential of the Brain Cortex. within General Brain Science and Reviews.,high citation signal (4),"Broad reviews can dominate citation-ranked lists while obscuring narrower empirical advances.; Taxonomy boundaries are imperfect because many brain papers combine methods, scales, and diseases.; Metadata-level ranking should be complemented with full-text expert review before strong claims are made.",10.1213/00000539-193601000-00047,690691451fa4cb8c8160bd1155bbf2951ab41578,https://doi.org/10.1213/00000539-193601000-00047,,,paper,unknown,brain; cortex; brain in title; neuroscience term,
100,1936,A genetic study of brain differentiation by the action current method.,F. T. Perkins,Unknown venue,1936,4,0,39.97,General Brain Science and Reviews,,Positions A genetic study of brain differentiation by the action current method. within General Brain Science and Reviews.,high citation signal (4); open-access PDF metadata,"Broad reviews can dominate citation-ranked lists while obscuring narrower empirical advances.; Taxonomy boundaries are imperfect because many brain papers combine methods, scales, and diseases.; Metadata-level ranking should be complemented with full-text expert review before strong claims are made.",10.1037/H0060387,424ba3d4f6c382a21035ffad280cba1682d6c11d,https://doi.org/10.1037/H0060387,https://kuscholarworks.ku.edu/bitstream/1808/33053/1/perkins_1934_3425488.pdf,,paper,unknown,brain; brain in title,
