rank,year,title,authors,venue,publicationDate,citationCount,influentialCitationCount,importanceScore,category,keywordTags,keyIdea,strengths,limitations,doi,sourceId,url,openAccessPdf,githubUrl,workType,language,relevanceReason,abstract
1,1936,The spread of activity in the cerebral cortex,"Dusser de Barenne, E. Adrian",Journal of Physiology,1936-11-06,307,10,116.14,General Brain Science and Reviews,,Positions The spread of activity in the cerebral cortex within General Brain Science and Reviews.,high citation signal (307); open-access PDF metadata,"Broad reviews can dominate citation-ranked lists while obscuring narrower empirical advances.; Taxonomy boundaries are imperfect because many brain papers combine methods, scales, and diseases.; Metadata-level ranking should be complemented with full-text expert review before strong claims are made.",10.1113/jphysiol.1936.sp003427,ba43de01c96a301f63bf7354cd9d23a47220147f,https://doi.org/10.1113/jphysiol.1936.sp003427,https://www.ncbi.nlm.nih.gov/pmc/articles/PMC1395260,,JournalArticle,unknown,cerebral; cortex; neuroscience term,
2,1936,Electrical potentials of the human brain,"A. Loomis, E. N. Harvey, G. Hobart",Unknown venue,1936,246,2,108.37,General Brain Science and Reviews,human,Positions Electrical potentials of the human brain within General Brain Science and Reviews.,high citation signal (246); human evidence signal,"Broad reviews can dominate citation-ranked lists while obscuring narrower empirical advances.; Taxonomy boundaries are imperfect because many brain papers combine methods, scales, and diseases.; Human cohort effects can depend on recruitment, demographics, comorbidity, and measurement context.",10.1037/H0062089,67260039802a2c2b71c4a15f06a5ddc17267c53c,https://doi.org/10.1037/H0062089,,,paper,unknown,brain; brain in title,
3,1936,THE EFFECTS OF ANESTHETICS ON ACTION POTENTIALS IN THE CEREBRAL CORTEX OF THE CAT,"A. J. Derbyshire, B. Rempel, A. Forbes, E. Lambert",Unknown venue,1936-07-31,188,0,107.35,General Brain Science and Reviews,,Positions THE EFFECTS OF ANESTHETICS ON ACTION POTENTIALS IN THE CEREBRAL CORTEX OF THE CAT within General Brain Science and Reviews.,high citation signal (188); open-access PDF metadata,"Broad reviews can dominate citation-ranked lists while obscuring narrower empirical advances.; Taxonomy boundaries are imperfect because many brain papers combine methods, scales, and diseases.; Metadata-level ranking should be complemented with full-text expert review before strong claims are made.",10.1152/AJPLEGACY.1936.116.3.577,5d8ce8d5eeda5dc0b7d066a859e475796c20f65c,https://doi.org/10.1152/AJPLEGACY.1936.116.3.577,https://www.physiology.org/pb-assets/PDFs/2017-Legacy.pdf,,paper,unknown,cerebral; cortex; neuroscience term,
4,1936,ACTION POTENTIALS OF THE BRAIN: IN NORMAL PERSONS AND IN NORMAL STATES OF CEREBRAL ACTIVITY,"H. Davis, P. Davis",Unknown venue,1936-12-01,166,4,102.12,General Brain Science and Reviews,,Positions ACTION POTENTIALS OF THE BRAIN: IN NORMAL PERSONS AND IN NORMAL STATES OF CEREBRAL ACTIVITY within General Brain Science and Reviews.,high citation signal (166),"Broad reviews can dominate citation-ranked lists while obscuring narrower empirical advances.; Taxonomy boundaries are imperfect because many brain papers combine methods, scales, and diseases.; Metadata-level ranking should be complemented with full-text expert review before strong claims are made.",10.1001/ARCHNEURPSYC.1936.02260120061004,4792870186f7a61516977a4b66e79cf6a171348a,https://doi.org/10.1001/ARCHNEURPSYC.1936.02260120061004,,,paper,unknown,brain; cerebral; brain in title,
5,1936,Electrical stimulation of points in the forebrain and mid-brain: The resultant alterations in respiration,H. Kabat,Unknown venue,1936-08-01,118,2,96.42,General Brain Science and Reviews,non-human;stimulation,Positions Electrical stimulation of points in the forebrain and mid-brain: The resultant alterations in respiration within General Brain Science and Reviews.,high citation signal (118),"Broad reviews can dominate citation-ranked lists while obscuring narrower empirical advances.; Taxonomy boundaries are imperfect because many brain papers combine methods, scales, and diseases.; Non-human findings need careful translation to human brain organization and clinical outcomes.",10.1002/cne.900640202,30e250e414117848f72269228997ea3056b95543,https://doi.org/10.1002/cne.900640202,,,paper,unknown,brain; brain in title,
6,1936,ELECTRICAL ACTIVITY OF THE CAT'S BRAIN,"R. Gerard, W. H. Marshall, L. Saul",Unknown venue,1936-10-01,105,0,91.94,General Brain Science and Reviews,,Positions ELECTRICAL ACTIVITY OF THE CAT'S BRAIN within General Brain Science and Reviews.,high citation signal (105),"Broad reviews can dominate citation-ranked lists while obscuring narrower empirical advances.; Taxonomy boundaries are imperfect because many brain papers combine methods, scales, and diseases.; Metadata-level ranking should be complemented with full-text expert review before strong claims are made.",10.1001/ARCHNEURPSYC.1936.02260100002001,d554027ffd98f4751c0a3db52ca0674e9ce6ee0c,https://doi.org/10.1001/ARCHNEURPSYC.1936.02260100002001,,,paper,unknown,brain; brain in title,
7,1936,CARDIOVASCULAR REACTIONS INDUCED BY ELECTRICAL STIMULATION OF THE CEREBRAL CORTEX,"E. Hoff, H. D. Green",Unknown venue,1936-10-31,89,0,95.2,General Brain Science and Reviews,stimulation,Positions CARDIOVASCULAR REACTIONS INDUCED BY ELECTRICAL STIMULATION OF THE CEREBRAL CORTEX within General Brain Science and Reviews.,high citation signal (89); open-access PDF metadata,"Broad reviews can dominate citation-ranked lists while obscuring narrower empirical advances.; Taxonomy boundaries are imperfect because many brain papers combine methods, scales, and diseases.; Metadata-level ranking should be complemented with full-text expert review before strong claims are made.",10.1152/AJPLEGACY.1936.117.3.411,d1cb1a15ed4547aa29e038d53c8eee98371449ca,https://doi.org/10.1152/AJPLEGACY.1936.117.3.411,https://www.physiology.org/pb-assets/PDFs/2017-Legacy.pdf,,paper,unknown,cerebral; cortex; neuroscience term,
8,1936,The carbohydrate metabolism of brain. 1. The determination of glycogen in nerve tissue.,S. E. Kerr,Unknown venue,1936-11-01,82,0,88.74,"Cerebrovascular, Metabolism, and Brain Injury",non-human,"Positions The carbohydrate metabolism of brain. 1. The determination of glycogen in nerve tissue. within Cerebrovascular, Metabolism, and Brain Injury.",high citation signal (82),"Acute injury studies can be sensitive to timing, severity, comorbidity, and treatment heterogeneity.; Animal models may not capture human vascular risk, injury complexity, or rehabilitation context.; Non-human findings need careful translation to human brain organization and clinical outcomes.",,2b0ccd91ee9dc48c5885b5af14b9366ca2f11ac9,https://www.semanticscholar.org/paper/2b0ccd91ee9dc48c5885b5af14b9366ca2f11ac9,,,paper,unknown,brain; brain in title,
9,1936,Multiple Primary Tumors of the Brain: Review of the Literature and Report of Twenty-one Cases,C. Courville,Unknown venue,1936-04-01,81,1,96.52,General Brain Science and Reviews,non-human,Positions Multiple Primary Tumors of the Brain: Review of the Literature and Report of Twenty-one Cases within General Brain Science and Reviews.,high citation signal (81); synthesis or review value,"Broad reviews can dominate citation-ranked lists while obscuring narrower empirical advances.; Taxonomy boundaries are imperfect because many brain papers combine methods, scales, and diseases.; Non-human findings need careful translation to human brain organization and clinical outcomes.",10.1158/AJC.1936.703,766391dad754f6d739a558714907bf653a161b0c,https://doi.org/10.1158/AJC.1936.703,,,Review,unknown,brain; brain in title,
10,1936,EXPERIMENTAL NEPHRITIS IN RATS INDUCED BY INJECTION OF ANTI-KIDNEY SERUM,J. Smadel,Journal of Experimental Medicine,1936-11-30,81,0,86.72,Clinical Neurology and Neurodegeneration,human;non-human,Nephritis can be induced in rats by the injection of anti-kidney sera obtained from rabbits immunized with suspensions of perfused rat kidney.,high citation signal (81); open-access PDF metadata; human evidence signal,"Clinical cohorts often differ in disease stage, comorbidity, treatment history, and follow-up duration.; Biomarkers may not transfer cleanly across populations, scanners, care settings, or diagnostic criteria.; Non-human findings need careful translation to human brain organization and clinical outcomes.",10.1084/jem.64.6.921,9f4bf1c8d00edc3ec088d7a086d0e96fc822b92c,https://doi.org/10.1084/jem.64.6.921,https://rupress.org/jem/article-pdf/64/6/921/1180855/921.pdf,,JournalArticle,unknown,brain,"Nephritis can be induced in rats by the injection of anti-kidney sera obtained from rabbits immunized with suspensions of perfused rat kidney. Anti-kidney sera, thus prepared, contain a number of antibodies capable, on injection into rats, of inducing a severe anaphylactoid reaction with general vascular manifestations that involve the kidney as well as other organs. These sera also contain a nephrotoxic agent that affects the kidney primarily. The nephrotoxic effect is characterized clinically by severe persistent albuminuria with casts, and transient anasarca during the acute disease, but no significant hematuria occurs. When a severe anaphylactoid reaction is superimposed on the nephrotoxic injury, hematuria is an outstanding feature. Nephrotoxin is demonstrable in vivo and is not related quantitatively to the precipitins in the anti-kidney serum against kidney extract. It is most readily obtained by immunization with kidney suspensions, but may occasionally appear after injections of other organ preparations; it does not result from immunization with erythrocytes or serum. Nephrotoxin is present in the globulin fraction of anti-kidney serum. The nephrotoxic action of anti-kidney serum is easily removed by absorption with kidney cells or fat-free kidney tissue. Similar preparations of liver likewise remove it, but less readily. Neither kidney, liver, or brain lipids affect it, nor does absorption with red blood cells or serum. Nephrotoxin appears to be an antibody that is relatively organ specific in its affinities. It differs from the more common antibodies involved in reverse anaphylaxis in one respect, at least: The animal rapidly becomes desensitized against the latter and fails to react, whereas desensitization to nephrotoxin is difficult to secure."
11,1936,"The carbohydrate metabolism of brain. 2. The effect of varying the carbohydrate and insulin supply on the glycogen, free sugar, and lactic acid in mammmalian brain.","S. E. Kerr, M. Ghantus",Unknown venue,1936,79,0,88.08,"Cerebrovascular, Metabolism, and Brain Injury",non-human,"Positions The carbohydrate metabolism of brain. 2. The effect of varying the carbohydrate and insulin supply on the glycogen, free sugar, and lactic acid in mammmalian brain. within Cerebrovascular, Metabolism, and Brain Injury.",high citation signal (79),"Acute injury studies can be sensitive to timing, severity, comorbidity, and treatment heterogeneity.; Animal models may not capture human vascular risk, injury complexity, or rehabilitation context.; Non-human findings need careful translation to human brain organization and clinical outcomes.",,74749adb17703b71067a7dee41a168528b5ea981,https://www.semanticscholar.org/paper/74749adb17703b71067a7dee41a168528b5ea981,,,paper,unknown,brain; brain in title,
12,1936,Reaction of the bladder to stimulation of points in the forebrain and mid-brain,"H. Kabat, H. Magoun, S. W. Ranson",Unknown venue,1936-02-01,77,1,87.62,General Brain Science and Reviews,stimulation,Positions Reaction of the bladder to stimulation of points in the forebrain and mid-brain within General Brain Science and Reviews.,high citation signal (77),"Broad reviews can dominate citation-ranked lists while obscuring narrower empirical advances.; Taxonomy boundaries are imperfect because many brain papers combine methods, scales, and diseases.; Metadata-level ranking should be complemented with full-text expert review before strong claims are made.",10.1002/cne.900630204,c580724f5cf29cd34af0c3b4cec6810030d72d01,https://doi.org/10.1002/cne.900630204,,,paper,unknown,brain; brain in title,
13,1936,BRAIN POTENTIALS IN CHILDREN AND ADULTS,D. B. Lindsley,Unknown venue,1936-10-16,74,1,86.91,"Brain Development, Plasticity, and Connectomics",human,"Positions BRAIN POTENTIALS IN CHILDREN AND ADULTS within Brain Development, Plasticity, and Connectomics.",high citation signal (74); human evidence signal,"Developmental and aging studies are sensitive to cohort composition, attrition, and longitudinal sampling intervals.; Network measures can depend heavily on parcellation, thresholding, and acquisition choices.; Human cohort effects can depend on recruitment, demographics, comorbidity, and measurement context.",10.1126/SCIENCE.84.2181.354,ffad9d58683201bc5ea63a125a5892f908d61138,https://doi.org/10.1126/SCIENCE.84.2181.354,,,paper,unknown,brain; brain in title,
14,1936,EXTRAPYRAMIDAL ACTION FROM THE CAT'S CEREBRAL CORTEX: MOTOR AND INHIBITORY,S. S. Tower,Unknown venue,1936-12-01,72,0,87.23,General Brain Science and Reviews,,Positions EXTRAPYRAMIDAL ACTION FROM THE CAT'S CEREBRAL CORTEX: MOTOR AND INHIBITORY within General Brain Science and Reviews.,high citation signal (72),"Broad reviews can dominate citation-ranked lists while obscuring narrower empirical advances.; Taxonomy boundaries are imperfect because many brain papers combine methods, scales, and diseases.; Metadata-level ranking should be complemented with full-text expert review before strong claims are made.",10.1093/BRAIN/59.4.408,2f93eeed68cd27f88c8f7ab5a6e9c1cd2cfed98a,https://doi.org/10.1093/BRAIN/59.4.408,,,paper,unknown,cerebral; cortex; neuroscience term,
15,1936,BRAIN POTENTIALS DURING HYPNOSIS.,"A. Loomis, E. N. Harvey, G. Hobart",Science,1936-03-06,72,0,97.23,General Brain Science and Reviews,,Positions BRAIN POTENTIALS DURING HYPNOSIS. within General Brain Science and Reviews.,high citation signal (72); recognized venue,"Broad reviews can dominate citation-ranked lists while obscuring narrower empirical advances.; Taxonomy boundaries are imperfect because many brain papers combine methods, scales, and diseases.; Metadata-level ranking should be complemented with full-text expert review before strong claims are made.",10.1126/SCIENCE.83.2149.239,b89698dc62ae855318c8c3e79c1fd32bfd9c6b5a,https://doi.org/10.1126/SCIENCE.83.2149.239,,,JournalArticle,unknown,brain; brain in title,
16,1936,CORTICAL EXCITATORY STATE AND VARIABILITY IN HUMAN BRAIN RHYTHMS.,H. Jasper,Science,1936-03-13,66,1,98.88,General Brain Science and Reviews,human,Positions CORTICAL EXCITATORY STATE AND VARIABILITY IN HUMAN BRAIN RHYTHMS. within General Brain Science and Reviews.,high citation signal (66); recognized venue; human evidence signal,"Broad reviews can dominate citation-ranked lists while obscuring narrower empirical advances.; Taxonomy boundaries are imperfect because many brain papers combine methods, scales, and diseases.; Human cohort effects can depend on recruitment, demographics, comorbidity, and measurement context.",10.1126/SCIENCE.83.2150.259,d563c0cf04c7a701592cfb348ece88b31a708797,https://doi.org/10.1126/SCIENCE.83.2150.259,,,JournalArticle,unknown,brain; cortical; brain in title,
17,1936,PACEMAKERS OF HUMAN BRAIN WAVES IN NORMALS AND IN GENERAL PARETICS,H. Hoagland,Unknown venue,1936-07-31,63,1,87.06,General Brain Science and Reviews,human,Positions PACEMAKERS OF HUMAN BRAIN WAVES IN NORMALS AND IN GENERAL PARETICS within General Brain Science and Reviews.,high citation signal (63); open-access PDF metadata; human evidence signal,"Broad reviews can dominate citation-ranked lists while obscuring narrower empirical advances.; Taxonomy boundaries are imperfect because many brain papers combine methods, scales, and diseases.; Human cohort effects can depend on recruitment, demographics, comorbidity, and measurement context.",10.1152/AJPLEGACY.1936.116.3.604,030bb065d2ace1de6d2c1096b5129e8c28f937e5,https://doi.org/10.1152/AJPLEGACY.1936.116.3.604,https://www.physiology.org/pb-assets/PDFs/2017-Legacy.pdf,,paper,unknown,brain; brain in title,
18,1936,MULTIPLE TELANGIECTASES OF THE BRAIN: A DISCUSSION OF HEREDITARY FACTORS IN THEIR DEVELOPMENT,"J. C. Michael, P. M. Levin",Unknown venue,1936-09-01,62,0,82.58,"Brain Development, Plasticity, and Connectomics",,"Positions MULTIPLE TELANGIECTASES OF THE BRAIN: A DISCUSSION OF HEREDITARY FACTORS IN THEIR DEVELOPMENT within Brain Development, Plasticity, and Connectomics.",high citation signal (62),"Developmental and aging studies are sensitive to cohort composition, attrition, and longitudinal sampling intervals.; Network measures can depend heavily on parcellation, thresholding, and acquisition choices.; Metadata-level ranking should be complemented with full-text expert review before strong claims are made.",10.1001/ARCHNEURPSYC.1936.02260090067003,5f86d7b588c7cab6307ac1869cc6baea5a50e7ef,https://doi.org/10.1001/ARCHNEURPSYC.1936.02260090067003,,,paper,unknown,brain; brain in title,
19,1936,THE CONVULSION THRESHOLD OF VARIOUS PARTS OF THE CAT'S BRAIN,"F. Gibbs, E. Gibbs",Unknown venue,1936,55,1,80.46,General Brain Science and Reviews,,Positions THE CONVULSION THRESHOLD OF VARIOUS PARTS OF THE CAT'S BRAIN within General Brain Science and Reviews.,high citation signal (55),"Broad reviews can dominate citation-ranked lists while obscuring narrower empirical advances.; Taxonomy boundaries are imperfect because many brain papers combine methods, scales, and diseases.; Metadata-level ranking should be complemented with full-text expert review before strong claims are made.",10.1001/ARCHNEURPSYC.1936.02260010119009,ea0c177dcee1f66a2b05587502bbfdb93137814c,https://doi.org/10.1001/ARCHNEURPSYC.1936.02260010119009,,,paper,unknown,brain; brain in title,
20,1936,Human Brain Rhythms: I. Recording Techniques and Preliminary Results,"H. Jasper, H. L. Andrews",Unknown venue,1936,54,1,81.33,General Brain Science and Reviews,human,Positions Human Brain Rhythms: I. Recording Techniques and Preliminary Results within General Brain Science and Reviews.,high citation signal (54); human evidence signal,"Broad reviews can dominate citation-ranked lists while obscuring narrower empirical advances.; Taxonomy boundaries are imperfect because many brain papers combine methods, scales, and diseases.; Human cohort effects can depend on recruitment, demographics, comorbidity, and measurement context.",10.1080/00221309.1936.9713141,37952dee239ebeb3cd7b8acb2566ed02c792b6f1,https://doi.org/10.1080/00221309.1936.9713141,,,paper,unknown,brain; brain in title,
21,1936,Brain mechanisms and brightness discrimination learning.,I. Krechevsky,Unknown venue,1936,45,1,76.92,Cognitive and Systems Neuroscience,,Positions Brain mechanisms and brightness discrimination learning. within Cognitive and Systems Neuroscience.,high citation signal (45),"Task designs can simplify cognition enough that ecological validity becomes uncertain.; Cross-species alignment between circuits, behavior, and subjective experience remains imperfect.; Metadata-level ranking should be complemented with full-text expert review before strong claims are made.",10.1037/H0063374,51c7175af8b1c7bdbc1e2dd1705a1bbac6ccca7d,https://doi.org/10.1037/H0063374,,,paper,unknown,brain; brain in title,
22,1936,The Thalamic Connections of the Temporal Lobe of the Brain in the Monkey.,Clark We,Unknown venue,1936-07-01,43,0,77.32,General Brain Science and Reviews,non-human,Positions The Thalamic Connections of the Temporal Lobe of the Brain in the Monkey. within General Brain Science and Reviews.,high citation signal (43),"Broad reviews can dominate citation-ranked lists while obscuring narrower empirical advances.; Taxonomy boundaries are imperfect because many brain papers combine methods, scales, and diseases.; Non-human findings need careful translation to human brain organization and clinical outcomes.",,e2fbb4ece632b0f68b37adee7bf4f451264cdaa9,https://www.semanticscholar.org/paper/e2fbb4ece632b0f68b37adee7bf4f451264cdaa9,,,paper,unknown,brain; brain in title,
23,1936,ACTION OF DRUGS ON THE CHOLINE ESTERASE OF THE BRAIN,"F. Bernheim, M. Bernheim",Journal of Pharmacology and Experimental Therapeutics,1936-08-01,42,0,76.9,General Brain Science and Reviews,non-human,1. The preparation and properties of the choline esterase of the brain are described.,high citation signal (42),"Broad reviews can dominate citation-ranked lists while obscuring narrower empirical advances.; Taxonomy boundaries are imperfect because many brain papers combine methods, scales, and diseases.; Non-human findings need careful translation to human brain organization and clinical outcomes.",10.1016/s0022-3565(25)09778-2,00e48016ece751e95589119e38efdbb438aa0adc,https://doi.org/10.1016/s0022-3565(25)09778-2,,,JournalArticle,unknown,brain; brain in title,1. The preparation and properties of the choline esterase of the brain are described. 2. In most animals the activity of choline esterase per milligram of dry weight is greater in the brain than in the serum. 3. Choline esterase is greatly inhibited by very small concentrations of morphine and apomorphine. 4. It is suggested that these two drugs and possibly other centrally acting drugs may cause the accumulation of acetylcholine in the brain by inhibiting the choline esterase.
24,1936,Differentiation of Pigment Cells in Tissue Cultures of Chick Neural Crest,F. Dorris,Unknown venue,1936-05-01,42,1,69.7,General Brain Science and Reviews,,Positions Differentiation of Pigment Cells in Tissue Cultures of Chick Neural Crest within General Brain Science and Reviews.,high citation signal (42),"Broad reviews can dominate citation-ranked lists while obscuring narrower empirical advances.; Taxonomy boundaries are imperfect because many brain papers combine methods, scales, and diseases.; Metadata-level ranking should be complemented with full-text expert review before strong claims are made.",10.3181/00379727-34-8654P,195c5a64932ea9a25fb7937c76b00d3e626ccf9e,https://doi.org/10.3181/00379727-34-8654P,,,JournalArticle,unknown,neural,
25,1936,"Observations on behavior of the systemic blood pressure, pulse and spinal fluid pressure following craniocerebral injury","J. Browder, R. Meyers",Unknown venue,1936-03-01,42,1,69.7,Cognitive and Systems Neuroscience,,"Positions Observations on behavior of the systemic blood pressure, pulse and spinal fluid pressure following craniocerebral injury within Cognitive and Systems Neuroscience.",high citation signal (42),"Task designs can simplify cognition enough that ecological validity becomes uncertain.; Cross-species alignment between circuits, behavior, and subjective experience remains imperfect.; Metadata-level ranking should be complemented with full-text expert review before strong claims are made.",10.1016/S0002-9610(36)80002-6,3b2c08a1eefc598e6a9ed7c73e9e68076c24e54a,https://doi.org/10.1016/S0002-9610(36)80002-6,,,Review,unknown,cerebral,
26,1936,FACTORS CONTROLLING BRAIN POTENTIALS,R. Gerard,Unknown venue,1936,41,1,75.28,General Brain Science and Reviews,,Positions FACTORS CONTROLLING BRAIN POTENTIALS within General Brain Science and Reviews.,high citation signal (41),"Broad reviews can dominate citation-ranked lists while obscuring narrower empirical advances.; Taxonomy boundaries are imperfect because many brain papers combine methods, scales, and diseases.; Metadata-level ranking should be complemented with full-text expert review before strong claims are made.",10.1101/SQB.1936.004.01.031,9e55a6fe96bf489b19fbe3f0e2b90a41b27a32d6,https://doi.org/10.1101/SQB.1936.004.01.031,,,paper,unknown,brain; brain in title,
27,1936,AN ACQUIRED RESISTANCE OF GROWING ANIMALS TO CERTAIN NEUROTROPIC VIRUSES IN THE ABSENCE OF HUMORAL ANTIBODIES OR PREVIOUS EXPOSURE TO INFECTION,"P. K. Olitsky, A. Sabin, H. R. Cox",Journal of Experimental Medicine,1936-10-31,41,0,73.48,General Brain Science and Reviews,non-human,"1. As mice grow older they acquire a resistance to peripheral inoculation with the Indiana and New Jersey strains of vesicular stomatitis virus and to some extent also to Western equine encephalomyelitis virus, but little or none to the Eastern strain.",high citation signal (41); open-access PDF metadata,"Broad reviews can dominate citation-ranked lists while obscuring narrower empirical advances.; Taxonomy boundaries are imperfect because many brain papers combine methods, scales, and diseases.; Non-human findings need careful translation to human brain organization and clinical outcomes.",10.1084/jem.64.5.723,a9f51b48711417d8aeb9bee9b2af730897d837ce,https://doi.org/10.1084/jem.64.5.723,https://rupress.org/jem/article-pdf/64/5/723/1140599/723.pdf,,JournalArticle,unknown,brain,"1. As mice grow older they acquire a resistance to peripheral inoculation with the Indiana and New Jersey strains of vesicular stomatitis virus and to some extent also to Western equine encephalomyelitis virus, but little or none to the Eastern strain. 2. While some mice may become resistant as early as the 30th day of life, others may still be susceptible at 1 year of age. 3. This resistance is readily demonstrable when the inoculations are made by intranasal, subcutaneous, intramuscular, intraperitoneal, and intravenous routes, but not when the virus is injected directly into the brain. 4. The resistance is not related to previous exposure to infection or to the presence of specific or nonspecific antiviral bodies in the blood. 5. No difference in susceptibility to peripheral inoculation was found in young and old guinea pigs to pseudorabies virus, and in relatively young and old Macacus rhesus monkeys to poliomyelitis virus."
