rank,year,title,authors,venue,publicationDate,citationCount,influentialCitationCount,importanceScore,category,keywordTags,keyIdea,strengths,limitations,doi,sourceId,url,semanticScholarUrl,openAccessPdf,githubUrl,workType,language,relevanceReason,abstract
56,2009,Resting Microglia Directly Monitor the Functional State of Synapses In Vivo and Determine the Fate of Ischemic Terminals,"H. Wake, A. Moorhouse, S. Jinno, S. Kohsaka, J. Nabekura",Journal of Neuroscience,2009-04-01,1556,73,166.51,"Cellular, Molecular, and Synaptic Neuroscience",non-human,Recent studies have identified the important contribution of glial cells to the plasticity of neuronal circuits.,"high citation signal (1,556); recognized venue; open-access PDF metadata","Cellular mechanisms can be difficult to connect directly to whole-brain dynamics or human behavior.; Single-cell sampling, dissociation, alignment, and batch effects can bias inferred cell populations.; Non-human findings need careful translation to human brain organization and clinical outcomes.",10.1523/JNEUROSCI.4363-08.2009,3c5a8898f5b50b80eb8228e2e1153b4d5a820a34,https://doi.org/10.1523/jneurosci.4363-08.2009,https://www.semanticscholar.org/paper/3c5a8898f5b50b80eb8228e2e1153b4d5a820a34,,,JournalArticle; Review,unknown,brain; cerebral; neuron; synapse; glia; microglia; neuroscience term,"Recent studies have identified the important contribution of glial cells to the plasticity of neuronal circuits. Resting microglia, the primary immune effector cells in the brain, dynamically extend and retract their processes as if actively surveying the microenvironment. However, just what is being sampled by these resting microglial processes has not been demonstrated in vivo, and the nature and function of any interactions between microglia and neuronal circuits is incompletely understood. Using in vivo two-photon imaging of fluorescent-labeled neurons and microglia, we demonstrate that the resting microglial processes make brief (∼5 min) and direct contacts with neuronal synapses at a frequency of about once per hour. These contacts are activity-dependent, being reduced in frequency by reductions in neuronal activity. After transient cerebral ischemia, the duration of these microglia-synapse contacts are markedly prolonged (∼1 h) and are frequently followed by the disappearance of the presynaptic bouton. Our results demonstrate that at least part of the dynamic motility of resting microglial processes in vivo is directed toward synapses and propose that microglia vigilantly monitor and respond to the functional status of synapses. Furthermore, the striking finding that some synapses in the ischemic areas disappear after prolonged microglial contact suggests microglia contribute to the subsequent increased turnover of synaptic connections. Further understanding of the mechanisms involved in the microglial detection of the functional state of synapses, and of their role in remodeling neuronal circuits disrupted by ischemia, may lead to novel therapies for treating brain injury that target microglia."
57,2009,Optical Deconstruction of Parkinsonian Neural Circuitry,"V. Gradinaru, Murtaza Z Mogri, K. Thompson, J. Henderson, K. Deisseroth",Science,2009-04-17,1544,93,149.17,Clinical Neurology and Neurodegeneration,,Positions Optical Deconstruction of Parkinsonian Neural Circuitry within Clinical Neurology and Neurodegeneration.,"high citation signal (1,544); recognized venue; open-access PDF metadata","Clinical cohorts often differ in disease stage, comorbidity, treatment history, and follow-up duration.; Biomarkers may not transfer cleanly across populations, scanners, care settings, or diagnostic criteria.; Metadata-level ranking should be complemented with full-text expert review before strong claims are made.",10.1126/science.1167093,8e2009732a1db192b2a54f187c08cedb80e0ad37,https://doi.org/10.1126/science.1167093,https://www.semanticscholar.org/paper/8e2009732a1db192b2a54f187c08cedb80e0ad37,,,JournalArticle,unknown,neural,
58,2009,Inclusion formation and neuronal cell death through neuron-to-neuron transmission of α-synuclein,"Paula A. Desplats, He-Jin Lee, Eun-Jin Bae, C. Patrick, E. Rockenstein, Leslie A. Crews, et al.",Proceedings of the National Academy of Sciences of the United States of America,2009-08-04,1509,59,154.76,"Cellular, Molecular, and Synaptic Neuroscience",,"Positions Inclusion formation and neuronal cell death through neuron-to-neuron transmission of α-synuclein within Cellular, Molecular, and Synaptic Neuroscience.","high citation signal (1,509); recognized venue; open-access PDF metadata","Cellular mechanisms can be difficult to connect directly to whole-brain dynamics or human behavior.; Single-cell sampling, dissociation, alignment, and batch effects can bias inferred cell populations.; Metadata-level ranking should be complemented with full-text expert review before strong claims are made.",10.1073/pnas.0903691106,702e229b84c7eec4b3136db15bddc412e88a1d98,https://doi.org/10.1073/pnas.0903691106,https://www.semanticscholar.org/paper/702e229b84c7eec4b3136db15bddc412e88a1d98,,,JournalArticle,unknown,neuron; neuroscience term,
59,2009,Socioeconomic status and the developing brain,"Daniel A. Hackman, M. Farah",Trends in Cognitive Sciences,2009-01-08,1501,41,167.86,"Brain Development, Plasticity, and Connectomics",non-human,Childhood socioeconomic status (SES) is associated with cognitive achievement throughout life.,"high citation signal (1,501); recognized venue; open-access PDF metadata","Developmental and aging studies are sensitive to cohort composition, attrition, and longitudinal sampling intervals.; Network measures can depend heavily on parcellation, thresholding, and acquisition choices.; Non-human findings need careful translation to human brain organization and clinical outcomes.",10.1016/j.tics.2008.11.003,30d7a149181a47e2838681b266188c58cdc0f78c,https://doi.org/10.1016/j.tics.2008.11.003,https://www.semanticscholar.org/paper/30d7a149181a47e2838681b266188c58cdc0f78c,,,Review; JournalArticle,unknown,brain; neural; neuroscience; neuroimaging; brain in title; neuroscience term,"Childhood socioeconomic status (SES) is associated with cognitive achievement throughout life. How does SES relate to brain development, and what are the mechanisms by which SES might exert its influence? We review studies in which behavioral, electrophysio-logical and neuroimaging methods have been used to characterize SES disparities in neurocognitive function. These studies indicate that SES is an important predictor of neurocognitive performance, particularly of language and executive function, and that SES differences are found in neural processing even when performance levels are equal. Implications for basic cognitive neuroscience and for understanding and ameliorating the problems related to childhood poverty are discussed."
60,2009,The neuro-symphony of stress,"M. Joëls, T. Baram",Nature Reviews Neuroscience,2009-06-01,1499,62,161.04,"Cellular, Molecular, and Synaptic Neuroscience",ECoG;non-human,The impact of stress on brain function is increasingly recognized.,"high citation signal (1,499); recognized venue; open-access PDF metadata","Cellular mechanisms can be difficult to connect directly to whole-brain dynamics or human behavior.; Single-cell sampling, dissociation, alignment, and batch effects can bias inferred cell populations.; Non-human findings need careful translation to human brain organization and clinical outcomes.",10.1038/nrn2632,e12874636a929936e7f1cc1edc4ab1de3ca5d62a,https://doi.org/10.1038/nrn2632,https://www.semanticscholar.org/paper/e12874636a929936e7f1cc1edc4ab1de3ca5d62a,,,Review,unknown,brain; neuron; ecog; neuroscience term,"The impact of stress on brain function is increasingly recognized. Various substances are released in response to stress and can influence distinct neuronal circuits, but the functional advantages of having such a diversity of stress mediators remain unclear. Individual neurotransmitter, neuropeptide and steroid stress mediators have specific spatial and temporal niches, but these niches also overlap. In addition, the effects of individual mediators on neuronal function and plasticity are integrated, and emerging evidence suggests that there is crosstalk between them. Together, this results in the stress instruments producing an orchestrated 'symphony' that enables fine-tuned responses to diverse challenges."
61,2009,Training induces changes in white matter architecture,"J. Scholz, M. Klein, T. Behrens, H. Johansen-Berg",Nature Neuroscience,2009-10-11,1493,71,149.77,"Brain Development, Plasticity, and Connectomics",human,"Although experience-dependent structural changes have been found in adult gray matter, there is little evidence for such changes in white matter.","high citation signal (1,493); recognized venue; open-access PDF metadata; human evidence signal","Developmental and aging studies are sensitive to cohort composition, attrition, and longitudinal sampling intervals.; Network measures can depend heavily on parcellation, thresholding, and acquisition choices.; Human cohort effects can depend on recruitment, demographics, comorbidity, and measurement context.",10.1038/nn.2412,563cc7e26f0f0e16046fff5c1273016e5187bd54,https://doi.org/10.1038/nn.2412,https://www.semanticscholar.org/paper/563cc7e26f0f0e16046fff5c1273016e5187bd54,,,JournalArticle,unknown,brain,"Although experience-dependent structural changes have been found in adult gray matter, there is little evidence for such changes in white matter. Using diffusion imaging, we detected a localized increase in fractional anisotropy, a measure of microstructure, in white matter underlying the intraparietal sulcus following training of a complex visuo-motor skill. This provides, to the best of our knowledge, the first evidence for training-related changes in white-matter structure in the healthy human adult brain."
62,2009,"Puzzlingly High Correlations in fMRI Studies of Emotion, Personality, and Social Cognition 1","E. Vul, Christine R. Harris, P. Winkielman, H. Pashler",Perspectives on Psychological Science,2009-05-01,1492,61,151.75,Neuroimaging and Brain Mapping,fMRI,"Positions Puzzlingly High Correlations in fMRI Studies of Emotion, Personality, and Social Cognition 1 within Neuroimaging and Brain Mapping.","high citation signal (1,492); recognized venue; open-access PDF metadata","Scanner, protocol, site, and preprocessing variation can limit reproducibility across cohorts.; Associational imaging biomarkers often need stronger longitudinal or intervention evidence before causal claims are made.; Imaging conclusions can depend on acquisition, preprocessing, and model specification.",10.1111/j.1745-6924.2009.01125.x,b1c693783edf572c37ecbe3fc0508b44661a7b7e,https://doi.org/10.1111/j.1745-6924.2009.01125.x,https://www.semanticscholar.org/paper/b1c693783edf572c37ecbe3fc0508b44661a7b7e,https://escholarship.org/content/qt51d4r5tn/qt51d4r5tn.pdf?t=lnrk38,,JournalArticle; Review,unknown,fmri; mri,
63,2009,Cellular Prion Protein Mediates Impairment of Synaptic Plasticity by Amyloid-β Oligomers,"J. Lauren, D. Gimbel, H. Nygaard, John W. Gilbert, S. Strittmatter",Nature,2009-02-26,1458,77,161.74,"Cellular, Molecular, and Synaptic Neuroscience",ECoG;human;non-human,A pathological hallmark of Alzheimer's disease is an accumulation of insoluble plaque containing the amyloid-β peptide of 40-42 amino acid residues.,"high citation signal (1,458); recognized venue; open-access PDF metadata; human evidence signal","Cellular mechanisms can be difficult to connect directly to whole-brain dynamics or human behavior.; Single-cell sampling, dissociation, alignment, and batch effects can bias inferred cell populations.; Non-human findings need careful translation to human brain organization and clinical outcomes.",10.1038/nature07761,e7555c5531d5682ca794b24f0cc9325b36861aa5,https://doi.org/10.1038/nature07761,https://www.semanticscholar.org/paper/e7555c5531d5682ca794b24f0cc9325b36861aa5,,,JournalArticle,unknown,brain; neuron; ecog; neuroscience term,"A pathological hallmark of Alzheimer's disease is an accumulation of insoluble plaque containing the amyloid-β peptide of 40-42 amino acid residues. Prefibrillar, soluble oligomers of amyloid-β have been recognized to be early and key intermediates in Alzheimer's-disease-related synaptic dysfunction. At nanomolar concentrations, soluble amyloid-β oligomers block hippocampal long-term potentiation, cause dendritic spine retraction from pyramidal cells and impair rodent spatial memory. Soluble amyloid-β oligomers have been prepared from chemical syntheses, transfected cell culture supernatants, transgenic mouse brain and human Alzheimer's disease brain. Together, these data imply a high-affinity cell-surface receptor for soluble amyloid-β oligomers on neurons-one that is central to the pathophysiological process in Alzheimer's disease. Here we identify the cellular prion protein (PrPC) as an amyloid-β-oligomer receptor by expression cloning. Amyloid-β oligomers bind with nanomolar affinity to PrPC, but the interaction does not require the infectious PrPSc conformation. Synaptic responsiveness in hippocampal slices from young adult PrP null mice is normal, but the amyloid-β oligomer blockade of long-term potentiation is absent. Anti-PrP antibodies prevent amyloid-β-oligomer binding to PrPC and rescue synaptic plasticity in hippocampal slices from oligomeric amyloid-β. Thus, PrPC is a mediator of amyloid-β-oligomer-induced synaptic dysfunction, and PrPC-specific pharmaceuticals may have therapeutic potential for Alzheimer's disease."
64,2009,Hyperactivity and hyperconnectivity of the default network in schizophrenia and in first-degree relatives of persons with schizophrenia,"S. Whitfield-Gabrieli, H. Thermenos, Snezana M Milanovic, M. Tsuang, S. Faraone, R. McCarley, et al.",Proceedings of the National Academy of Sciences of the United States of America,2009-01-27,1453,93,166.88,Neuroimaging and Brain Mapping,MRI;fMRI;human;connectome,"We examined the status of the neural network mediating the default mode of brain function, which typically exhibits greater activation during rest than during task, in patients in the early phase of schizophrenia and in young first-degree relatives of persons with schizophrenia.","high citation signal (1,453); recognized venue; open-access PDF metadata; human evidence signal","Scanner, protocol, site, and preprocessing variation can limit reproducibility across cohorts.; Associational imaging biomarkers often need stronger longitudinal or intervention evidence before causal claims are made.; Human cohort effects can depend on recruitment, demographics, comorbidity, and measurement context.",10.1073/pnas.0809141106,14ab6bcb0a029ab5daffab06ea960cd4e4de4d7a,https://doi.org/10.1073/pnas.0809141106,https://www.semanticscholar.org/paper/14ab6bcb0a029ab5daffab06ea960cd4e4de4d7a,,,JournalArticle,unknown,brain; cortex; neural; prefrontal; mri; neuroscience term,"We examined the status of the neural network mediating the default mode of brain function, which typically exhibits greater activation during rest than during task, in patients in the early phase of schizophrenia and in young first-degree relatives of persons with schizophrenia. During functional MRI, patients, relatives, and controls alternated between rest and performance of working memory (WM) tasks. As expected, controls exhibited task-related suppression of activation in the default network, including medial prefrontal cortex (MPFC) and posterior cingulate cortex/precuneus. Patients and relatives exhibited significantly reduced task-related suppression in MPFC, and these reductions remained after controlling for performance. Increased task-related MPFC suppression correlated with better WM performance in patients and relatives and with less psychopathology in all 3 groups. For WM task performance, patients and relatives had greater activation in right dorsolateral prefrontal cortex (DLPFC) than controls. During rest and task, patients and relatives exhibited abnormally high functional connectivity within the default network. The magnitudes of default network connectivity during rest and task correlated with psychopathology in the patients. Further, during both rest and task, patients exhibited reduced anticorrelations between MPFC and DLPFC, a region that was hyperactivated by patients and relatives during WM performance. Among patients, the magnitude of MPFC task suppression negatively correlated with default connectivity, suggesting an association between the hyperactivation and hyperconnectivity in schizophrenia. Hyperactivation (reduced task-related suppression) of default regions and hyperconnectivity of the default network may contribute to disturbances of thought in schizophrenia and risk for the illness."
65,2009,Functional atlas of emotional faces processing: a voxel-based meta-analysis of 105 functional magnetic resonance imaging studies.,"P. Fusar-Poli, A. Placentino, F. Carletti, P. Landi, P. Allen, S. Surguladze, et al.",Journal of Psychiatry & Neuroscience,2009-11-01,1445,98,172.98,Neuroimaging and Brain Mapping,MRI;fMRI;human;non-human;connectome,BACKGROUND Most of our social interactions involve perception of emotional information from the faces of other people.,"high citation signal (1,445); recognized venue; human evidence signal","Scanner, protocol, site, and preprocessing variation can limit reproducibility across cohorts.; Associational imaging biomarkers often need stronger longitudinal or intervention evidence before causal claims are made.; Non-human findings need careful translation to human brain organization and clinical outcomes.",10.1139/jpn.0953,85b73447455cfe511e3df3b1befa93fedd9ed46a,https://doi.org/10.1139/jpn.0953,https://www.semanticscholar.org/paper/85b73447455cfe511e3df3b1befa93fedd9ed46a,,,Review; MetaAnalysis; JournalArticle,unknown,brain; cortex; neural; neuroimaging; amygdala; cerebellum; prefrontal; fmri; neuroscience term,"BACKGROUND Most of our social interactions involve perception of emotional information from the faces of other people. Furthermore, such emotional processes are thought to be aberrant in a range of clinical disorders, including psychosis and depression. However, the exact neurofunctional maps underlying emotional facial processing are not well defined. METHODS Two independent researchers conducted separate comprehensive PubMed (1990 to May 2008) searches to find all functional magnetic resonance imaging (fMRI) studies using a variant of the emotional faces paradigm in healthy participants. The search terms were: ""fMRI AND happy faces,"" ""fMRI AND sad faces,"" ""fMRI AND fearful faces,"" ""fMRI AND angry faces,"" ""fMRI AND disgusted faces"" and ""fMRI AND neutral faces."" We extracted spatial coordinates and inserted them in an electronic database. We performed activation likelihood estimation analysis for voxel-based meta-analyses. RESULTS Of the originally identified studies, 105 met our inclusion criteria. The overall database consisted of 1785 brain coordinates that yielded an overall sample of 1600 healthy participants. Quantitative voxel-based meta-analysis of brain activation provided neurofunctional maps for 1) main effect of human faces; 2) main effect of emotional valence; and 3) modulatory effect of age, sex, explicit versus implicit processing and magnetic field strength. Processing of emotional faces was associated with increased activation in a number of visual, limbic, temporoparietal and prefrontal areas; the putamen; and the cerebellum. Happy, fearful and sad faces specifically activated the amygdala, whereas angry or disgusted faces had no effect on this brain region. Furthermore, amygdala sensitivity was greater for fearful than for happy or sad faces. Insular activation was selectively reported during processing of disgusted and angry faces. However, insular sensitivity was greater for disgusted than for angry faces. Conversely, neural response in the visual cortex and cerebellum was observable across all emotional conditions. LIMITATIONS Although the activation likelihood estimation approach is currently one of the most powerful and reliable meta-analytical methods in neuroimaging research, it is insensitive to effect sizes. CONCLUSION Our study has detailed neurofunctional maps to use as normative references in future fMRI studies of emotional facial processing in psychiatric populations. We found selective differences between neural networks underlying the basic emotions in limbic and insular brain regions."
66,2009,The Oscillating Brain: Complex and Reliable,"X. Zuo, A. di Martino, C. Kelly, Z. Shehzad, Dylan G. Gee, D. F. Klein, et al.",NeuroImage,2009-09-24,1433,199,166.63,Neuroimaging and Brain Mapping,fMRI;human;non-human;connectome,The human brain is a complex dynamic system capable of generating a multitude of oscillatory waves in support of brain function.,"high citation signal (1,433); recognized venue; open-access PDF metadata; human evidence signal","Scanner, protocol, site, and preprocessing variation can limit reproducibility across cohorts.; Associational imaging biomarkers often need stronger longitudinal or intervention evidence before causal claims are made.; Non-human findings need careful translation to human brain organization and clinical outcomes.",10.1016/j.neuroimage.2009.09.037,0fe27fbb6a4a59bf4cd94d970d732d51dd9c414f,https://doi.org/10.1016/j.neuroimage.2009.09.037,https://www.semanticscholar.org/paper/0fe27fbb6a4a59bf4cd94d970d732d51dd9c414f,,,JournalArticle,unknown,brain; basal ganglia; glia; fmri; mri; brain in title,"The human brain is a complex dynamic system capable of generating a multitude of oscillatory waves in support of brain function. Using fMRI, we examined the amplitude of spontaneous low-frequency oscillations (LFO) observed in the human resting brain and the test-retest reliability of relevant amplitude measures. We confirmed prior reports that gray matter exhibits higher LFO amplitude than white matter. Within gray matter, the largest amplitudes appeared along mid-brain structures associated with the ""default-mode"" network. Additionally, we found that high amplitude LFO activity in specific brain regions was reliable across time. Further, parcellation-based results revealed significant and highly reliable ranking orders of LFO amplitudes among anatomical parcellation units. Detailed examination of individual low frequency bands showed distinct spatial profiles. Intriguingly, LFO amplitudes in the slow-4 (0.027 - 0.073 Hz) band as defined by Buzsáki et al. were most robust in the basal ganglia, as has been found in spontaneous electrophysiological recordings in the awake rat. These results suggest that amplitude measures of LFO can contribute to further between-group characterization of existing and future ""resting-state"" fMRI datasets."
