rank,year,title,authors,venue,publicationDate,citationCount,influentialCitationCount,importanceScore,category,keywordTags,keyIdea,strengths,limitations,doi,sourceId,url,semanticScholarUrl,openAccessPdf,githubUrl,workType,language,relevanceReason,abstract
71,2011,Freezing of gait: moving forward on a mysterious clinical phenomenon,"J. Nutt, B. Bloem, Nir Giladi, M. Hallett, A. Nieuwboer",Lancet Neurology,2011-08-01,1209,72,154.37,Clinical Neurology and Neurodegeneration,human;non-human;stimulation,Freezing of gait (FoG) is a unique and disabling clinical phenomenon characterised by brief episodes of inability to step or by extremely short steps that typically occur on initiating gait or on turning while walking.,"high citation signal (1,209); recognized venue; open-access PDF metadata; human evidence signal","Clinical cohorts often differ in disease stage, comorbidity, treatment history, and follow-up duration.; Biomarkers may not transfer cleanly across populations, scanners, care settings, or diagnostic criteria.; Non-human findings need careful translation to human brain organization and clinical outcomes.",10.1016/S1474-4422(11)70143-0,574424d00b1f9df79fcca7b746dba080dd8dc402,https://doi.org/10.1016/s1474-4422(11)70143-0,https://www.semanticscholar.org/paper/574424d00b1f9df79fcca7b746dba080dd8dc402,,,Review; JournalArticle,unknown,brain; cortical; basal ganglia; glia,"Freezing of gait (FoG) is a unique and disabling clinical phenomenon characterised by brief episodes of inability to step or by extremely short steps that typically occur on initiating gait or on turning while walking. Patients with FoG, which is a feature of parkinsonian syndromes, show variability in gait metrics between FoG episodes and a substantial reduction in step length with frequent trembling of the legs during FoG episodes. Physiological, functional imaging, and clinical-pathological studies point to disturbances in frontal cortical regions, the basal ganglia, and the midbrain locomotor region as the probable origins of FoG. Medications, deep brain stimulation, and rehabilitation techniques can alleviate symptoms of FoG in some patients, but these treatments lack efficacy in patients with advanced FoG. A better understanding of the phenomenon is needed to aid the development of effective therapeutic strategies."
72,2011,Why is the partial oxygen pressure of human tissues a crucial parameter? Small molecules and hypoxia,"Aude Carreau, Bouchra El Hafny-Rahbi, A. Matejuk, C. Grillon, C. Kieda",Journal of Cellular and Molecular Medicine,2011-05-29,1195,57,146.96,Neuroimaging and Brain Mapping,MRI;human,• Introduction - Imaging of hypoxic areas - Hypoxia markers - Positron emission tomography (PET) - Near-infrared spectroscopy (NIRS) - Magnetic resonance spectroscopy (MRS) - Electron paramagnetic resonance spectroscopy (EPR) • Oxygen partial pressure measurement - Polarographic sensor - Optical sensor - Mass spectrometry • What does tumour hypoxia mean?,"high citation signal (1,195); recognized venue; open-access PDF metadata; human evidence signal","Scanner, protocol, site, and preprocessing variation can limit reproducibility across cohorts.; Associational imaging biomarkers often need stronger longitudinal or intervention evidence before causal claims are made.; Human cohort effects can depend on recruitment, demographics, comorbidity, and measurement context.",10.1111/j.1582-4934.2011.01258.x,885e1ada8c4bf03734ac447aaf53d5d4999b2570,https://doi.org/10.1111/j.1582-4934.2011.01258.x,https://www.semanticscholar.org/paper/885e1ada8c4bf03734ac447aaf53d5d4999b2570,,,Review; JournalArticle,unknown,brain,"• Introduction - Imaging of hypoxic areas - Hypoxia markers - Positron emission tomography (PET) - Near-infrared spectroscopy (NIRS) - Magnetic resonance spectroscopy (MRS) - Electron paramagnetic resonance spectroscopy (EPR) • Oxygen partial pressure measurement - Polarographic sensor - Optical sensor - Mass spectrometry • What does tumour hypoxia mean? • Small molecules and hypoxia - Chemotherapeutic drugs - Radiation sensitizers: the nitroimidazoles - Hypoxia prodrugs: tirapazimine and anthraquinone - pO2 modulator: myo-inositol trispyrophosphate (ITPP) - Hypoxia mimetics: dimethyloxallyl glycine, desferrioxamine and metal ions • What does physioxia mean? - From air to blood - In brain - In lungs - In skin - In intestinal tissue - In liver - In kidney - In muscle - In bone marrow - In umbilical cord blood - To summarize physioxia • Cellular and molecular consequences of physioxia versus normoxia and hypoxia - Hypoxia inducible factors actions - Role of microRNAs in hypoxia-dependent regulations - Cell adhesion molecules: their regulation by oxygen partial pressure - Soluble molecules: example of angiogenin • Conclusion"
73,2011,Human apoE isoforms differentially regulate brain amyloid-β peptide clearance,"Joseph M. Castellano, Jungsu Kim, Floy R. Stewart, Hong Jiang, R. DeMattos, B. Patterson, et al.",Science Translational Medicine,2011-06-29,1189,39,168.07,"Cellular, Molecular, and Synaptic Neuroscience",EEG;human;non-human,Human apoE4 increases the concentration of soluble Aβ in the brain by impairing its clearance.,"high citation signal (1,189); recognized venue; open-access PDF metadata; human evidence signal","Cellular mechanisms can be difficult to connect directly to whole-brain dynamics or human behavior.; Single-cell sampling, dissociation, alignment, and batch effects can bias inferred cell populations.; Non-human findings need careful translation to human brain organization and clinical outcomes.",10.1126/scitranslmed.3002156,e501f9c7c6b1fad550f0272a61eb43df18830c86,https://doi.org/10.1126/scitranslmed.3002156,https://www.semanticscholar.org/paper/e501f9c7c6b1fad550f0272a61eb43df18830c86,,,JournalArticle,unknown,brain; cerebral; neuron; neuroimaging; hippocampus; brain in title; neuroscience term,"Human apoE4 increases the concentration of soluble Aβ in the brain by impairing its clearance. Clearing the Debris in Alzheimer's Disease The strongest risk factor for developing the common sporadic form of Alzheimer's disease (AD) that occurs in old age is the ε4 allele encoding apolipoprotein E4 (apoE4). Two ε4 alleles can lower the age of onset of AD by 10 to 15 years. In contrast, the ε2 allele decreases the risk of developing this neurodegenerative disorder. APOE is important for lipoprotein metabolism, but how it might be involved in AD has remained unclear. It has been suggested that the apoE4 isoform might somehow help to drive accumulation of the peptide amyloid-β (Aβ), which forms amyloid plaques in the brain that contribute to neuronal death and are the characteristic hallmark of AD. In a tour de force study in humans and mice, Holtzman and his team at Washington University in St. Louis now show that apoE4 contributes to Aβ accumulation in the brain not by affecting Aβ synthesis but by affecting its clearance. First, the authors looked at the Aβ concentration in the cerebrospinal fluid (CSF) of cognitively normal individuals under age 70 carrying different APOE genotypes. They found that those with the ε4/ε4 genotype had a much lower CSF Aβ concentration than did those with the protective ε2/ε3 genotype. A CSF Aβ concentration of less than 500 pg/ml is an indication that Aβ peptide is accumulating in the brain and thus is not moving into the CSF. Next, the researchers analyzed imaging data using a dye called Pittsburgh compound B that binds to amyloid plaques in the brain and showed that those individuals with the ε4/ε4 genotype bound more dye than did those with the other APOE genotypes. They then moved to a mouse model of AD in which the mice expressed one of the three human apoE isoforms. They measured Aβ concentrations in the interstitial fluid of these mice using in vivo microdialysis and then looked at stained hippocampal sections from these mice. They found greater Aβ concentrations in both interstitial fluid and the hippocampus in mice expressing the human apoE4 isoform than in animals expressing either the E3 or E2 isoforms. They discovered that this difference in Aβ concentration between the mice carrying different APOE genotypes was present in young as well as aged mice, suggesting that it predates the appearance of amyloid plaques. They then measured clearance of Aβ from the interstitial fluid of young mice and showed that those with the human apoE4 isoform were less able to clear Aβ than those with the apoE2 or apoE3 isoforms. The researchers showed that processing of the amyloid precursor protein and generation of the Aβ peptide did not vary according to genotype, lending credence to the hypothesis that apoE4 affects clearance of Aβ but not its synthesis. This thorough study sheds new light on how apoE4 is implicated in AD and highlights the Aβ clearance pathway as a new target for developing drugs to slow or even halt the accumulation of amyloid plaques in patients with AD. The apolipoprotein E (APOE) ε4 allele is the strongest genetic risk factor for late-onset, sporadic Alzheimer's disease (AD). The APOE ε4 allele markedly increases AD risk and decreases age of onset, likely through its strong effect on the accumulation of amyloid-β (Aβ) peptide. In contrast, the APOE ε2 allele appears to decrease AD risk. Most rare, early-onset forms of familial AD are caused by autosomal dominant mutations that often lead to overproduction of Aβ42 peptide. However, the mechanism by which APOE alleles differentially modulate Aβ accumulation in sporadic, late-onset AD is less clear. In a cohort of cognitively normal individuals, we report that reliable molecular and neuroimaging biomarkers of cerebral Aβ deposition vary in an apoE isoform-dependent manner. We hypothesized that human apoE isoforms differentially affect Aβ clearance or synthesis in vivo, resulting in an apoE isoform-dependent pattern of Aβ accumulation later in life. Performing in vivo microdialysis in a mouse model of Aβ-amyloidosis expressing human apoE isoforms (PDAPP/TRE), we find that the concentration and clearance of soluble Aβ in the brain interstitial fluid depends on the isoform of apoE expressed. This pattern parallels the extent of Aβ deposition observed in aged PDAPP/TRE mice. ApoE isoform-dependent differences in soluble Aβ metabolism are observed not only in aged but also in young PDAPP/TRE mice well before the onset of Aβ deposition in amyloid plaques in the brain. Additionally, amyloidogenic processing of amyloid precursor protein and Aβ synthesis, as assessed by in vivo stable isotopic labeling kinetics, do not vary according to apoE isoform in young PDAPP/TRE mice. Our results suggest that APOE alleles contribute to AD risk by differentially regulating clearance of Aβ from the brain, suggesting that Aβ clearance pathways may be useful therapeutic targets for AD prevention."
74,2011,Mutations in UBQLN2 cause dominant X-linked juvenile and adult onset ALS and ALS/dementia,"H. Deng, Wenjie Chen, Seong-Tshool Hong, K. Boycott, G. Gorrie, N. Siddique, et al.",Nature,2011-08-21,1188,120,154.86,Clinical Neurology and Neurodegeneration,human;non-human,Amyotrophic lateral sclerosis (ALS) is a paralytic and usually fatal disorder caused by motor-neuron degeneration in the brain and spinal cord.,"high citation signal (1,188); recognized venue; open-access PDF metadata; human evidence signal","Clinical cohorts often differ in disease stage, comorbidity, treatment history, and follow-up duration.; Biomarkers may not transfer cleanly across populations, scanners, care settings, or diagnostic criteria.; Non-human findings need careful translation to human brain organization and clinical outcomes.",10.1038/nature10353,be299bedc01c83a97f014b130d8ab66f37ea9c88,https://doi.org/10.1038/nature10353,https://www.semanticscholar.org/paper/be299bedc01c83a97f014b130d8ab66f37ea9c88,https://www.ncbi.nlm.nih.gov/pmc/articles/PMC3169705,,JournalArticle,unknown,brain; neuron; neuroscience term,"Amyotrophic lateral sclerosis (ALS) is a paralytic and usually fatal disorder caused by motor-neuron degeneration in the brain and spinal cord. Most cases of ALS are sporadic but about 5-10% are familial. Mutations in superoxide dismutase 1 (SOD1), TAR DNA-binding protein (TARDBP, also known as TDP43) and fused in sarcoma (FUS, also known as translocated in liposarcoma (TLS)) account for approximately 30% of classic familial ALS. Mutations in several other genes have also been reported as rare causes of ALS or ALS-like syndromes. The causes of the remaining cases of familial ALS and of the vast majority of sporadic ALS are unknown. Despite extensive studies of previously identified ALS-causing genes, the pathogenic mechanism underlying motor-neuron degeneration in ALS remains largely obscure. Dementia, usually of the frontotemporal lobar type, may occur in some ALS cases. It is unclear whether ALS and dementia share common aetiology and pathogenesis in ALS/dementia. Here we show that mutations in UBQLN2, which encodes the ubiquitin-like protein ubiquilin 2, cause dominantly inherited, chromosome-X-linked ALS and ALS/dementia. We describe novel ubiquilin 2 pathology in the spinal cords of ALS cases and in the brains of ALS/dementia cases with or without UBQLN2 mutations. Ubiquilin 2 is a member of the ubiquilin family, which regulates the degradation of ubiquitinated proteins. Functional analysis showed that mutations in UBQLN2 lead to an impairment of protein degradation. Therefore, our findings link abnormalities in ubiquilin 2 to defects in the protein degradation pathway, abnormal protein aggregation and neurodegeneration, indicating a common pathogenic mechanism that can be exploited for therapeutic intervention."
75,2011,Adjuvant whole-brain radiotherapy versus observation after radiosurgery or surgical resection of one to three cerebral metastases: results of the EORTC 22952-26001 study.,"M. Kocher, R. Soffietti, U. Abacioglu, S. Villà, F. Fauchon, B. Baumert, et al.",Journal of Clinical Oncology,2011-01-10,1163,36,141.27,Clinical Neurology and Neurodegeneration,human,Positions Adjuvant whole-brain radiotherapy versus observation after radiosurgery or surgical resection of one to three cerebral metastases: results of the EORTC 22952-26001 study. within Clinical Neurology and Neurodegeneration.,"high citation signal (1,163); open-access PDF metadata; human evidence signal","Clinical cohorts often differ in disease stage, comorbidity, treatment history, and follow-up duration.; Biomarkers may not transfer cleanly across populations, scanners, care settings, or diagnostic criteria.; Human cohort effects can depend on recruitment, demographics, comorbidity, and measurement context.",10.1200/JCO.2010.30.1655,045e8d27b720a0149a8d1eb6973c9a0b5b5bb66c,https://doi.org/10.1200/jco.2010.30.1655,https://www.semanticscholar.org/paper/045e8d27b720a0149a8d1eb6973c9a0b5b5bb66c,,,Study; JournalArticle; ClinicalTrial,unknown,brain; cerebral; brain in title,
76,2011,Adult hippocampal neurogenesis buffers stress responses and depressive behavior,"J. Snyder, A. Soumier, Michelle Brewer, J. Pickel, H. Cameron",Nature,2011-08-03,1162,41,156.46,Cognitive and Systems Neuroscience,human;non-human,Glucocorticoids are released in response to stressful experiences and serve many beneficial homeostatic functions.,"high citation signal (1,162); recognized venue; open-access PDF metadata; human evidence signal","Task designs can simplify cognition enough that ecological validity becomes uncertain.; Cross-species alignment between circuits, behavior, and subjective experience remains imperfect.; Non-human findings need careful translation to human brain organization and clinical outcomes.",10.1038/nature10287,38688dee2bbd9a7417cbfa74dafaba8bccdfb61d,https://doi.org/10.1038/nature10287,https://www.semanticscholar.org/paper/38688dee2bbd9a7417cbfa74dafaba8bccdfb61d,https://www.ncbi.nlm.nih.gov/pmc/articles/PMC3162077,,JournalArticle,unknown,brain; neuron; hippocampus; neuroscience term,"Glucocorticoids are released in response to stressful experiences and serve many beneficial homeostatic functions. However, dysregulation of glucocorticoids is associated with cognitive impairments and depressive illness. In the hippocampus, a brain region densely populated with receptors for stress hormones, stress and glucocorticoids strongly inhibit adult neurogenesis. Decreased neurogenesis has been implicated in the pathogenesis of anxiety and depression, but direct evidence for this role is lacking. Here we show that adult-born hippocampal neurons are required for normal expression of the endocrine and behavioural components of the stress response. Using either transgenic or radiation methods to inhibit adult neurogenesis specifically, we find that glucocorticoid levels are slower to recover after moderate stress and are less suppressed by dexamethasone in neurogenesis-deficient mice than intact mice, consistent with a role for the hippocampus in regulation of the hypothalamic-pituitary-adrenal (HPA) axis. Relative to controls, neurogenesis-deficient mice also showed increased food avoidance in a novel environment after acute stress, increased behavioural despair in the forced swim test, and decreased sucrose preference, a measure of anhedonia. These findings identify a small subset of neurons within the dentate gyrus that are critical for hippocampal negative control of the HPA axis and support a direct role for adult neurogenesis in depressive illness."
77,2011,Brain graphs: graphical models of the human brain connectome.,"E. Bullmore, D. Bassett",Annual Review of Clinical Psychology,2011-03-28,1159,60,139.41,Neuroimaging and Brain Mapping,human;connectome,Positions Brain graphs: graphical models of the human brain connectome. within Neuroimaging and Brain Mapping.,"high citation signal (1,159); human evidence signal","Scanner, protocol, site, and preprocessing variation can limit reproducibility across cohorts.; Associational imaging biomarkers often need stronger longitudinal or intervention evidence before causal claims are made.; Human cohort effects can depend on recruitment, demographics, comorbidity, and measurement context.",10.1146/annurev-clinpsy-040510-143934,c6b745c7ecc3fc89d0df71727e1a0f456be7187a,https://doi.org/10.1146/annurev-clinpsy-040510-143934,https://www.semanticscholar.org/paper/c6b745c7ecc3fc89d0df71727e1a0f456be7187a,,,Review; JournalArticle,unknown,brain; connectome; brain in title,
78,2011,Leptin Action on GABAergic Neurons Prevents Obesity and Reduces Inhibitory Tone to POMC Neurons,"Linh Vong, C. Ye, Zongfang Yang, Brian J. Choi, S. Chua, B. Lowell",Neuron,2011-07-14,1158,82,152.0,"Cellular, Molecular, and Synaptic Neuroscience",,SUMMARY Leptin acts in the brain to prevent obesity.,"high citation signal (1,158); recognized venue; open-access PDF metadata","Cellular mechanisms can be difficult to connect directly to whole-brain dynamics or human behavior.; Single-cell sampling, dissociation, alignment, and batch effects can bias inferred cell populations.; Metadata-level ranking should be complemented with full-text expert review before strong claims are made.",10.1016/j.neuron.2011.05.028,55dd92243724aa77ec40d69e4fab6f9559692cd9,https://doi.org/10.1016/j.neuron.2011.05.028,https://www.semanticscholar.org/paper/55dd92243724aa77ec40d69e4fab6f9559692cd9,,,JournalArticle,unknown,brain; neuron; neuroscience term,"SUMMARY Leptin acts in the brain to prevent obesity. The underlying neurocircuitry responsible for this is poorly understood, in part due to incomplete knowledge regarding first order, leptin-responsive neurons. To address this, we and others have been removing leptin receptors from candidate first order neurons. While functionally relevant neurons have been identified, the observed effects have been small suggesting that most first order neurons remain unidentified. Here we take an alternative approach and test whether first order neurons are inhibitory (GABAergic, VGAT+) or excitatory (glutamatergic, VGLUT2+). Remarkably, the vast majority of leptin's anti-obesity effects are mediated by GABAergic neurons; glutamatergic neurons play only a minor role. Leptin, working directly on presynaptic GABAergic neurons, many of which appear not to express AgRP, reduces inhibitory tone to postsynaptic POMC neurons. As POMC neurons prevent obesity, their disinhibition by leptin action on presynaptic GABAergic neurons likely mediates, at least in part, leptin's anti-obesity effects."
79,2011,Mass univariate analysis of event-related brain potentials/fields I: A critical tutorial review,"David M. Groppe, T. Urbach, M. Kutas",Psychophysiology,2011-09-06,1158,100,148.4,"EEG, MEG, and Electrophysiology",EEG;non-human,Event-related potentials (ERPs) and magnetic fields (ERFs) are typically analyzed via ANOVAs on mean activity in a priori windows.,"high citation signal (1,158); open-access PDF metadata; synthesis or review value","Low signal-to-noise ratio, artifacts, and source-localization uncertainty complicate interpretation.; Many studies rely on controlled tasks and may not generalize to everyday behavior or clinical monitoring.; Non-human findings need careful translation to human brain organization and clinical outcomes.",10.1111/j.1469-8986.2011.01273.x,f447acefe38f48e7c61f0c4d0ebef66dd43cbc14,https://doi.org/10.1111/j.1469-8986.2011.01273.x,https://www.semanticscholar.org/paper/f447acefe38f48e7c61f0c4d0ebef66dd43cbc14,,,Review; JournalArticle,unknown,brain; brain in title,"Event-related potentials (ERPs) and magnetic fields (ERFs) are typically analyzed via ANOVAs on mean activity in a priori windows. Advances in computing power and statistics have produced an alternative, mass univariate analyses consisting of thousands of statistical tests and powerful corrections for multiple comparisons. Such analyses are most useful when one has little a priori knowledge of effect locations or latencies, and for delineating effect boundaries. Mass univariate analyses complement and, at times, obviate traditional analyses. Here we review this approach as applied to ERP/ERF data and four methods for multiple comparison correction: strong control of the family-wise error rate (FWER) via permutation tests, weak control of FWER via cluster-based permutation tests, false discovery rate control, and control of the generalized FWER. We end with recommendations for their use and introduce free MATLAB software for their implementation."
80,2011,Longitudinal Development of Human Brain Wiring Continues from Childhood into Adulthood,"C. Lebel, C. Beaulieu",Journal of Neuroscience,2011-07-27,1147,92,151.02,"Brain Development, Plasticity, and Connectomics",human,"Positions Longitudinal Development of Human Brain Wiring Continues from Childhood into Adulthood within Brain Development, Plasticity, and Connectomics.","high citation signal (1,147); recognized venue; open-access PDF metadata; human evidence signal","Developmental and aging studies are sensitive to cohort composition, attrition, and longitudinal sampling intervals.; Network measures can depend heavily on parcellation, thresholding, and acquisition choices.; Human cohort effects can depend on recruitment, demographics, comorbidity, and measurement context.",10.1523/JNEUROSCI.5302-10.2011,9ba6804338e3a7eeb345a129f74cd89adaa4867b,https://doi.org/10.1523/jneurosci.5302-10.2011,https://www.semanticscholar.org/paper/9ba6804338e3a7eeb345a129f74cd89adaa4867b,https://europepmc.org/articles/pmc6623097?pdf=render,,JournalArticle,unknown,brain; brain in title,
