rank,year,title,authors,venue,publicationDate,citationCount,influentialCitationCount,importanceScore,category,keywordTags,keyIdea,strengths,limitations,doi,sourceId,url,semanticScholarUrl,openAccessPdf,githubUrl,workType,language,relevanceReason,abstract
55,2011,Vascular Contributions to Cognitive Impairment and Dementia,"P. Gorelick, A. Scuteri, S. Black, C. DeCarli, S. Greenberg, C. Iadecola, et al.",Stroke,2011-07-21,1362,54,145.71,Clinical Neurology and Neurodegeneration,MRI;EEG;human;non-human,Background and Purpose- This scientific statement provides an overview of the evidence on vascular contributions to cognitive impairment and dementia.,"high citation signal (1,362); open-access PDF metadata; human evidence signal","Clinical cohorts often differ in disease stage, comorbidity, treatment history, and follow-up duration.; Biomarkers may not transfer cleanly across populations, scanners, care settings, or diagnostic criteria.; Non-human findings need careful translation to human brain organization and clinical outcomes.",10.1161/STR.0b013e3182299496,349ef695d4a2dbdc85f5b635237c9068ec61b2ba,https://doi.org/10.1161/str.0b013e3182299496,https://www.semanticscholar.org/paper/349ef695d4a2dbdc85f5b635237c9068ec61b2ba,,,Review; JournalArticle,unknown,brain; cerebral; cortical; neuroimaging,"Background and Purpose- This scientific statement provides an overview of the evidence on vascular contributions to cognitive impairment and dementia. Vascular contributions to cognitive impairment and dementia of later life are common. Definitions of vascular cognitive impairment (VCI), neuropathology, basic science and pathophysiological aspects, role of neuroimaging and vascular and other associated risk factors, and potential opportunities for prevention and treatment are reviewed. This statement serves as an overall guide for practitioners to gain a better understanding of VCI and dementia, prevention, and treatment. Methods- Writing group members were nominated by the writing group co-chairs on the basis of their previous work in relevant topic areas and were approved by the American Heart Association Stroke Council Scientific Statement Oversight Committee, the Council on Epidemiology and Prevention, and the Manuscript Oversight Committee. The writing group used systematic literature reviews (primarily covering publications from 1990 to May 1, 2010), previously published guidelines, personal files, and expert opinion to summarize existing evidence, indicate gaps in current knowledge, and, when appropriate, formulate recommendations using standard American Heart Association criteria. All members of the writing group had the opportunity to comment on the recommendations and approved the final version of this document. After peer review by the American Heart Association, as well as review by the Stroke Council leadership, Council on Epidemiology and Prevention Council, and Scientific Statements Oversight Committee, the statement was approved by the American Heart Association Science Advisory and Coordinating Committee. Results- The construct of VCI has been introduced to capture the entire spectrum of cognitive disorders associated with all forms of cerebral vascular brain injury-not solely stroke-ranging from mild cognitive impairment through fully developed dementia. Dysfunction of the neurovascular unit and mechanisms regulating cerebral blood flow are likely to be important components of the pathophysiological processes underlying VCI. Cerebral amyloid angiopathy is emerging as an important marker of risk for Alzheimer disease, microinfarction, microhemorrhage and macrohemorrhage of the brain, and VCI. The neuropathology of cognitive impairment in later life is often a mixture of Alzheimer disease and microvascular brain damage, which may overlap and synergize to heighten the risk of cognitive impairment. In this regard, magnetic resonance imaging and other neuroimaging techniques play an important role in the definition and detection of VCI and provide evidence that subcortical forms of VCI with white matter hyperintensities and small deep infarcts are common. In many cases, risk markers for VCI are the same as traditional risk factors for stroke. These risks may include but are not limited to atrial fibrillation, hypertension, diabetes mellitus, and hypercholesterolemia. Furthermore, these same vascular risk factors may be risk markers for Alzheimer disease. Carotid intimal-medial thickness and arterial stiffness are emerging as markers of arterial aging and may serve as risk markers for VCI. Currently, no specific treatments for VCI have been approved by the US Food and Drug Administration. However, detection and control of the traditional risk factors for stroke and cardiovascular disease may be effective in the prevention of VCI, even in older people. Conclusions- Vascular contributions to cognitive impairment and dementia are important. Understanding of VCI has evolved substantially in recent years, based on preclinical, neuropathologic, neuroimaging, physiological, and epidemiological studies. Transdisciplinary, translational, and transactional approaches are recommended to further our understanding of this entity and to better characterize its neuropsychological profile. There is a need for prospective, quantitative, clinical-pathological-neuroimaging studies to improve knowledge of the pathological basis of neuroimaging change and the complex interplay between vascular and Alzheimer disease pathologies in the evolution of clinical VCI and Alzheimer disease. Long-term vascular risk marker interventional studies beginning as early as midlife may be required to prevent or postpone the onset of VCI and Alzheimer disease. Studies of intensive reduction of vascular risk factors in high-risk groups are another important avenue of research."
56,2011,Decompressive craniectomy in diffuse traumatic brain injury.,"D. Cooper, J. Rosenfeld, L. Murray, Y. Arabi, A. Davies, P. D'Urso, et al.",New England Journal of Medicine,2011-04-20,1351,59,140.77,"Cerebrovascular, Metabolism, and Brain Injury",,"Positions Decompressive craniectomy in diffuse traumatic brain injury. within Cerebrovascular, Metabolism, and Brain Injury.","high citation signal (1,351); open-access PDF metadata","Acute injury studies can be sensitive to timing, severity, comorbidity, and treatment heterogeneity.; Animal models may not capture human vascular risk, injury complexity, or rehabilitation context.; Metadata-level ranking should be complemented with full-text expert review before strong claims are made.",10.1056/NEJMoa1102077,22160fdb1a7bb4dc17d1de706921efa30e59e17d,https://doi.org/10.1056/nejmoa1102077,https://www.semanticscholar.org/paper/22160fdb1a7bb4dc17d1de706921efa30e59e17d,,,Study; JournalArticle,unknown,brain; brain in title,
57,2011,The stressed synapse: the impact of stress and glucocorticoids on glutamate transmission,"M. Popoli, Zhen Yan, B. McEwen, G. Sanacora",Nature Reviews Neuroscience,2011-11-30,1334,50,160.54,Cognitive and Systems Neuroscience,,"Mounting evidence suggests that acute and chronic stress, especially the stress-induced release of glucocorticoids, induces changes in glutamate neurotransmission in the prefrontal cortex and the hippocampus, thereby influencing some aspects of cognitive processing.","high citation signal (1,334); recognized venue; open-access PDF metadata","Task designs can simplify cognition enough that ecological validity becomes uncertain.; Cross-species alignment between circuits, behavior, and subjective experience remains imperfect.; Metadata-level ranking should be complemented with full-text expert review before strong claims are made.",10.1038/nrn3138,2ef2b6f262a83e7a04f915e4382d49f7251949c4,https://doi.org/10.1038/nrn3138,https://www.semanticscholar.org/paper/2ef2b6f262a83e7a04f915e4382d49f7251949c4,,,Review; JournalArticle,unknown,brain; cortex; hippocampus; prefrontal; synapse; neuroscience term,"Mounting evidence suggests that acute and chronic stress, especially the stress-induced release of glucocorticoids, induces changes in glutamate neurotransmission in the prefrontal cortex and the hippocampus, thereby influencing some aspects of cognitive processing. In addition, dysfunction of glutamatergic neurotransmission is increasingly considered to be a core feature of stress-related mental illnesses. Recent studies have shed light on the mechanisms by which stress and glucocorticoids affect glutamate transmission, including effects on glutamate release, glutamate receptors and glutamate clearance and metabolism. This new understanding provides insights into normal brain functioning, as well as the pathophysiology and potential new treatments of stress-related neuropsychiatric disorders."
58,2011,A Baseline for the Multivariate Comparison of Resting-State Networks,"E. Allen, Erik B. Erhardt, E. Damaraju, W. Gruner, J. Segall, Rogers F. Silva, et al.",Frontiers in Systems Neuroscience,2011-02-04,1323,129,157.59,"Brain Development, Plasticity, and Connectomics",MRI;fMRI;MEG;human;non-human;connectome,"As the size of functional and structural MRI datasets expands, it becomes increasingly important to establish a baseline from which diagnostic relevance may be determined, a processing strategy that efficiently prepares data for analysis, and a statistical approach that identifies important effects in a manner that is both robust and reproducible.","high citation signal (1,323); recognized venue; open-access PDF metadata; human evidence signal","Developmental and aging studies are sensitive to cohort composition, attrition, and longitudinal sampling intervals.; Network measures can depend heavily on parcellation, thresholding, and acquisition choices.; Non-human findings need careful translation to human brain organization and clinical outcomes.",10.3389/fnsys.2011.00002,7ef16f997257c30bd5a36b1dec6a3329afd35c4f,https://doi.org/10.3389/fnsys.2011.00002,https://www.semanticscholar.org/paper/7ef16f997257c30bd5a36b1dec6a3329afd35c4f,https://www.frontiersin.org/articles/10.3389/fnsys.2011.00002/pdf,,JournalArticle,unknown,brain; meg; mri,"As the size of functional and structural MRI datasets expands, it becomes increasingly important to establish a baseline from which diagnostic relevance may be determined, a processing strategy that efficiently prepares data for analysis, and a statistical approach that identifies important effects in a manner that is both robust and reproducible. In this paper, we introduce a multivariate analytic approach that optimizes sensitivity and reduces unnecessary testing. We demonstrate the utility of this mega-analytic approach by identifying the effects of age and gender on the resting-state networks (RSNs) of 603 healthy adolescents and adults (mean age: 23.4 years, range: 12-71 years). Data were collected on the same scanner, preprocessed using an automated analysis pipeline based in SPM, and studied using group independent component analysis. RSNs were identified and evaluated in terms of three primary outcome measures: time course spectral power, spatial map intensity, and functional network connectivity. Results revealed robust effects of age on all three outcome measures, largely indicating decreases in network coherence and connectivity with increasing age. Gender effects were of smaller magnitude but suggested stronger intra-network connectivity in females and more inter-network connectivity in males, particularly with regard to sensorimotor networks. These findings, along with the analysis approach and statistical framework described here, provide a useful baseline for future investigations of brain networks in health and disease."
59,2011,Author ' s personal copy Partial Least Squares ( PLS ) methods for neuroimaging : A tutorial and review,"A. Krishnan, L. Williams, A. Mcintosh, H. Abdi",Unknown venue,2011,1320,141,139.35,Neuroimaging and Brain Mapping,,Positions Author ' s personal copy Partial Least Squares ( PLS ) methods for neuroimaging : A tutorial and review within Neuroimaging and Brain Mapping.,"high citation signal (1,320); synthesis or review value","Scanner, protocol, site, and preprocessing variation can limit reproducibility across cohorts.; Associational imaging biomarkers often need stronger longitudinal or intervention evidence before causal claims are made.; Metadata-level ranking should be complemented with full-text expert review before strong claims are made.",,7d3651188dee0fb2323f302332a4eb6259b3a225,https://www.semanticscholar.org/paper/7d3651188dee0fb2323f302332a4eb6259b3a225,https://www.semanticscholar.org/paper/7d3651188dee0fb2323f302332a4eb6259b3a225,,,Review,unknown,neuroimaging,
60,2011,The Effect of Training on Motoneuron Survival in Amyotrophic Lateral Sclerosis: Which Motoneuron Type is Saved?,"Sherif M. Elbasiouny, Jenna E. Schuster",Front. Physio.,2011-04-25,1310,8,147.81,"Cellular, Molecular, and Synaptic Neuroscience",EEG;human;non-human,Amyotrophic lateral sclerosis (ALS) is characterized by selective and progressive degeneration of motoneurons (MNs).,"high citation signal (1,310); open-access PDF metadata; human evidence signal","Cellular mechanisms can be difficult to connect directly to whole-brain dynamics or human behavior.; Single-cell sampling, dissociation, alignment, and batch effects can bias inferred cell populations.; Non-human findings need careful translation to human brain organization and clinical outcomes.",10.3389/fphys.2011.00018,47a36b01cd92348f4f626ba536cb85b144f47c13,https://doi.org/10.3389/fphys.2011.00018,https://www.semanticscholar.org/paper/47a36b01cd92348f4f626ba536cb85b144f47c13,https://www.frontiersin.org/articles/10.3389/fphys.2011.00018/pdf,,JournalArticle,unknown,brain; neuron; synapse; neuroscience term,"Amyotrophic lateral sclerosis (ALS) is characterized by selective and progressive degeneration of motoneurons (MNs). Although the etiology of the disease is unknown, glutamate toxicity and reactive oxygen species toxicity have been strongly implicated in ALS pathophysiology, Training exercise has been proposed to provide a beneficial therapy during the early or late stages of ALS (Pinto et al., 1999; Drory et al., 2001); however, some studies showed deleterious effects of exercise on survival in ALS (Mahoney et al., 2004). The beneficial effects are based on the cellular adaptations induced by training exercise in the brain, spinal cord, and skeletal muscles that could counteract the oxidative stress complication in ALS. For instance, training exercise increases the capacity of antioxidant enzymes and reduces lipid peroxides in brain regions of rats (Somani and Husain, 1997; Husain and Somani, 1998). In skeletal muscle, training reduces oxidative stress following exercise (Miyazaki et al., 2001), increases the mitochondrial capacity (Holloszy et al., 1970), and increases the expression of neurotrophic factors (Gomez-Pinilla et al., 2001). The latter could be particularly beneficial in ALS because neurotrophic factors could prevent MN degeneration, preserve muscle innervation, and inhibit muscle atrophy (Acsadi et al., 2002; Manabe et al., 2002; Sun et al., 2002). Therefore, it is conceivable that training exercise could be beneficial by resisting oxidative stress and offsetting energy deficits caused by mitochondrial dysfunction in ALS. In a recent study, training exercise has been also shown to have neuroprotective effects in the spinal cord by saving MNs from degeneration, in addition to maintaining muscle fiber composition (Deforges et al., 2009). The Deforges et al. (2009) study is important for understanding the effect of training exercise in ALS because it compared two training paradigms and showed differential neuroprotective effects in the spinal cord. Here we discuss the methodology and interpretation from the Deforges et al. (2009) study on which MN type is saved by training exercise, and try to reconcile their conclusions with the literature and more recent work. Deforges et al. (2009) examined the effect of two training exercise paradigms (i.e., running and swimming) on MN survival and muscle fiber composition in the G93A (high expressor line) mouse model of ALS. In comparison to other ALS mouse models, this model has high level of expression of the mutant human SOD1 gene, rapid disease onset, and short life span. Training exercise was performed through 30 min daily running or swimming sessions that started at postnatal day 70 (P70) and lasted until P115 or death. Mice survival, MN count, and muscle fiber composition were assessed at P115 in the fast twitch muscles tibialis and plantaris and the slow twitch soleus muscle of the G93A mouse groups (i.e., running and swimming ALS groups), and were compared to normal, non-transgenic (control group), and untrained G93A transgenic mice (sedentary ALS group). MN count was based on soma cross-sectional area in which MNs were classified into three types: small (soma size 700 μm2) soma MN types. Muscle fiber composition was examined using immunofluorescence in which muscle fibers were incubated with antibodies raised against myosin heavy chains (MyHC) for slow (type I) and fast (types II, IIa, and IIb) fibers. The percentage of fast fiber type IIx was determined as the difference between the number of type II fibers and the sum of type IIa and IIb fibers [IIx = II − (IIb + IIa)]. The results showed that in the sedentary ALS group the disease caused MN loss in the ventral horn of 49% relative to control with a reduction in the proportion of medium and large MN types and increase in the proportion of small MN type. In fast twitch muscles, the disease caused a significant transition in muscle fiber types from fast-to-slow (type II to type I) and within the type II fiber type (from type IIb/IIx to type IIa). The slow twitch soleus muscle, on the other hand, experienced an increase in the proportion of type IIx muscle fibers. The G93A transgenic mice in the running ALS group did not have significant difference in symptom onset or survival time and had comparable loss of MNs (45%) to the sedentary group. In contrast, the G93A transgenic mice in the swimming ALS group survived longer and had delayed symptom onset relative to the sedentary ALS group. They also had higher MN total number and higher proportion of medium-size MNs relative to the sedentary ALS group, and maintained muscle fiber composition in all muscles similar to the control group. The authors concluded that swimming preferentially activated large MNs, innervating fast muscle fibers of type II), and protected them. On their methodology, Deforges et al. (2009) measured the number of surviving MNs by counting MN cell bodies in the ventral horn of spinal cord. Although this provides anatomical evidence, this technique does not provide information on the functional state of MNs (i.e., whether surviving MNs produce muscle contractions). This is exceptionally important in ALS because MNs retract from the neuromuscular junction before the MN cell body dies (Fischer et al., 2004). Second, Deforges et al. (2009) classified MNs based on their morphological properties (e.g., soma size). This method could be misleading in ALS because WT and mutant MNs exhibit differences in morphology and cell size (Amendola and Durand, 2008) and, for all mice, the separation between MN types based on soma size is problematic because there is a continuum of sizes (McHanwell and Biscoe, 1981). To avoid these problems, functional motor unit electrophysiology, in which the number of surviving MNs is estimated from isometric whole muscle and single motor unit twitch forces (Gordon et al., 2010), could be used together with MN cell body count to measure the number of functional surviving MNs. Although conducting functional motor unit electrophysiology would add complexity to the experiment, it would also allow for distinguishing between motor unit types (fast vs. slow) accurately based on their contractile properties. Regarding their interpretation, the authors in Deforges et al. (2009) concluded from their soma size measurements that swimming rescued large MNs and saved them from degeneration. However, in their MN classification the authors did not consider gamma-MNs, which have the smallest soma size in the ventral horn of the spinal cord. With that in mind, the results of the Deforges et al. (2009) could be reinterpreted in light of published literature on the soma size of various MN types in adult WT mice. Accordingly, MNs that were saved by swimming exercise (whose soma size is between 300 and 700 μm2) actually correspond to small alpha-MNs (whose soma size ranges between 450 and 580 μm2; McHanwell and Biscoe, 1981; Ishihara et al., 2001), which innervate slow muscle fibers. Also, MNs that were reduced in proportion by swimming exercise (whose soma size is 700 μm2), which innervate fast muscle fibers, did not change with swimming, indicating that ""true"" large MNs were not protected. In sum, swimming exercise actually increased the proportion of small alpha-MNs, which innervate slow muscle fibers, even if large MNs were preferentially activated as claimed by the authors. This effect could be due to MN conversion from the large to small type by the effect of the training exercise. This reinterpretation is also consistent with a previous study in which swimming training in normal (i.e., non-transgenic) mice was shown to induce a fast-to-slow fiber conversion (Clement et al., 2008). In light of this reinterpretation, the Deforges et al. (2009) comes in agreement with Gordon et al. (2010) in which increased neuromuscular activity in G93A transgenic mice saved fast motor units by converting them to slow motor units, which are innervated by the small alpha-MNs. This conversion was supported by both electrophysiological recordings and histochemical staining techniques. In Deforges et al. (2009), a fundamental concept the authors claimed is that swimming exercise preferentially recruits the larger, faster motor units in contrast to the running exercise that recruits the smaller, slower motor units. Certainly, recruitment is orderly from small to large motor units although the relative recruitment of large motor units may differ with the exercise. In other words, swimming exercise must have involved activation of both small and large MNs, whereas running exercise involved mainly activation of small MNs, with maybe some activation of large MNs. With that in mind, the beneficial effect of swimming, but not running, exercise on MN survival in ALS could be explained in the context of their electrical properties. In the neonatal phase, large mutant MNs are vulnerable and selectively exhibit 30% reduction in their input resistance relative to WT (Bories et al., 2007), which makes them harder to recruit. Therefore, exercise of sufficient intensity to activate large MNs, such as swimming exercise as in the Deforges et al. (2009) study or functional overload of spared motor units as in the Gordon et al. (2010) study, could then be essential to both recruit and convert them to slow MNs. Also, specific types of synaptic inputs to MNs are lost in ALS [e.g., cholinergic synapses on MNs are lost in ALS as shown by Nagao et al. (1998)] and it is possible that training exercise rescues vulnerable MNs in part by strengthening remaining inputs to MNs. These are open questions that warrant further investigations."
