rank,year,title,authors,venue,publicationDate,citationCount,influentialCitationCount,importanceScore,category,keywordTags,keyIdea,strengths,limitations,doi,sourceId,url,openAccessPdf,workType,language,relevanceReason,abstract
1,1924,BRAIN ABSCESS,"M. Brouwer, A. Tunkel, G. Mckhann, D. van de Beek",New England Journal of Medicine,1924-02-01,123,3,95.97,General Brain Science and Reviews,non-human,In his classificationof brain abscessesDr.,high citation signal (123),"Broad reviews can dominate citation-ranked lists while obscuring narrower empirical advances.; Taxonomy boundaries are imperfect because many brain papers combine methods, scales, and diseases.; Non-human findings need careful translation to human brain organization and clinical outcomes.",10.5694/j.1326-5377.1924.tb65442.x,fefa8577bf3c1c7b317f7fae6cf0184d27be2805,https://doi.org/10.5694/j.1326-5377.1924.tb65442.x,,Review; JournalArticle,unknown,brain; brain in title,"In his classificationof brain abscessesDr. Eagletonhas adopted a nomenclature which is unlikely to meet with general acceptance . According to the mode of entry of infection he uses the terms adjacent or secondary and intercurrent or tertiary. The terms used do not seem to be well chosenand do not correspondwith their more generally accepted meanings in pathological terminology. The chapterson the general diagnosisof brain abscess are well planned. The author attaches much importance to the initial vague rigor followed by a subnormal temperature and by repeatedfailure to recoverbacteria from the blood. The localization of brain abscessesis also fUlly ais· cussed. He is of opinion that these occur in situations more or less d'efinitely corresponding to the extra-cranial focus . As valuable localizing signs much importance is attached to ""naming aphasia"" and transient or incomplete hemianopsia, especia lly for colours in temporo-sphenoidallobe abscesses . The latter is said to be due tothe involvement of the fibres of Meyer's tract in their course from the cuneusto the pulvinar region. The importance of the presence of a capsule in brain abscessill indicated and the mechanical difficulties of draining acuteabscesses without a capsule in an adequate manner are fully dealt with. The author illustrates his encephaloscope for viewing the interior of an abscess. It is a hollow tube of similar pattern to a Kelly's speculum illuminated by a head lamp and fitted over a hollow metal searcher to be inserted into the abscess.It is not clearly disclosed in the text that by the use of the encephaloscopean acute abscess can be more effectively drained. As a record of the author's personalexperienceswith full notesot his operation cases and autopsy findings the, volume will repay careful study. The mortality of brain abs cess is still approximately 75%, but the author is of opinion that with earlier diagnosis and earlier operation his operative resultsin recentyearshave greatly improved."
2,1924,STUDIES OF CEREBRAL FUNCTION IN LEARNING: V. THE RETENTION OF MOTOR HABITS AFTER DESTRUCTION OF THE SO-CALLED MOTOR AREAS IN PRIMATES,K. Lashley,Unknown venue,1924-09-01,118,4,92.22,Cognitive and Systems Neuroscience,non-human,Positions STUDIES OF CEREBRAL FUNCTION IN LEARNING: V. THE RETENTION OF MOTOR HABITS AFTER DESTRUCTION OF THE SO-CALLED MOTOR AREAS IN PRIMATES within Cognitive and Systems Neuroscience.,high citation signal (118); open-access PDF metadata,"Task designs can simplify cognition enough that ecological validity becomes uncertain.; Cross-species alignment between circuits, behavior, and subjective experience remains imperfect.; Non-human findings need careful translation to human brain organization and clinical outcomes.",10.1001/ARCHNEURPSYC.1924.02200030002001,50bbcaaf160b03a0a902c3553cfe1c2b6a1107f8,https://doi.org/10.1001/ARCHNEURPSYC.1924.02200030002001,https://www.biodiversitylibrary.org/itempdf/64710,paper,unknown,cerebral,
3,1924,Changes in vascularity in the brain stem and cerebellum of the albino rat between birth and maturity,E. Craigie,Unknown venue,1924-12-01,73,0,88.67,General Brain Science and Reviews,non-human,Positions Changes in vascularity in the brain stem and cerebellum of the albino rat between birth and maturity within General Brain Science and Reviews.,high citation signal (73),"Broad reviews can dominate citation-ranked lists while obscuring narrower empirical advances.; Taxonomy boundaries are imperfect because many brain papers combine methods, scales, and diseases.; Non-human findings need careful translation to human brain organization and clinical outcomes.",10.1002/CNE.900380103,06e8b2d82421b46e10095d453ed41c265ebf6e62,https://doi.org/10.1002/CNE.900380103,,paper,unknown,brain; cerebellum; brain in title,
4,1924,Experimental Researches on Sensory Localization in the Cerebral Cortex of the Monkey (Macacus),J. G. D. D. Barenne,Unknown venue,1924-06-02,42,0,81.9,General Brain Science and Reviews,non-human,"In a previous paper it was shown that the method of local strychnization of the central nervous system not only yields good results in investigations on the sensory mechanisms of the spinal cord, but also with regard to the problem of the localization of the sensory area (sensibility) in the cerebral cortex.",high citation signal (42); open-access PDF metadata,"Broad reviews can dominate citation-ranked lists while obscuring narrower empirical advances.; Taxonomy boundaries are imperfect because many brain papers combine methods, scales, and diseases.; Non-human findings need careful translation to human brain organization and clinical outcomes.",10.1098/RSPB.1924.0026,8757892f8b0d7013cd68f9708dd402249441edd9,https://doi.org/10.1098/RSPB.1924.0026,https://doi.org/10.1098/rspb.1924.0026,paper,unknown,cerebral; cortex; neuroscience term,"In a previous paper it was shown that the method of local strychnization of the central nervous system not only yields good results in investigations on the sensory mechanisms of the spinal cord, but also with regard to the problem of the localization of the sensory area (sensibility) in the cerebral cortex. The writer then showed that there exists on the convexity of the cortex of the cat a large area, intimately connected with sensory functions. The slight strychnization of a very small part of this so-called ""active zone"" gives rise to intense symptoms of sensory excitation, whereas the application of the strychnine to parts of the cortex outside this area is not followed by like disturbances. The sensory disturbances produced by the poisoning of that part of the cerebral cortex affect both cutaneous and deep sensibility. They manifest themselves in the cat so far as the skin is concerned by:-"
5,1924,An experimental study of the cerebral physiology of the virginian opossum,F. Rogers,Unknown venue,1924-08-01,35,0,66.5,General Brain Science and Reviews,,Positions An experimental study of the cerebral physiology of the virginian opossum within General Brain Science and Reviews.,high citation signal (35),"Broad reviews can dominate citation-ranked lists while obscuring narrower empirical advances.; Taxonomy boundaries are imperfect because many brain papers combine methods, scales, and diseases.; Metadata-level ranking should be complemented with full-text expert review before strong claims are made.",10.1002/cne.900370203,4ca505133dde2557e1ad32590447bb08bddd5d6e,https://doi.org/10.1002/cne.900370203,,paper,unknown,cerebral,
6,1924,A Glimpse Into the History of the Surgery of the Brain,C. Ballance,Unknown venue,1924-02-01,34,2,75.0,General Brain Science and Reviews,,Positions A Glimpse Into the History of the Surgery of the Brain within General Brain Science and Reviews.,high citation signal (34); open-access PDF metadata,"Broad reviews can dominate citation-ranked lists while obscuring narrower empirical advances.; Taxonomy boundaries are imperfect because many brain papers combine methods, scales, and diseases.; Metadata-level ranking should be complemented with full-text expert review before strong claims are made.",10.1097/00005053-192402000-00068,733b9f665a323580ccf5167b37fa55b80c437c29,https://doi.org/10.1097/00005053-192402000-00068,https://doi.org/10.1097/00005053-192402000-00068,paper,unknown,brain; brain in title,
7,1924,The motor cortex of the opossum,"P. A. Gray, E. L. Turner",Unknown venue,1924-04-01,34,0,72.0,General Brain Science and Reviews,,Positions The motor cortex of the opossum within General Brain Science and Reviews.,high citation signal (34),"Broad reviews can dominate citation-ranked lists while obscuring narrower empirical advances.; Taxonomy boundaries are imperfect because many brain papers combine methods, scales, and diseases.; Metadata-level ranking should be complemented with full-text expert review before strong claims are made.",10.1002/cne.900360403,941a1cb5b9c08389e217b56c35e6175015fc1464,https://doi.org/10.1002/cne.900360403,,paper,unknown,cortex; neuroscience term,
8,1924,THE CEREBRAL SUBARACHNOID SYSTEM,"C. Locke, H. Naffziger",Unknown venue,1924-10-01,30,0,63.81,General Brain Science and Reviews,,Positions THE CEREBRAL SUBARACHNOID SYSTEM within General Brain Science and Reviews.,high citation signal (30),"Broad reviews can dominate citation-ranked lists while obscuring narrower empirical advances.; Taxonomy boundaries are imperfect because many brain papers combine methods, scales, and diseases.; Metadata-level ranking should be complemented with full-text expert review before strong claims are made.",10.1001/ARCHNEURPSYC.1924.02200040054004,973a3749cda7f1417b63b3478ece7910cbad3fa2,https://doi.org/10.1001/ARCHNEURPSYC.1924.02200040054004,,paper,unknown,cerebral,
9,1924,On the Brain of the Tree-Shrew (Tupaia minor).,W. E. Clark,Unknown venue,1924-12-01,25,2,66.65,General Brain Science and Reviews,,Positions On the Brain of the Tree-Shrew (Tupaia minor). within General Brain Science and Reviews.,high citation signal (25),"Broad reviews can dominate citation-ranked lists while obscuring narrower empirical advances.; Taxonomy boundaries are imperfect because many brain papers combine methods, scales, and diseases.; Metadata-level ranking should be complemented with full-text expert review before strong claims are made.",10.1111/j.1096-3642.1924.tb03328.x,078629c577d4005c5e626ef1d2aae49e7188dde0,https://doi.org/10.1111/j.1096-3642.1924.tb03328.x,,paper,unknown,brain; brain in title,
10,1924,ON THE FUNDAMENTAL NERVOUS PROCESSES IN THE CORTEX OF THE CEREBRAL HEMISPHERESI.-THE PRINCIPAL STAGES OF THE DEVELOPMENT OF THE INDIVIDUAL REFLEX: ITS GENERALIZATION AND DIFFERENTIATION,J. Beritoff,Unknown venue,1924-05-01,24,1,67.94,"Brain Development, Plasticity, and Connectomics",,"Positions ON THE FUNDAMENTAL NERVOUS PROCESSES IN THE CORTEX OF THE CEREBRAL HEMISPHERESI.-THE PRINCIPAL STAGES OF THE DEVELOPMENT OF THE INDIVIDUAL REFLEX: ITS GENERALIZATION AND DIFFERENTIATION within Brain Development, Plasticity, and Connectomics.",high citation signal (24),"Developmental and aging studies are sensitive to cohort composition, attrition, and longitudinal sampling intervals.; Network measures can depend heavily on parcellation, thresholding, and acquisition choices.; Metadata-level ranking should be complemented with full-text expert review before strong claims are made.",10.1093/BRAIN/47.2.109,8dff293163d851fa6afb5574a7cde387b511b6a9,https://doi.org/10.1093/BRAIN/47.2.109,,paper,unknown,cerebral; cortex; neuroscience term,
11,1924,ON CERTAIN MINOR INJURIES OF THE BRAIN,W. Trotter,British medical journal,1924-05-10,23,0,68.2,General Brain Science and Reviews,,Positions ON CERTAIN MINOR INJURIES OF THE BRAIN within General Brain Science and Reviews.,high citation signal (23); open-access PDF metadata,"Broad reviews can dominate citation-ranked lists while obscuring narrower empirical advances.; Taxonomy boundaries are imperfect because many brain papers combine methods, scales, and diseases.; Metadata-level ranking should be complemented with full-text expert review before strong claims are made.",10.1136/bmj.1.3306.816,241c6625e92d9ea1ad79b6b4cfc9726fcdb5dbf9,https://doi.org/10.1136/bmj.1.3306.816,https://europepmc.org/articles/pmc2304364?pdf=render,JournalArticle,unknown,brain; brain in title,
12,1924,ENCEPHALITOZOON CUNICULI AS A KIDNEY PARASITE IN THE RABBIT,"Theobald. Smith, L. Florence",Journal of Experimental Medicine,1924-12-31,23,0,63.4,General Brain Science and Reviews,non-human,A spontaneous epidemic of nephritis among young rabbits associated with a protozoan parasite has been observed in a certain breeding stock since 1918.,high citation signal (23); open-access PDF metadata,"Broad reviews can dominate citation-ranked lists while obscuring narrower empirical advances.; Taxonomy boundaries are imperfect because many brain papers combine methods, scales, and diseases.; Non-human findings need careful translation to human brain organization and clinical outcomes.",10.1084/jem.41.1.25,46172ac49a676257ad7dbbf31087204dcb3e9040,https://doi.org/10.1084/jem.41.1.25,https://rupress.org/jem/article-pdf/41/1/25/1177233/25.pdf,JournalArticle,unknown,brain,"A spontaneous epidemic of nephritis among young rabbits associated with a protozoan parasite has been observed in a certain breeding stock since 1918. It is regarded as a nest infection. The parasite is tentatively classed among the microsporidia and the stages encountered are regarded as vegetative which may perhaps pass through several generations in the same host. It is a parasite of the epithelial cell, provoking no immediate host reactions. These are supposed to follow injury such as destruction of the epithelium and denudation and plugging of the tubules. The localizations in the brain are also without cell reaction, except under special conditions, and the many cell foci present are attributed to coccidia and perhaps bacteria and other intestinal parasites. The kidneys are looked upon as the normal habitat and the brain parasites as aberrant and outside the normal cycle unless it can be shown that the spores discharged into the circulation may again multiply in some organ like the kidneys in direct communication with the exterior. It is highly probable that many reported cases of nephritis among older rabbits used in experiments had their origin in an early invasion of the parasite described."
13,1924,BRAIN DEVELOPMENT IN ANURAN LARVAE AFTER THYROID OR PITUITARY GLAND REMOVAL,B. M. Allen,Unknown venue,1924-09-01,19,0,61.92,"Brain Development, Plasticity, and Connectomics",,"Positions BRAIN DEVELOPMENT IN ANURAN LARVAE AFTER THYROID OR PITUITARY GLAND REMOVAL within Brain Development, Plasticity, and Connectomics.",high citation signal (19),"Developmental and aging studies are sensitive to cohort composition, attrition, and longitudinal sampling intervals.; Network measures can depend heavily on parcellation, thresholding, and acquisition choices.; Metadata-level ranking should be complemented with full-text expert review before strong claims are made.",10.1210/ENDO-8-5-639,5c5bcbd671d4f2f0f80c950c6b9c76df85d584a7,https://doi.org/10.1210/ENDO-8-5-639,,paper,unknown,brain; brain in title,
14,1924,A CASE OF PRIMARY CARCINOMA OF THE BLADDER WITH METASTASIS TO THE BRAIN,"W. E. Lower, R. Watkins",Unknown venue,1924-03-01,16,0,59.0,General Brain Science and Reviews,,Positions A CASE OF PRIMARY CARCINOMA OF THE BLADDER WITH METASTASIS TO THE BRAIN within General Brain Science and Reviews.,high citation signal (16),"Broad reviews can dominate citation-ranked lists while obscuring narrower empirical advances.; Taxonomy boundaries are imperfect because many brain papers combine methods, scales, and diseases.; Metadata-level ranking should be complemented with full-text expert review before strong claims are made.",10.1097/00000441-192403000-00007,399fe5be26206d75cac14f9641a664473a96870f,https://doi.org/10.1097/00000441-192403000-00007,,paper,unknown,brain; brain in title,
15,1924,ELECTRICALLY EXCITABLE REGION OF THE FOREBRAIN OF THE ALLIGATOR,"C. Bagley, C. P. Richter",Unknown venue,1924-03-01,15,0,57.91,General Brain Science and Reviews,,Positions ELECTRICALLY EXCITABLE REGION OF THE FOREBRAIN OF THE ALLIGATOR within General Brain Science and Reviews.,high citation signal (15),"Broad reviews can dominate citation-ranked lists while obscuring narrower empirical advances.; Taxonomy boundaries are imperfect because many brain papers combine methods, scales, and diseases.; Metadata-level ranking should be complemented with full-text expert review before strong claims are made.",10.1001/ARCHNEURPSYC.1924.02190330007001,1d28d7c10eed0f67f39fc0cd47a2a2f034886969,https://doi.org/10.1001/ARCHNEURPSYC.1924.02190330007001,,paper,unknown,brain; brain in title,
16,1924,The Electric Response in Reflex Contractions of Spinal and Decerebrate Preparations,"S. Cooper, E. Adrian",Unknown venue,1924-05-01,15,0,56.11,"EEG, MEG, and Electrophysiology",non-human,In a series of communications Liddell and Sherrington (1) have analysed the mechanical response of a muscle stimulated to reflex contraction by rhythmic shocks to an afferent nerve.,high citation signal (15); open-access PDF metadata,"Low signal-to-noise ratio, artifacts, and source-localization uncertainty complicate interpretation.; Many studies rely on controlled tasks and may not generalize to everyday behavior or clinical monitoring.; Non-human findings need careful translation to human brain organization and clinical outcomes.",10.1098/RSPB.1924.0024,b98c26a9200c7a7959755a6515f067a2a529584a,https://doi.org/10.1098/RSPB.1924.0024,https://doi.org/10.1098/rspb.1924.0024,paper,unknown,brain,"In a series of communications Liddell and Sherrington (1) have analysed the mechanical response of a muscle stimulated to reflex contraction by rhythmic shocks to an afferent nerve. In particular they have described characteristic differences between the flexor response of the spinal and the extensor response of the decerebrate preparation ( i. e ., the preparation in which the midbrain is left attached to the spinal cord). During the past year we have attempted an analysis of the electrical response of a reflexly contracting muscle. The investigation was concerned in the main with some other points, but it has involved many comparisons of the electrical response of spinal and decerebrate preparations, and as these supplement and generally confirm, the views of Liddell and Sherrington it seems best to publish them as a separate communication. Method of Experiment . The experiments have been made on cats either decapitated under anaesthesia by Sherrington's method or decerebrated by removal of all the brain above the anterior colliculi. The limb was fixed by a drill through. the lower end of the femur and shielded stimulating electrodes were applied to the popliteal nerve. The muscles whose action currents were recorded were the tibialis anticus for the flexion reflex and the vastocrureus for the crossed extension reflex. In the earlier experiments the tendon of the muscle was fixed by a clamp; in the later it was attached to a rubber tambour which communicated by a leaden pipe 9 feet long with another tambour which carried a pointer moving in the eyepiece of the string galvanometer. A more direct method could not be used owing to the distance between the animal table and the galvanometer. The movement of this pointer, magnified 40 times, was recorded on the same strip of cinematograph film as the movements of the string. Owing to the length of the pipe there is a lag of some hundredths of a second in the movement of the second tambour, and sudden movements ( e. g ., the single twitch of a muscle) set up waves in the pipe which cause oscillations on the record."
17,1924,THE CREATINE CONTENT OF BRAIN,"V. Harding, B. A. Eagles",Unknown venue,1924-06-01,11,0,55.73,General Brain Science and Reviews,,Positions THE CREATINE CONTENT OF BRAIN within General Brain Science and Reviews.,high citation signal (11); open-access PDF metadata,"Broad reviews can dominate citation-ranked lists while obscuring narrower empirical advances.; Taxonomy boundaries are imperfect because many brain papers combine methods, scales, and diseases.; Metadata-level ranking should be complemented with full-text expert review before strong claims are made.",10.1016/S0021-9258(18)85209-7,de1156de577b03a45e09639e8a7fdacaea35a9ba,https://doi.org/10.1016/S0021-9258(18)85209-7,https://doi.org/10.1016/s0021-9258(18)85209-7,paper,unknown,brain; brain in title,
18,1924,MENINGO-ENCEPHALITIC LESIONS AND PROTOZOAN-LIKE PARASITES: IN THE BRAINS OF APPARENTLY NORMAL LABORATORY ANIMALS COMMONLY EMPLOYED FOR EXPERIMENTATION,"E. V. Cowdry, F. M. Nicholson",Unknown venue,1924-02-16,10,0,52.36,General Brain Science and Reviews,non-human,Positions MENINGO-ENCEPHALITIC LESIONS AND PROTOZOAN-LIKE PARASITES: IN THE BRAINS OF APPARENTLY NORMAL LABORATORY ANIMALS COMMONLY EMPLOYED FOR EXPERIMENTATION within General Brain Science and Reviews.,high citation signal (10),"Broad reviews can dominate citation-ranked lists while obscuring narrower empirical advances.; Taxonomy boundaries are imperfect because many brain papers combine methods, scales, and diseases.; Non-human findings need careful translation to human brain organization and clinical outcomes.",10.1001/JAMA.1924.02650330037015,5cdc66a28135de3e7925e2e5674a92cdefdeac22,https://doi.org/10.1001/JAMA.1924.02650330037015,,paper,unknown,brain; brain in title,
19,1924,The effect of cerebral anæmia upon blood-pressure and respiration,F. Roberts,Journal of Physiology,1924-10-09,10,0,49.36,General Brain Science and Reviews,non-human,Positions The effect of cerebral anæmia upon blood-pressure and respiration within General Brain Science and Reviews.,high citation signal (10); open-access PDF metadata,"Broad reviews can dominate citation-ranked lists while obscuring narrower empirical advances.; Taxonomy boundaries are imperfect because many brain papers combine methods, scales, and diseases.; Non-human findings need careful translation to human brain organization and clinical outcomes.",10.1113/jphysiol.1924.sp002167,3807e110da8bb8f3285b6e31394af0a96453aba1,https://doi.org/10.1113/jphysiol.1924.sp002167,https://www.ncbi.nlm.nih.gov/pmc/articles/PMC1405774,JournalArticle,unknown,cerebral,
20,1924,Sarcoma of Brain,J. R. Perdrau,Unknown venue,1924-10-01,9,0,49.45,General Brain Science and Reviews,,Positions Sarcoma of Brain within General Brain Science and Reviews.,high citation signal (9),"Broad reviews can dominate citation-ranked lists while obscuring narrower empirical advances.; Taxonomy boundaries are imperfect because many brain papers combine methods, scales, and diseases.; Metadata-level ranking should be complemented with full-text expert review before strong claims are made.",10.1097/00005053-192410000-00007,3fad74a1bc14711fd6e38d707ce157945c8a3162,https://doi.org/10.1097/00005053-192410000-00007,,paper,unknown,brain; brain in title,
21,1924,Action of leukocytes and of brain tissue on toxin of B. botulinus,G. E. Coleman,Unknown venue,1924-06-01,8,0,47.55,General Brain Science and Reviews,,Positions Action of leukocytes and of brain tissue on toxin of B. botulinus within General Brain Science and Reviews.,high citation signal (8),"Broad reviews can dominate citation-ranked lists while obscuring narrower empirical advances.; Taxonomy boundaries are imperfect because many brain papers combine methods, scales, and diseases.; Metadata-level ranking should be complemented with full-text expert review before strong claims are made.",10.1093/INFDIS/34.6.614,c12478cb466db693a2d342d644ff5cdcc9fccb46,https://doi.org/10.1093/INFDIS/34.6.614,,paper,unknown,brain; brain in title,
22,1924,BRAIN CHANGES IN STARVATION,G. B. Hassin,Unknown venue,1924-05-01,8,0,47.55,General Brain Science and Reviews,,Positions BRAIN CHANGES IN STARVATION within General Brain Science and Reviews.,high citation signal (8),"Broad reviews can dominate citation-ranked lists while obscuring narrower empirical advances.; Taxonomy boundaries are imperfect because many brain papers combine methods, scales, and diseases.; Metadata-level ranking should be complemented with full-text expert review before strong claims are made.",10.1001/ARCHNEURPSYC.1924.02190350057004,2a591018df968b8f1f5c7df6832ca0e15987b693,https://doi.org/10.1001/ARCHNEURPSYC.1924.02190350057004,,paper,unknown,brain; brain in title,
23,1924,On the growth of the human cerebellum in early life.,"R. Scammon, H. Dunn",Unknown venue,1924-01-01,8,0,42.75,General Brain Science and Reviews,human,Positions On the growth of the human cerebellum in early life. within General Brain Science and Reviews.,high citation signal (8); human evidence signal,"Broad reviews can dominate citation-ranked lists while obscuring narrower empirical advances.; Taxonomy boundaries are imperfect because many brain papers combine methods, scales, and diseases.; Human cohort effects can depend on recruitment, demographics, comorbidity, and measurement context.",10.3181/00379727-21-110,137f20e65695deed0619986a1eaa244eee22ff33,https://doi.org/10.3181/00379727-21-110,,JournalArticle,unknown,cerebellum,
