rank,year,title,authors,venue,publicationDate,citationCount,influentialCitationCount,importanceScore,category,keywordTags,keyIdea,strengths,limitations,doi,sourceId,url,openAccessPdf,workType,language,relevanceReason,abstract
68,1924,A CASE OF TUBERCULOUS CHOROIDITIS TERMINATED BY MENINGITIS AND MULTIPLE BRAIN ABSCESSES,Bride Tm,Unknown venue,1924-07-01,0,0,11.0,General Brain Science and Reviews,,Positions A CASE OF TUBERCULOUS CHOROIDITIS TERMINATED BY MENINGITIS AND MULTIPLE BRAIN ABSCESSES within General Brain Science and Reviews.,high citation signal (0); open-access PDF metadata,"Broad reviews can dominate citation-ranked lists while obscuring narrower empirical advances.; Taxonomy boundaries are imperfect because many brain papers combine methods, scales, and diseases.; Metadata-level ranking should be complemented with full-text expert review before strong claims are made.",10.1136/bjo.8.7.320,2fd5cdaa3488d6ac7aadf83e761e771c462553ca,https://doi.org/10.1136/bjo.8.7.320,https://bjo.bmj.com/content/bjophthalmol/8/7/320.full.pdf,paper,unknown,brain; brain in title,
69,1924,A Lecture ON BRAIN AND MIND *,R. J. Berry,British medical journal,1924-04-19,0,0,11.0,General Brain Science and Reviews,,Positions A Lecture ON BRAIN AND MIND * within General Brain Science and Reviews.,high citation signal (0); open-access PDF metadata,"Broad reviews can dominate citation-ranked lists while obscuring narrower empirical advances.; Taxonomy boundaries are imperfect because many brain papers combine methods, scales, and diseases.; Metadata-level ranking should be complemented with full-text expert review before strong claims are made.",10.1136/bmj.1.3303.707,8c67ac99ff58375487ce7b5ddf5ae0eb758f39e6,https://doi.org/10.1136/bmj.1.3303.707,https://europepmc.org/articles/pmc2304158?pdf=render,JournalArticle,unknown,brain; brain in title,
70,1924,ACCIDENTAL MALARIA INFECTION IN SYPHILIS OF THE BRAIN,M. Buchsbaum,Unknown venue,1924-10-25,0,0,8.0,General Brain Science and Reviews,,Positions ACCIDENTAL MALARIA INFECTION IN SYPHILIS OF THE BRAIN within General Brain Science and Reviews.,high citation signal (0),"Broad reviews can dominate citation-ranked lists while obscuring narrower empirical advances.; Taxonomy boundaries are imperfect because many brain papers combine methods, scales, and diseases.; Metadata-level ranking should be complemented with full-text expert review before strong claims are made.",10.1001/JAMA.1924.02660170071032,42e596a34ee53b974acc8bce0277353d0a3ca41e,https://doi.org/10.1001/JAMA.1924.02660170071032,,paper,unknown,brain; brain in title,
71,1924,Babinski Phenomena in Meningitis and Brain Edema,A. Edelmann,Unknown venue,1924-09-01,0,0,8.0,"Cerebrovascular, Metabolism, and Brain Injury",,"Positions Babinski Phenomena in Meningitis and Brain Edema within Cerebrovascular, Metabolism, and Brain Injury.",high citation signal (0),"Acute injury studies can be sensitive to timing, severity, comorbidity, and treatment heterogeneity.; Animal models may not capture human vascular risk, injury complexity, or rehabilitation context.; Metadata-level ranking should be complemented with full-text expert review before strong claims are made.",10.1097/00005053-192409000-00047,aae77ee3b0cc4d167c0387c4b537870e15cac67c,https://doi.org/10.1097/00005053-192409000-00047,,paper,unknown,brain; brain in title,
72,1924,Brain Abscess Following Wounds,Lefort,Unknown venue,1924-09-01,0,0,8.0,General Brain Science and Reviews,,Positions Brain Abscess Following Wounds within General Brain Science and Reviews.,high citation signal (0),"Broad reviews can dominate citation-ranked lists while obscuring narrower empirical advances.; Taxonomy boundaries are imperfect because many brain papers combine methods, scales, and diseases.; Metadata-level ranking should be complemented with full-text expert review before strong claims are made.",10.1097/00005053-192409000-00059,07f6a7b61885e927cec6ec9040dd179345209e05,https://doi.org/10.1097/00005053-192409000-00059,,paper,unknown,brain; brain in title,
73,1924,BRAIN ABSCESS: REPORT OF AN UNUSUAL CASE,M. G. Peterman,Unknown venue,1924-08-01,0,0,8.0,General Brain Science and Reviews,,Positions BRAIN ABSCESS: REPORT OF AN UNUSUAL CASE within General Brain Science and Reviews.,high citation signal (0),"Broad reviews can dominate citation-ranked lists while obscuring narrower empirical advances.; Taxonomy boundaries are imperfect because many brain papers combine methods, scales, and diseases.; Metadata-level ranking should be complemented with full-text expert review before strong claims are made.",10.1001/archpedi.1924.04120200078008,bcde8eb576325e8448cbf9ef9844336a7532a281,https://doi.org/10.1001/archpedi.1924.04120200078008,,paper,unknown,brain; brain in title,
74,1924,BRAIN AND MIND,C. Williams,Unknown venue,1924-05-17,0,0,11.0,General Brain Science and Reviews,,Positions BRAIN AND MIND within General Brain Science and Reviews.,high citation signal (0); open-access PDF metadata,"Broad reviews can dominate citation-ranked lists while obscuring narrower empirical advances.; Taxonomy boundaries are imperfect because many brain papers combine methods, scales, and diseases.; Metadata-level ranking should be complemented with full-text expert review before strong claims are made.",10.1136/BMJ.1.3307.886,a0f7622a9aa071fccf33f8c67930a5f7610a8fa6,https://doi.org/10.1136/BMJ.1.3307.886,http://europepmc.org/articles/pmc2304298?pdf=render,paper,unknown,brain; brain in title,
75,1924,BRAIN AND MIND,J. Brown,Unknown venue,1924-05-31,0,0,8.0,General Brain Science and Reviews,,Positions BRAIN AND MIND within General Brain Science and Reviews.,high citation signal (0),"Broad reviews can dominate citation-ranked lists while obscuring narrower empirical advances.; Taxonomy boundaries are imperfect because many brain papers combine methods, scales, and diseases.; Metadata-level ranking should be complemented with full-text expert review before strong claims are made.",10.1136/BMJ.1.3309.984,72bc48c1b7ec2cc8dcdcece6d2143d266aabedae,https://doi.org/10.1136/BMJ.1.3309.984,,paper,unknown,brain; brain in title,
76,1924,Brain Sarcoma Successfully Removed,A. Barkman,Unknown venue,1924-09-01,0,0,8.0,General Brain Science and Reviews,,Positions Brain Sarcoma Successfully Removed within General Brain Science and Reviews.,high citation signal (0),"Broad reviews can dominate citation-ranked lists while obscuring narrower empirical advances.; Taxonomy boundaries are imperfect because many brain papers combine methods, scales, and diseases.; Metadata-level ranking should be complemented with full-text expert review before strong claims are made.",10.1097/00005053-192409000-00070,71861be5543913cc0502c816025621d7bdcf17ec,https://doi.org/10.1097/00005053-192409000-00070,,paper,unknown,brain; brain in title,
77,1924,Brain Tumor and Electrical Resistance,A. Meyer,Unknown venue,1924-10-01,0,0,8.0,Clinical Neurology and Neurodegeneration,,Positions Brain Tumor and Electrical Resistance within Clinical Neurology and Neurodegeneration.,high citation signal (0),"Clinical cohorts often differ in disease stage, comorbidity, treatment history, and follow-up duration.; Biomarkers may not transfer cleanly across populations, scanners, care settings, or diagnostic criteria.; Metadata-level ranking should be complemented with full-text expert review before strong claims are made.",10.1097/00005053-192410000-00009,36efd18975ac465efa000ae023c7e934298cae37,https://doi.org/10.1097/00005053-192410000-00009,,paper,unknown,brain; brain in title,
78,1924,Cerebrospinai Fluid in Brain Tumors,C. Lange,Unknown venue,1924-10-01,0,0,8.0,Clinical Neurology and Neurodegeneration,,Positions Cerebrospinai Fluid in Brain Tumors within Clinical Neurology and Neurodegeneration.,high citation signal (0),"Clinical cohorts often differ in disease stage, comorbidity, treatment history, and follow-up duration.; Biomarkers may not transfer cleanly across populations, scanners, care settings, or diagnostic criteria.; Metadata-level ranking should be complemented with full-text expert review before strong claims are made.",10.1097/00005053-192410000-00010,2eda9f0bfa224681c822eb16c57d6d6762db2cb1,https://doi.org/10.1097/00005053-192410000-00010,,paper,unknown,brain; brain in title,
79,1924,Classification of Brain Tumors,"Spiller, Frazier",Unknown venue,1924-10-01,0,0,8.0,Clinical Neurology and Neurodegeneration,,Positions Classification of Brain Tumors within Clinical Neurology and Neurodegeneration.,high citation signal (0),"Clinical cohorts often differ in disease stage, comorbidity, treatment history, and follow-up duration.; Biomarkers may not transfer cleanly across populations, scanners, care settings, or diagnostic criteria.; Metadata-level ranking should be complemented with full-text expert review before strong claims are made.",10.1097/00005053-192410000-00012,21f71881e878542f8f5674d4dd452188c2d316c8,https://doi.org/10.1097/00005053-192410000-00012,,paper,unknown,brain; brain in title,
80,1924,Clinical Observations on Forced Movements in the Horizontal Plane Through Lesion of the Central Vestibular Connections in the Fore-Brain,L. Muskens,Unknown venue,1924-06-01,0,0,9.2,Clinical Neurology and Neurodegeneration,human,Positions Clinical Observations on Forced Movements in the Horizontal Plane Through Lesion of the Central Vestibular Connections in the Fore-Brain within Clinical Neurology and Neurodegeneration.,high citation signal (0); human evidence signal,"Clinical cohorts often differ in disease stage, comorbidity, treatment history, and follow-up duration.; Biomarkers may not transfer cleanly across populations, scanners, care settings, or diagnostic criteria.; Human cohort effects can depend on recruitment, demographics, comorbidity, and measurement context.",10.1097/00005053-192406000-00033,4f5df5d1c957d4c800ac3bc8e7b505102faced4c,https://doi.org/10.1097/00005053-192406000-00033,,paper,unknown,brain; brain in title,
81,1924,Concussion of the Brain,H. Duret,Unknown venue,1924-09-01,0,0,8.0,General Brain Science and Reviews,,Positions Concussion of the Brain within General Brain Science and Reviews.,high citation signal (0),"Broad reviews can dominate citation-ranked lists while obscuring narrower empirical advances.; Taxonomy boundaries are imperfect because many brain papers combine methods, scales, and diseases.; Metadata-level ranking should be complemented with full-text expert review before strong claims are made.",10.1097/00005053-192409000-00029,7ed9d9aab601ea02b928c80f776b828a187bf628,https://doi.org/10.1097/00005053-192409000-00029,,paper,unknown,brain; brain in title,
82,1924,Contrecoup Damage to the Brain in Head Injuries,J. Caldwell,Unknown venue,1924-09-01,0,0,8.0,General Brain Science and Reviews,,Positions Contrecoup Damage to the Brain in Head Injuries within General Brain Science and Reviews.,high citation signal (0),"Broad reviews can dominate citation-ranked lists while obscuring narrower empirical advances.; Taxonomy boundaries are imperfect because many brain papers combine methods, scales, and diseases.; Metadata-level ranking should be complemented with full-text expert review before strong claims are made.",10.1097/00005053-192409000-00009,57e196ee1a9e988c732ac127aeca979755cc04c4,https://doi.org/10.1097/00005053-192409000-00009,,paper,unknown,brain; brain in title,
83,1924,Eating and Drinking Reflexes and Brain Evolution,Shaklee,Unknown venue,1924-09-01,0,0,8.0,General Brain Science and Reviews,,Positions Eating and Drinking Reflexes and Brain Evolution within General Brain Science and Reviews.,high citation signal (0),"Broad reviews can dominate citation-ranked lists while obscuring narrower empirical advances.; Taxonomy boundaries are imperfect because many brain papers combine methods, scales, and diseases.; Metadata-level ranking should be complemented with full-text expert review before strong claims are made.",10.1097/00005053-192409000-00017,c580f72e1ca81a1aa11663fa4217eb1ed37b33d7,https://doi.org/10.1097/00005053-192409000-00017,,paper,unknown,brain; brain in title,
84,1924,Extraction of Foreign Bodies from the Brain,Sauve,Unknown venue,1924-09-01,0,0,8.0,General Brain Science and Reviews,,Positions Extraction of Foreign Bodies from the Brain within General Brain Science and Reviews.,high citation signal (0),"Broad reviews can dominate citation-ranked lists while obscuring narrower empirical advances.; Taxonomy boundaries are imperfect because many brain papers combine methods, scales, and diseases.; Metadata-level ranking should be complemented with full-text expert review before strong claims are made.",10.1097/00005053-192409000-00087,c597fbaef05ac1e1be252a182e5bb08ad075d6bd,https://doi.org/10.1097/00005053-192409000-00087,,paper,unknown,brain; brain in title,
85,1924,Five Brain Tumors,"W. B. Terhune, A. Riggs",Unknown venue,1924-06-26,0,0,8.0,Clinical Neurology and Neurodegeneration,,Positions Five Brain Tumors within Clinical Neurology and Neurodegeneration.,high citation signal (0),"Clinical cohorts often differ in disease stage, comorbidity, treatment history, and follow-up duration.; Biomarkers may not transfer cleanly across populations, scanners, care settings, or diagnostic criteria.; Metadata-level ranking should be complemented with full-text expert review before strong claims are made.",10.1056/NEJM192406261902605,3b46c4f1783027f05e3971767f511deb21cdc90b,https://doi.org/10.1056/NEJM192406261902605,,paper,unknown,brain; brain in title,
86,1924,"Hemiplegias without Visible Brain Lesions in the Pneumonias of the Insane. (Amer. Journ. of Psychiat., July, 1923.) Canavan, Myrtelle",M. Franklin,Unknown venue,1924-04-01,0,0,8.0,General Brain Science and Reviews,,"Positions Hemiplegias without Visible Brain Lesions in the Pneumonias of the Insane. (Amer. Journ. of Psychiat., July, 1923.) Canavan, Myrtelle within General Brain Science and Reviews.",high citation signal (0),"Broad reviews can dominate citation-ranked lists while obscuring narrower empirical advances.; Taxonomy boundaries are imperfect because many brain papers combine methods, scales, and diseases.; Metadata-level ranking should be complemented with full-text expert review before strong claims are made.",10.1192/bjp.70.289.322-b,344cc80e748563bad0e08b07cfd94298256ca51d,https://doi.org/10.1192/bjp.70.289.322-b,,paper,unknown,brain; brain in title,
87,1924,HISTOPATHOLOGY OF A FOCAL BRAIN SOFTENING,H. Singer,Unknown venue,1924-04-01,0,0,8.0,General Brain Science and Reviews,,Positions HISTOPATHOLOGY OF A FOCAL BRAIN SOFTENING within General Brain Science and Reviews.,high citation signal (0),"Broad reviews can dominate citation-ranked lists while obscuring narrower empirical advances.; Taxonomy boundaries are imperfect because many brain papers combine methods, scales, and diseases.; Metadata-level ranking should be complemented with full-text expert review before strong claims are made.",10.1176/AJP.80.4.717,ebe70877db6fbebf934462996438e4d01496d03a,https://doi.org/10.1176/AJP.80.4.717,,paper,unknown,brain; brain in title,
88,1924,Manifestations from Pilocarpin in Brain Lesions,C. Besta,Unknown venue,1924-09-01,0,0,8.0,General Brain Science and Reviews,,Positions Manifestations from Pilocarpin in Brain Lesions within General Brain Science and Reviews.,high citation signal (0),"Broad reviews can dominate citation-ranked lists while obscuring narrower empirical advances.; Taxonomy boundaries are imperfect because many brain papers combine methods, scales, and diseases.; Metadata-level ranking should be complemented with full-text expert review before strong claims are made.",10.1097/00005053-192409000-00033,551799f608280925df86c7a5f99a2b83c5a15ba3,https://doi.org/10.1097/00005053-192409000-00033,,paper,unknown,brain; brain in title,
89,1924,Multiple Abscesses in Brain,Claude.,Unknown venue,1924-10-01,0,0,8.0,General Brain Science and Reviews,,Positions Multiple Abscesses in Brain within General Brain Science and Reviews.,high citation signal (0),"Broad reviews can dominate citation-ranked lists while obscuring narrower empirical advances.; Taxonomy boundaries are imperfect because many brain papers combine methods, scales, and diseases.; Metadata-level ranking should be complemented with full-text expert review before strong claims are made.",10.1097/00005053-192410000-00031,5838014eb5b7fb944dfdad32063f24470fed7dcd,https://doi.org/10.1097/00005053-192410000-00031,,paper,unknown,brain; brain in title,
90,1924,ON THE DIFFICULTIES OF UTILIZING APHASIC SYMPTOMS IN THE LOCALIZATION OF BRAIN TUMORS: WITH A REPORT OF FOUR CASES WITH NECROPSY,I. S. Wechsler,Unknown venue,1924-01-01,0,0,8.0,Clinical Neurology and Neurodegeneration,,Positions ON THE DIFFICULTIES OF UTILIZING APHASIC SYMPTOMS IN THE LOCALIZATION OF BRAIN TUMORS: WITH A REPORT OF FOUR CASES WITH NECROPSY within Clinical Neurology and Neurodegeneration.,high citation signal (0),"Clinical cohorts often differ in disease stage, comorbidity, treatment history, and follow-up duration.; Biomarkers may not transfer cleanly across populations, scanners, care settings, or diagnostic criteria.; Metadata-level ranking should be complemented with full-text expert review before strong claims are made.",10.1097/00005053-192401000-00002,805a972eb60a42bde44401bd4c78912c25d43cff,https://doi.org/10.1097/00005053-192401000-00002,,paper,unknown,brain; brain in title,
91,1924,Otogenic Brain Complications,G. Brat,Unknown venue,1924-09-01,0,0,8.0,General Brain Science and Reviews,,Positions Otogenic Brain Complications within General Brain Science and Reviews.,high citation signal (0),"Broad reviews can dominate citation-ranked lists while obscuring narrower empirical advances.; Taxonomy boundaries are imperfect because many brain papers combine methods, scales, and diseases.; Metadata-level ranking should be complemented with full-text expert review before strong claims are made.",10.1097/00005053-192409000-00088,af031e044e3467fb3a92a9d7953632b320db850a,https://doi.org/10.1097/00005053-192409000-00088,,paper,unknown,brain; brain in title,
92,1924,"Report of a Case of Encephalitis Lethargica, with Markedly Chocked Discs in Which a Diagnosis of Brain Tumor Was Made; Ocular Changes in Encephalitis Lethargica","D. Parmenter, R. Cheney",Unknown venue,1924-05-29,0,0,8.0,Clinical Neurology and Neurodegeneration,,"Positions Report of a Case of Encephalitis Lethargica, with Markedly Chocked Discs in Which a Diagnosis of Brain Tumor Was Made; Ocular Changes in Encephalitis Lethargica within Clinical Neurology and Neurodegeneration.",high citation signal (0),"Clinical cohorts often differ in disease stage, comorbidity, treatment history, and follow-up duration.; Biomarkers may not transfer cleanly across populations, scanners, care settings, or diagnostic criteria.; Metadata-level ranking should be complemented with full-text expert review before strong claims are made.",10.1056/NEJM192405291902205,d2a8a5e367e2fc5408578c5b4a066a017586f6c2,https://doi.org/10.1056/NEJM192405291902205,,paper,unknown,brain; brain in title,
93,1924,Roentgen Ray Treatment of Brain Tumors,Nordentoft,Unknown venue,1924-09-01,0,0,8.0,Clinical Neurology and Neurodegeneration,,Positions Roentgen Ray Treatment of Brain Tumors within Clinical Neurology and Neurodegeneration.,high citation signal (0),"Clinical cohorts often differ in disease stage, comorbidity, treatment history, and follow-up duration.; Biomarkers may not transfer cleanly across populations, scanners, care settings, or diagnostic criteria.; Metadata-level ranking should be complemented with full-text expert review before strong claims are made.",10.1097/00005053-192409000-00079,b5ce5c5620dc21c6606ecd3b7e8845a53a3f7142,https://doi.org/10.1097/00005053-192409000-00079,,paper,unknown,brain; brain in title,
94,1924,Sarcoma of Brain Simulating Lethargic Encephalitis,W. Clark,Unknown venue,1924-09-01,0,0,8.0,General Brain Science and Reviews,,Positions Sarcoma of Brain Simulating Lethargic Encephalitis within General Brain Science and Reviews.,high citation signal (0),"Broad reviews can dominate citation-ranked lists while obscuring narrower empirical advances.; Taxonomy boundaries are imperfect because many brain papers combine methods, scales, and diseases.; Metadata-level ranking should be complemented with full-text expert review before strong claims are made.",10.1097/00005053-192409000-00071,e5c04d06a615b7ed6e7fd9137e648a279769ff2a,https://doi.org/10.1097/00005053-192409000-00071,,paper,unknown,brain; brain in title,
95,1924,SHEET MICA IN BRAIN SURGERY,E. Kane,Unknown venue,1924-05-24,0,0,8.0,General Brain Science and Reviews,,Positions SHEET MICA IN BRAIN SURGERY within General Brain Science and Reviews.,high citation signal (0),"Broad reviews can dominate citation-ranked lists while obscuring narrower empirical advances.; Taxonomy boundaries are imperfect because many brain papers combine methods, scales, and diseases.; Metadata-level ranking should be complemented with full-text expert review before strong claims are made.",10.1001/JAMA.1924.02650470054032,24688ed2c58e46b47c21d53e29173bd198d81f9a,https://doi.org/10.1001/JAMA.1924.02650470054032,,paper,unknown,brain; brain in title,
96,1924,Studies in Brain Stem IV,K H Rogers,Unknown venue,1924-07-01,0,0,8.0,General Brain Science and Reviews,,Positions Studies in Brain Stem IV within General Brain Science and Reviews.,high citation signal (0),"Broad reviews can dominate citation-ranked lists while obscuring narrower empirical advances.; Taxonomy boundaries are imperfect because many brain papers combine methods, scales, and diseases.; Metadata-level ranking should be complemented with full-text expert review before strong claims are made.",10.1097/00005053-192407000-00033,c049865685bd48bb1c1b1d5fede7850647ccf31d,https://doi.org/10.1097/00005053-192407000-00033,,paper,unknown,brain; brain in title,
97,1924,THE DISCOLORATION OF BRAIN MEDIUM BY ANAEROBIC BACTERIA,"I. C. Hall, Emelia Peterson",Journal of Bacteriology,1924-05-01,0,0,12.2,General Brain Science and Reviews,non-human,Positions THE DISCOLORATION OF BRAIN MEDIUM BY ANAEROBIC BACTERIA within General Brain Science and Reviews.,high citation signal (0); open-access PDF metadata,"Broad reviews can dominate citation-ranked lists while obscuring narrower empirical advances.; Taxonomy boundaries are imperfect because many brain papers combine methods, scales, and diseases.; Non-human findings need careful translation to human brain organization and clinical outcomes.",10.1128/jb.9.3.211-224.1924,7f228964d824074287f4800de87c3b1652c95134,https://doi.org/10.1128/jb.9.3.211-224.1924,https://doi.org/10.1128/jb.9.3.211-224.1924,JournalArticle,unknown,brain; brain in title,
98,1924,The Human Brain,G. E. Smith,Nature,1924-03-01,0,0,24.2,General Brain Science and Reviews,human,Positions The Human Brain within General Brain Science and Reviews.,high citation signal (0); recognized venue; open-access PDF metadata; human evidence signal,"Broad reviews can dominate citation-ranked lists while obscuring narrower empirical advances.; Taxonomy boundaries are imperfect because many brain papers combine methods, scales, and diseases.; Human cohort effects can depend on recruitment, demographics, comorbidity, and measurement context.",10.1038/113390a0,85e54d605bc84743520285a5469a279f73b782e9,https://doi.org/10.1038/113390a0,https://www.nature.com/articles/113390a0.pdf,paper,unknown,brain; brain in title,
99,1924,"The Pliocene Age of the Brain Valley Gravels, Essex",J. W. Gregory,Geological Magazine,1924-12-01,0,0,8.0,General Brain Science and Reviews,,"Positions The Pliocene Age of the Brain Valley Gravels, Essex within General Brain Science and Reviews.",high citation signal (0),"Broad reviews can dominate citation-ranked lists while obscuring narrower empirical advances.; Taxonomy boundaries are imperfect because many brain papers combine methods, scales, and diseases.; Metadata-level ranking should be complemented with full-text expert review before strong claims are made.",10.1017/S0016756800102171,50c560f4bc9d8023c6f39d8bd1ff5d3fb628dc55,https://doi.org/10.1017/S0016756800102171,,Review,unknown,brain; brain in title,
100,1924,THE SKULL BONKS AND THE BRAIN,Tilmann,Unknown venue,1924-08-01,0,0,8.0,General Brain Science and Reviews,,Positions THE SKULL BONKS AND THE BRAIN within General Brain Science and Reviews.,high citation signal (0),"Broad reviews can dominate citation-ranked lists while obscuring narrower empirical advances.; Taxonomy boundaries are imperfect because many brain papers combine methods, scales, and diseases.; Metadata-level ranking should be complemented with full-text expert review before strong claims are made.",10.1097/00005053-192408000-00066,8138d6f29ebfd9371231d0db36e230bf3f05b663,https://doi.org/10.1097/00005053-192408000-00066,,paper,unknown,brain; brain in title,
