rank,year,title,authors,venue,publicationDate,citationCount,influentialCitationCount,importanceScore,category,keywordTags,keyIdea,strengths,limitations,doi,sourceId,url,semanticScholarUrl,openAccessPdf,githubUrl,workType,language,relevanceReason,abstract
44,1981,DSP4 (N-(2-chloroethyl)-N-ethyl-2-bromobenzylamine)--a useful denervation tool for central and peripheral noradrenaline neurons.,"G. Jonsson, H. Hallman, F. Ponzio, S. Ross",European Journal of Pharmacology,1981-06-19,465,22,118.6,"Cellular, Molecular, and Synaptic Neuroscience",,"Positions DSP4 (N-(2-chloroethyl)-N-ethyl-2-bromobenzylamine)--a useful denervation tool for central and peripheral noradrenaline neurons. within Cellular, Molecular, and Synaptic Neuroscience.",high citation signal (465),"Cellular mechanisms can be difficult to connect directly to whole-brain dynamics or human behavior.; Single-cell sampling, dissociation, alignment, and batch effects can bias inferred cell populations.; Metadata-level ranking should be complemented with full-text expert review before strong claims are made.",10.1016/0014-2999(81)90272-7,4e500fb921aba8d6d0daee7711f7892dc5621f7d,https://doi.org/10.1016/0014-2999(81)90272-7,https://www.semanticscholar.org/paper/4e500fb921aba8d6d0daee7711f7892dc5621f7d,,,JournalArticle,unknown,neuron; neuroscience term,
45,1981,The immunocytochemical localization of somatostatin-containing neurons in the rat central nervous system.,"J. Finley, J. Maderdrut, L. Roger, P. Petrusz",Neuroscience,1981-11-01,460,10,131.6,"Cellular, Molecular, and Synaptic Neuroscience",non-human,"Positions The immunocytochemical localization of somatostatin-containing neurons in the rat central nervous system. within Cellular, Molecular, and Synaptic Neuroscience.",high citation signal (460); recognized venue,"Cellular mechanisms can be difficult to connect directly to whole-brain dynamics or human behavior.; Single-cell sampling, dissociation, alignment, and batch effects can bias inferred cell populations.; Non-human findings need careful translation to human brain organization and clinical outcomes.",10.1016/0306-4522(81)90006-3,946c86e62ea4e54324336ce142710da13bd726ea,https://doi.org/10.1016/0306-4522(81)90006-3,https://www.semanticscholar.org/paper/946c86e62ea4e54324336ce142710da13bd726ea,,,JournalArticle,unknown,neuron; neuroscience term,
46,1981,Mood change following left hemispheric brain injury,"R. Robinson, B. Szetela",Annals of Neurology,1981-05-01,457,4,130.28,Clinical Neurology and Neurodegeneration,,Positions Mood change following left hemispheric brain injury within Clinical Neurology and Neurodegeneration.,high citation signal (457); recognized venue,"Clinical cohorts often differ in disease stage, comorbidity, treatment history, and follow-up duration.; Biomarkers may not transfer cleanly across populations, scanners, care settings, or diagnostic criteria.; Metadata-level ranking should be complemented with full-text expert review before strong claims are made.",10.1002/ana.410090506,2881be242eeab44f91193e8489bdb0dd991b12b4,https://doi.org/10.1002/ana.410090506,https://www.semanticscholar.org/paper/2881be242eeab44f91193e8489bdb0dd991b12b4,,,JournalArticle,unknown,brain; brain in title,
47,1981,"""Crossed cerebellar diaschisis"" in human supratentorial brain infarction.","J. Baron, M. Bousser, D. Comar, P. Castaigne",Transactions of the American Neurological Association,1981,454,16,120.57,General Brain Science and Reviews,human;non-human,"Positions ""Crossed cerebellar diaschisis"" in human supratentorial brain infarction. within General Brain Science and Reviews.",high citation signal (454); human evidence signal,"Broad reviews can dominate citation-ranked lists while obscuring narrower empirical advances.; Taxonomy boundaries are imperfect because many brain papers combine methods, scales, and diseases.; Non-human findings need careful translation to human brain organization and clinical outcomes.",,a29168c367669f96f24d51b58498be55cf4b26ce,https://www.semanticscholar.org/paper/a29168c367669f96f24d51b58498be55cf4b26ce,https://www.semanticscholar.org/paper/a29168c367669f96f24d51b58498be55cf4b26ce,,,JournalArticle,unknown,brain; brain in title,
48,1981,Neuron-specific enolase is produced by neuroendocrine tumours.,"F. Tapia, A. Barbosa, P. J. Marangos, J. Polak, S. R. Bloom, C. Dermody, et al.",The Lancet,1981-04-11,451,2,130.05,"Cellular, Molecular, and Synaptic Neuroscience",,"Positions Neuron-specific enolase is produced by neuroendocrine tumours. within Cellular, Molecular, and Synaptic Neuroscience.",high citation signal (451); recognized venue,"Cellular mechanisms can be difficult to connect directly to whole-brain dynamics or human behavior.; Single-cell sampling, dissociation, alignment, and batch effects can bias inferred cell populations.; Metadata-level ranking should be complemented with full-text expert review before strong claims are made.",10.1016/S0140-6736(81)92682-9,eb0c587468ad26b50aa2a0d39f7e0c0fa8d42326,https://doi.org/10.1016/s0140-6736(81)92682-9,https://www.semanticscholar.org/paper/eb0c587468ad26b50aa2a0d39f7e0c0fa8d42326,,,JournalArticle,unknown,neuron; neuroscience term,
49,1981,Fodrin: axonally transported polypeptides associated with the internal periphery of many cells,"J. Levine, M. Willard",Journal of Cell Biology,1981-09-01,448,10,138.13,"Cellular, Molecular, and Synaptic Neuroscience",non-human,"Fodrin (formerly designated 26 and 27) comprises two polypeptides (250,000 and 240,000 mol wt) that are axonally transported at a maximum time-averaged velocity of 40 mm/d--slower than the most rapidly moving axonally transported proteins, but faster than at least three additional groups of proteins.",high citation signal (448); recognized venue; open-access PDF metadata,"Cellular mechanisms can be difficult to connect directly to whole-brain dynamics or human behavior.; Single-cell sampling, dissociation, alignment, and batch effects can bias inferred cell populations.; Non-human findings need careful translation to human brain organization and clinical outcomes.",10.1083/jcb.90.3.631,6812ed67116caf8508fc58ee4dfdcd1f7f120eda,https://doi.org/10.1083/jcb.90.3.631,https://www.semanticscholar.org/paper/6812ed67116caf8508fc58ee4dfdcd1f7f120eda,,,JournalArticle,unknown,brain; cortical; neuron; neuroscience term,"Fodrin (formerly designated 26 and 27) comprises two polypeptides (250,000 and 240,000 mol wt) that are axonally transported at a maximum time-averaged velocity of 40 mm/d--slower than the most rapidly moving axonally transported proteins, but faster than at least three additional groups of proteins. In this communication, we report the intracellular distribution of fodrin. Fodrin was purified from guinea pig brain, and a specific antifodrin antibody was produced in rabbit and used to localize fodrin in tissue sections and cultured cells by means of indirect immunofluorescence. Fodrin antigens were highly concentrated in the cortical cytoplasm of neurons and also nonneuronal tissues (e.g., skeletal muscle, uterus, intestinal epithelium). Their disposition resembles a lining of the cell: hence, the designation fodrin (from Greek fodros, lining). In cultured fibroblasts, immunofluorescently labeled fodrin antigens were arranged in parallel arrays of bands in the plane of the plasma membrane, possibly reflecting an exclusion of labeled fodrin from some areas occupied by stress fibers. The distribution of fodrin antigens in mouse 3T3 cells transformed with simian virus 40 was more diffuse, indicating that the disposition of fodrin is responsive to altered physiological states of the cell. When mixtures of fodrin and F-actin were centrifuged, fodrin cosedimented with the actin, indicating that these proteins interact in vitro. We conclude that fodrin is a specific component of the cortical cytoplasm of many cells and consider the possibilities: (a) that fodrin may be indirectly attached to the plasma membrane via cortical actin filaments; (b) that fodrin may be mobile within the cortical cytoplasm and that, in axons, a cortical lining may be in constant motion relative to the internal cytoplasm; and (c) that fodrin could serve to link other proteins and organelles to a submembrane force-generating system."
50,1981,"Vimentin, the 57 000 molecular weight protein of fibroblast filaments, is the major cytoskeletal component in immature glia.","D. Dahl, D. Rueger, A. Bignami, K. Weber, M. Osborn",European Journal of Cell Biology,1981-06-01,448,9,123.93,"Cellular, Molecular, and Synaptic Neuroscience",,"Positions Vimentin, the 57 000 molecular weight protein of fibroblast filaments, is the major cytoskeletal component in immature glia. within Cellular, Molecular, and Synaptic Neuroscience.",high citation signal (448); recognized venue,"Cellular mechanisms can be difficult to connect directly to whole-brain dynamics or human behavior.; Single-cell sampling, dissociation, alignment, and batch effects can bias inferred cell populations.; Metadata-level ranking should be complemented with full-text expert review before strong claims are made.",,8ee3296a3ce78895c1ae9d1df659018555a8550f,https://www.semanticscholar.org/paper/8ee3296a3ce78895c1ae9d1df659018555a8550f,https://www.semanticscholar.org/paper/8ee3296a3ce78895c1ae9d1df659018555a8550f,,,JournalArticle,unknown,glia,
51,1981,Production of a specific antiserum to rat brain glutamic acid decarboxylase by injection of an antigen-antibody complex.,"W. Oertel, D. Schmechel, M. Tappaz, I. Kopin",Neuroscience,1981-12-01,429,11,130.35,General Brain Science and Reviews,non-human,Positions Production of a specific antiserum to rat brain glutamic acid decarboxylase by injection of an antigen-antibody complex. within General Brain Science and Reviews.,high citation signal (429); recognized venue,"Broad reviews can dominate citation-ranked lists while obscuring narrower empirical advances.; Taxonomy boundaries are imperfect because many brain papers combine methods, scales, and diseases.; Non-human findings need careful translation to human brain organization and clinical outcomes.",10.1016/0306-4522(81)90113-5,c40a69069f67262cab833c7078c5acf9c9ccd731,https://doi.org/10.1016/0306-4522(81)90113-5,https://www.semanticscholar.org/paper/c40a69069f67262cab833c7078c5acf9c9ccd731,,,JournalArticle,unknown,brain; brain in title,
52,1981,Cerebral Amyloid Angiopathy in the Elderly,M. Tomonaga,Journal of The American Geriatrics Society,1981-04-01,418,26,110.68,General Brain Science and Reviews,,Positions Cerebral Amyloid Angiopathy in the Elderly within General Brain Science and Reviews.,high citation signal (418),"Broad reviews can dominate citation-ranked lists while obscuring narrower empirical advances.; Taxonomy boundaries are imperfect because many brain papers combine methods, scales, and diseases.; Metadata-level ranking should be complemented with full-text expert review before strong claims are made.",10.1111/j.1532-5415.1981.tb01757.x,9afd7f4f2fe20d6d42bdfa6f8e0bc854379a3085,https://doi.org/10.1111/j.1532-5415.1981.tb01757.x,https://www.semanticscholar.org/paper/9afd7f4f2fe20d6d42bdfa6f8e0bc854379a3085,,,JournalArticle,unknown,cerebral,
53,1981,Transplanted adrenal chromaffin cells in rat brain reduce lesion-induced rotational behaviour,"W. Freed, J. Morihisa, E. Spoor, B. Hoffer, L. Olson, A. Seiger, et al.",Nature,1981-07-23,414,5,129.71,General Brain Science and Reviews,non-human,Positions Transplanted adrenal chromaffin cells in rat brain reduce lesion-induced rotational behaviour within General Brain Science and Reviews.,high citation signal (414); recognized venue,"Broad reviews can dominate citation-ranked lists while obscuring narrower empirical advances.; Taxonomy boundaries are imperfect because many brain papers combine methods, scales, and diseases.; Non-human findings need careful translation to human brain organization and clinical outcomes.",10.1038/292351A0,be28aacc176db1b85e8443fa0a34597e650e1c1f,https://doi.org/10.1038/292351a0,https://www.semanticscholar.org/paper/be28aacc176db1b85e8443fa0a34597e650e1c1f,,,JournalArticle,unknown,brain; brain in title,
54,1981,Immunohistochemical mapping of vitamin D-dependent calcium-binding protein in brain,"S. S. Jande, Leonard Maler, D. Lawson",Nature,1981-12-24,411,3,128.38,General Brain Science and Reviews,,Positions Immunohistochemical mapping of vitamin D-dependent calcium-binding protein in brain within General Brain Science and Reviews.,high citation signal (411); recognized venue,"Broad reviews can dominate citation-ranked lists while obscuring narrower empirical advances.; Taxonomy boundaries are imperfect because many brain papers combine methods, scales, and diseases.; Metadata-level ranking should be complemented with full-text expert review before strong claims are made.",10.1038/294765A0,c46e566022126bb78d7eec7106f2e8ce347f09d5,https://doi.org/10.1038/294765a0,https://www.semanticscholar.org/paper/c46e566022126bb78d7eec7106f2e8ce347f09d5,,,JournalArticle,unknown,brain; brain in title,
55,1981,Adsorption of divalent cations to bilayer membranes containing phosphatidylserine,"Nancy Mulrine, G. Vaio",The Journal of General Physiology,1981-04-01,411,20,114.58,General Brain Science and Reviews,non-human,"The Stern equation, a combination of the Langmuir adsorption isotherm, the Boltzmann relation, and the Grahame equation from the theory of the diffuse double layer, provides a simple theoretical framework for describing the adsorption of charged molecules to surfaces.",high citation signal (411); open-access PDF metadata,"Broad reviews can dominate citation-ranked lists while obscuring narrower empirical advances.; Taxonomy boundaries are imperfect because many brain papers combine methods, scales, and diseases.; Non-human findings need careful translation to human brain organization and clinical outcomes.",10.1085/jgp.77.4.445,658ecfed00d097d15572b6a280169318c68d64f6,https://doi.org/10.1085/jgp.77.4.445,https://www.semanticscholar.org/paper/658ecfed00d097d15572b6a280169318c68d64f6,,,JournalArticle,unknown,brain,"The Stern equation, a combination of the Langmuir adsorption isotherm, the Boltzmann relation, and the Grahame equation from the theory of the diffuse double layer, provides a simple theoretical framework for describing the adsorption of charged molecules to surfaces. The ability of this equation to describe the adsorption of divalent cations to membranes containing brain phosphatidylserine (PS) was tested in the following manner. Charge reversal measurements were first made to determine the intrinsic 1:1 association constants of the divalent cations with the anionic PS molecules: when the net charge of a PS vesicle is zero one-half of the available sites are occupied by divalent cations. The intrinsic association constant, therefore, is equal to the reciprocal of the divalent cation concentration at which the mobility of a PS vesicle reverses sign. The Stern equation with this association constant is capable of accurately describing both the zeta potential data obtained with PS vesicles at other concentrations of the divalent cations and the data obtained with with vesicles formed from mixtures of PS and zwitterionic phospholipids. Independent measurements of the number of ions adsorbed to sonicated PS vesicles were made with a calcium-sensitive electrode. The results agreed with the zeta potential results obtained with multilamellar vesicles. When membranes are formed at 20 degrees C in 0.1 M NaCl, the intrinsic 1:1 association constants of Ni, Co, Mn, Ba, Sr, Ca, and Mg with PS are 40, 28, 25, 20, 14, 12, and 8 M-1, respectively."
56,1981,Brain Lactic Acidosis and Ischemic Cell Damage: 2. Histopathology,"H. Kalimo, S. Rehncrona, B. Söderfeldt, Y. Olsson, B. Siesjö",Journal of Cerebral Blood Flow and Metabolism,1981-09-01,410,1,119.33,"Cerebrovascular, Metabolism, and Brain Injury",,"Positions Brain Lactic Acidosis and Ischemic Cell Damage: 2. Histopathology within Cerebrovascular, Metabolism, and Brain Injury.",high citation signal (410); open-access PDF metadata,"Acute injury studies can be sensitive to timing, severity, comorbidity, and treatment heterogeneity.; Animal models may not capture human vascular risk, injury complexity, or rehabilitation context.; Metadata-level ranking should be complemented with full-text expert review before strong claims are made.",10.1038/jcbfm.1981.35,6819ff3c7bfd4b53ebdc842dcd8cb300a144f3db,https://doi.org/10.1038/jcbfm.1981.35,https://www.semanticscholar.org/paper/6819ff3c7bfd4b53ebdc842dcd8cb300a144f3db,,,JournalArticle,unknown,brain; brain in title,
57,1981,Immunocytochemical localization of glutamate decarboxylase in rat cerebellum with a new antiserum.,"W. Oertel, D. Schmechel, E. Mugnaini, M. Tappaz, I. Kopin",Neuroscience,1981-12-01,409,9,123.49,General Brain Science and Reviews,non-human,Positions Immunocytochemical localization of glutamate decarboxylase in rat cerebellum with a new antiserum. within General Brain Science and Reviews.,high citation signal (409); recognized venue,"Broad reviews can dominate citation-ranked lists while obscuring narrower empirical advances.; Taxonomy boundaries are imperfect because many brain papers combine methods, scales, and diseases.; Non-human findings need careful translation to human brain organization and clinical outcomes.",10.1016/0306-4522(81)90115-9,e4997749d5ae282f2b72c3206ceca80fc79a509a,https://doi.org/10.1016/0306-4522(81)90115-9,https://www.semanticscholar.org/paper/e4997749d5ae282f2b72c3206ceca80fc79a509a,,,JournalArticle,unknown,cerebellum,
58,1981,"Cerebral radionecrosis: incidence and risk in relation to dose, time, fractionation and volume.","J. Marks, R. Bagĺan, Satish C. Prassad, W. Blank","International Journal of Radiation Oncology, Biology, Physics",1981-02-01,406,5,110.16,General Brain Science and Reviews,,"Positions Cerebral radionecrosis: incidence and risk in relation to dose, time, fractionation and volume. within General Brain Science and Reviews.",high citation signal (406),"Broad reviews can dominate citation-ranked lists while obscuring narrower empirical advances.; Taxonomy boundaries are imperfect because many brain papers combine methods, scales, and diseases.; Metadata-level ranking should be complemented with full-text expert review before strong claims are made.",10.1016/0360-3016(81)90443-0,ddb7be79a5baf2149cc56181b168587be289e781,https://doi.org/10.1016/0360-3016(81)90443-0,https://www.semanticscholar.org/paper/ddb7be79a5baf2149cc56181b168587be289e781,,,JournalArticle; CaseReport,unknown,cerebral,
59,1981,Reticulo-cortical activity and behavior: A critique of the arousal theory and a new synthesis,"C. H. Vanderwolf, T. Robinson",Behavioral and Brain Sciences,1981-09-01,406,3,122.16,Cognitive and Systems Neuroscience,,Positions Reticulo-cortical activity and behavior: A critique of the arousal theory and a new synthesis within Cognitive and Systems Neuroscience.,high citation signal (406); recognized venue,"Task designs can simplify cognition enough that ecological validity becomes uncertain.; Cross-species alignment between circuits, behavior, and subjective experience remains imperfect.; Metadata-level ranking should be complemented with full-text expert review before strong claims are made.",10.1017/S0140525X00009869,131340e98b55cd1475f4ce8eb31df8dc4487caa8,https://doi.org/10.1017/s0140525x00009869,https://www.semanticscholar.org/paper/131340e98b55cd1475f4ce8eb31df8dc4487caa8,,,paper,unknown,cortical,
60,1981,Transport and Metabolism of Glutamate and Gaba in Neurons and Glial Cells,A. Schousboe,Unknown venue,1981,405,7,118.11,"Cellular, Molecular, and Synaptic Neuroscience",,"Positions Transport and Metabolism of Glutamate and Gaba in Neurons and Glial Cells within Cellular, Molecular, and Synaptic Neuroscience.",high citation signal (405),"Cellular mechanisms can be difficult to connect directly to whole-brain dynamics or human behavior.; Single-cell sampling, dissociation, alignment, and batch effects can bias inferred cell populations.; Metadata-level ranking should be complemented with full-text expert review before strong claims are made.",10.1016/S0074-7742(08)60289-5,482b55ed32233c63879e8cb32ec69dc1b8b98418,https://doi.org/10.1016/s0074-7742(08)60289-5,https://www.semanticscholar.org/paper/482b55ed32233c63879e8cb32ec69dc1b8b98418,,,paper,unknown,neuron; glia; neuroscience term,
61,1981,"Antibodies to neurofilament, glial filament, and fibroblast intermediate filament proteins bind to different cell types of the nervous system","S. Yen, K. L. Fields",Journal of Cell Biology,1981-01-01,402,2,139.38,"Cellular, Molecular, and Synaptic Neuroscience",human;non-human,"Antisera were raised to the 210,000-dalton and the 49,000-dalton proteins of a fraction enriched in intermediate (10 nm) filaments from human brain.",high citation signal (402); recognized venue; open-access PDF metadata; human evidence signal,"Cellular mechanisms can be difficult to connect directly to whole-brain dynamics or human behavior.; Single-cell sampling, dissociation, alignment, and batch effects can bias inferred cell populations.; Non-human findings need careful translation to human brain organization and clinical outcomes.",10.1083/jcb.88.1.115,3dc3db5de3eb7ab509f04d4a3157032c932b17b7,https://doi.org/10.1083/jcb.88.1.115,https://www.semanticscholar.org/paper/3dc3db5de3eb7ab509f04d4a3157032c932b17b7,,,JournalArticle,unknown,brain; neuron; cerebellum; glia; neuroscience term,"Antisera were raised to the 210,000-dalton and the 49,000-dalton proteins of a fraction enriched in intermediate (10 nm) filaments from human brain. Proteins of the filament preparation were separated by SDS- polyacrylamide gel electrophoresis and used for immunization and subsequent analysis of the reactions of the sera by rocket immunoelectrophoresis. Anti-210,000-dalton serum precipitated proteins of molecular weights 210,000, 160,000, and 68,000, and, thus, reacted with all the neurofilament triplet components. Anti-49,000-dalton serum did not react with the triplet proteins but precipitated the 49,000- dalton protein. By immunofluorescence on tissue sections, anti-210,000- dalton serum bound to neuronal axons in sciatic nerve and cerebellum. In dissociated cell cultures, rat dorsal root ganglion cells and their processes bound the serum, whereas nonneuronal cells did not. Some cultured cerebellar neurons were also positive, whereas astrocytes were not. At the ultrastructural level, anti-210,000-dalton serum bound to intermediate filaments inside axonal processes. Anti-49,000-dalton serum bound to astrocytes in sections of the cerebellum, and cultured astrocytes had filaments that stained, whereas other cell types did not. In sciatic nerve sections, elements stained with this serum, but cultured cells from newborn sciatic nerve were negative. An antiserum against the 58,000-dalton protein of the cytoskeleton of NIL-8 fibroblasts strongly stained sciatic nerve sections, binding to Schwann cells but not to axons or to myelin. In cerebellar sections, astrocytes were positive, as were blood vessels and cells in the pia. In cell cultures, anti-58,000-dalton serum stained filaments inside Schwann cells, fibroblasts, and astrocytes, but neurons were negative. Cells in the cultures and tissue sections of the nervous system failed to react with antiserum to the 58,000-dalton protein of skin intermediate filaments. In these studies, astrocytes in vivo and in culture were the only cells which had antigens related to two classes of intermediate filaments."
62,1981,"Analysis of thick brain sections by obverse-reverse computer microscopy: application of a new, high clarity Golgi-Nissl stain.","Edmund M. Glaser, Edmund M. Glaser, Hendrik Van der Loos, Hendrik Van der Loos",Journal of Neuroscience Methods,1981-08-01,402,11,127.98,General Brain Science and Reviews,,"Positions Analysis of thick brain sections by obverse-reverse computer microscopy: application of a new, high clarity Golgi-Nissl stain. within General Brain Science and Reviews.",high citation signal (402); recognized venue,"Broad reviews can dominate citation-ranked lists while obscuring narrower empirical advances.; Taxonomy boundaries are imperfect because many brain papers combine methods, scales, and diseases.; Metadata-level ranking should be complemented with full-text expert review before strong claims are made.",10.1016/0165-0270(81)90045-5,b54ad514527085ea3595536c0e158481c2f5ee93,https://doi.org/10.1016/0165-0270(81)90045-5,https://www.semanticscholar.org/paper/b54ad514527085ea3595536c0e158481c2f5ee93,,,JournalArticle,unknown,brain; brain in title,
