rank,year,title,authors,venue,publicationDate,citationCount,influentialCitationCount,importanceScore,category,keywordTags,keyIdea,strengths,limitations,doi,sourceId,url,openAccessPdf,githubUrl,workType,language,relevanceReason,abstract
45,1985,"Spatial EEG patterns, non-linear dynamics and perception: the neo-Sherringtonian view.","W. Freeman, C. Skarda",Brain Research,1985-12-01,559,14,152.5,"Cellular, Molecular, and Synaptic Neuroscience",EEG;non-human;stimulation,Spatial analysis with preamplifier arrays and computers offers fresh perspectives on brain function.,high citation signal (559); recognized venue; open-access PDF metadata,"Cellular mechanisms can be difficult to connect directly to whole-brain dynamics or human behavior.; Single-cell sampling, dissociation, alignment, and batch effects can bias inferred cell populations.; Non-human findings need careful translation to human brain organization and clinical outcomes.",10.1016/0165-0173(85)90022-0,c38a0f653fba479343b9e6779c21183020bbe5fe,https://doi.org/10.1016/0165-0173(85)90022-0,https://escholarship.org/content/qt08d8g56h/qt08d8g56h.pdf?t=mi9rol,,Review; JournalArticle,unknown,brain; cerebral; cortex; cortical; neural; synapse; eeg; neuroscience term,"Spatial analysis with preamplifier arrays and computers offers fresh perspectives on brain function. Realization of its potential depends on development of appropriate procedures for data processing and display, experimental paradigms to serve as benchmarks, and theories of brain function to predict what to look for and how to distinguish valid results from artifacts. Measurement of EEGs from arrays of 64 electrodes chronically implanted on the olfactory bulbs of rabbits that are trained to discriminate odorant conditioned stimuli show that the odorants induce spatially distinctive amplitude patterns of neural activity. The odor-specific information density is inferred to be uniform over the whole main bulb. The neural dynamics that produce these activity patterns emerge from the synaptically interactive sheet of excitatory mitral and inhibitory granule cells with distributed input and output tracts and with static nonlinearities deriving from the nerve impulse mechanism. Excitatory synapses between mitral cells are subject to modification when odorants are paired with unconditioned stimuli, thus forming nerve cell assemblies. Odorant-specific information established by a stimulus locally in the bulbar unit activity is integrated with past experience by an assembly, disseminated over the entire bulb on the order of 100 mm2 in area in a time period of 2.5 ms, and sustained for a time period on the order of 0.1 s. An arbitrary spatial sample on the order of 20% of bulbar EEG activity captures the entire integrated information albeit at lesser resolution than the whole. This synaptic mechanism of local input and global output may be common to all of the cerebral cortex. The implications are discussed for neocortical sensory systems, motor pattern generators, and goal-directed behavior in the context of self-organizing non-linear dynamic systems."
46,1985,"Molecular pharmacology of 5-HT1 and 5-HT2 recognition sites in rat and pig brain membranes: radioligand binding studies with [3H]5-HT, [3H]8-OH-DPAT, (-)[125I]iodocyanopindolol, [3H]mesulergine and [3H]ketanserin.","D. Hoyer, G. Engel, H. Kalkman",European Journal of Pharmacology,1985-11-26,558,13,126.27,"EEG, MEG, and Electrophysiology",ECoG;non-human,"Positions Molecular pharmacology of 5-HT1 and 5-HT2 recognition sites in rat and pig brain membranes: radioligand binding studies with [3H]5-HT, [3H]8-OH-DPAT, (-)[125I]iodocyanopindolol, [3H]mesulergine and [3H]ketanserin. within EEG, MEG, and Electrophysiology.",high citation signal (558),"Low signal-to-noise ratio, artifacts, and source-localization uncertainty complicate interpretation.; Many studies rely on controlled tasks and may not generalize to everyday behavior or clinical monitoring.; Non-human findings need careful translation to human brain organization and clinical outcomes.",10.1016/0014-2999(85)90658-2,c633f847517b5a3320720357e27c5654d063d1e9,https://doi.org/10.1016/0014-2999(85)90658-2,,,JournalArticle,unknown,brain; ecog; brain in title,
47,1985,Cerebral intracellular pH by 31P nuclear magnetic resonance spectroscopy,"O. Petroff, J. Prichard, K. Behar, J. Alger, J. D. den Hollander, R. Shulman",Neurology,1985-06-01,552,14,128.88,Neuroimaging and Brain Mapping,MRI,Positions Cerebral intracellular pH by 31P nuclear magnetic resonance spectroscopy within Neuroimaging and Brain Mapping.,high citation signal (552); recognized venue,"Scanner, protocol, site, and preprocessing variation can limit reproducibility across cohorts.; Associational imaging biomarkers often need stronger longitudinal or intervention evidence before causal claims are made.; Imaging conclusions can depend on acquisition, preprocessing, and model specification.",10.1212/WNL.35.6.781,01803bf294cee5b5cf41a749ce582784ec842e68,https://doi.org/10.1212/WNL.35.6.781,,,JournalArticle; Study,unknown,cerebral,
48,1985,"The primate premotor cortex: past, present, and preparatory.",S. Wise,Annual Review of Neuroscience,1985,545,14,134.65,General Brain Science and Reviews,non-human,"Positions The primate premotor cortex: past, present, and preparatory. within General Brain Science and Reviews.",high citation signal (545); recognized venue,"Broad reviews can dominate citation-ranked lists while obscuring narrower empirical advances.; Taxonomy boundaries are imperfect because many brain papers combine methods, scales, and diseases.; Non-human findings need careful translation to human brain organization and clinical outcomes.",10.1146/ANNUREV.NE.08.030185.000245,1bd0a550e95cd98c9b4640aa2e43f4bafa810b21,https://doi.org/10.1146/ANNUREV.NE.08.030185.000245,,,Review; JournalArticle,unknown,cortex; neuroscience term,
49,1985,Architecture and Connections of Cortical Association Areas,"D. Pandya, E. Yeterian",Unknown venue,1985,539,19,115.25,General Brain Science and Reviews,,Positions Architecture and Connections of Cortical Association Areas within General Brain Science and Reviews.,high citation signal (539),"Broad reviews can dominate citation-ranked lists while obscuring narrower empirical advances.; Taxonomy boundaries are imperfect because many brain papers combine methods, scales, and diseases.; Metadata-level ranking should be complemented with full-text expert review before strong claims are made.",10.1007/978-1-4757-9619-3_1,fb5a2135ffda8d5cccad6aae5bf047ccd4d2fde6,https://doi.org/10.1007/978-1-4757-9619-3_1,,,paper,unknown,cortical,
50,1985,EEG quantitation of narcotic effect: the comparative pharmacodynamics of fentanyl and alfentanil.,"J. Scott, K. V. Ponganis, D. Stanski",Anesthesiology,1985-03-01,538,18,120.61,"EEG, MEG, and Electrophysiology",EEG;non-human,"Positions EEG quantitation of narcotic effect: the comparative pharmacodynamics of fentanyl and alfentanil. within EEG, MEG, and Electrophysiology.",high citation signal (538); open-access PDF metadata,"Low signal-to-noise ratio, artifacts, and source-localization uncertainty complicate interpretation.; Many studies rely on controlled tasks and may not generalize to everyday behavior or clinical monitoring.; Non-human findings need careful translation to human brain organization and clinical outcomes.",10.1097/00000542-198503000-00005,7c9e3cb2adfbd9a5cefe1a42922c3c50142389c5,https://doi.org/10.1097/00000542-198503000-00005,https://pubs.asahq.org/anesthesiology/article-pdf/62/3/234/309648/0000542-198503000-00005.pdf,,JournalArticle; Study,unknown,eeg,
51,1985,The vasopressinergic innervation of the brain in normal and castrated rats,"G. Devries, R. M. Buijs, F. V. Leeuwen, A. R. Caffé, Dick F. Swaab",The Journal of comparative neurology,1985-03-08,537,17,137.38,Clinical Neurology and Neurodegeneration,non-human,Positions The vasopressinergic innervation of the brain in normal and castrated rats within Clinical Neurology and Neurodegeneration.,high citation signal (537); recognized venue; open-access PDF metadata,"Clinical cohorts often differ in disease stage, comorbidity, treatment history, and follow-up duration.; Biomarkers may not transfer cleanly across populations, scanners, care settings, or diagnostic criteria.; Non-human findings need careful translation to human brain organization and clinical outcomes.",10.1002/CNE.902330206,e9f1cb2a2021328854accab76b1c96284265d4a7,https://doi.org/10.1002/CNE.902330206,https://pure.knaw.nl/portal/files/489895/14756_285_swaab.pdf,,JournalArticle,unknown,brain; brain in title,
52,1985,The central neural connections of the area postrema of the rat,"R. Shapiro, R. Miselis",The Journal of comparative neurology,1985-04-15,531,23,128.18,Clinical Neurology and Neurodegeneration,non-human,Positions The central neural connections of the area postrema of the rat within Clinical Neurology and Neurodegeneration.,high citation signal (531); recognized venue,"Clinical cohorts often differ in disease stage, comorbidity, treatment history, and follow-up duration.; Biomarkers may not transfer cleanly across populations, scanners, care settings, or diagnostic criteria.; Non-human findings need careful translation to human brain organization and clinical outcomes.",10.1002/cne.902340306,4e5e3a9b252a0ade3c483aa902c90c9b8bc10d47,https://doi.org/10.1002/cne.902340306,,,JournalArticle,unknown,neural,
53,1985,A sexually dimorphic nucleus in the human brain.,"D. Swaab, E. Fliers",Science,1985-05-31,509,11,133.42,General Brain Science and Reviews,human,Positions A sexually dimorphic nucleus in the human brain. within General Brain Science and Reviews.,high citation signal (509); recognized venue; human evidence signal,"Broad reviews can dominate citation-ranked lists while obscuring narrower empirical advances.; Taxonomy boundaries are imperfect because many brain papers combine methods, scales, and diseases.; Human cohort effects can depend on recruitment, demographics, comorbidity, and measurement context.",10.1126/SCIENCE.3992248,15de3c6210f378e521162947f949dcec05ea39fe,https://doi.org/10.1126/SCIENCE.3992248,,,JournalArticle; Study,unknown,brain; brain in title,
54,1985,Specific in vitro and in vivo binding of 3H-raclopride. A potent substituted benzamide drug with high affinity for dopamine D-2 receptors in the rat brain.,"C. Köhler, Håkan Hall, Sven Ove Ögren, L. Gawell",Biochemical Pharmacology,1985-07-01,503,23,121.21,General Brain Science and Reviews,non-human,Positions Specific in vitro and in vivo binding of 3H-raclopride. A potent substituted benzamide drug with high affinity for dopamine D-2 receptors in the rat brain. within General Brain Science and Reviews.,high citation signal (503),"Broad reviews can dominate citation-ranked lists while obscuring narrower empirical advances.; Taxonomy boundaries are imperfect because many brain papers combine methods, scales, and diseases.; Non-human findings need careful translation to human brain organization and clinical outcomes.",10.1016/0006-2952(85)90778-6,963629374fa79fd056755fe0dfebbe4fa0328dd2,https://doi.org/10.1016/0006-2952(85)90778-6,,,JournalArticle,unknown,brain; brain in title,
55,1985,Distinct monoamine oxidase A and B populations in primate brain.,"K. Westlund, R. Denney, L. Kochersperger, R. M. Rose, C. Abell",Science,1985-10-11,499,6,133.06,General Brain Science and Reviews,non-human,Positions Distinct monoamine oxidase A and B populations in primate brain. within General Brain Science and Reviews.,high citation signal (499); recognized venue,"Broad reviews can dominate citation-ranked lists while obscuring narrower empirical advances.; Taxonomy boundaries are imperfect because many brain papers combine methods, scales, and diseases.; Non-human findings need careful translation to human brain organization and clinical outcomes.",10.1126/SCIENCE.3875898,05b4ca5a637e0243ff6127ff9387fcf74caf042a,https://doi.org/10.1126/SCIENCE.3875898,,,JournalArticle,unknown,brain; brain in title,
56,1985,Protein kinases in the brain.,"Angus C. Naira, H. Hemmings, P. Greengard",Annual Review of Biochemistry,1985,495,4,119.72,General Brain Science and Reviews,,Positions Protein kinases in the brain. within General Brain Science and Reviews.,high citation signal (495),"Broad reviews can dominate citation-ranked lists while obscuring narrower empirical advances.; Taxonomy boundaries are imperfect because many brain papers combine methods, scales, and diseases.; Metadata-level ranking should be complemented with full-text expert review before strong claims are made.",10.1146/ANNUREV.BI.54.070185.004435,be3fc68a1e1dd96c6561767d50553ebda358e860,https://doi.org/10.1146/ANNUREV.BI.54.070185.004435,,,Review; JournalArticle,unknown,brain; brain in title,
57,1985,Studies of the earliest generated cells of the cat's visual cortex: cogeneration of subplate and marginal zones,"M. Luskin, C. Shatz",Journal of Neuroscience,1985-04-01,494,14,141.08,Cognitive and Systems Neuroscience,human;non-human,The earliest generated cells of the cat's telencephalon that may play a role in the formation of the primary visual cortex are the subject of this study.,high citation signal (494); recognized venue; open-access PDF metadata; human evidence signal,"Task designs can simplify cognition enough that ecological validity becomes uncertain.; Cross-species alignment between circuits, behavior, and subjective experience remains imperfect.; Non-human findings need careful translation to human brain organization and clinical outcomes.",10.1523/JNEUROSCI.05-04-01062.1985,586e94314826ce18e375d6cfb93d4609d43cea09,https://doi.org/10.1523/JNEUROSCI.05-04-01062.1985,https://www.jneurosci.org/content/jneuro/5/4/1062.full.pdf,,JournalArticle; Study,unknown,brain; cortex; cortical; neuroscience term,"The earliest generated cells of the cat's telencephalon that may play a role in the formation of the primary visual cortex are the subject of this study. Using [3H]thymidine autoradiography, we have found that these cells are generated between embryonic day 24 (E24) and E30 (gestation is 65 days) and that they are present in very low numbers in the white matter of the adult brain. These cells are rarely labeled by injections made after E30, when the cells destined for the cortical layers are generated. Examination of the labeling pattern in the fetal brain 10 days or more after administration of [3H]thymidine between E24 and E30 revealed a bistratified distribution of these early generated cells. Labeled cells were found in large numbers in two embryonic zones flanking the developing cortical plate: above in the marginal zone and below in the subplate. (Some if not all of the marginal zone cells constitute the population of Cajal-Retzius cells of the cat's telencephalon.). These experiments indicate that cells of the subplate and marginal zones are cogenerated in time during the days just preceding the genesis of the cortical plate. We also examined the distribution of the early generated cells shortly after their genesis-- on E30, a time when cells of the cortical plate are just being generated at the ventricular zone. In this case, the labeling pattern at the occipital pole was not bistratified. Rather, labeled cells were situated within a single zone extending from the pial surface inward to the border of the ventricular zone. This finding indicates that the cells of the subplate and marginal zones are generated as a contiguous population that is subsequently split apart by the insertion of cells forming the cortical plate. A comparison between the number of early generated cells found in fetal and newborn brains with that found in adult brains suggests that these cells are generated initially in substantial numbers but then largely disappear during early postnatal life, since injections of [3H]thymidine between E24 and E30 yielded large numbers of labeled cells in the white matter and layer 1 at birth, but very few at 2 months postnatal. This significant loss contrasted with the results from injections made just a few days later (E33) that resulted in large numbers of labeled cells in cortical layer 6 not only at birth but also in adulthood."
58,1985,Chemoarchitecture of the Brain,R. Nieuwenhuys,Springer Berlin Heidelberg,1985,489,20,119.5,General Brain Science and Reviews,,Positions Chemoarchitecture of the Brain within General Brain Science and Reviews.,high citation signal (489),"Broad reviews can dominate citation-ranked lists while obscuring narrower empirical advances.; Taxonomy boundaries are imperfect because many brain papers combine methods, scales, and diseases.; Metadata-level ranking should be complemented with full-text expert review before strong claims are made.",10.1007/978-3-642-70426-0,26013dabfae9c16a207b267bfde181cf1bebbe82,https://doi.org/10.1007/978-3-642-70426-0,,,Review,unknown,brain; brain in title,
59,1985,"Apolipoprotein E mRNA is abundant in the brain and adrenals, as well as in the liver, and is present in other peripheral tissues of rats and marmosets.","N. Elshourbagy, W S Liao, R. Mahley, John M. TAYLORt",Proceedings of the National Academy of Sciences of the United States of America,1985,481,4,135.4,General Brain Science and Reviews,non-human,"Positions Apolipoprotein E mRNA is abundant in the brain and adrenals, as well as in the liver, and is present in other peripheral tissues of rats and marmosets. within General Brain Science and Reviews.",high citation signal (481); recognized venue; open-access PDF metadata,"Broad reviews can dominate citation-ranked lists while obscuring narrower empirical advances.; Taxonomy boundaries are imperfect because many brain papers combine methods, scales, and diseases.; Non-human findings need careful translation to human brain organization and clinical outcomes.",10.1073/PNAS.82.1.203,42560cc681b5439e84d9df95cbf49572f9a3a1f4,https://doi.org/10.1073/PNAS.82.1.203,https://doi.org/10.1073/pnas.82.1.203,,JournalArticle,unknown,brain; brain in title,
60,1985,Corticopontine projection in the macaque: The distribution of labelled cortical cells after large injections of horseradish peroxidase in the pontine nuclei,"M. Glickstein, J. May, B. Mercier",The Journal of comparative neurology,1985-05-15,479,11,126.33,Clinical Neurology and Neurodegeneration,non-human,Positions Corticopontine projection in the macaque: The distribution of labelled cortical cells after large injections of horseradish peroxidase in the pontine nuclei within Clinical Neurology and Neurodegeneration.,high citation signal (479); recognized venue,"Clinical cohorts often differ in disease stage, comorbidity, treatment history, and follow-up duration.; Biomarkers may not transfer cleanly across populations, scanners, care settings, or diagnostic criteria.; Non-human findings need careful translation to human brain organization and clinical outcomes.",10.1002/cne.902350306,413168d06880189303c6cf6c41c0dee57d149d09,https://doi.org/10.1002/cne.902350306,,,JournalArticle,unknown,cortical,
61,1985,Cellular Origin of Ischemia-Induced Glutamate Release from Brain Tissue In Vivo and In Vitro,"J. Drejer, H. Benveniste, N. Diemer, A. Schousboe",Journal of Neurochemistry,1985-07-01,477,9,119.05,"Cerebrovascular, Metabolism, and Brain Injury",,"Positions Cellular Origin of Ischemia-Induced Glutamate Release from Brain Tissue In Vivo and In Vitro within Cerebrovascular, Metabolism, and Brain Injury.",high citation signal (477),"Acute injury studies can be sensitive to timing, severity, comorbidity, and treatment heterogeneity.; Animal models may not capture human vascular risk, injury complexity, or rehabilitation context.; Metadata-level ranking should be complemented with full-text expert review before strong claims are made.",10.1111/j.1471-4159.1985.tb05486.x,2fe50bbab247cc6f609c882b425b40c8550931cf,https://doi.org/10.1111/j.1471-4159.1985.tb05486.x,,,JournalArticle,unknown,brain; brain in title,
62,1985,"Reduction, Qualia, and the Direct Introspection of Brain States",P. Churchland,Unknown venue,1985,477,13,119.05,General Brain Science and Reviews,,"Positions Reduction, Qualia, and the Direct Introspection of Brain States within General Brain Science and Reviews.",high citation signal (477),"Broad reviews can dominate citation-ranked lists while obscuring narrower empirical advances.; Taxonomy boundaries are imperfect because many brain papers combine methods, scales, and diseases.; Metadata-level ranking should be complemented with full-text expert review before strong claims are made.",10.2307/2026509,859f31c15b339f388e1b84ab2d420d3ddffcbf3e,https://doi.org/10.2307/2026509,,,Review,unknown,brain; brain in title,
63,1985,Selective neuronal vulnerability: morphological and molecular characteristics.,W. Pulsinelli,Progress in Brain Research,1985,468,9,130.71,"Cellular, Molecular, and Synaptic Neuroscience",,"Positions Selective neuronal vulnerability: morphological and molecular characteristics. within Cellular, Molecular, and Synaptic Neuroscience.",high citation signal (468); recognized venue,"Cellular mechanisms can be difficult to connect directly to whole-brain dynamics or human behavior.; Single-cell sampling, dissociation, alignment, and batch effects can bias inferred cell populations.; Metadata-level ranking should be complemented with full-text expert review before strong claims are made.",10.1016/S0079-6123(08)61973-1,b2e63a64fbc2d3318315de6e4810db971d7b9588,https://doi.org/10.1016/S0079-6123(08)61973-1,,,JournalArticle,unknown,neuron; neuroscience term,
64,1985,Identification of scrapie prion protein-specific mRNA in scrapie-infected and uninfected brain,"B. Chesebro, R. Race, K. Wehrly, J. Nishio, M. Bloom, D. Lechner, et al.",Nature,1985-05-23,467,6,130.67,General Brain Science and Reviews,,Positions Identification of scrapie prion protein-specific mRNA in scrapie-infected and uninfected brain within General Brain Science and Reviews.,high citation signal (467); recognized venue,"Broad reviews can dominate citation-ranked lists while obscuring narrower empirical advances.; Taxonomy boundaries are imperfect because many brain papers combine methods, scales, and diseases.; Metadata-level ranking should be complemented with full-text expert review before strong claims are made.",10.1038/315331A0,94252fbb0253c4e2622b2ed5bb504ad94625e35a,https://doi.org/10.1038/315331A0,,,JournalArticle,unknown,brain; brain in title,
65,1985,Organization of cerebral cortical afferent systems in the rat. II. Hypothalamocortical projections,C. Saper,The Journal of comparative neurology,1985-07-01,463,15,127.72,Clinical Neurology and Neurodegeneration,non-human,Positions Organization of cerebral cortical afferent systems in the rat. II. Hypothalamocortical projections within Clinical Neurology and Neurodegeneration.,high citation signal (463); recognized venue,"Clinical cohorts often differ in disease stage, comorbidity, treatment history, and follow-up duration.; Biomarkers may not transfer cleanly across populations, scanners, care settings, or diagnostic criteria.; Non-human findings need careful translation to human brain organization and clinical outcomes.",10.1002/cne.902370103,851890a86b918d35753d5d159076b5c89815f9a9,https://doi.org/10.1002/cne.902370103,,,JournalArticle,unknown,cerebral; cortical,
