rank,year,title,authors,venue,publicationDate,citationCount,influentialCitationCount,importanceScore,category,keywordTags,keyIdea,strengths,limitations,doi,sourceId,url,semanticScholarUrl,openAccessPdf,githubUrl,workType,language,relevanceReason,abstract
26,1981,Immunocytochemical demonstration of vimentin in astrocytes and ependymal cells of developing and adult mouse nervous system,"J. Schnitzer, W. Franke, M. Schachner",Journal of Cell Biology,1981-08-01,637,18,149.65,"Cellular, Molecular, and Synaptic Neuroscience",human;non-human,"The occurrence of vimentin, a specific intermediate filament protein, has been studied by immunoflourescence microscopy in tissue of adult and embryonic brain as well as in cell cultures from nervous tissue.",high citation signal (637); recognized venue; open-access PDF metadata; human evidence signal,"Cellular mechanisms can be difficult to connect directly to whole-brain dynamics or human behavior.; Single-cell sampling, dissociation, alignment, and batch effects can bias inferred cell populations.; Non-human findings need careful translation to human brain organization and clinical outcomes.",10.1083/jcb.90.2.435,29f88b4b263dde8bc291e5d38f063ca66aa72551,https://doi.org/10.1083/jcb.90.2.435,https://www.semanticscholar.org/paper/29f88b4b263dde8bc291e5d38f063ca66aa72551,,,JournalArticle; Study,unknown,brain; neuron; neural; cerebellum; glia; neuroscience term,"The occurrence of vimentin, a specific intermediate filament protein, has been studied by immunoflourescence microscopy in tissue of adult and embryonic brain as well as in cell cultures from nervous tissue. By double imminofluorescence labeling, the distribution of vimentin has been compared with that of subunit proteins of other types of intermediate filaments (glial fibrillary acidic [GFA] protein, neurofilament protein, prekeratin) and other cell-type specific markers (fibronectin, tetanus toxin receptor, 04 antigen). In adult brain tissue, vimentin is found not only in fibroblasts and cells of larger blood vessels but also in ependymal cells and astrocytes. In embryonic brain tissue, vimentin is detectable as early as embryonic day 11, the earliest stage tested, and is located in radial fibers spanning the neural tube, in ventricular cells, and in blood vessels. At all stages tested, oligodendrocytes and neurons do not express detectable amounts of vimentin. In primary cultures of early postnatal mouse cerebellum, a coincident location of vimentin and GFA protein is seen in astrocytes, and both types of filament proteins are included in the perinuclear aggregates formed upon exposure of the cells to colcemid. In cerebellar cell cultures of embryonic-day-13 mice, vimentin is seen in various cell types of epithelioid or fibroblastlike morphology but is absent from cells expressing tetanus toxin receptors. Among these embryonic, vimentin-positive cells, a certain cell type reacting neither with tetanus toxin nor with antibodies to fibronectin or GFA protein has been tentatively identified as precursor to more mature astrocytes. The results show that, in the neuroectoderm, vimentin is a specific marker for astrocytes and ependymal cells. It is expressed in the mouse in astrocytes and glial precursors well before the onset of GFA protein expression and might therefore serve as an early marker of glial differentiation. Our results show that vimentin and GFA protein coexist in one cell type not only in primary cultures in vitro but also in the intact tissue in situ."
27,1981,Regional cerebral oxygen supply and utilization in dementia. A clinical and physiological study with oxygen-15 and positron tomography.,"R. Frackowiak, C. Pozzilli, N. Legg, G. Duboulay, J. Marshall, G. Lenzi, et al.",Brain : a journal of neurology,1981-12-01,635,7,131.39,Clinical Neurology and Neurodegeneration,human,Positions Regional cerebral oxygen supply and utilization in dementia. A clinical and physiological study with oxygen-15 and positron tomography. within Clinical Neurology and Neurodegeneration.,high citation signal (635); recognized venue; human evidence signal,"Clinical cohorts often differ in disease stage, comorbidity, treatment history, and follow-up duration.; Biomarkers may not transfer cleanly across populations, scanners, care settings, or diagnostic criteria.; Human cohort effects can depend on recruitment, demographics, comorbidity, and measurement context.",10.1093/brain/104.4.753,dfa6cf6b9142b1dfd4f920c33ddd80bdacb6a809,https://doi.org/10.1093/brain/104.4.753,https://www.semanticscholar.org/paper/dfa6cf6b9142b1dfd4f920c33ddd80bdacb6a809,,,JournalArticle; Review,unknown,cerebral,
28,1981,Discrimination of Multiple [3H]5-Hydroxytryptamine Binding Sites by the Neuroleptic Spiperone in Rat Brain,"N. Pedigo, H. Yamamura, D. Nelson",Journal of Neurochemistry,1981-01-01,624,5,125.08,General Brain Science and Reviews,non-human,Positions Discrimination of Multiple [3H]5-Hydroxytryptamine Binding Sites by the Neuroleptic Spiperone in Rat Brain within General Brain Science and Reviews.,high citation signal (624),"Broad reviews can dominate citation-ranked lists while obscuring narrower empirical advances.; Taxonomy boundaries are imperfect because many brain papers combine methods, scales, and diseases.; Non-human findings need careful translation to human brain organization and clinical outcomes.",10.1111/j.1471-4159.1981.tb02397.x,af293a15bf896a32e7b46b711b4c62cf5e4f3ff6,https://doi.org/10.1111/j.1471-4159.1981.tb02397.x,https://www.semanticscholar.org/paper/af293a15bf896a32e7b46b711b4c62cf5e4f3ff6,,,JournalArticle; Study,unknown,brain; brain in title,
29,1981,Brain Lactic Acidosis and Ischemic Cell Damage: 1. Biochemistry and Neurophysiology,"S. Rehncrona, I. Rosén, B. Siesjö",Journal of Cerebral Blood Flow and Metabolism,1981-09-01,601,5,126.2,"Cerebrovascular, Metabolism, and Brain Injury",,"Positions Brain Lactic Acidosis and Ischemic Cell Damage: 1. Biochemistry and Neurophysiology within Cerebrovascular, Metabolism, and Brain Injury.",high citation signal (601); open-access PDF metadata,"Acute injury studies can be sensitive to timing, severity, comorbidity, and treatment heterogeneity.; Animal models may not capture human vascular risk, injury complexity, or rehabilitation context.; Metadata-level ranking should be complemented with full-text expert review before strong claims are made.",10.1038/jcbfm.1981.34,8390f6ce9cbe0176a9a4a492e0546dfc637afa53,https://doi.org/10.1038/jcbfm.1981.34,https://www.semanticscholar.org/paper/8390f6ce9cbe0176a9a4a492e0546dfc637afa53,,,JournalArticle,unknown,brain; brain in title,
30,1981,"Demonstration and characterization of Ia-positive dendritic cells in the interstitial connective tissues of rat heart and other tissues, but not brain","By, Hart, John, Fabre",Journal of Experimental Medicine,1981-08-01,597,9,127.28,General Brain Science and Reviews,non-human,"In this study, we have used a mouse monoclonal antibody to rat Ia (RT1- B or class II) antigens to demonstrate, by immunofluorescence on frozen sections, intensely Ia-positive dendritic cells in the interstitial connective tissues of every tissue we have examined (heart, liver, thyroid, pancreas, skin, kidney, ureter, and bladder) with the striking exception of brain.",high citation signal (597); open-access PDF metadata,"Broad reviews can dominate citation-ranked lists while obscuring narrower empirical advances.; Taxonomy boundaries are imperfect because many brain papers combine methods, scales, and diseases.; Non-human findings need careful translation to human brain organization and clinical outcomes.",10.1084/jem.154.2.347,4cb46d6fa767a4d8bdf49e619ee62022b7186325,https://doi.org/10.1084/jem.154.2.347,https://www.semanticscholar.org/paper/4cb46d6fa767a4d8bdf49e619ee62022b7186325,https://europepmc.org/articles/pmc2186417?pdf=render,,JournalArticle,unknown,brain; brain in title,"In this study, we have used a mouse monoclonal antibody to rat Ia (RT1- B or class II) antigens to demonstrate, by immunofluorescence on frozen sections, intensely Ia-positive dendritic cells in the interstitial connective tissues of every tissue we have examined (heart, liver, thyroid, pancreas, skin, kidney, ureter, and bladder) with the striking exception of brain. The characteristics of the interstitial dendritic cell found in heart were studied in detail, and this cell was shown to be negative for acid phosphatase, beta-glucuronidase, and ATPase activity, and certainly some and probably all of the cells were negative for nonspecific esterase activity. Experiments with colloidal carbon suggested that the cell was either poorly or not at all phagocytic. The cells were negative for surface immunoglobulin and the W3/13 antigen, but positive for the leukocyte common antigen and the SD (Class I) antigens of the major histocompatibility complex. The cell was shown to be of bone marrow origin, and either the cell itself, or more probably its precursor, was shown to be sensitive to irradiation and to cyclophosphamide. All strains tested--including the nude rat-- had large numbers of interstitial dendritic cells. The widespread distribution, except in brain, of this cell, which resembles in every respect the dendritic cell described by Steinman et al. (4) in the spleen and lymph nodes of the mouse, is of interest, and the implications in this finding are discussed."
31,1981,Regional pattern of degeneration in Alzheimer's disease: neuronal loss and histopathological grading,"A. Brun, E. Englund",Histopathology,1981-09-01,590,10,124.07,"Cellular, Molecular, and Synaptic Neuroscience",non-human,"Positions Regional pattern of degeneration in Alzheimer's disease: neuronal loss and histopathological grading within Cellular, Molecular, and Synaptic Neuroscience.",high citation signal (590),"Cellular mechanisms can be difficult to connect directly to whole-brain dynamics or human behavior.; Single-cell sampling, dissociation, alignment, and batch effects can bias inferred cell populations.; Non-human findings need careful translation to human brain organization and clinical outcomes.",10.1111/j.1365-2559.1981.tb01818.x,792789132f01a9902d8ec2b7790a9223d17b97c6,https://doi.org/10.1111/j.1365-2559.1981.tb01818.x,https://www.semanticscholar.org/paper/792789132f01a9902d8ec2b7790a9223d17b97c6,,,JournalArticle,unknown,neuron; neuroscience term,
32,1981,Intracerebral metastases in solid-tumor patients: Natural history and results of treatment,"S. Zimm, G. Wampler, D. Stablein, T. Hazra, H. Young",Cancer,1981-07-15,581,17,120.8,Clinical Neurology and Neurodegeneration,human,Positions Intracerebral metastases in solid-tumor patients: Natural history and results of treatment within Clinical Neurology and Neurodegeneration.,high citation signal (581); open-access PDF metadata; human evidence signal,"Clinical cohorts often differ in disease stage, comorbidity, treatment history, and follow-up duration.; Biomarkers may not transfer cleanly across populations, scanners, care settings, or diagnostic criteria.; Human cohort effects can depend on recruitment, demographics, comorbidity, and measurement context.",10.1002/1097-0142(19810715)48:2<384::AID-CNCR2820480227>3.0.CO;2-8,27ad7292ff83ed28af7469081244161f40d9fc35,https://doi.org/10.1002/1097-0142(19810715)48:2<384::aid-cncr2820480227>3.0.co;2-8,https://www.semanticscholar.org/paper/27ad7292ff83ed28af7469081244161f40d9fc35,,,JournalArticle; Review,unknown,cerebral,
33,1981,Extracellular ion concentrations during spreading depression and ischemia in the rat brain cortex.,"A. Hansen, T. Zeuthen",Acta Physiologica Scandinavica,1981-12-01,558,28,131.07,"Cerebrovascular, Metabolism, and Brain Injury",non-human,"Positions Extracellular ion concentrations during spreading depression and ischemia in the rat brain cortex. within Cerebrovascular, Metabolism, and Brain Injury.",high citation signal (558),"Acute injury studies can be sensitive to timing, severity, comorbidity, and treatment heterogeneity.; Animal models may not capture human vascular risk, injury complexity, or rehabilitation context.; Non-human findings need careful translation to human brain organization and clinical outcomes.",10.1111/J.1748-1716.1981.TB06920.X,11d56cf8621ca2cf888f3bdd378fcaa9e7160c1a,https://doi.org/10.1111/j.1748-1716.1981.tb06920.x,https://www.semanticscholar.org/paper/11d56cf8621ca2cf888f3bdd378fcaa9e7160c1a,,,JournalArticle,unknown,brain; cortex; brain in title; neuroscience term,
34,1981,"Diffuse cerebral swelling following head injuries in children: the syndrome of ""malignant brain edema"".","D. Bruce, A. Alavi, L. Bilaniuk, C. Dolinskas, W. Obrist, B. Uzzell",Journal of Neurosurgery,1981-02-01,555,20,124.97,"Brain Development, Plasticity, and Connectomics",human,"Positions Diffuse cerebral swelling following head injuries in children: the syndrome of ""malignant brain edema"". within Brain Development, Plasticity, and Connectomics.",high citation signal (555); human evidence signal,"Developmental and aging studies are sensitive to cohort composition, attrition, and longitudinal sampling intervals.; Network measures can depend heavily on parcellation, thresholding, and acquisition choices.; Human cohort effects can depend on recruitment, demographics, comorbidity, and measurement context.",10.3171/JNS.1981.54.2.0170,aa34c6f584e43d32e265faa8c535deba85f4b14c,https://doi.org/10.3171/jns.1981.54.2.0170,https://www.semanticscholar.org/paper/aa34c6f584e43d32e265faa8c535deba85f4b14c,,,JournalArticle; Review,unknown,brain; cerebral; brain in title,
35,1981,Biochemical evidence for glutamate as neurotransmitter in corticostriatal and corticothalamic fibres in rat brain.,"F. Fonnum, J. Storm-Mathisen, I. Divac",Neuroscience,1981-05-01,550,7,134.81,General Brain Science and Reviews,non-human,Positions Biochemical evidence for glutamate as neurotransmitter in corticostriatal and corticothalamic fibres in rat brain. within General Brain Science and Reviews.,high citation signal (550); recognized venue,"Broad reviews can dominate citation-ranked lists while obscuring narrower empirical advances.; Taxonomy boundaries are imperfect because many brain papers combine methods, scales, and diseases.; Non-human findings need careful translation to human brain organization and clinical outcomes.",10.1016/0306-4522(81)90168-8,4861ad4c633780c93c5af87293915121e678cbe8,https://doi.org/10.1016/0306-4522(81)90168-8,https://www.semanticscholar.org/paper/4861ad4c633780c93c5af87293915121e678cbe8,,,JournalArticle,unknown,brain; brain in title,
36,1981,Organization of ascending serotonin systems in the adult rat brain. A radioautographic study after intraventricular administration of [3H]5-hydroxytryptamine.,"A. Parent, L. Descarries, A. Beaudet",Neuroscience,1981-02-01,541,7,135.71,General Brain Science and Reviews,human;non-human,Positions Organization of ascending serotonin systems in the adult rat brain. A radioautographic study after intraventricular administration of [3H]5-hydroxytryptamine. within General Brain Science and Reviews.,high citation signal (541); recognized venue; human evidence signal,"Broad reviews can dominate citation-ranked lists while obscuring narrower empirical advances.; Taxonomy boundaries are imperfect because many brain papers combine methods, scales, and diseases.; Non-human findings need careful translation to human brain organization and clinical outcomes.",10.1016/0306-4522(81)90050-6,312a69118c62bbefc8f5c8c51b89cd9f28e9c6a3,https://doi.org/10.1016/0306-4522(81)90050-6,https://www.semanticscholar.org/paper/312a69118c62bbefc8f5c8c51b89cd9f28e9c6a3,,,JournalArticle,unknown,brain; brain in title,
37,1981,Brain aging correlates: retardation by hormonal-pharmacological treatments.,"P. Landfield, R. Baskin, T. A. Pitler",Science,1981-10-30,540,6,133.28,"Brain Development, Plasticity, and Connectomics",,"Positions Brain aging correlates: retardation by hormonal-pharmacological treatments. within Brain Development, Plasticity, and Connectomics.",high citation signal (540); recognized venue,"Developmental and aging studies are sensitive to cohort composition, attrition, and longitudinal sampling intervals.; Network measures can depend heavily on parcellation, thresholding, and acquisition choices.; Metadata-level ranking should be complemented with full-text expert review before strong claims are made.",10.1126/SCIENCE.6270791,387cca9375f10863c7db643e0c913a1fb9662859,https://doi.org/10.1126/science.6270791,https://www.semanticscholar.org/paper/387cca9375f10863c7db643e0c913a1fb9662859,,,JournalArticle,unknown,brain; brain in title,
38,1981,Identification of a synaptic vesicle-specific membrane protein with a wide distribution in neuronal and neurosecretory tissue,"W. Matthew, L. Tsavaler, L. Reichardt",Journal of Cell Biology,1981-10-01,530,18,144.35,"Cellular, Molecular, and Synaptic Neuroscience",ECoG;non-human,"Two different monoclonal antibodies, characterized initially as binding synaptic terminal regions of rat brain, bind a 65,000-dalton protein, which is exposed on the outer surface of brain synaptic vesicles.",high citation signal (530); recognized venue; open-access PDF metadata,"Cellular mechanisms can be difficult to connect directly to whole-brain dynamics or human behavior.; Single-cell sampling, dissociation, alignment, and batch effects can bias inferred cell populations.; Non-human findings need careful translation to human brain organization and clinical outcomes.",10.1083/jcb.91.1.257,2ce138f267e80ecee42ffa8873413b27b5074af6,https://doi.org/10.1083/jcb.91.1.257,https://www.semanticscholar.org/paper/2ce138f267e80ecee42ffa8873413b27b5074af6,,,JournalArticle; Study,unknown,brain; neuron; neural; ecog; neuroscience term,"Two different monoclonal antibodies, characterized initially as binding synaptic terminal regions of rat brain, bind a 65,000-dalton protein, which is exposed on the outer surface of brain synaptic vesicles. Immunocytochemical experiments at the electron microscope level demonstrate that these antibodies bind the vesicles in many different types of nerve terminals. The antibodies have been used successfully to purify synaptic vesicles from crude brain homogenates by immunoprecipitation onto the surface of polyacrylamide beads. The profiles of the structures precipitated by these beads are almost exclusively vesicular, confirming the vesicle-specificity of the antibodies. In SDS gels, the antibodies bind a single protein of 65,000 daltons. The two antibodies are not identical, but compete for binding sites on this protein. Immune competition experiments also demonstrate that the antigenic components on the 65,000-dalton protein are widely distributed in neuronal and neural secretory tissues. Detectable antigen is not found in uninnervated tissue--blood cells and extrajunctional muscle. Low levels are found in nonneural secretory tissues; it is not certain whether this reflects the presence of low amounts of the antigen on all the exocytotic vesicles in these tissues or whether the antigen is found only in neuronal fibers within these tissues. The molecular weight and at least two antigenic determinants of the 65,000-dalton protein are highly conserved throughout vertebrate phylogeny. The two antibodies recognize a 65,000-dalton protein present in shark, amphibia, birds, and mammals. The highly conserved nature of the determinants on this protein and their specific localization on secretory vesicles of many different types suggest that this protein may be essential for the normal function of neuronal secretory vesicles."
39,1981,"Application of high performance liquid chromatography with electrochemical detection to neurochemical analysis: measurement of catecholamines, serotonin and metabolites in rat brain.",I. Mefford,Journal of Neuroscience Methods,1981-02-01,520,4,133.8,General Brain Science and Reviews,non-human,"Positions Application of high performance liquid chromatography with electrochemical detection to neurochemical analysis: measurement of catecholamines, serotonin and metabolites in rat brain. within General Brain Science and Reviews.",high citation signal (520); recognized venue,"Broad reviews can dominate citation-ranked lists while obscuring narrower empirical advances.; Taxonomy boundaries are imperfect because many brain papers combine methods, scales, and diseases.; Non-human findings need careful translation to human brain organization and clinical outcomes.",10.1016/0165-0270(81)90056-X,01c628f7eaf65251cd0d74ace40a45f7fd53a75e,https://doi.org/10.1016/0165-0270(81)90056-x,https://www.semanticscholar.org/paper/01c628f7eaf65251cd0d74ace40a45f7fd53a75e,,,Review; JournalArticle,unknown,brain; brain in title,
40,1981,Transcriptional regulation of the mouse metallothionein-I gene by heavy metals.,"D. Durnam, R. Palmiter",Journal of Biological Chemistry,1981-06-10,511,5,118.49,General Brain Science and Reviews,non-human,"Administration of Cd, Zn, Cu, or Hg increases the rate of transcription from the metallothionein-I gene in mouse liver and kidney.",high citation signal (511); open-access PDF metadata,"Broad reviews can dominate citation-ranked lists while obscuring narrower empirical advances.; Taxonomy boundaries are imperfect because many brain papers combine methods, scales, and diseases.; Non-human findings need careful translation to human brain organization and clinical outcomes.",10.1016/s0021-9258(19)69264-1,3f69b5a1ce55a8aed07bb1724fff0d603284b494,https://doi.org/10.1016/s0021-9258(19)69264-1,https://www.semanticscholar.org/paper/3f69b5a1ce55a8aed07bb1724fff0d603284b494,,,JournalArticle; Study,unknown,brain,"Administration of Cd, Zn, Cu, or Hg increases the rate of transcription from the metallothionein-I gene in mouse liver and kidney. Maximal transcription rates occur 1 h after Cd administration in both tissues. Metallothionein-I mRNA levels, measured by cDNA hybridization, and metallothionein protein synthesis, measured by [35S]cysteine incorporation, increase simultaneously, reaching maximal levels about 4 h after Cd administration. Cd also induces metallothionein-I mRNA in all other tissues examined (spleen, heart, skeletal muscle, brain, and intestine) except testes. Comparison of the inductions by Cd and Hg shows that the kinetics of metallothionein-I mRNA accumulation as well as the stability of the resultant metallothioneins differ."
41,1981,Nuclear magnetic resonance imaging of the brain in multiple sclerosis.,"I. Young, A. S. Hall, C. Pallis, G. Bydder, N. Legg, R. Steiner",The Lancet,1981-11-14,507,8,134.55,Clinical Neurology and Neurodegeneration,MRI;human,Positions Nuclear magnetic resonance imaging of the brain in multiple sclerosis. within Clinical Neurology and Neurodegeneration.,high citation signal (507); recognized venue; human evidence signal,"Clinical cohorts often differ in disease stage, comorbidity, treatment history, and follow-up duration.; Biomarkers may not transfer cleanly across populations, scanners, care settings, or diagnostic criteria.; Human cohort effects can depend on recruitment, demographics, comorbidity, and measurement context.",10.1016/S0140-6736(81)91273-3,d415ccabb9f3058353001e7ec205eec75855cc23,https://doi.org/10.1016/s0140-6736(81)91273-3,https://www.semanticscholar.org/paper/d415ccabb9f3058353001e7ec205eec75855cc23,,,JournalArticle; ClinicalTrial; Study,unknown,brain; brain in title,
42,1981,Light-microscopic immunocytochemical localization of tyrosine hydroxylase in prenatal rat brain. II. Late ontogeny,"L. Specht, V. Pickel, T. Joh, D. Reis",The Journal of comparative neurology,1981-06-20,504,7,133.24,Clinical Neurology and Neurodegeneration,non-human,Positions Light-microscopic immunocytochemical localization of tyrosine hydroxylase in prenatal rat brain. II. Late ontogeny within Clinical Neurology and Neurodegeneration.,high citation signal (504); recognized venue,"Clinical cohorts often differ in disease stage, comorbidity, treatment history, and follow-up duration.; Biomarkers may not transfer cleanly across populations, scanners, care settings, or diagnostic criteria.; Non-human findings need careful translation to human brain organization and clinical outcomes.",10.1002/cne.901990208,821dcaba0ecefc1801454c8c1f04cdf29fee553c,https://doi.org/10.1002/cne.901990208,https://www.semanticscholar.org/paper/821dcaba0ecefc1801454c8c1f04cdf29fee553c,,,JournalArticle,unknown,brain; brain in title,
43,1981,Calcium-binding protein parvalbumin as a neuronal marker,"M. Celio, C. Heizmann",Nature,1981-09-24,478,5,131.09,"Cellular, Molecular, and Synaptic Neuroscience",,"Positions Calcium-binding protein parvalbumin as a neuronal marker within Cellular, Molecular, and Synaptic Neuroscience.",high citation signal (478); recognized venue,"Cellular mechanisms can be difficult to connect directly to whole-brain dynamics or human behavior.; Single-cell sampling, dissociation, alignment, and batch effects can bias inferred cell populations.; Metadata-level ranking should be complemented with full-text expert review before strong claims are made.",10.1038/293300A0,53d4d8996c69a13e094737e673816ad3585a5d2a,https://doi.org/10.1038/293300a0,https://www.semanticscholar.org/paper/53d4d8996c69a13e094737e673816ad3585a5d2a,,,JournalArticle,unknown,neuron; neuroscience term,
