rank,year,title,authors,venue,publicationDate,citationCount,influentialCitationCount,importanceScore,category,keywordTags,keyIdea,strengths,limitations,doi,sourceId,url,openAccessPdf,githubUrl,workType,language,relevanceReason,abstract
1,1985,Two receptor systems for corticosterone in rat brain: microdistribution and differential occupation.,"J. Reul, E. R. Kloet",Endocrinology,1985-12-01,2707,41,151.47,General Brain Science and Reviews,non-human,Positions Two receptor systems for corticosterone in rat brain: microdistribution and differential occupation. within General Brain Science and Reviews.,"high citation signal (2,707)","Broad reviews can dominate citation-ranked lists while obscuring narrower empirical advances.; Taxonomy boundaries are imperfect because many brain papers combine methods, scales, and diseases.; Non-human findings need careful translation to human brain organization and clinical outcomes.",10.1210/ENDO-117-6-2505,81d9daa29cf3b7df606e9c293269d1c0e16b490f,https://doi.org/10.1210/ENDO-117-6-2505,,,JournalArticle,unknown,brain; brain in title,
2,1985,Epilepsy and the functional anatomy of the human brain,"W. Penfield, H. Jasper",Unknown venue,1985,2116,30,147.04,Clinical Neurology and Neurodegeneration,human,Positions Epilepsy and the functional anatomy of the human brain within Clinical Neurology and Neurodegeneration.,"high citation signal (2,116); human evidence signal","Clinical cohorts often differ in disease stage, comorbidity, treatment history, and follow-up duration.; Biomarkers may not transfer cleanly across populations, scanners, care settings, or diagnostic criteria.; Human cohort effects can depend on recruitment, demographics, comorbidity, and measurement context.",,70c53af9eae2eab8c60b70e42ca42aaa47bf5ff9,https://www.semanticscholar.org/paper/70c53af9eae2eab8c60b70e42ca42aaa47bf5ff9,,,paper,unknown,brain; brain in title,
3,1985,Quantitative autoradiographic mapping of serotonin receptors in the rat brain. I. Serotonin-1 receptors.,"Á. Pazos, J. Palacios",Brain Research,1985-11-04,1858,47,156.7,General Brain Science and Reviews,non-human,Positions Quantitative autoradiographic mapping of serotonin receptors in the rat brain. I. Serotonin-1 receptors. within General Brain Science and Reviews.,"high citation signal (1,858); recognized venue","Broad reviews can dominate citation-ranked lists while obscuring narrower empirical advances.; Taxonomy boundaries are imperfect because many brain papers combine methods, scales, and diseases.; Non-human findings need careful translation to human brain organization and clinical outcomes.",10.1016/0006-8993(85)90856-X,fdb8e682df2d6234c00041b60828de508bea4651,https://doi.org/10.1016/0006-8993(85)90856-X,,,JournalArticle,unknown,brain; brain in title,
4,1985,Graphical Evaluation of Blood-to-Brain Transfer Constants from Multiple-Time Uptake Data. Generalizations,"C. Patlak, R. Blasberg",Journal of Cerebral Blood Flow and Metabolism,1985-12-01,1772,54,145.65,"Cerebrovascular, Metabolism, and Brain Injury",,"Positions Graphical Evaluation of Blood-to-Brain Transfer Constants from Multiple-Time Uptake Data. Generalizations within Cerebrovascular, Metabolism, and Brain Injury.","high citation signal (1,772); open-access PDF metadata","Acute injury studies can be sensitive to timing, severity, comorbidity, and treatment heterogeneity.; Animal models may not capture human vascular risk, injury complexity, or rehabilitation context.; Metadata-level ranking should be complemented with full-text expert review before strong claims are made.",10.1038/jcbfm.1985.87,d74c3d3f3ef3879f6ddc101ad790e5ae4732d399,https://doi.org/10.1038/jcbfm.1985.87,https://journals.sagepub.com/doi/pdf/10.1038/jcbfm.1985.87,,JournalArticle,unknown,brain; brain in title,
5,1985,Current source-density method and application in cat cerebral cortex: investigation of evoked potentials and EEG phenomena.,U. Mitzdorf,Physiological Reviews,1985,1752,140,147.64,"EEG, MEG, and Electrophysiology",EEG,"Positions Current source-density method and application in cat cerebral cortex: investigation of evoked potentials and EEG phenomena. within EEG, MEG, and Electrophysiology.","high citation signal (1,752)","Low signal-to-noise ratio, artifacts, and source-localization uncertainty complicate interpretation.; Many studies rely on controlled tasks and may not generalize to everyday behavior or clinical monitoring.; Metadata-level ranking should be complemented with full-text expert review before strong claims are made.",10.1152/PHYSREV.1985.65.1.37,fc3681ef39409c0a02be2b5729ed62a5d679a6b8,https://doi.org/10.1152/PHYSREV.1985.65.1.37,,,Review; JournalArticle,unknown,cerebral; cortex; eeg; neuroscience term,
6,1985,Limbic seizure and brain damage produced by kainic acid: mechanisms and relevance to human temporal lobe epilepsy.,Y. Ben-Ari,Neuroscience,1985-02-01,1742,59,155.54,General Brain Science and Reviews,human,Positions Limbic seizure and brain damage produced by kainic acid: mechanisms and relevance to human temporal lobe epilepsy. within General Brain Science and Reviews.,"high citation signal (1,742); recognized venue; human evidence signal","Broad reviews can dominate citation-ranked lists while obscuring narrower empirical advances.; Taxonomy boundaries are imperfect because many brain papers combine methods, scales, and diseases.; Human cohort effects can depend on recruitment, demographics, comorbidity, and measurement context.",10.1016/0306-4522(85)90299-4,421aff7da83c500add85cab838e255a65b3b8534,https://doi.org/10.1016/0306-4522(85)90299-4,,,Review; JournalArticle; Study,unknown,brain; brain in title,
7,1985,The distribution of tau in the mammalian central nervous system,"L. Binder, A. Frankfurter, L. Rebhun",Journal of Cell Biology,1985-10-01,1525,36,160.15,"Cellular, Molecular, and Synaptic Neuroscience",non-human,We have determined the biochemical and immunocytochemical localization of the heterogeneous microtubule-associated protein tau using a monoclonal antibody that binds to all of the tau polypeptides in both bovine and rat brain.,"high citation signal (1,525); recognized venue; open-access PDF metadata","Cellular mechanisms can be difficult to connect directly to whole-brain dynamics or human behavior.; Single-cell sampling, dissociation, alignment, and batch effects can bias inferred cell populations.; Non-human findings need careful translation to human brain organization and clinical outcomes.",10.1083/jcb.101.4.1371,a05fdf29472de7f028eb675e4cf3ffd71ec8b324,https://doi.org/10.1083/jcb.101.4.1371,https://rupress.org/jcb/article-pdf/101/4/1371/1052196/1371.pdf,,JournalArticle; Study,unknown,brain; neuron; glia; neuroscience term,"We have determined the biochemical and immunocytochemical localization of the heterogeneous microtubule-associated protein tau using a monoclonal antibody that binds to all of the tau polypeptides in both bovine and rat brain. Using immunoblot assays and competitive enzyme- linked immunosorbent assays, we have shown tau to be more abundant in bovine white matter extracts and microtubules than in extracts and microtubules from an enriched gray matter region of the brain. On a per mole basis, twice-cycled microtubules from white matter contained three times more tau than did twice-cycled microtubules from gray matter. Immunohistochemical studies that compared the localization of tau with that of MAP2 and tubulin demonstrated that tau was restricted to axons, extending the results of the biochemical studies. Tau localization was not observed in glia, which indicated that, at least in brain, tau is neuron specific. These observations indicate that tau may help define a subpopulation of microtubules that is restricted to axons. Furthermore, the monoclonal antibody described in this report should prove very useful to investigators studying axonal sprouting and growth because it is an exclusive axonal marker."
8,1985,"Amplification, enhanced expression and possible rearrangement of EGF receptor gene in primary human brain tumours of glial origin","T. Libermann, Harris R. Nusbaum, N. Razon, R. Kris, I. Lax, H. Soreq, et al.",Nature,1985-01-10,1524,32,155.14,"Cellular, Molecular, and Synaptic Neuroscience",human,"Positions Amplification, enhanced expression and possible rearrangement of EGF receptor gene in primary human brain tumours of glial origin within Cellular, Molecular, and Synaptic Neuroscience.","high citation signal (1,524); recognized venue; human evidence signal","Cellular mechanisms can be difficult to connect directly to whole-brain dynamics or human behavior.; Single-cell sampling, dissociation, alignment, and batch effects can bias inferred cell populations.; Human cohort effects can depend on recruitment, demographics, comorbidity, and measurement context.",10.1038/313144A0,80b86fc638a04c9d9d395f1674450bd19c3fd510,https://doi.org/10.1038/313144A0,,,JournalArticle,unknown,brain; glia; brain in title,
9,1985,Effect of anoxia on ion distribution in the brain.,A. Hansen,Physiological Reviews,1985,1376,87,141.1,General Brain Science and Reviews,,Positions Effect of anoxia on ion distribution in the brain. within General Brain Science and Reviews.,"high citation signal (1,376); open-access PDF metadata","Broad reviews can dominate citation-ranked lists while obscuring narrower empirical advances.; Taxonomy boundaries are imperfect because many brain papers combine methods, scales, and diseases.; Metadata-level ranking should be complemented with full-text expert review before strong claims are made.",10.1152/PHYSREV.1985.65.1.101,e56a4f89c6e95a6a647692ad07bbfcf4b8af955a,https://doi.org/10.1152/PHYSREV.1985.65.1.101,https://journals.physiology.org/doi/pdf/10.1152/physrev.1985.65.1.101,,Review; JournalArticle; Study,unknown,brain; brain in title,
10,1985,Developmental dyslexia: Four consecutive patients with cortical anomalies,"A. Galaburda, G. Sherman, G. Rosen, F. Aboitiz, N. Geschwind",Annals of Neurology,1985-08-01,1310,47,144.41,Clinical Neurology and Neurodegeneration,human,Positions Developmental dyslexia: Four consecutive patients with cortical anomalies within Clinical Neurology and Neurodegeneration.,"high citation signal (1,310); recognized venue; human evidence signal","Clinical cohorts often differ in disease stage, comorbidity, treatment history, and follow-up duration.; Biomarkers may not transfer cleanly across populations, scanners, care settings, or diagnostic criteria.; Human cohort effects can depend on recruitment, demographics, comorbidity, and measurement context.",10.1002/ANA.410180210,cdd2d044207d0d8c024f555ef07759049a566dbe,https://doi.org/10.1002/ANA.410180210,,,JournalArticle; CaseReport,unknown,cortical,
11,1985,"Parkinsonism-inducing neurotoxin, N-methyl-4-phenyl-1,2,3,6 -tetrahydropyridine: uptake of the metabolite N-methyl-4-phenylpyridine by dopamine neurons explains selective toxicity.","J. Javitch, R. D'Amato, S. Strittmatter, S. Snyder",Proceedings of the National Academy of Sciences of the United States of America,1985-04-01,1295,35,152.01,"Cellular, Molecular, and Synaptic Neuroscience",,"Positions Parkinsonism-inducing neurotoxin, N-methyl-4-phenyl-1,2,3,6 -tetrahydropyridine: uptake of the metabolite N-methyl-4-phenylpyridine by dopamine neurons explains selective toxicity. within Cellular, Molecular, and Synaptic Neuroscience.","high citation signal (1,295); recognized venue; open-access PDF metadata","Cellular mechanisms can be difficult to connect directly to whole-brain dynamics or human behavior.; Single-cell sampling, dissociation, alignment, and batch effects can bias inferred cell populations.; Metadata-level ranking should be complemented with full-text expert review before strong claims are made.",10.1073/PNAS.82.7.2173,ee2971aafef27ae7dec55733ac559a1fb7bd6172,https://doi.org/10.1073/PNAS.82.7.2173,https://doi.org/10.1073/pnas.82.7.2173,,JournalArticle,unknown,neuron; neuroscience term,
12,1985,"Inhibition of NADH-linked oxidation in brain mitochondria by 1-methyl-4-phenyl-pyridine, a metabolite of the neurotoxin, 1-methyl-4-phenyl-1,2,5,6-tetrahydropyridine.","W. Nicklas, Ivy Vyas, R. Heikkila",Life Science,1985-07-01,1282,30,148.83,General Brain Science and Reviews,,"Positions Inhibition of NADH-linked oxidation in brain mitochondria by 1-methyl-4-phenyl-pyridine, a metabolite of the neurotoxin, 1-methyl-4-phenyl-1,2,5,6-tetrahydropyridine. within General Brain Science and Reviews.","high citation signal (1,282); recognized venue","Broad reviews can dominate citation-ranked lists while obscuring narrower empirical advances.; Taxonomy boundaries are imperfect because many brain papers combine methods, scales, and diseases.; Metadata-level ranking should be complemented with full-text expert review before strong claims are made.",10.1016/0024-3205(85)90146-8,2a71f5d432e6a5e551f54c0b73d46e854fbb2a3f,https://doi.org/10.1016/0024-3205(85)90146-8,,,JournalArticle,unknown,brain; brain in title,
13,1985,Distribution of N-methyl-D-aspartate-sensitive L-[3H]glutamate-binding sites in rat brain,"D. Monaghan, C. Cotman",Journal of Neuroscience,1985-11-01,1277,26,170.95,"Cellular, Molecular, and Synaptic Neuroscience",non-human,N-methyl-D-aspartate (NMDA) is an acidic amino acid which depolarizes neurons by selectively interacting with a distinct class of excitatory amino acid receptor.,"high citation signal (1,277); recognized venue; open-access PDF metadata","Cellular mechanisms can be difficult to connect directly to whole-brain dynamics or human behavior.; Single-cell sampling, dissociation, alignment, and batch effects can bias inferred cell populations.; Non-human findings need careful translation to human brain organization and clinical outcomes.",10.1523/JNEUROSCI.05-11-02909.1985,5571b767f6e0f81d8c94b724639cb61772adc1ed,https://doi.org/10.1523/JNEUROSCI.05-11-02909.1985,https://www.jneurosci.org/content/jneuro/5/11/2909.full.pdf,,JournalArticle,unknown,brain; cerebral; cortex; neuron; hippocampus; basal ganglia; glia; brain in title; neuroscience term,"N-methyl-D-aspartate (NMDA) is an acidic amino acid which depolarizes neurons by selectively interacting with a distinct class of excitatory amino acid receptor. Recent evidence has indicated that this receptor is a neurotransmitter receptor in the spinal cord, cerebral cortex, and hippocampus for which the endogenous ligand is likely to be L-glutamate or a structurally related compound. Using quantitative autoradiography, we have studied the anatomical distribution of the class of L- [3H]glutamate-binding sites displaced by NMDA, which appear to correspond to NMDA receptors. The CA1 region of the hippocampus contains the highest density of sites. In general, telencephalic regions have high levels of binding sites. The cerebral cortex shows significant density variations among the differing layers and regions, with the highest levels found in the frontal cortex layers I to III. Within the basal ganglia, the highest levels are found in the nucleus accumbens, intermediate levels are found in the caudate/putamen, and very low levels are found in the globus pallidus. Thalamic regions have moderate levels with variations among differing regions. Midbrain and brainstem have low levels of binding sites, but within these regions there are structures exhibiting higher levels, e.g., the nucleus of the solitary tract and the inferior olive. The distribution of NMDA sites is consistent with most, but not all, of the regions previously proposed to use glutamate as an excitatory transmitter. Thus, the distribution of NMDA-sensitive L-[3H]glutamate-binding sites suggests that the NMDA receptor represents a major, distinct subset of excitatory amino acid receptors and indicates regions in which neurotransmission may be mediated or modulated by this receptor."
14,1985,Inhibition of return : Neural basis and function,"M. Posner, R. Rafal, Lisa S. Choate, J. Vaughan",Unknown venue,1985-08-01,1229,92,130.07,General Brain Science and Reviews,,Positions Inhibition of return : Neural basis and function within General Brain Science and Reviews.,"high citation signal (1,229)","Broad reviews can dominate citation-ranked lists while obscuring narrower empirical advances.; Taxonomy boundaries are imperfect because many brain papers combine methods, scales, and diseases.; Metadata-level ranking should be complemented with full-text expert review before strong claims are made.",10.1080/02643298508252866,451c867b4eafc97453ed5573511c011b6909c8f2,https://doi.org/10.1080/02643298508252866,,,paper,unknown,neural,
15,1985,"Left, right, hand and brain : the right shift theory",M. Annett,Unknown venue,1985,1155,113,134.95,General Brain Science and Reviews,,"Positions Left, right, hand and brain : the right shift theory within General Brain Science and Reviews.","high citation signal (1,155)","Broad reviews can dominate citation-ranked lists while obscuring narrower empirical advances.; Taxonomy boundaries are imperfect because many brain papers combine methods, scales, and diseases.; Metadata-level ranking should be complemented with full-text expert review before strong claims are made.",,7b1a478adc1439047e1bd26e675cad4364645af0,https://www.semanticscholar.org/paper/7b1a478adc1439047e1bd26e675cad4364645af0,,,paper,unknown,brain; brain in title,
16,1985,Induction of reproducible brain infarction by photochemically initiated thrombosis,"B. Watson, W. Dietrich, R. Busto, M. Wachtel, M. Ginsberg",Annals of Neurology,1985-05-01,1135,46,146.63,Clinical Neurology and Neurodegeneration,,Positions Induction of reproducible brain infarction by photochemically initiated thrombosis within Clinical Neurology and Neurodegeneration.,"high citation signal (1,135); recognized venue","Clinical cohorts often differ in disease stage, comorbidity, treatment history, and follow-up duration.; Biomarkers may not transfer cleanly across populations, scanners, care settings, or diagnostic criteria.; Metadata-level ranking should be complemented with full-text expert review before strong claims are made.",10.1002/ana.410170513,091e6b3849cef011376f1270ab27860236690172,https://doi.org/10.1002/ana.410170513,,,JournalArticle,unknown,brain; brain in title,
17,1985,The anatomy of neuropeptide-Y-containing neurons in rat brain.,"B. Chronwall, D. Dimaggio, V. J. Massari, V. J. Massari, V. Pickel, D. Ruggiero, et al.",Neuroscience,1985-08-01,1100,29,155.27,"Cellular, Molecular, and Synaptic Neuroscience",non-human,"Positions The anatomy of neuropeptide-Y-containing neurons in rat brain. within Cellular, Molecular, and Synaptic Neuroscience.","high citation signal (1,100); recognized venue","Cellular mechanisms can be difficult to connect directly to whole-brain dynamics or human behavior.; Single-cell sampling, dissociation, alignment, and batch effects can bias inferred cell populations.; Non-human findings need careful translation to human brain organization and clinical outcomes.",10.1016/0306-4522(85)90260-X,eb3ea0b9e01c27325bc799876511b5b780d1ad07,https://doi.org/10.1016/0306-4522(85)90260-X,,,JournalArticle,unknown,brain; neuron; brain in title; neuroscience term,
18,1985,"Nicotinic binding in rat brain: autoradiographic comparison of [3H]acetylcholine, [3H]nicotine, and [125I]-alpha-bungarotoxin","P. Clarke, R. Schwartz, S. Paul, C. Pert, A. Pert",Journal of Neuroscience,1985-05-01,1042,22,164.5,"EEG, MEG, and Electrophysiology",EEG;non-human,"Three radioligands have been commonly used to label putative nicotinic cholinoceptors in the mammalian central nervous system: the agonists [3H]nicotine and [3H]acetylcholine ([3H]ACh--in the presence of atropine to block muscarinic receptors), and the snake venom extract, [125I]-alpha-bungarotoxin([125I]BTX), which acts as a nicotinic antagonist at the neuromuscular junction.","high citation signal (1,042); recognized venue; open-access PDF metadata","Low signal-to-noise ratio, artifacts, and source-localization uncertainty complicate interpretation.; Many studies rely on controlled tasks and may not generalize to everyday behavior or clinical monitoring.; Non-human findings need careful translation to human brain organization and clinical outcomes.",10.1523/JNEUROSCI.05-05-01307.1985,4b6dff7298a19fbadd6c340f04c2e8a5349177af,https://doi.org/10.1523/JNEUROSCI.05-05-01307.1985,https://www.jneurosci.org/content/jneuro/5/5/1307.full.pdf,,JournalArticle; Study,unknown,brain; cerebral; cortex; hippocampus; glia; brain in title; neuroscience term,"Three radioligands have been commonly used to label putative nicotinic cholinoceptors in the mammalian central nervous system: the agonists [3H]nicotine and [3H]acetylcholine ([3H]ACh--in the presence of atropine to block muscarinic receptors), and the snake venom extract, [125I]-alpha-bungarotoxin([125I]BTX), which acts as a nicotinic antagonist at the neuromuscular junction. Binding studies employing brain homogenates indicate that the regional distributions of both [3H]nicotine and [3H]ACh differ from that of [125I]BTX. The possible relationship between brain sites bound by [3H]nicotine and [3H]ACh has not been examined directly. We have used the technique of autoradiography to produce detailed maps of [3H]nicotine, [3H]ACh, and [125I]BTX labeling; near-adjacent tissue sections were compared at many levels of the rat brain. The maps of high affinity agonist labeling are strikingly concordant, with highest densities in the interpeduncular nucleus, most thalamic nuclei, superior colliculus, medial habenula, presubiculum, cerebral cortex (layers I and III/IV), and the substantia nigra pars compacta/ventral tegmental area. The pattern of [125I]BTX binding is strikingly different, the only notable overlap with agonist binding being the cerebral cortex (layer I) and superior colliculus. [125I]BTX binding is also dense in the inferior colliculus, cerebral cortex (layer VI), hypothalamus, and hippocampus, but is virtually absent in thalamus. Various lines of evidence suggest that the high affinity agonist-binding sites in brain correspond to nicotinic cholinergic receptors similar to those found at autonomic ganglia; BTX- binding sites may also serve as receptors for nicotine and are possibly related to neuromuscular nicotinic cholinoceptors."
19,1985,Isolation of HTLV-III from cerebrospinal fluid and neural tissues of patients with neurologic syndromes related to the acquired immunodeficiency syndrome.,"D. Ho, T. Rota, R. Schooley, J. Kaplan, J. Allan, J. Groopman, et al.",New England Journal of Medicine,1985-12-12,1035,14,128.18,Clinical Neurology and Neurodegeneration,human,Positions Isolation of HTLV-III from cerebrospinal fluid and neural tissues of patients with neurologic syndromes related to the acquired immunodeficiency syndrome. within Clinical Neurology and Neurodegeneration.,"high citation signal (1,035); human evidence signal","Clinical cohorts often differ in disease stage, comorbidity, treatment history, and follow-up duration.; Biomarkers may not transfer cleanly across populations, scanners, care settings, or diagnostic criteria.; Human cohort effects can depend on recruitment, demographics, comorbidity, and measurement context.",10.1056/NEJM198512123132401,c5aa06856bacfca3d62f042ca389d8356e0ad3a9,https://doi.org/10.1056/NEJM198512123132401,,,JournalArticle; CaseReport,unknown,neural,
20,1985,Anatomical correlates of the distribution of the pathological changes in the neocortex in Alzheimer disease.,"R. Pearson, M. Esiri, R. Hiorns, G. Wilcock, T. Powell",Proceedings of the National Academy of Sciences of the United States of America,1985-07-01,1015,23,147.63,Clinical Neurology and Neurodegeneration,,Positions Anatomical correlates of the distribution of the pathological changes in the neocortex in Alzheimer disease. within Clinical Neurology and Neurodegeneration.,"high citation signal (1,015); recognized venue; open-access PDF metadata","Clinical cohorts often differ in disease stage, comorbidity, treatment history, and follow-up duration.; Biomarkers may not transfer cleanly across populations, scanners, care settings, or diagnostic criteria.; Metadata-level ranking should be complemented with full-text expert review before strong claims are made.",10.1073/PNAS.82.13.4531,471313f15a18191fbf1354077f2aee496a621583,https://doi.org/10.1073/PNAS.82.13.4531,https://europepmc.org/articles/pmc391136?pdf=render,,JournalArticle,unknown,cortex; neuroscience term,
21,1985,Histoanatomic observations of the brain in early infantile autism,"M. Bauman, T. Kemper",Neurology,1985-06-01,932,28,143.09,Clinical Neurology and Neurodegeneration,,Positions Histoanatomic observations of the brain in early infantile autism within Clinical Neurology and Neurodegeneration.,high citation signal (932); recognized venue,"Clinical cohorts often differ in disease stage, comorbidity, treatment history, and follow-up duration.; Biomarkers may not transfer cleanly across populations, scanners, care settings, or diagnostic criteria.; Metadata-level ranking should be complemented with full-text expert review before strong claims are made.",10.1212/WNL.35.6.866,bcbd08fb7ff7ee7296fda2e78fabb88b7876d499,https://doi.org/10.1212/WNL.35.6.866,,,JournalArticle; Study,unknown,brain; brain in title,
