rank,year,title,authors,venue,publicationDate,citationCount,influentialCitationCount,importanceScore,category,keywordTags,keyIdea,strengths,limitations,doi,sourceId,url,openAccessPdf,githubUrl,workType,language,relevanceReason,abstract
61,2012,The neuroscience of tinnitus.,"J. Eggermont, L. Roberts",Trends in Neurosciences,2012-05-24,1298,93,149.05,General Brain Science and Reviews,,Positions The neuroscience of tinnitus. within General Brain Science and Reviews.,"high citation signal (1,298); recognized venue","Broad reviews can dominate citation-ranked lists while obscuring narrower empirical advances.; Taxonomy boundaries are imperfect because many brain papers combine methods, scales, and diseases.; Metadata-level ranking should be complemented with full-text expert review before strong claims are made.",10.1016/j.tins.2004.08.010,0f98328b820b55e7b03e875500ef0353940dc74f,https://doi.org/10.1016/j.tins.2004.08.010,,,Review; JournalArticle,unknown,neuroscience; neuroscience term,
62,2012,Bilingualism: Consequences for Mind and Brain,"E. Bialystok, F. Craik, G. Luk",Trends in Cognitive Sciences,2012-04-01,1277,67,154.95,"Brain Development, Plasticity, and Connectomics",human,"Building on earlier evidence showing a beneficial effect of bilingualism on children's cognitive development, we review recent studies using both behavioral and neuroimaging methods to examine the effects of bilingualism on cognition in adulthood and explore possible mechanisms for these effects.","high citation signal (1,277); recognized venue; open-access PDF metadata; human evidence signal","Developmental and aging studies are sensitive to cohort composition, attrition, and longitudinal sampling intervals.; Network measures can depend heavily on parcellation, thresholding, and acquisition choices.; Human cohort effects can depend on recruitment, demographics, comorbidity, and measurement context.",10.1016/j.tics.2012.03.001,8911f0125bda69df70a47658d37ee53d9db7ae4c,https://doi.org/10.1016/j.tics.2012.03.001,https://europepmc.org/articles/pmc3322418?pdf=render,,Review; JournalArticle,unknown,brain; neuroimaging; brain in title,"Building on earlier evidence showing a beneficial effect of bilingualism on children's cognitive development, we review recent studies using both behavioral and neuroimaging methods to examine the effects of bilingualism on cognition in adulthood and explore possible mechanisms for these effects. This research shows that bilingualism has a somewhat muted effect in adulthood but a larger role in older age, protecting against cognitive decline, a concept known as ""cognitive reserve"". We discuss recent evidence that bilingualism is associated with a delay in the onset of symptoms of dementia. Cognitive reserve is a crucial research area in the context of an aging population; the possibility that bilingualism contributes to cognitive reserve is therefore of growing importance as populations become increasingly diverse."
63,2012,"Atrophy of medial temporal lobes on MRI in ""probable"" Alzheimer's disease and normal ageing: diagnostic value and neuropsychological correlates","P. Scheltens, L. van de Pol",Journal of Neurology Neurosurgery & Psychiatry,2012-05-07,1274,47,143.91,Clinical Neurology and Neurodegeneration,MRI,"Positions Atrophy of medial temporal lobes on MRI in ""probable"" Alzheimer's disease and normal ageing: diagnostic value and neuropsychological correlates within Clinical Neurology and Neurodegeneration.","high citation signal (1,274); recognized venue","Clinical cohorts often differ in disease stage, comorbidity, treatment history, and follow-up duration.; Biomarkers may not transfer cleanly across populations, scanners, care settings, or diagnostic criteria.; Imaging conclusions can depend on acquisition, preprocessing, and model specification.",10.1136/jnnp-2012-302562,045bfac3619fcbe6c4a67cfeecfcee1171d910cd,https://doi.org/10.1136/jnnp-2012-302562,,,Review,unknown,mri,
64,2012,Spectral fingerprints of large-scale neuronal interactions,"M. Siegel, T. Donner, A. Engel",Nature Reviews Neuroscience,2012-01-11,1269,67,149.84,"EEG, MEG, and Electrophysiology",EEG,"Positions Spectral fingerprints of large-scale neuronal interactions within EEG, MEG, and Electrophysiology.","high citation signal (1,269); recognized venue","Low signal-to-noise ratio, artifacts, and source-localization uncertainty complicate interpretation.; Many studies rely on controlled tasks and may not generalize to everyday behavior or clinical monitoring.; Metadata-level ranking should be complemented with full-text expert review before strong claims are made.",10.1038/nrn3137,04503784eb574dc0202c744487e311c15ec83719,https://doi.org/10.1038/nrn3137,,,Review; JournalArticle,unknown,neuron; neuroscience term,
65,2012,Drug Transport across the Blood-Brain Barrier,W. Pardridge,Journal of Cerebral Blood Flow and Metabolism,2012-11-01,1259,42,139.5,"Cerebrovascular, Metabolism, and Brain Injury",,"Positions Drug Transport across the Blood-Brain Barrier within Cerebrovascular, Metabolism, and Brain Injury.","high citation signal (1,259); open-access PDF metadata","Acute injury studies can be sensitive to timing, severity, comorbidity, and treatment heterogeneity.; Animal models may not capture human vascular risk, injury complexity, or rehabilitation context.; Metadata-level ranking should be complemented with full-text expert review before strong claims are made.",10.1038/jcbfm.2012.126,6315f172bd9fc7154f8398d5f9376507556b2d4a,https://doi.org/10.1038/jcbfm.2012.126,https://journals.sagepub.com/doi/pdf/10.1038/jcbfm.2012.126,,Review; JournalArticle,unknown,brain; brain in title,
66,2012,Acetylcholine as a neuromodulator: cholinergic signaling shapes nervous system function and behavior,"M. Picciotto, M. Higley, Y. Mineur",Neuron,2012-10-04,1251,44,154.58,"Cellular, Molecular, and Synaptic Neuroscience",connectome,"Acetylcholine in the brain alters neuronal excitability, influences synaptic transmission, induces synaptic plasticity and coordinates the firing of groups of neurons.","high citation signal (1,251); recognized venue; open-access PDF metadata","Cellular mechanisms can be difficult to connect directly to whole-brain dynamics or human behavior.; Single-cell sampling, dissociation, alignment, and batch effects can bias inferred cell populations.; Metadata-level ranking should be complemented with full-text expert review before strong claims are made.",10.1016/j.neuron.2012.08.036,5209206b88819f47346ec46e1b6ebc7a2e9f54c3,https://doi.org/10.1016/j.neuron.2012.08.036,http://www.cell.com/article/S0896627312008021/pdf,,Review; JournalArticle,unknown,brain; neuron; neuroscience term,"Acetylcholine in the brain alters neuronal excitability, influences synaptic transmission, induces synaptic plasticity and coordinates the firing of groups of neurons. As a result, it changes the state of neuronal networks throughout the brain and modifies their response to internal and external inputs: the classical role of a neuromodulator. Here we identify actions of cholinergic signaling on cellular and synaptic properties of neurons in several brain areas and discuss the consequences of this signaling on behaviors related to drug abuse, attention, food intake, and affect. The diverse effects of acetylcholine depend on the site of release, the receptor subtypes, and the target neuronal population, however, a common theme is that acetylcholine potentiates behaviors that are adaptive to environmental stimuli and decreases responses to ongoing stimuli that do not require immediate action. The ability of acetylcholine to coordinate the response of neuronal networks in many brain areas makes cholinergic modulation an essential mechanism underlying complex behaviors."
67,2012,"The Future of Memory: Remembering, Imagining, and the Brain","D. Schacter, D. Addis, D. Hassabis, Victoria C. Martin, R. N. Spreng, K. Szpunar",Neuron,2012-11-21,1246,46,152.51,"Cellular, Molecular, and Synaptic Neuroscience",connectome,"During the past few years, there has been a dramatic increase in research examining the role of memory in imagination and future thinking.","high citation signal (1,246); recognized venue; open-access PDF metadata","Cellular mechanisms can be difficult to connect directly to whole-brain dynamics or human behavior.; Single-cell sampling, dissociation, alignment, and batch effects can bias inferred cell populations.; Metadata-level ranking should be complemented with full-text expert review before strong claims are made.",10.1016/j.neuron.2012.11.001,4a6472998c8da1a20213877cca72d9966aea08e7,https://doi.org/10.1016/j.neuron.2012.11.001,https://europepmc.org/articles/pmc3815616?pdf=render,,Review; JournalArticle,unknown,brain; brain in title,"During the past few years, there has been a dramatic increase in research examining the role of memory in imagination and future thinking. This work has revealed striking similarities between remembering the past and imagining or simulating the future, including the finding that a common brain network underlies both memory and imagination. Here we discuss a number of key points that have emerged during recent years, focusing in particular on the importance of distinguishing between temporal and non-temporal factors in analyses of memory and imagination, the nature of differences between remembering the past and imagining the future, the identification of component processes that comprise the default network supporting memory-based simulations, and the finding that this network can couple flexibly with other networks to support complex goal-directed simulations. This growing area of research has broadened our conception of memory by highlighting the many ways in which memory supports adaptive functioning."
68,2012,The cognitive neuroscience of ageing,C. Grady,Nature Reviews Neuroscience,2012-06-20,1236,99,151.17,General Brain Science and Reviews,,Positions The cognitive neuroscience of ageing within General Brain Science and Reviews.,"high citation signal (1,236); recognized venue; open-access PDF metadata","Broad reviews can dominate citation-ranked lists while obscuring narrower empirical advances.; Taxonomy boundaries are imperfect because many brain papers combine methods, scales, and diseases.; Metadata-level ranking should be complemented with full-text expert review before strong claims are made.",10.1038/nrn3256,7f2c7db02b5d6aa841ed91edafb13b0bc33174c2,https://doi.org/10.1038/nrn3256,https://www.ncbi.nlm.nih.gov/pmc/articles/PMC3800175,,Review; JournalArticle,unknown,neuroscience; neuroscience term,
69,2012,Input-specific control of reward and aversion in the ventral tegmental area,"S. Lammel, B. Lim, Chen Ran, Kee Wui Huang, Michael J. Betley, K. Tye, et al.",Nature,2012-10-01,1232,84,161.51,"Cellular, Molecular, and Synaptic Neuroscience",non-human;connectome,Ventral tegmental area (VTA) dopamine neurons have important roles in adaptive and pathological brain functions related to reward and motivation.,"high citation signal (1,232); recognized venue; open-access PDF metadata","Cellular mechanisms can be difficult to connect directly to whole-brain dynamics or human behavior.; Single-cell sampling, dissociation, alignment, and batch effects can bias inferred cell populations.; Non-human findings need careful translation to human brain organization and clinical outcomes.",10.1038/nature11527,bf43fe37933ed6c25477c6d1004b3a0577ae1128,https://doi.org/10.1038/nature11527,https://www.ncbi.nlm.nih.gov/pmc/articles/PMC3493743,,JournalArticle,unknown,brain; cortex; neuron; prefrontal; synapse; neuroscience term,"Ventral tegmental area (VTA) dopamine neurons have important roles in adaptive and pathological brain functions related to reward and motivation. However, it is unknown whether subpopulations of VTA dopamine neurons participate in distinct circuits that encode different motivational signatures, and whether inputs to the VTA differentially modulate such circuits. Here we show that, because of differences in synaptic connectivity, activation of inputs to the VTA from the laterodorsal tegmentum and the lateral habenula elicit reward and aversion in mice, respectively. Laterodorsal tegmentum neurons preferentially synapse on dopamine neurons projecting to the nucleus accumbens lateral shell, whereas lateral habenula neurons synapse primarily on dopamine neurons projecting to the medial prefrontal cortex as well as on GABAergic (γ-aminobutyric-acid-containing) neurons in the rostromedial tegmental nucleus. These results establish that distinct VTA circuits generate reward and aversion, and thereby provide a new framework for understanding the circuit basis of adaptive and pathological motivated behaviours."
70,2012,Axonal Pathology in Traumatic Brain Injury,"V. Johnson, W. Stewart, Douglas H. Smith",Experimental Neurology,2012-01-20,1227,90,153.44,Clinical Neurology and Neurodegeneration,human;non-human,"Over the past 70 years, diffuse axonal injury (DAI) has emerged as one of the most common and important pathological features of traumatic brain injury (TBI).","high citation signal (1,227); recognized venue; open-access PDF metadata; human evidence signal","Clinical cohorts often differ in disease stage, comorbidity, treatment history, and follow-up duration.; Biomarkers may not transfer cleanly across populations, scanners, care settings, or diagnostic criteria.; Non-human findings need careful translation to human brain organization and clinical outcomes.",10.1016/j.expneurol.2012.01.013,6fdff07fcccb6429453f06a8aae43cdaad508837,https://doi.org/10.1016/j.expneurol.2012.01.013,https://europepmc.org/articles/pmc3979341?pdf=render,,Review; JournalArticle,unknown,brain; brain in title,"Over the past 70 years, diffuse axonal injury (DAI) has emerged as one of the most common and important pathological features of traumatic brain injury (TBI). Axons in the white matter appear to be especially vulnerable to injury due to the mechanical loading of the brain during TBI. As such, DAI has been found in all severities of TBI and may represent a key pathologic substrate of mild TBI (concussion). Pathologically, DAI encompasses a spectrum of effects from primary mechanical breaking of the axonal cytoskeleton, to transport interruption, swelling and proteolysis, through secondary physiological changes. Depending on the severity and extent of injury, these changes can manifest acutely as immediate loss of consciousness or confusion and persist as coma and/or cognitive dysfunction. In addition, recent evidence suggests that TBI may induce long-term neurodegenerative processes, such as insidiously progressive axonal pathology. Indeed, axonal degeneration has been found to continue even years after injury in humans, and appears to play a role in the development of Alzheimer's disease-like pathological changes. Here we review the current understanding of DAI as a uniquely mechanical injury, its histopathological identification, and its acute and chronic pathogenesis following TBI."
71,2012,Apolipoprotein E controls cerebrovascular integrity via cyclophilin A,"R. Bell, E. Winkler, I. Singh, A. Sagare, R. Deane, Zhenhua Wu, et al.",Nature,2012-05-16,1219,68,157.32,"Cerebrovascular, Metabolism, and Brain Injury",human;non-human,"Human apolipoprotein E has three isoforms: APOE2, APOE3 and APOE4.","high citation signal (1,219); recognized venue; open-access PDF metadata; human evidence signal","Acute injury studies can be sensitive to timing, severity, comorbidity, and treatment heterogeneity.; Animal models may not capture human vascular risk, injury complexity, or rehabilitation context.; Non-human findings need careful translation to human brain organization and clinical outcomes.",10.1038/nature11087,e99d6ac774400b8c05fd2723a8a8e08d1ad5ef0d,https://doi.org/10.1038/nature11087,https://europepmc.org/articles/pmc4047116?pdf=render,,JournalArticle,unknown,brain; cerebral; neuron; neuroscience term,"Human apolipoprotein E has three isoforms: APOE2, APOE3 and APOE4. APOE4 is a major genetic risk factor for Alzheimer's disease and is associated with Down's syndrome dementia and poor neurological outcome after traumatic brain injury and haemorrhage. Neurovascular dysfunction is present in normal APOE4 carriers and individuals with APOE4-associated disorders. In mice, lack of Apoe leads to blood-brain barrier (BBB) breakdown, whereas APOE4 increases BBB susceptibility to injury. How APOE genotype affects brain microcirculation remains elusive. Using different APOE transgenic mice, including mice with ablation and/or inhibition of cyclophilin A (CypA), here we show that expression of APOE4 and lack of murine Apoe, but not APOE2 and APOE3, leads to BBB breakdown by activating a proinflammatory CypA-nuclear factor-κB-matrix-metalloproteinase-9 pathway in pericytes. This, in turn, leads to neuronal uptake of multiple blood-derived neurotoxic proteins, and microvascular and cerebral blood flow reductions. We show that the vascular defects in Apoe-deficient and APOE4-expressing mice precede neuronal dysfunction and can initiate neurodegenerative changes. Astrocyte-secreted APOE3, but not APOE4, suppressed the CypA-nuclear factor-κB-matrix-metalloproteinase-9 pathway in pericytes through a lipoprotein receptor. Our data suggest that CypA is a key target for treating APOE4-mediated neurovascular injury and the resulting neuronal dysfunction and degeneration."
72,2012,Probing sporadic and familial Alzheimer's disease using induced pluripotent stem cells,"Mason A. Israel, Shauna H. Yuan, C. Bardy, Sol M. Reyna, Yangling Mu, C. Herrera, et al.",Nature,2012-01-25,1217,68,155.29,"Cellular, Molecular, and Synaptic Neuroscience",human;non-human,Our understanding of Alzheimer's disease pathogenesis is currently limited by difficulties in obtaining live neurons from patients and the inability to model the sporadic form of the disease.,"high citation signal (1,217); recognized venue; open-access PDF metadata; human evidence signal","Cellular mechanisms can be difficult to connect directly to whole-brain dynamics or human behavior.; Single-cell sampling, dissociation, alignment, and batch effects can bias inferred cell populations.; Non-human findings need careful translation to human brain organization and clinical outcomes.",10.1038/nature10821,3260ea0bde48ce0ca080128443544ef73cc91516,https://doi.org/10.1038/nature10821,https://www.ncbi.nlm.nih.gov/pmc/articles/PMC3338985,,JournalArticle,unknown,brain; neuron; neuroscience term,"Our understanding of Alzheimer's disease pathogenesis is currently limited by difficulties in obtaining live neurons from patients and the inability to model the sporadic form of the disease. It may be possible to overcome these challenges by reprogramming primary cells from patients into induced pluripotent stem cells (iPSCs). Here we reprogrammed primary fibroblasts from two patients with familial Alzheimer's disease, both caused by a duplication of the amyloid-β precursor protein gene (APP; termed APPDp), two with sporadic Alzheimer's disease (termed sAD1, sAD2) and two non-demented control individuals into iPSC lines. Neurons from differentiated cultures were purified with fluorescence-activated cell sorting and characterized. Purified cultures contained more than 90% neurons, clustered with fetal brain messenger RNA samples by microarray criteria, and could form functional synaptic contacts. Virtually all cells exhibited normal electrophysiological activity. Relative to controls, iPSC-derived, purified neurons from the two APPDp patients and patient sAD2 exhibited significantly higher levels of the pathological markers amyloid-β(1-40), phospho-tau(Thr 231) and active glycogen synthase kinase-3β (aGSK-3β). Neurons from APPDp and sAD2 patients also accumulated large RAB5-positive early endosomes compared to controls. Treatment of purified neurons with β-secretase inhibitors, but not γ-secretase inhibitors, caused significant reductions in phospho-Tau(Thr 231) and aGSK-3β levels. These results suggest a direct relationship between APP proteolytic processing, but not amyloid-β, in GSK-3β activation and tau phosphorylation in human neurons. Additionally, we observed that neurons with the genome of one sAD patient exhibited the phenotypes seen in familial Alzheimer's disease samples. More generally, we demonstrate that iPSC technology can be used to observe phenotypes relevant to Alzheimer's disease, even though it can take decades for overt disease to manifest in patients."
73,2012,Filter Bank Common Spatial Pattern Algorithm on BCI Competition IV Datasets 2a and 2b,"K. Ang, Z. Chin, C. Wang, Cuntai Guan, Haihong Zhang",Frontiers in Neuroscience,2012-03-29,1201,156,147.85,"EEG, MEG, and Electrophysiology",EEG,"The Common Spatial Pattern (CSP) algorithm is an effective and popular method for classifying 2-class motor imagery electroencephalogram (EEG) data, but its effectiveness depends on the subject-specific frequency band.","high citation signal (1,201); recognized venue; open-access PDF metadata","Low signal-to-noise ratio, artifacts, and source-localization uncertainty complicate interpretation.; Many studies rely on controlled tasks and may not generalize to everyday behavior or clinical monitoring.; Metadata-level ranking should be complemented with full-text expert review before strong claims are made.",10.3389/fnins.2012.00039,bc122aa1332985c4b346fc34b5cfdd65c22a08ea,https://doi.org/10.3389/fnins.2012.00039,https://www.frontiersin.org/articles/10.3389/fnins.2012.00039/pdf,,JournalArticle,unknown,brain; eeg,"The Common Spatial Pattern (CSP) algorithm is an effective and popular method for classifying 2-class motor imagery electroencephalogram (EEG) data, but its effectiveness depends on the subject-specific frequency band. This paper presents the Filter Bank Common Spatial Pattern (FBCSP) algorithm to optimize the subject-specific frequency band for CSP on Datasets 2a and 2b of the Brain-Computer Interface (BCI) Competition IV. Dataset 2a comprised 4 classes of 22 channels EEG data from 9 subjects, and Dataset 2b comprised 2 classes of 3 bipolar channels EEG data from 9 subjects. Multi-class extensions to FBCSP are also presented to handle the 4-class EEG data in Dataset 2a, namely, Divide-and-Conquer (DC), Pair-Wise (PW), and One-Versus-Rest (OVR) approaches. Two feature selection algorithms are also presented to select discriminative CSP features on Dataset 2b, namely, the Mutual Information-based Best Individual Feature (MIBIF) algorithm, and the Mutual Information-based Rough Set Reduction (MIRSR) algorithm. The single-trial classification accuracies were presented using 10 × 10-fold cross-validations on the training data and session-to-session transfer on the evaluation data from both datasets. Disclosure of the test data labels after the BCI Competition IV showed that the FBCSP algorithm performed relatively the best among the other submitted algorithms and yielded a mean kappa value of 0.569 and 0.600 across all subjects in Datasets 2a and 2b respectively."
74,2012,Nanoelectronic programmable synapses based on phase change materials for brain-inspired computing.,"D. Kuzum, R. Jeyasingh, Byoungil Lee, H. Wong",Nano letters (Print),2012-05-09,1195,21,143.56,"Cellular, Molecular, and Synaptic Neuroscience",,"Positions Nanoelectronic programmable synapses based on phase change materials for brain-inspired computing. within Cellular, Molecular, and Synaptic Neuroscience.","high citation signal (1,195)","Cellular mechanisms can be difficult to connect directly to whole-brain dynamics or human behavior.; Single-cell sampling, dissociation, alignment, and batch effects can bias inferred cell populations.; Metadata-level ranking should be complemented with full-text expert review before strong claims are made.",10.1021/nl201040y,f0826e544de458328516f9fb93aa92dd62b52051,https://doi.org/10.1021/nl201040y,,,JournalArticle,unknown,brain; synapse; brain in title; neuroscience term,
75,2012,Whole-brain mapping of direct inputs to midbrain dopamine neurons.,"Mitsuko Watabe-Uchida, Li-song Zhu, Sachie K. Ogawa, Archana Vamanrao, N. Uchida",Neuron,2012-06-07,1189,83,158.47,Neuroimaging and Brain Mapping,,Positions Whole-brain mapping of direct inputs to midbrain dopamine neurons. within Neuroimaging and Brain Mapping.,"high citation signal (1,189); recognized venue; open-access PDF metadata","Scanner, protocol, site, and preprocessing variation can limit reproducibility across cohorts.; Associational imaging biomarkers often need stronger longitudinal or intervention evidence before causal claims are made.; Metadata-level ranking should be complemented with full-text expert review before strong claims are made.",10.1016/j.neuron.2012.03.017,e9b4fcfd2a4deeefabe5350587f9d868ef3b7eed,https://doi.org/10.1016/j.neuron.2012.03.017,http://www.cell.com/article/S0896627312002814/pdf,,JournalArticle,unknown,brain; neuron; brain in title; neuroscience term,
