rank,year,title,authors,venue,publicationDate,citationCount,influentialCitationCount,importanceScore,category,keywordTags,keyIdea,strengths,limitations,doi,sourceId,url,openAccessPdf,githubUrl,workType,language,relevanceReason,abstract
28,1936,Brain Potentials from Normal Speakers and Stutterers,"L. E. Travis, J. Knott",Unknown venue,1936,39,0,74.4,General Brain Science and Reviews,,Positions Brain Potentials from Normal Speakers and Stutterers within General Brain Science and Reviews.,high citation signal (39),"Broad reviews can dominate citation-ranked lists while obscuring narrower empirical advances.; Taxonomy boundaries are imperfect because many brain papers combine methods, scales, and diseases.; Metadata-level ranking should be complemented with full-text expert review before strong claims are made.",10.1080/00223980.1936.9917448,5a8d757be420e97bafd18ee5a7d1d54a824af46c,https://doi.org/10.1080/00223980.1936.9917448,,,paper,unknown,brain; brain in title,
29,1936,Respiration of brain.,"T. F. Dixon, A. Meyer",Biochemical Journal,1936-09-01,39,1,78.6,General Brain Science and Reviews,non-human,Positions Respiration of brain. within General Brain Science and Reviews.,high citation signal (39); open-access PDF metadata,"Broad reviews can dominate citation-ranked lists while obscuring narrower empirical advances.; Taxonomy boundaries are imperfect because many brain papers combine methods, scales, and diseases.; Non-human findings need careful translation to human brain organization and clinical outcomes.",10.1042/BJ0301577,e8d595f7d89bc09dca91d3e2aa673cce2b9031ca,https://doi.org/10.1042/BJ0301577,https://europepmc.org/articles/pmc1263225?pdf=render,,JournalArticle,unknown,brain; brain in title,
30,1936,Pyruvic acid oxidation in brain: Vitamin B(1) and the pyruvate oxidase in pigeon's brain.,R. Peters,Biochemical Journal,1936-12-01,36,0,76.0,General Brain Science and Reviews,,Positions Pyruvic acid oxidation in brain: Vitamin B(1) and the pyruvate oxidase in pigeon's brain. within General Brain Science and Reviews.,high citation signal (36); open-access PDF metadata,"Broad reviews can dominate citation-ranked lists while obscuring narrower empirical advances.; Taxonomy boundaries are imperfect because many brain papers combine methods, scales, and diseases.; Metadata-level ranking should be complemented with full-text expert review before strong claims are made.",10.1042/BJ0302206,a7021b6cd7f240b5146c671886a85525f5207b45,https://doi.org/10.1042/BJ0302206,https://europepmc.org/articles/pmc1263328?pdf=render,,JournalArticle,unknown,brain; brain in title,
31,1936,On the Growth of Rous Sarcoma Inoculated into the Brain,E. Vazquez-lopez,Unknown venue,1936,35,0,75.5,General Brain Science and Reviews,,Positions On the Growth of Rous Sarcoma Inoculated into the Brain within General Brain Science and Reviews.,high citation signal (35); open-access PDF metadata,"Broad reviews can dominate citation-ranked lists while obscuring narrower empirical advances.; Taxonomy boundaries are imperfect because many brain papers combine methods, scales, and diseases.; Metadata-level ranking should be complemented with full-text expert review before strong claims are made.",10.1158/AJC.1936.29,c656e536e6d0c8f97cf13797295d2d1e8d82c6c9,https://doi.org/10.1158/AJC.1936.29,http://cancerres.aacrjournals.org/content/26/1/29.full.pdf,,paper,unknown,brain; brain in title,
32,1936,DISTURBANCES IN GASTRO-INTESTINAL FUNCTION AFTER LOCALIZED ABLATIONS OF CEREBRAL CORTEX,"F. Mettler, C. Mettler, J. Combs",Unknown venue,1936-04-01,34,0,74.0,General Brain Science and Reviews,,Positions DISTURBANCES IN GASTRO-INTESTINAL FUNCTION AFTER LOCALIZED ABLATIONS OF CEREBRAL CORTEX within General Brain Science and Reviews.,high citation signal (34),"Broad reviews can dominate citation-ranked lists while obscuring narrower empirical advances.; Taxonomy boundaries are imperfect because many brain papers combine methods, scales, and diseases.; Metadata-level ranking should be complemented with full-text expert review before strong claims are made.",10.1001/ARCHSURG.1936.01180220044003,191b04b645bc4c8e3b96dbe7891660e8e67fb781,https://doi.org/10.1001/ARCHSURG.1936.01180220044003,,,paper,unknown,cerebral; cortex; neuroscience term,
33,1936,The fissural pattern of the Primate brain,C. J. Connolly,Unknown venue,1936-07-01,34,3,73.2,General Brain Science and Reviews,non-human,Positions The fissural pattern of the Primate brain within General Brain Science and Reviews.,high citation signal (34),"Broad reviews can dominate citation-ranked lists while obscuring narrower empirical advances.; Taxonomy boundaries are imperfect because many brain papers combine methods, scales, and diseases.; Non-human findings need careful translation to human brain organization and clinical outcomes.",10.1002/AJPA.1330210322,1cbf5a8fc4dcd5fbb0f0952cbe2d7bb293669c30,https://doi.org/10.1002/AJPA.1330210322,,,paper,unknown,brain; brain in title,
34,1936,"Observations on the form and proportions of the endocranial casts of Sinanthropus Pekinensis, other hominids and the great apes : a comparative study of brain size",F. Weidenreich,Unknown venue,1936,33,0,72.67,General Brain Science and Reviews,non-human,"Positions Observations on the form and proportions of the endocranial casts of Sinanthropus Pekinensis, other hominids and the great apes : a comparative study of brain size within General Brain Science and Reviews.",high citation signal (33),"Broad reviews can dominate citation-ranked lists while obscuring narrower empirical advances.; Taxonomy boundaries are imperfect because many brain papers combine methods, scales, and diseases.; Non-human findings need careful translation to human brain organization and clinical outcomes.",,654dd50b548f9772b1888881232a5b3d4c6f2b0f,https://www.semanticscholar.org/paper/654dd50b548f9772b1888881232a5b3d4c6f2b0f,,,paper,unknown,brain; brain in title,
35,1936,The Growth of Embryo Bones Transplanted Whole in the Rat9s Brain,R. A. Willis,Unknown venue,1936-07-01,33,0,75.67,General Brain Science and Reviews,non-human,Positions The Growth of Embryo Bones Transplanted Whole in the Rat9s Brain within General Brain Science and Reviews.,high citation signal (33); open-access PDF metadata,"Broad reviews can dominate citation-ranked lists while obscuring narrower empirical advances.; Taxonomy boundaries are imperfect because many brain papers combine methods, scales, and diseases.; Non-human findings need careful translation to human brain organization and clinical outcomes.",10.1098/RSPB.1936.0048,635e12101858ae8145629c868fd017083b6ceb58,https://doi.org/10.1098/RSPB.1936.0048,http://rspb.royalsocietypublishing.org/content/120/819/496.full.pdf,,paper,unknown,brain; brain in title,
36,1936,DO BRAIN WAVES HAVE INDIVIDUALITY?,"L. E. Travis, A. Gottlober",Science,1936-12-11,32,0,82.94,General Brain Science and Reviews,,Positions DO BRAIN WAVES HAVE INDIVIDUALITY? within General Brain Science and Reviews.,high citation signal (32); recognized venue,"Broad reviews can dominate citation-ranked lists while obscuring narrower empirical advances.; Taxonomy boundaries are imperfect because many brain papers combine methods, scales, and diseases.; Metadata-level ranking should be complemented with full-text expert review before strong claims are made.",10.1126/SCIENCE.84.2189.532,b60958503c950f5ecfcaf337dd991809866cf7c4,https://doi.org/10.1126/SCIENCE.84.2189.532,,,JournalArticle,unknown,brain; brain in title,
37,1936,PENETRATING WOUNDS OF THE BRAIN AN EXPERIMENTAL STUDY,C. Pilcher,Annals of Surgery,1936-02-01,32,0,75.14,General Brain Science and Reviews,non-human,Positions PENETRATING WOUNDS OF THE BRAIN AN EXPERIMENTAL STUDY within General Brain Science and Reviews.,high citation signal (32); open-access PDF metadata,"Broad reviews can dominate citation-ranked lists while obscuring narrower empirical advances.; Taxonomy boundaries are imperfect because many brain papers combine methods, scales, and diseases.; Non-human findings need careful translation to human brain organization and clinical outcomes.",10.1097/00000658-193602000-00003,4edccbab3d12c8f84d4f1653c53f73ffa4eb525c,https://doi.org/10.1097/00000658-193602000-00003,https://www.ncbi.nlm.nih.gov/pmc/articles/PMC1391014,,JournalArticle,unknown,brain; brain in title,
38,1936,EXPERIMENTAL ENCEPHALITIS (ST. LOUIS TYPE) IN MICE WITH HIGH INBORN RESISTANCE,"L. T. Webster, A. D. Clow",Journal of Experimental Medicine,1936-05-31,32,1,72.34,General Brain Science and Reviews,human;non-human,1. St. Louis encephalitis virus injected intracerebrally or intraperitoneally in maximum doses in resistant mice is distributed and is effective in a manner generally similar to that in susceptible mice.,high citation signal (32); open-access PDF metadata; human evidence signal,"Broad reviews can dominate citation-ranked lists while obscuring narrower empirical advances.; Taxonomy boundaries are imperfect because many brain papers combine methods, scales, and diseases.; Non-human findings need careful translation to human brain organization and clinical outcomes.",10.1084/jem.63.6.827,6a678fc371173da0d06a4324ac24128ef9d0a083,https://doi.org/10.1084/jem.63.6.827,https://rupress.org/jem/article-pdf/63/6/827/1180776/827.pdf,,JournalArticle,unknown,brain; cerebral,"1. St. Louis encephalitis virus injected intracerebrally or intraperitoneally in maximum doses in resistant mice is distributed and is effective in a manner generally similar to that in susceptible mice. The minimum infecting dose is at least 1,000 times greater in resistant than susceptible mice and virus injected in the brain tends to remain at a relatively low titre, persist for a few days, and then disappear. 2. Virus dropped in the nares is demonstrable and progresses in the brains of resistant mice as in susceptible mice, but does not increase in titre beyond the 5th day, does not bring about fatal encephalitis, and persists for at least 4 weeks. 3. Lesions in the brains of resistant mice following nasal instillation of virus do not appear until the 8th day, reach a maximum at 40 days, and are still present, though resolving, at 3 months. The changes resemble those seen in the human disease and in other unnamed forms of encephalitis. 4. The quantity of virus drops 1,000-fold when recovered from resistant mice and becomes non-infective by the nasal route. Passage in susceptible mice promptly restores its full titre."
39,1936,"SPONTANEOUS INTRACEREBRAL HEMORRHAGE: ETIOLOGY AND SURGICAL TREATMENT, WITH A REPORT OF NINE CASES","W. M. Craig, A. W. Adson",Unknown venue,1936-04-01,32,0,64.94,"Cerebrovascular, Metabolism, and Brain Injury",,"Positions SPONTANEOUS INTRACEREBRAL HEMORRHAGE: ETIOLOGY AND SURGICAL TREATMENT, WITH A REPORT OF NINE CASES within Cerebrovascular, Metabolism, and Brain Injury.",high citation signal (32),"Acute injury studies can be sensitive to timing, severity, comorbidity, and treatment heterogeneity.; Animal models may not capture human vascular risk, injury complexity, or rehabilitation context.; Metadata-level ranking should be complemented with full-text expert review before strong claims are made.",10.1001/ARCHNEURPSYC.1936.02260040009001,8bf61d63465bb08358c54fe09c199e481d840f90,https://doi.org/10.1001/ARCHNEURPSYC.1936.02260040009001,,,paper,unknown,cerebral,
40,1936,A pupillo-constrictor area in the cerebral cortex of the cat and its relationship to the pretectal area,R. W. Barris,Unknown venue,1936-02-01,31,0,72.38,General Brain Science and Reviews,,Positions A pupillo-constrictor area in the cerebral cortex of the cat and its relationship to the pretectal area within General Brain Science and Reviews.,high citation signal (31),"Broad reviews can dominate citation-ranked lists while obscuring narrower empirical advances.; Taxonomy boundaries are imperfect because many brain papers combine methods, scales, and diseases.; Metadata-level ranking should be complemented with full-text expert review before strong claims are made.",10.1002/CNE.900630208,5a5be9cb25c7f6a63d59323b620cf16e4a995c78,https://doi.org/10.1002/CNE.900630208,,,paper,unknown,cerebral; cortex; neuroscience term,
41,1936,SOME EFFECTS OF LAMINAR THERMOCOAGULATION UPON THE LOCAL ACTION POTENTIALS OF THE CEREBRAL CORTEX OF THE MONKEY,"J. G. D. de Barenne, W. McCulloch",Unknown venue,1936-01-31,29,0,72.42,General Brain Science and Reviews,non-human,Positions SOME EFFECTS OF LAMINAR THERMOCOAGULATION UPON THE LOCAL ACTION POTENTIALS OF THE CEREBRAL CORTEX OF THE MONKEY within General Brain Science and Reviews.,high citation signal (29),"Broad reviews can dominate citation-ranked lists while obscuring narrower empirical advances.; Taxonomy boundaries are imperfect because many brain papers combine methods, scales, and diseases.; Non-human findings need careful translation to human brain organization and clinical outcomes.",10.1152/AJPLEGACY.1936.114.3.692,6eef2203bf86952f31c162e1046d53659c721f45,https://doi.org/10.1152/AJPLEGACY.1936.114.3.692,,,paper,unknown,cerebral; cortex; neuroscience term,
42,1936,A purring center in the cat's brain,"E. Gibbs, F. Gibbs",Unknown venue,1936-08-01,29,0,69.22,General Brain Science and Reviews,,Positions A purring center in the cat's brain within General Brain Science and Reviews.,high citation signal (29),"Broad reviews can dominate citation-ranked lists while obscuring narrower empirical advances.; Taxonomy boundaries are imperfect because many brain papers combine methods, scales, and diseases.; Metadata-level ranking should be complemented with full-text expert review before strong claims are made.",10.1002/CNE.900640203,78901c779ba50cf26c29a5773e1c62cb8a7f9c7d,https://doi.org/10.1002/CNE.900640203,,,paper,unknown,brain; brain in title,
43,1936,Étude de l'activité électrique du cortex cérébral: Chez le lapin non narcotisé ni curarisé,L. Ectors,Unknown venue,1936,29,0,69.22,General Brain Science and Reviews,,Positions Étude de l'activité électrique du cortex cérébral: Chez le lapin non narcotisé ni curarisé within General Brain Science and Reviews.,high citation signal (29),"Broad reviews can dominate citation-ranked lists while obscuring narrower empirical advances.; Taxonomy boundaries are imperfect because many brain papers combine methods, scales, and diseases.; Metadata-level ranking should be complemented with full-text expert review before strong claims are made.",10.3109/13813453609144786,0d189401831c3d9d5de3183207d777a39cb13db5,https://doi.org/10.3109/13813453609144786,,,paper,unknown,cortex; neuroscience term,
44,1936,DESTRUCTION OF THE CEREBRAL CORTEX FOLLOWING: NITROUS OXIDE-OXYGEN ANESTHESIA,"K. Lowenberg, R. Waggoner, A. Mich, T. Zbinden",Annals of Surgery,1936-11-01,26,0,72.33,General Brain Science and Reviews,,Positions DESTRUCTION OF THE CEREBRAL CORTEX FOLLOWING: NITROUS OXIDE-OXYGEN ANESTHESIA within General Brain Science and Reviews.,high citation signal (26); open-access PDF metadata,"Broad reviews can dominate citation-ranked lists while obscuring narrower empirical advances.; Taxonomy boundaries are imperfect because many brain papers combine methods, scales, and diseases.; Metadata-level ranking should be complemented with full-text expert review before strong claims are made.",10.1097/00000658-193611000-00001,a30cfe677defedb2fad33bf7e26c90b99861ca20,https://doi.org/10.1097/00000658-193611000-00001,https://journals.lww.com/anesthesia-analgesia/abstract/1938/03000/destruction_of_the_cerebral_cortex_following.24.aspx,,JournalArticle,unknown,cerebral; cortex; neuroscience term,
45,1936,ELECTRIC POTENTIALS OF THE BRAIN IN CERTAIN TYPES OF MENTAL DEFICIENCY,G. Kreezer,Unknown venue,1936-12-01,26,0,67.33,General Brain Science and Reviews,,Positions ELECTRIC POTENTIALS OF THE BRAIN IN CERTAIN TYPES OF MENTAL DEFICIENCY within General Brain Science and Reviews.,high citation signal (26),"Broad reviews can dominate citation-ranked lists while obscuring narrower empirical advances.; Taxonomy boundaries are imperfect because many brain papers combine methods, scales, and diseases.; Metadata-level ranking should be complemented with full-text expert review before strong claims are made.",10.1001/ARCHNEURPSYC.1936.02260120053003,d15ba98d81e3e81e5e584959ae44fbb11cfc343e,https://doi.org/10.1001/ARCHNEURPSYC.1936.02260120053003,,,paper,unknown,brain; brain in title,
46,1936,BLOOD PLASMA PROTEIN REGENERATION CONTROLLED BY DIET,"J. B. Mcnaught, V. Scott, F. Woods, G. Whipple",Journal of Experimental Medicine,1936-01-31,26,0,66.73,Clinical Neurology and Neurodegeneration,human;non-human,"When blood plasma proteins are depleted by bleeding, with return of washed red cells (plasmapheresis), it is possible to bring the dog to a steady state of low plasma protein in the circulation and a uniform plasma protein production on a basal diet.",high citation signal (26); open-access PDF metadata; human evidence signal,"Clinical cohorts often differ in disease stage, comorbidity, treatment history, and follow-up duration.; Biomarkers may not transfer cleanly across populations, scanners, care settings, or diagnostic criteria.; Non-human findings need careful translation to human brain organization and clinical outcomes.",10.1084/jem.63.2.277,0bfebde3b4a676e598606ac7d7b63690c3cd16d3,https://doi.org/10.1084/jem.63.2.277,https://doi.org/10.1084/jem.63.2.277,,JournalArticle,unknown,brain,"When blood plasma proteins are depleted by bleeding, with return of washed red cells (plasmapheresis), it is possible to bring the dog to a steady state of low plasma protein in the circulation and a uniform plasma protein production on a basal diet. These dogs become test subjects by which the potency of various diet factors for plasma protein regeneration can be measured. Plant and grain proteins are quite well utilized to form new plasma protein in these test dogs but soy bean meal probably should be rated at the head of this list. It is utilized with unexpected promptness and favors the production of albumin in contrast to other plant proteins which distinctly favor globulin production. Long plasmapheresis periods on basal rations rich in grain proteins lower the resistance of these animals to infection. Spleen, brain, and stomach when fed with the basal diet in these test dogs show less favorable potency ratios-10.2, 11.8, and 13.6 respectively. This means the grams of tissue protein which must be fed to produce 1 gm. of new plasma protein. Fasting periods indicate that the dog can contribute only 4 to 6 gm. of plasma protein each week-an insignificant contribution presumably derived from the host's tissue proteins. Infection and intoxication disturb the plasma protein production of these standardized dogs and may reduce the output of plasma proteins to very low levels in spite of considerable food intake. There may be a very sharp drop in the plasma protein level during the first day of intoxication (Dog 33-324). Some of these observations may be of value in a study of clinical conditions associated with hypoproteinemia."
47,1936,CONSTANCY OF THE CEREBRAL BLOOD FLOW,W. Lennox,Unknown venue,1936-08-01,26,0,61.33,General Brain Science and Reviews,,Positions CONSTANCY OF THE CEREBRAL BLOOD FLOW within General Brain Science and Reviews.,high citation signal (26),"Broad reviews can dominate citation-ranked lists while obscuring narrower empirical advances.; Taxonomy boundaries are imperfect because many brain papers combine methods, scales, and diseases.; Metadata-level ranking should be complemented with full-text expert review before strong claims are made.",10.1001/ARCHNEURPSYC.1936.02260080147010,bf0f044498c547a514f351fc1624714a1f3d66bc,https://doi.org/10.1001/ARCHNEURPSYC.1936.02260080147010,,,paper,unknown,cerebral,
48,1936,LIPOMA AND OSTEOLIPOMA OF THE BRAIN,"S. J. Sperling, B. J. Alpers",Unknown venue,1936-01-01,25,2,66.65,General Brain Science and Reviews,,Positions LIPOMA AND OSTEOLIPOMA OF THE BRAIN within General Brain Science and Reviews.,high citation signal (25),"Broad reviews can dominate citation-ranked lists while obscuring narrower empirical advances.; Taxonomy boundaries are imperfect because many brain papers combine methods, scales, and diseases.; Metadata-level ranking should be complemented with full-text expert review before strong claims are made.",10.1097/00005053-193601000-00002,71f06cd61bd03c12d1066309c33fbb4a271ff8ba,https://doi.org/10.1097/00005053-193601000-00002,,,Review,unknown,brain; brain in title,
49,1936,The Electrical Activity of the Cortex,E. Adrian,Unknown venue,1936-01-01,24,0,68.94,General Brain Science and Reviews,,Positions The Electrical Activity of the Cortex within General Brain Science and Reviews.,high citation signal (24); open-access PDF metadata,"Broad reviews can dominate citation-ranked lists while obscuring narrower empirical advances.; Taxonomy boundaries are imperfect because many brain papers combine methods, scales, and diseases.; Metadata-level ranking should be complemented with full-text expert review before strong claims are made.",10.1177/003591573602900301,7449035b7a42f6eed88033718662458acc6fdcc1,https://doi.org/10.1177/003591573602900301,https://doi.org/10.1177/003591573602900301,,paper,unknown,cortex; neuroscience term,
50,1936,THE LIMITED NEUROTROPIC CHARACTER OF THE ENCEPHALITIS VIRUS (ST. LOUIS TYPE) IN SUSCEPTIBLE MICE,"L. T. Webster, A. D. Clow",Journal of Experimental Medicine,1936-02-29,24,0,67.34,"EEG, MEG, and Electrophysiology",EEG;non-human,1. St. Louis encephalitis virus injected intracerebrally into susceptible mice multiplies there to reach a titre of 109 intracerebral lethal doses.,high citation signal (24); open-access PDF metadata,"Low signal-to-noise ratio, artifacts, and source-localization uncertainty complicate interpretation.; Many studies rely on controlled tasks and may not generalize to everyday behavior or clinical monitoring.; Non-human findings need careful translation to human brain organization and clinical outcomes.",10.1084/jem.63.3.433,1e1f07f92a29421f8411c978f580801676bb274b,https://doi.org/10.1084/jem.63.3.433,https://doi.org/10.1084/jem.63.3.433,,JournalArticle,unknown,brain; cerebral,"1. St. Louis encephalitis virus injected intracerebrally into susceptible mice multiplies there to reach a titre of 109 intracerebral lethal doses. It is found also in the blood in small amounts immediately following injection and preceding death. 2. Injected intraperitoneally or subcutaneously the virus circulates in the blood for several hours and survives in the spleen for days. It does not multiply in the brain and cause encephalitis, however, unless overwhelming doses are injected or the brain is traumatized. 3. Virus dropped into the nares is demonstrable in the olfactory bulbs at 24 hours, in the piriform lobes at 24 to 48 hours, in the remainder of the brain at 3 days, and in the spinal cord at 4 days. In the brain it reaches a titre of 109 in 6 days. Virus is not readily demonstrable in the blood but is present in the spleen after 48 hours. 4. Virus survives and is capable of multiplying in the spleen. 5. Lesions following nasal instillation of virus appear first in the olfactory bulbs on the 3rd day, in the piriform lobes on the 4th, and in Ammon's horn on the 5th day. The character of the lesions in order of their appearance is exudation of mononuclear cells about superficial blood vessels and in the pia, hyperplasia of the endothelium of the pia, and necrosis of nerve cells of the olfactory tract."
51,1936,LOCALIZATION OF THE CENTRAL RESPIRATORY MECHANISM AS STUDIED BY LOCAL COOLING OF THE SURFACE OF THE BRAIN STEM,H. Nicholson,Unknown venue,1936-03-31,23,0,66.4,General Brain Science and Reviews,non-human,Positions LOCALIZATION OF THE CENTRAL RESPIRATORY MECHANISM AS STUDIED BY LOCAL COOLING OF THE SURFACE OF THE BRAIN STEM within General Brain Science and Reviews.,high citation signal (23),"Broad reviews can dominate citation-ranked lists while obscuring narrower empirical advances.; Taxonomy boundaries are imperfect because many brain papers combine methods, scales, and diseases.; Non-human findings need careful translation to human brain organization and clinical outcomes.",10.1152/AJPLEGACY.1936.115.2.402,2e99c615423c696be9068cb2d5cd078f8fff16bd,https://doi.org/10.1152/AJPLEGACY.1936.115.2.402,,,paper,unknown,brain; brain in title,
52,1936,EXTENSIVE PIGMENTED NEVUS ASSOCIATED WITH PRIMARY MELANOBLASTOSIS OF LEPTOMENINGES OF BRAIN AND SPINAL CORD: REPORT OF A CASE,E. W. Netherton,Unknown venue,1936-02-01,21,0,63.64,General Brain Science and Reviews,,Positions EXTENSIVE PIGMENTED NEVUS ASSOCIATED WITH PRIMARY MELANOBLASTOSIS OF LEPTOMENINGES OF BRAIN AND SPINAL CORD: REPORT OF A CASE within General Brain Science and Reviews.,high citation signal (21),"Broad reviews can dominate citation-ranked lists while obscuring narrower empirical advances.; Taxonomy boundaries are imperfect because many brain papers combine methods, scales, and diseases.; Metadata-level ranking should be complemented with full-text expert review before strong claims are made.",10.1001/ARCHDERM.1936.01470080034003,16807688ac2fe5fe1226b8212e41ec54566221e6,https://doi.org/10.1001/ARCHDERM.1936.01470080034003,,,paper,unknown,brain; brain in title,
53,1936,The modifications of behavior consequent to cerebral lesions,K. Goldstein,Psychiatric quarterly,1936-12-01,20,2,56.8,Cognitive and Systems Neuroscience,,Positions The modifications of behavior consequent to cerebral lesions within Cognitive and Systems Neuroscience.,high citation signal (20),"Task designs can simplify cognition enough that ecological validity becomes uncertain.; Cross-species alignment between circuits, behavior, and subjective experience remains imperfect.; Metadata-level ranking should be complemented with full-text expert review before strong claims are made.",10.1007/BF01563142,6df0761de0c9a4e5f8f5ebac7e9ca041d14dcfb4,https://doi.org/10.1007/BF01563142,,,paper,unknown,cerebral,
