rank,year,title,authors,venue,publicationDate,citationCount,influentialCitationCount,importanceScore,category,keywordTags,keyIdea,strengths,limitations,doi,sourceId,url,openAccessPdf,workType,language,relevanceReason,abstract
51,1925,A method for sectioning the whole human brain,P. A. Stegall,Unknown venue,1925-02-01,1,0,21.68,General Brain Science and Reviews,human,Positions A method for sectioning the whole human brain within General Brain Science and Reviews.,high citation signal (1); human evidence signal,"Broad reviews can dominate citation-ranked lists while obscuring narrower empirical advances.; Taxonomy boundaries are imperfect because many brain papers combine methods, scales, and diseases.; Human cohort effects can depend on recruitment, demographics, comorbidity, and measurement context.",10.1002/AR.1090290407,c81c6a0e7d1f0d6bc2a92074f0ef9cc9f35813a2,https://doi.org/10.1002/AR.1090290407,,paper,unknown,brain; brain in title,
52,1925,BRAIN TUMOR: NEURO-OTOLOGIC EXAMINATION IN SEVEN CONSECUTIVE VERIFIED CASES IN THE POSTERIOR FOSSA IN CHILDREN,D. E. Wishart,Unknown venue,1925-07-01,1,0,21.68,Clinical Neurology and Neurodegeneration,human,Positions BRAIN TUMOR: NEURO-OTOLOGIC EXAMINATION IN SEVEN CONSECUTIVE VERIFIED CASES IN THE POSTERIOR FOSSA IN CHILDREN within Clinical Neurology and Neurodegeneration.,high citation signal (1); human evidence signal,"Clinical cohorts often differ in disease stage, comorbidity, treatment history, and follow-up duration.; Biomarkers may not transfer cleanly across populations, scanners, care settings, or diagnostic criteria.; Human cohort effects can depend on recruitment, demographics, comorbidity, and measurement context.",10.1001/ARCHOTOL.1925.00570010009001,e4c97f083eb6d61ba7285486907c98fdaeb55bcd,https://doi.org/10.1001/ARCHOTOL.1925.00570010009001,,paper,unknown,brain; brain in title,
53,1925,CALCIFIED BRAIN TUMOR,G. Crabb,Unknown venue,1925-07-25,1,0,20.48,Clinical Neurology and Neurodegeneration,,Positions CALCIFIED BRAIN TUMOR within Clinical Neurology and Neurodegeneration.,high citation signal (1),"Clinical cohorts often differ in disease stage, comorbidity, treatment history, and follow-up duration.; Biomarkers may not transfer cleanly across populations, scanners, care settings, or diagnostic criteria.; Metadata-level ranking should be complemented with full-text expert review before strong claims are made.",10.1001/JAMA.1925.26710040001009,124c35a84fe9c2ff07888284cc793a29f37a4a75,https://doi.org/10.1001/JAMA.1925.26710040001009,,paper,unknown,brain; brain in title,
54,1925,Case of Recent and Old Haemorrhages of the Brain.,Douglas Rg,Unknown venue,1925-06-01,1,0,20.48,"Cerebrovascular, Metabolism, and Brain Injury",,"Positions Case of Recent and Old Haemorrhages of the Brain. within Cerebrovascular, Metabolism, and Brain Injury.",high citation signal (1),"Acute injury studies can be sensitive to timing, severity, comorbidity, and treatment heterogeneity.; Animal models may not capture human vascular risk, injury complexity, or rehabilitation context.; Metadata-level ranking should be complemented with full-text expert review before strong claims are made.",,d9a26369d5932f2b2dec8bd38cefc97c9e09467d,https://www.semanticscholar.org/paper/d9a26369d5932f2b2dec8bd38cefc97c9e09467d,,paper,unknown,brain; brain in title,
55,1925,Double Optic Atrophy Secondary to Brain Tumor,G. F. Libby,Unknown venue,1925-06-01,1,0,20.48,Clinical Neurology and Neurodegeneration,,Positions Double Optic Atrophy Secondary to Brain Tumor within Clinical Neurology and Neurodegeneration.,high citation signal (1),"Clinical cohorts often differ in disease stage, comorbidity, treatment history, and follow-up duration.; Biomarkers may not transfer cleanly across populations, scanners, care settings, or diagnostic criteria.; Metadata-level ranking should be complemented with full-text expert review before strong claims are made.",10.1016/S0002-9394(25)90075-X,fe3358db0aaeb54a712da4c30298c285b7d2d7f5,https://doi.org/10.1016/S0002-9394(25)90075-X,,paper,unknown,brain; brain in title,
56,1925,Experimental Production of Gliosis: II. Reaction of Brain Tissue to the Lipoid Fractions and to the Residue of Brain Extracts.,L. Bender,American Journal of Pathology,1925-11-01,1,0,20.48,General Brain Science and Reviews,,Positions Experimental Production of Gliosis: II. Reaction of Brain Tissue to the Lipoid Fractions and to the Residue of Brain Extracts. within General Brain Science and Reviews.,high citation signal (1),"Broad reviews can dominate citation-ranked lists while obscuring narrower empirical advances.; Taxonomy boundaries are imperfect because many brain papers combine methods, scales, and diseases.; Metadata-level ranking should be complemented with full-text expert review before strong claims are made.",,003d27e6e82c942ff45f4cc505f361057a8e84c8,https://www.semanticscholar.org/paper/003d27e6e82c942ff45f4cc505f361057a8e84c8,,JournalArticle,unknown,brain; brain in title,
57,1925,FURTHER POINTS IN THE PHYSIOLOGY OF BRAIN SURGERY*,C. Reynolds,The Journal of neurology and psychopathology,1925-05-01,1,0,35.48,Clinical Neurology and Neurodegeneration,,Positions FURTHER POINTS IN THE PHYSIOLOGY OF BRAIN SURGERY* within Clinical Neurology and Neurodegeneration.,high citation signal (1); recognized venue; open-access PDF metadata,"Clinical cohorts often differ in disease stage, comorbidity, treatment history, and follow-up duration.; Biomarkers may not transfer cleanly across populations, scanners, care settings, or diagnostic criteria.; Metadata-level ranking should be complemented with full-text expert review before strong claims are made.",10.1136/jnnp.s1-6.21.35,b6639c566f8c4996db7f14466bf579265fc8eaa4,https://doi.org/10.1136/jnnp.s1-6.21.35,https://jnnp.bmj.com/content/jnnp/s1-6/21/35.full.pdf,JournalArticle,unknown,brain; brain in title,
58,1925,AN ELECTRICAL THEORY OF NEURAL ENERGY,C. K. Mills,Unknown venue,1925-02-01,1,0,14.48,General Brain Science and Reviews,,Positions AN ELECTRICAL THEORY OF NEURAL ENERGY within General Brain Science and Reviews.,high citation signal (1),"Broad reviews can dominate citation-ranked lists while obscuring narrower empirical advances.; Taxonomy boundaries are imperfect because many brain papers combine methods, scales, and diseases.; Metadata-level ranking should be complemented with full-text expert review before strong claims are made.",10.1001/ARCHNEURPSYC.1925.02200080002001,cd0b170ac1053caa07c5a6619f053f65c664c96a,https://doi.org/10.1001/ARCHNEURPSYC.1925.02200080002001,,paper,unknown,neural,
59,1925,SIGNIFICANCE OF JACKSONIAN EPILEPSY IN FOCAL DIAGNOSIS OF CEREBRAL LESIONS,W. B. Cadwalader,Unknown venue,1925-09-01,1,0,14.48,Clinical Neurology and Neurodegeneration,,Positions SIGNIFICANCE OF JACKSONIAN EPILEPSY IN FOCAL DIAGNOSIS OF CEREBRAL LESIONS within Clinical Neurology and Neurodegeneration.,high citation signal (1),"Clinical cohorts often differ in disease stage, comorbidity, treatment history, and follow-up duration.; Biomarkers may not transfer cleanly across populations, scanners, care settings, or diagnostic criteria.; Metadata-level ranking should be complemented with full-text expert review before strong claims are made.",10.1001/ARCHNEURPSYC.1925.02200150071006,be3b9257cede8ab1dc85af57dcfbb2e40b508e1d,https://doi.org/10.1001/ARCHNEURPSYC.1925.02200150071006,,paper,unknown,cerebral,
60,1925,"THE CORRECTION OF FLEXION, ADDUCTION, AND INTERNAL ROTATION DEFORMITIES OF THE LOWER EXTREMITIES, RESULTING FROM CEREBRAL PALSY OF CHILDHOOD.",R. Pyles,California and western medicine,1925-12-01,1,0,14.48,"Brain Development, Plasticity, and Connectomics",,"Positions THE CORRECTION OF FLEXION, ADDUCTION, AND INTERNAL ROTATION DEFORMITIES OF THE LOWER EXTREMITIES, RESULTING FROM CEREBRAL PALSY OF CHILDHOOD. within Brain Development, Plasticity, and Connectomics.",high citation signal (1),"Developmental and aging studies are sensitive to cohort composition, attrition, and longitudinal sampling intervals.; Network measures can depend heavily on parcellation, thresholding, and acquisition choices.; Metadata-level ranking should be complemented with full-text expert review before strong claims are made.",,a767df6d28536fdada9a7ee14a9edf5fd2610e02,https://www.semanticscholar.org/paper/a767df6d28536fdada9a7ee14a9edf5fd2610e02,,JournalArticle,unknown,cerebral,
61,1925,The relation of learning and retention to the extent of cerebral lesions in the rat.,K. Lashley,Unknown venue,1925-04-01,1,0,15.68,Cognitive and Systems Neuroscience,non-human,Positions The relation of learning and retention to the extent of cerebral lesions in the rat. within Cognitive and Systems Neuroscience.,high citation signal (1),"Task designs can simplify cognition enough that ecological validity becomes uncertain.; Cross-species alignment between circuits, behavior, and subjective experience remains imperfect.; Non-human findings need careful translation to human brain organization and clinical outcomes.",10.3181/00379727-22-197,b593b330b6c57e9b5029319d3a9f0d88e3be4b1b,https://doi.org/10.3181/00379727-22-197,,JournalArticle,unknown,cerebral,
62,1925,"BOSTON SOCIETY OF PSYCHIATRY AND NEUROLOGY REGULAR MONTHLY MEETING, APRIL 16, 1925, WILLIAM HEALY, M.D., PRESIDENT, IN THE CHAIR. SARCOMATOSIS OF THE BRAIN",B. M. Fried,Unknown venue,1925-11-01,0,0,14.0,Clinical Neurology and Neurodegeneration,,"Positions BOSTON SOCIETY OF PSYCHIATRY AND NEUROLOGY REGULAR MONTHLY MEETING, APRIL 16, 1925, WILLIAM HEALY, M.D., PRESIDENT, IN THE CHAIR. SARCOMATOSIS OF THE BRAIN within Clinical Neurology and Neurodegeneration.",high citation signal (0),"Clinical cohorts often differ in disease stage, comorbidity, treatment history, and follow-up duration.; Biomarkers may not transfer cleanly across populations, scanners, care settings, or diagnostic criteria.; Metadata-level ranking should be complemented with full-text expert review before strong claims are made.",10.1097/00005053-192511000-00005,73f14b8d8299cb5748420db5c98ebfe371538986,https://doi.org/10.1097/00005053-192511000-00005,,paper,unknown,brain; brain in title; neuroscience term,
63,1925,BRAIN ABSCESS OF AURAL ORIGIN,C. Yorke,British medical journal,1925-02-21,0,0,11.0,General Brain Science and Reviews,,Positions BRAIN ABSCESS OF AURAL ORIGIN within General Brain Science and Reviews.,high citation signal (0); open-access PDF metadata,"Broad reviews can dominate citation-ranked lists while obscuring narrower empirical advances.; Taxonomy boundaries are imperfect because many brain papers combine methods, scales, and diseases.; Metadata-level ranking should be complemented with full-text expert review before strong claims are made.",10.1136/BMJ.1.3347.354,76f4fcd0ebb6d8d19ae7518a535ca3ca135fb8c5,https://doi.org/10.1136/BMJ.1.3347.354,https://europepmc.org/articles/pmc2196747?pdf=render,JournalArticle,unknown,brain; brain in title,
64,1925,"Brain abscess, sinus thrombosis and menin-gitis complicating acute mastoiditis; a clinical study of two cases",J. Polisar,Unknown venue,1925-10-01,0,0,9.2,Clinical Neurology and Neurodegeneration,human,"Positions Brain abscess, sinus thrombosis and menin-gitis complicating acute mastoiditis; a clinical study of two cases within Clinical Neurology and Neurodegeneration.",high citation signal (0); human evidence signal,"Clinical cohorts often differ in disease stage, comorbidity, treatment history, and follow-up duration.; Biomarkers may not transfer cleanly across populations, scanners, care settings, or diagnostic criteria.; Human cohort effects can depend on recruitment, demographics, comorbidity, and measurement context.",10.1288/00005537-192510000-00011,c4b4283642cd3c3e3e795632f05e1cf6bfb24cf1,https://doi.org/10.1288/00005537-192510000-00011,,paper,unknown,brain; brain in title,
65,1925,"Changes in the Endocrine Glands and Brain in Schizophrenia [Über Veränderungen Endocriner Organe und des Gehirns bei Schizophrenie]. (Zeitschr. für die ges. Neur. und Psychiat., March, 1925.) Münzer, F. T., and Pollak, W.",W. S. Dawson,Unknown venue,1925-07-01,0,0,8.0,General Brain Science and Reviews,,"Positions Changes in the Endocrine Glands and Brain in Schizophrenia [Über Veränderungen Endocriner Organe und des Gehirns bei Schizophrenie]. (Zeitschr. für die ges. Neur. und Psychiat., March, 1925.) Münzer, F. T., and Pollak, W. within General Brain Science and Reviews.",high citation signal (0),"Broad reviews can dominate citation-ranked lists while obscuring narrower empirical advances.; Taxonomy boundaries are imperfect because many brain papers combine methods, scales, and diseases.; Metadata-level ranking should be complemented with full-text expert review before strong claims are made.",10.1192/bjp.71.294.613-a,9c2a7a7d08148f022e0bfa175ae620f93e330d5d,https://doi.org/10.1192/bjp.71.294.613-a,,paper,unknown,brain; brain in title,
66,1925,Instrument for Puncture of The Ventricles of The Brain,K. Lewkowicz,Proceedings of the Royal Society of Medicine,1925-04-01,0,0,11.0,General Brain Science and Reviews,,Positions Instrument for Puncture of The Ventricles of The Brain within General Brain Science and Reviews.,high citation signal (0); open-access PDF metadata,"Broad reviews can dominate citation-ranked lists while obscuring narrower empirical advances.; Taxonomy boundaries are imperfect because many brain papers combine methods, scales, and diseases.; Metadata-level ranking should be complemented with full-text expert review before strong claims are made.",10.1177/003591572501802142,38d8bf165e785547b157cd653727cbff686d5d4e,https://doi.org/10.1177/003591572501802142,https://doi.org/10.1177/003591572501802142,JournalArticle,unknown,brain; brain in title,
67,1925,MAPS OF THE BRAIN,Unknown authors,Unknown venue,1925-10-01,0,0,8.0,General Brain Science and Reviews,,Positions MAPS OF THE BRAIN within General Brain Science and Reviews.,high citation signal (0),"Broad reviews can dominate citation-ranked lists while obscuring narrower empirical advances.; Taxonomy boundaries are imperfect because many brain papers combine methods, scales, and diseases.; Metadata-level ranking should be complemented with full-text expert review before strong claims are made.",10.5694/j.1326-5377.1925.tb12054.x,056a1a22a8ac4617a9400158d2785e64d7bc032c,https://doi.org/10.5694/j.1326-5377.1925.tb12054.x,,paper,unknown,brain; brain in title,
68,1925,Perforation of the septum pellucidum of the brain,J. Grant,Unknown venue,1925-05-01,0,0,9.2,General Brain Science and Reviews,non-human,Positions Perforation of the septum pellucidum of the brain within General Brain Science and Reviews.,high citation signal (0),"Broad reviews can dominate citation-ranked lists while obscuring narrower empirical advances.; Taxonomy boundaries are imperfect because many brain papers combine methods, scales, and diseases.; Non-human findings need careful translation to human brain organization and clinical outcomes.",10.1002/AR.1090300208,96be659da8b123afed99c875acdb429e1a00d029,https://doi.org/10.1002/AR.1090300208,,paper,unknown,brain; brain in title,
69,1925,SOME SURGICAL ASPECTS OP THE PATHOLOGY OF GLIOMAS OF THE BRAIN,E. Sachs,Annals of Surgery,1925-05-01,0,0,11.0,General Brain Science and Reviews,,Positions SOME SURGICAL ASPECTS OP THE PATHOLOGY OF GLIOMAS OF THE BRAIN within General Brain Science and Reviews.,high citation signal (0); open-access PDF metadata,"Broad reviews can dominate citation-ranked lists while obscuring narrower empirical advances.; Taxonomy boundaries are imperfect because many brain papers combine methods, scales, and diseases.; Metadata-level ranking should be complemented with full-text expert review before strong claims are made.",10.1097/00000658-192505010-00002,e56bb8161a646107c3c0d3aa6bf34454c7c1e023,https://doi.org/10.1097/00000658-192505010-00002,https://www.ncbi.nlm.nih.gov/pmc/articles/PMC1400036,JournalArticle,unknown,brain; brain in title,
70,1925,STUDIES ON DEMENTIA PRECOX: A STATISTICAL INVESTIGATION OF VARIOUS CONDITIONS WHICH MIGHT HAVE AFFECTED THE BRAIN BEFORE THE ONSET OF THE DISEASE,"S. Kure, M. Shimoda",Unknown venue,1925-11-01,0,0,8.0,Clinical Neurology and Neurodegeneration,,Positions STUDIES ON DEMENTIA PRECOX: A STATISTICAL INVESTIGATION OF VARIOUS CONDITIONS WHICH MIGHT HAVE AFFECTED THE BRAIN BEFORE THE ONSET OF THE DISEASE within Clinical Neurology and Neurodegeneration.,high citation signal (0),"Clinical cohorts often differ in disease stage, comorbidity, treatment history, and follow-up duration.; Biomarkers may not transfer cleanly across populations, scanners, care settings, or diagnostic criteria.; Metadata-level ranking should be complemented with full-text expert review before strong claims are made.",10.1097/00005053-192511000-00003,6dcd2d6a09fe15a74593927599d20bd266db15a6,https://doi.org/10.1097/00005053-192511000-00003,,paper,unknown,brain; brain in title,
71,1925,The Localisation of Brain Tumours by Ventriculography,W. PiersonJ.,Unknown venue,1925-10-01,0,0,8.0,General Brain Science and Reviews,,Positions The Localisation of Brain Tumours by Ventriculography within General Brain Science and Reviews.,high citation signal (0),"Broad reviews can dominate citation-ranked lists while obscuring narrower empirical advances.; Taxonomy boundaries are imperfect because many brain papers combine methods, scales, and diseases.; Metadata-level ranking should be complemented with full-text expert review before strong claims are made.",10.1259/BIR.1925.0077,b73967e8ce7becb0519f380460abc797a09903d8,https://doi.org/10.1259/BIR.1925.0077,,paper,unknown,brain; brain in title,
72,1925,"The Site of the Globe Playhouse, Southwark. By W. W. Braines. Second edition. With 18 plans and illustrations. 9¾ × 7¼; pp. 112. Published by arrangement with the London County Council. London: Hodder and Stoughton. 1924. 6s.",W. Martin,The Antiquaries Journal,1925-07-01,0,0,9.2,General Brain Science and Reviews,non-human,"Positions The Site of the Globe Playhouse, Southwark. By W. W. Braines. Second edition. With 18 plans and illustrations. 9¾ × 7¼; pp. 112. Published by arrangement with the London County Council. London: Hodder and Stoughton. 1924. 6s. within General Brain Science and Reviews.",high citation signal (0),"Broad reviews can dominate citation-ranked lists while obscuring narrower empirical advances.; Taxonomy boundaries are imperfect because many brain papers combine methods, scales, and diseases.; Non-human findings need careful translation to human brain organization and clinical outcomes.",10.1017/S0003581500006879,3d4c264d7ec2e2a52a86fc134b48dccce640c442,https://doi.org/10.1017/S0003581500006879,,paper,unknown,brain; brain in title,
73,1925,The Value of Honey as a Body and Brain Building Food,H. Castle,Unknown venue,1925-04-01,0,0,8.0,General Brain Science and Reviews,,Positions The Value of Honey as a Body and Brain Building Food within General Brain Science and Reviews.,high citation signal (0),"Broad reviews can dominate citation-ranked lists while obscuring narrower empirical advances.; Taxonomy boundaries are imperfect because many brain papers combine methods, scales, and diseases.; Metadata-level ranking should be complemented with full-text expert review before strong claims are made.",10.1080/0005772X.1925.11095935,8827e63d7fff067e0eca8bbb33641e8edfe2e7f2,https://doi.org/10.1080/0005772X.1925.11095935,,paper,unknown,brain; brain in title,
74,1925,XCI. Three Cases of Otitic Brain Abscess,S. Smith,Unknown venue,1925-12-01,0,0,8.0,General Brain Science and Reviews,,Positions XCI. Three Cases of Otitic Brain Abscess within General Brain Science and Reviews.,high citation signal (0),"Broad reviews can dominate citation-ranked lists while obscuring narrower empirical advances.; Taxonomy boundaries are imperfect because many brain papers combine methods, scales, and diseases.; Metadata-level ranking should be complemented with full-text expert review before strong claims are made.",10.1177/000348942503400411,3afb24389e664bdb2c29a251c14b814b60604a30,https://doi.org/10.1177/000348942503400411,,JournalArticle,unknown,brain; brain in title,
75,1925,XL. Case Histories of Otitic Brain Abscess Observed at Cook County Hospital,C. Yerger,Unknown venue,1925-06-01,0,0,8.0,General Brain Science and Reviews,,Positions XL. Case Histories of Otitic Brain Abscess Observed at Cook County Hospital within General Brain Science and Reviews.,high citation signal (0),"Broad reviews can dominate citation-ranked lists while obscuring narrower empirical advances.; Taxonomy boundaries are imperfect because many brain papers combine methods, scales, and diseases.; Metadata-level ranking should be complemented with full-text expert review before strong claims are made.",10.1177/000348942503400217,234c69d1eaee9ce9a2b7c3bbeefc8c437314d009,https://doi.org/10.1177/000348942503400217,,JournalArticle,unknown,brain; brain in title,
76,1925,Recent Literature,P. Rousseau,American Journal of Sociology,1925-11-01,0,0,4.4,General Brain Science and Reviews,human;non-human,Psychoanalytic Studies.-The Nihilist instinct in man: The passion to destroy in order to drive away intolerable boredom is the master passion in the human brain.,high citation signal (0); human evidence signal,"Broad reviews can dominate citation-ranked lists while obscuring narrower empirical advances.; Taxonomy boundaries are imperfect because many brain papers combine methods, scales, and diseases.; Non-human findings need careful translation to human brain organization and clinical outcomes.",10.1086/213914,17dadc21f05c7e9b62592d70d687ca4161431224,https://doi.org/10.1086/213914,,JournalArticle; Review,unknown,brain,"Psychoanalytic Studies.-The Nihilist instinct in man: The passion to destroy in order to drive away intolerable boredom is the master passion in the human brain. Death-dealing activities fascinate us. Inhuman nature: In war the cave man supplants the civilized man. War is the emancipation of the semi-civilized modern man from the restraints of conventional morality. Under the direction of the state he does what he could not otherwise do. Rational motives are not the propelling forces in man's conduct. He is dominated by his instincts, to which war gives expression. The cost of war is the penalty for man's vicious inheritance. The illusion of war is the great reality.-S. D. Schmalhausen, Psychoanalytic Review, XJI (July, I925),"
