rank,year,title,authors,venue,publicationDate,citationCount,influentialCitationCount,importanceScore,category,keywordTags,keyIdea,strengths,limitations,doi,sourceId,url,openAccessPdf,workType,language,relevanceReason,abstract
46,1924,"Studies of the Brain-Stem. Carbon dioxide excretion after destruction of the optic thalamus, and the reflex functions of the thalamus in body temperature regulation","F. Rogers, S. Wheat",Unknown venue,1924-07-01,2,0,28.98,General Brain Science and Reviews,non-human,"Positions Studies of the Brain-Stem. Carbon dioxide excretion after destruction of the optic thalamus, and the reflex functions of the thalamus in body temperature regulation within General Brain Science and Reviews.",high citation signal (2),"Broad reviews can dominate citation-ranked lists while obscuring narrower empirical advances.; Taxonomy boundaries are imperfect because many brain papers combine methods, scales, and diseases.; Non-human findings need careful translation to human brain organization and clinical outcomes.",10.1097/00005053-192407000-00031,73e13149f6dc15fd11af5f21fba3116a707dedc9,https://doi.org/10.1097/00005053-192407000-00031,,paper,unknown,brain; brain in title,
47,1924,The Spatz Test for Iron in the Brain,J. Dudgeon,Unknown venue,1924-10-01,2,0,27.78,General Brain Science and Reviews,,Positions The Spatz Test for Iron in the Brain within General Brain Science and Reviews.,high citation signal (2),"Broad reviews can dominate citation-ranked lists while obscuring narrower empirical advances.; Taxonomy boundaries are imperfect because many brain papers combine methods, scales, and diseases.; Metadata-level ranking should be complemented with full-text expert review before strong claims are made.",10.1192/BJP.70.291.577,d1dff8c2a111bc6676fda726cb806adddf124154,https://doi.org/10.1192/BJP.70.291.577,,paper,unknown,brain; brain in title,
48,1924,A Streptothrix Organism from a Brain Abscess.,A. E. Steele,The Journal of medical research,1924-03-01,1,0,20.48,General Brain Science and Reviews,,Positions A Streptothrix Organism from a Brain Abscess. within General Brain Science and Reviews.,high citation signal (1),"Broad reviews can dominate citation-ranked lists while obscuring narrower empirical advances.; Taxonomy boundaries are imperfect because many brain papers combine methods, scales, and diseases.; Metadata-level ranking should be complemented with full-text expert review before strong claims are made.",,f33cd449063be358e2f9231a64f1874b0b9853b2,https://www.semanticscholar.org/paper/f33cd449063be358e2f9231a64f1874b0b9853b2,,JournalArticle,unknown,brain; brain in title,
49,1924,ABSCESS OF THE BRAIN THAT POINTED EXTERNALLY,H. Drummond,British medical journal,1924-06-07,1,0,23.48,General Brain Science and Reviews,,Positions ABSCESS OF THE BRAIN THAT POINTED EXTERNALLY within General Brain Science and Reviews.,high citation signal (1); open-access PDF metadata,"Broad reviews can dominate citation-ranked lists while obscuring narrower empirical advances.; Taxonomy boundaries are imperfect because many brain papers combine methods, scales, and diseases.; Metadata-level ranking should be complemented with full-text expert review before strong claims are made.",10.1136/BMJ.1.3310.995-A,ec095ee2084952251af79962b58badb6dc2eb2f6,https://doi.org/10.1136/BMJ.1.3310.995-A,https://europepmc.org/articles/pmc2304450?pdf=render,JournalArticle,unknown,brain; brain in title,
50,1924,ACCIDENTAL MALARIAL INFECTION IN SYPHILIS OF THE BRAIN,L. E. Hines,Unknown venue,1924-10-11,1,0,20.48,General Brain Science and Reviews,,Positions ACCIDENTAL MALARIAL INFECTION IN SYPHILIS OF THE BRAIN within General Brain Science and Reviews.,high citation signal (1),"Broad reviews can dominate citation-ranked lists while obscuring narrower empirical advances.; Taxonomy boundaries are imperfect because many brain papers combine methods, scales, and diseases.; Metadata-level ranking should be complemented with full-text expert review before strong claims are made.",10.1001/JAMA.1924.26610150001013,24d65b4f7555f710e2a4544b048d30886c8d02da,https://doi.org/10.1001/JAMA.1924.26610150001013,,paper,unknown,brain; brain in title,
51,1924,Angiomas in the Brain,Lechner,Unknown venue,1924-09-01,1,0,20.48,General Brain Science and Reviews,,Positions Angiomas in the Brain within General Brain Science and Reviews.,high citation signal (1),"Broad reviews can dominate citation-ranked lists while obscuring narrower empirical advances.; Taxonomy boundaries are imperfect because many brain papers combine methods, scales, and diseases.; Metadata-level ranking should be complemented with full-text expert review before strong claims are made.",10.1097/00005053-192409000-00082,70122c1c8b587ec54aa0438efe80cafab4893e12,https://doi.org/10.1097/00005053-192409000-00082,,paper,unknown,brain; brain in title,
52,1924,Cysticercus of Taenia Solium in Human Brain.,F. W. Luney,Canadian Medical Association journal,1924-02-01,1,0,21.68,General Brain Science and Reviews,human,Positions Cysticercus of Taenia Solium in Human Brain. within General Brain Science and Reviews.,high citation signal (1); human evidence signal,"Broad reviews can dominate citation-ranked lists while obscuring narrower empirical advances.; Taxonomy boundaries are imperfect because many brain papers combine methods, scales, and diseases.; Human cohort effects can depend on recruitment, demographics, comorbidity, and measurement context.",,6cf188a68694da14daf585747fa7bf1b34109704,https://www.semanticscholar.org/paper/6cf188a68694da14daf585747fa7bf1b34109704,,JournalArticle,unknown,brain; brain in title,
53,1924,Endothelioma of the Brain,Maragliano,Unknown venue,1924-09-01,1,0,20.48,General Brain Science and Reviews,,Positions Endothelioma of the Brain within General Brain Science and Reviews.,high citation signal (1),"Broad reviews can dominate citation-ranked lists while obscuring narrower empirical advances.; Taxonomy boundaries are imperfect because many brain papers combine methods, scales, and diseases.; Metadata-level ranking should be complemented with full-text expert review before strong claims are made.",10.1097/00005053-192409000-00081,bae7874a2bd0a2587781f302170ec105947bd6ed,https://doi.org/10.1097/00005053-192409000-00081,,paper,unknown,brain; brain in title,
54,1924,Four Cases of Abscess of the Brain,J. Wishart,Journal of Laryngology and Otology,1924-11-01,1,0,20.48,General Brain Science and Reviews,,Positions Four Cases of Abscess of the Brain within General Brain Science and Reviews.,high citation signal (1),"Broad reviews can dominate citation-ranked lists while obscuring narrower empirical advances.; Taxonomy boundaries are imperfect because many brain papers combine methods, scales, and diseases.; Metadata-level ranking should be complemented with full-text expert review before strong claims are made.",10.1017/S002221510002675X,7798b563855e05a12e151a18e343ad018e9a0fab,https://doi.org/10.1017/S002221510002675X,,paper,unknown,brain; brain in title,
55,1924,LXXXVIII. Suspended Respiration in a Case of Brain Abscess,F. N. Sperry,Unknown venue,1924-12-01,1,0,21.68,General Brain Science and Reviews,non-human,Positions LXXXVIII. Suspended Respiration in a Case of Brain Abscess within General Brain Science and Reviews.,high citation signal (1),"Broad reviews can dominate citation-ranked lists while obscuring narrower empirical advances.; Taxonomy boundaries are imperfect because many brain papers combine methods, scales, and diseases.; Non-human findings need careful translation to human brain organization and clinical outcomes.",10.1177/000348942403300421,4bc55d8cb053934e5d33a7ec302cdf04fd91aee8,https://doi.org/10.1177/000348942403300421,,JournalArticle,unknown,brain; brain in title,
56,1924,THE APPARENT EFFECT OF ARSPHENAMIN IN TWO CASES OF BRAIN TUMOR,"A. W. Morrison, J. McKinley",Unknown venue,1924-03-01,1,0,20.48,Clinical Neurology and Neurodegeneration,,Positions THE APPARENT EFFECT OF ARSPHENAMIN IN TWO CASES OF BRAIN TUMOR within Clinical Neurology and Neurodegeneration.,high citation signal (1),"Clinical cohorts often differ in disease stage, comorbidity, treatment history, and follow-up duration.; Biomarkers may not transfer cleanly across populations, scanners, care settings, or diagnostic criteria.; Metadata-level ranking should be complemented with full-text expert review before strong claims are made.",10.1097/00005053-192403000-00004,8acd3dbf6cc8322302f937ff4cd8808110a90377,https://doi.org/10.1097/00005053-192403000-00004,,paper,unknown,brain; brain in title,
57,1924,FACTORS AFFECTING THE SUSCEPTIBILITY OF FROGS TO THE CONVULSANT ACTION OF ACID FUCHSIN,J. Thomas,Journal of Pharmacology and Experimental Therapeutics,1924-05-01,1,0,17.68,General Brain Science and Reviews,non-human,"This study has been primarily a search for evidence either for or against the view originally expressed by Barbour and Abel (1) that the increase in susceptibility to acid fuchsin in frogs after decerebration was due to the failure, because of decerebration, of a previously functional inhibitory mechanism.",high citation signal (1),"Broad reviews can dominate citation-ranked lists while obscuring narrower empirical advances.; Taxonomy boundaries are imperfect because many brain papers combine methods, scales, and diseases.; Non-human findings need careful translation to human brain organization and clinical outcomes.",10.1016/s0022-3565(25)05739-8,cd4e10b2b8815938557e0685fc40a7d32676f8d6,https://doi.org/10.1016/s0022-3565(25)05739-8,,JournalArticle,unknown,brain; cerebral,"This study has been primarily a search for evidence either for or against the view originally expressed by Barbour and Abel (1) that the increase in susceptibility to acid fuchsin in frogs after decerebration was due to the failure, because of decerebration, of a previously functional inhibitory mechanism. 1. It was found that removal of one cerebral hemisphere was as effective as complete decerebration in increasing the susceptibility of frogs to acid fuchsin. 2. The presence of one uninjured cerebral hemisphere failed to alter either the character or the time of appearance of convulsions when compared with the results of complete decerebration. 3. The following procedures have also been shown to increase definitely and markedly the susceptibility of frogs to the convulsant effects of acid fuchsin: a. Injuries to the olfactory lobes. b. Injuries to the brain which were considered to be too slight to interfere seriously with function, such as simple needle punctures. c. Injuries to the spinal cord including both transection and needle punctures. d. Deep etherization, in which respiration ceased for a time. 4. After transection of the spinal cord at the level of the inferior angles of the scapulae the head end of the body was involved in convulsions before the posterior end, in spite of the fact that the cerebrum was uninjured and therefore should have been able to delay the onset of convulsions if the delay seen in normal frogs is due to inhibition. 5. The fact that injuries of such a wide variety, some of them ( b ) probably too slight to interfere seriously with function, cause an increase in the susceptibility of the frog to acid fuchsin similar in character to that produced by complete decerebration, speaks strongly against the view that the increase in susceptibility after complete decerebration is due to damage to a hypothetical inhibitory mechanism in the cerebrum. The question of the existence or non-existence of an inhibitory mechanism in the cerebrum is not the question at issue in this communication for the experimental methods used by both Barbour and Abel and myself are probably not suitable to decide that question. 6. It seems clear, therefore, that we are not dealing here with a factor of cerebral inhibition and that the conclusion previously drawn (3), to the effect that ""cerebral inhibition is a minor factor, if it is a factor at all, in determining the time of onset of acid fuchsin convulsions"" was fully warranted."
58,1924,A Few Suggestions in General Surgery,C. Walters,Bristol medico-chirurgical journal,1924-10-01,1,0,15.68,General Brain Science and Reviews,non-human,is described a method of tying ligatures by means of artery forceps.,high citation signal (1),"Broad reviews can dominate citation-ranked lists while obscuring narrower empirical advances.; Taxonomy boundaries are imperfect because many brain papers combine methods, scales, and diseases.; Non-human findings need careful translation to human brain organization and clinical outcomes.",,061d6a4faa6ffc1f88b7394bf74ee9e67897beb2,https://www.semanticscholar.org/paper/061d6a4faa6ffc1f88b7394bf74ee9e67897beb2,,JournalArticle,unknown,brain,"is described a method of tying ligatures by means of artery forceps. On this one has developed a technique by which all manoeuvres of ligaturing and suturing are done by means of pressure forceps, so that one may perhaps describe it as "" The Pressure Forceps Technique."" One has always seen in the so-called "" spoon and fork operation on bone, brain and joint an element of r^v introduced by hand ligaturing, and sometimes one has seen the operation still further jeopardised by hand suturing when gloves are so readily torn, whereas by means of tbe Pressure Forceps Technique the surgeon's hands appr?aC^"
59,1924,"II. SENSORI-MOTOR NEUROLOGY: 6. BRAIN, BASAL GANGLIA, TUMOR, APOPLEXY, CORTICAL FUNCTIONS",Briceno Rissi,Unknown venue,1924-10-01,0,0,20.0,"Cellular, Molecular, and Synaptic Neuroscience",,"Positions II. SENSORI-MOTOR NEUROLOGY: 6. BRAIN, BASAL GANGLIA, TUMOR, APOPLEXY, CORTICAL FUNCTIONS within Cellular, Molecular, and Synaptic Neuroscience.",high citation signal (0),"Cellular mechanisms can be difficult to connect directly to whole-brain dynamics or human behavior.; Single-cell sampling, dissociation, alignment, and batch effects can bias inferred cell populations.; Metadata-level ranking should be complemented with full-text expert review before strong claims are made.",10.1097/00005053-192410000-00005,96262d5233e7197e13d7c1167cf312f75edf7240,https://doi.org/10.1097/00005053-192410000-00005,,paper,unknown,brain; cortical; basal ganglia; glia; brain in title; neuroscience term,
60,1924,ALCOHOL INJECTION OF BRAIN CORTEX IN JACKSONIAN EPILEPSY,C. Dowman,Unknown venue,1924-11-08,0,0,16.0,Clinical Neurology and Neurodegeneration,,Positions ALCOHOL INJECTION OF BRAIN CORTEX IN JACKSONIAN EPILEPSY within Clinical Neurology and Neurodegeneration.,high citation signal (0),"Clinical cohorts often differ in disease stage, comorbidity, treatment history, and follow-up duration.; Biomarkers may not transfer cleanly across populations, scanners, care settings, or diagnostic criteria.; Metadata-level ranking should be complemented with full-text expert review before strong claims are made.",10.1001/jama.1924.02660190024007,e964bfdc22fdd087c02dafeb2c93aef312b66c60,https://doi.org/10.1001/jama.1924.02660190024007,,paper,unknown,brain; cortex; brain in title; neuroscience term,
61,1924,Book Reviews,"R. Sellar, P. Brown, E. Bowden",IEEE spectrum,1924-08-01,0,0,26.8,Clinical Neurology and Neurodegeneration,MRI;ECoG;human;non-human,This is a beautifully-produced book in the tradition of SpringerVerlag.,high citation signal (0); synthesis or review value; human evidence signal,"Clinical cohorts often differ in disease stage, comorbidity, treatment history, and follow-up duration.; Biomarkers may not transfer cleanly across populations, scanners, care settings, or diagnostic criteria.; Non-human findings need careful translation to human brain organization and clinical outcomes.",10.1007/BF00593520,604f35bbf0fe38309ce3a6bad0c99942b4eac19a,https://doi.org/10.1007/BF00593520,,Review,unknown,brain; cerebral; ecog; mri; neuroscience term,"This is a beautifully-produced book in the tradition of SpringerVerlag. Only 62 of the 237 pages relate directly to diagnostic imaging. This may discourage radiologists without a particular interest in AIDS from buying it. However the other sections, particularly the clinical neurology section, are also of great value. They document the changing clinical picture of AIDS since the introduction of antiviraI therapy and prophyaxis. So often the diagnosis of AIDS is made only by maintaining a high index of clinical suspicion. The radiology section has a comprehensive and up-to-day survey of the relevant literature, with some 400 references. This material however, has not been particularly well sifted. Many of the reports detailing only a few cases are given the same weight as those with a much larger number of better-documented cases. This is well illustrated in the chapter on lymphoma where two papers are quoted, one by Lee and the other by Schwaighofer. They compare the MRI appearances of lymphoma in AIDS and non-AIDS patients. Lee states that the lesions caused lymphoma in AIDS patients are larger, while Schwaighofer finds the exact opposite, the lesions in AIDS patients being smaller. Despite these two contradictory findings appearing on the same page, no critical comment is made by the authors. A more selective and considered approach to the literature would have been of greater value. The investigation of AIDS very much depends on local availability of CT and MRI. The authors recognise this problem and recommend CT as a basic examination which should be performed on all patients with full blown AIDS even if they have no central nervous system symptoms or signs. If MRI is freely available, this is recommended as the imaging method of choice. Some guidelines are given as to which patients should definitely go on to have MRI, but the precise investigative algorithm used by the authors is not given. It would be very useful to know which patients they believed should have gadolinium and what indications they had for brain biopsy. The book is well illustrated; some of the MR and CT images are of moderate quality, but their use is justified since the conditions illustrated are rare. Less satisfactory is the use of scans performed on non-AIDS patients to illustrate the appearances of cerebral abscess and tuberculosis: these patients have intensely enhancing lesions, whereas in patients with AIDS who have reduced white cell effectiveness, contrast enhancement may well be atypical. In summary the value of this book is in its extensive up-to-date bibliography and in the summary of this literative. But a more critical approach would have been more valuable to those involved in the practical management of AIDS patients. R. I. Sellar (Edinburgh) Science and Practice in Clinical Neurology. Eds.: S.C. Gandevia, D.J.Burke, M.Anthony. Cambridge: Cambridge University Press 1994, (ISBN 0-521-43119-0). s 35.00/US$ 59.95."
62,1924,A DEVELOPMENTAL ANOMALY OF THE CEREBRAL CORTEX,"E. A. Linell, A. Koster",Unknown venue,1924-08-01,0,0,10.0,"Brain Development, Plasticity, and Connectomics",,"Positions A DEVELOPMENTAL ANOMALY OF THE CEREBRAL CORTEX within Brain Development, Plasticity, and Connectomics.",high citation signal (0),"Developmental and aging studies are sensitive to cohort composition, attrition, and longitudinal sampling intervals.; Network measures can depend heavily on parcellation, thresholding, and acquisition choices.; Metadata-level ranking should be complemented with full-text expert review before strong claims are made.",10.1001/ARCHNEURPSYC.1924.02200020038004,6f8473fab0683c022c96267d52a6be2a9a786a59,https://doi.org/10.1001/ARCHNEURPSYC.1924.02200020038004,,paper,unknown,cerebral; cortex; neuroscience term,
63,1924,Editorial,J. Willmann,Construction Robotics,1924-08-01,0,0,16.6,"EEG, MEG, and Electrophysiology",EEG;human;non-human,"A,MONG the dwelling-places of neurological theory it is well from time to time to inspect foundations; else by constant usage we are apt to gain from the appearance of the superstructure a false sense of the solidity of the whole.",high citation signal (0); open-access PDF metadata; human evidence signal,"Low signal-to-noise ratio, artifacts, and source-localization uncertainty complicate interpretation.; Many studies rely on controlled tasks and may not generalize to everyday behavior or clinical monitoring.; Non-human findings need careful translation to human brain organization and clinical outcomes.",10.1136/jnnp.s1-5.18.151,48ecbb2f781080381028ae342d7e71d16770b9db,https://doi.org/10.1136/jnnp.s1-5.18.151,https://jnnp.bmj.com/content/jnnp/s1-5/18/151.full.pdf,paper,unknown,cerebral; cortex; neuroscience term,"A,MONG the dwelling-places of neurological theory it is well from time to time to inspect foundations; else by constant usage we are apt to gain from the appearance of the superstructure a false sense of the solidity of the whole. It is now nearly twenty years since the modern theory of cutaneous sensibility was founded upon the pioneer work of Head and Rivers. Their method, involving experimental nerve section in the human subject, was new to medical science, and, it seems, must form the basis of future researches in this direction. Their observations were precisely recorded, and have in the main been confirmed by subsequent workers. Their interpretation of these records, and the theory of sensory function which they consequentlv deduiced, have been widely accepted by physiologists, and have, moreover, served as a basis for further inquiries, which have reached their culmination in the attractive hypotheses set forth in Head's monograph on sensory disturbances in relation to lesions of the optic thalamus and of the cerebral cortex. The central idea which runs through Head's later papers is the belief, deduced from the first experiments, that sensibility in the peripheral nerve involves the existence of two separate groups of nerve fibres, the one ' protopathic,' of a primitive quality, the other ' epicritic,' concerned mainly with the finer differentiation of stimuli, of a higher order, and of more recent development in the history of the race. The explanation, in these terms, of the phenomena which accompany regeneration of the peripheral sensory nerve fibre is that in the first stage of regeneration the function of ' protopathic ' fibres may be observed, released for the time being from ' epicritic ' control. As the process of repair becomes completed, the process of evolution is briefly recapitulated. With the appearance of 'epicritic' sensibility, 'protopathic ' function is submerged. According to this hypothesis, therefore, the occurrence at a certain state of repair of a certain abnormal state of sensibility is explained as a ' release phenomenon.' The same doctrine explains subsequent conclusions concerning the clinical results of higher lesions. The abnormalities of sensation often associated"
64,1924,Influence of Pain and Its Attendants Upon the Cerebral Cortex Cells.,G. S. Foster,Unknown venue,1924-06-01,0,0,10.0,General Brain Science and Reviews,,Positions Influence of Pain and Its Attendants Upon the Cerebral Cortex Cells. within General Brain Science and Reviews.,high citation signal (0),"Broad reviews can dominate citation-ranked lists while obscuring narrower empirical advances.; Taxonomy boundaries are imperfect because many brain papers combine methods, scales, and diseases.; Metadata-level ranking should be complemented with full-text expert review before strong claims are made.",10.1213/00000539-192406000-00009,acf74927ef7da83423d0a3ebcbbfd6d9a07fe2c9,https://doi.org/10.1213/00000539-192406000-00009,,paper,unknown,cerebral; cortex; neuroscience term,
65,1924,"3. BRAIN, MENINGES, TRAUMA: TUBERCULOUS MENINGITIS OF CHILDHOOD",H. S. Reichle,Unknown venue,1924-08-01,0,0,8.0,"Brain Development, Plasticity, and Connectomics",,"Positions 3. BRAIN, MENINGES, TRAUMA: TUBERCULOUS MENINGITIS OF CHILDHOOD within Brain Development, Plasticity, and Connectomics.",high citation signal (0),"Developmental and aging studies are sensitive to cohort composition, attrition, and longitudinal sampling intervals.; Network measures can depend heavily on parcellation, thresholding, and acquisition choices.; Metadata-level ranking should be complemented with full-text expert review before strong claims are made.",10.1097/00005053-192408000-00009,c962128fe3a29676620c73189b5c67dc400e26f0,https://doi.org/10.1097/00005053-192408000-00009,,paper,unknown,brain; brain in title,
66,1924,"7. BRAIN, ANATOMY PHYSIOLOGY, VASCULAR DISTURBANCES: CISTERN PUNCTURE IN SPINAL SUBARACHNOID BLOCK",J. Ayer,Unknown venue,1924-08-01,0,0,8.0,General Brain Science and Reviews,,"Positions 7. BRAIN, ANATOMY PHYSIOLOGY, VASCULAR DISTURBANCES: CISTERN PUNCTURE IN SPINAL SUBARACHNOID BLOCK within General Brain Science and Reviews.",high citation signal (0),"Broad reviews can dominate citation-ranked lists while obscuring narrower empirical advances.; Taxonomy boundaries are imperfect because many brain papers combine methods, scales, and diseases.; Metadata-level ranking should be complemented with full-text expert review before strong claims are made.",10.1097/00005053-192408000-00071,6041e13c5d2cb0a8843e86551844925740de02c1,https://doi.org/10.1097/00005053-192408000-00071,,paper,unknown,brain; brain in title,
67,1924,A Case of Brain Tumour with Symptoms Suggesting Epidemic Encephalitis,J. A. O'flynn,Journal of the Royal Naval Medical Service,1924-07-01,0,0,8.0,General Brain Science and Reviews,,Positions A Case of Brain Tumour with Symptoms Suggesting Epidemic Encephalitis within General Brain Science and Reviews.,high citation signal (0),"Broad reviews can dominate citation-ranked lists while obscuring narrower empirical advances.; Taxonomy boundaries are imperfect because many brain papers combine methods, scales, and diseases.; Metadata-level ranking should be complemented with full-text expert review before strong claims are made.",10.1136/jrnms-10-219,4a1877cacd11e26b67f6d63c1ed584015b2f7eb0,https://doi.org/10.1136/jrnms-10-219,,paper,unknown,brain; brain in title,
