rank,year,title,authors,venue,publicationDate,citationCount,influentialCitationCount,importanceScore,category,keywordTags,keyIdea,strengths,limitations,doi,sourceId,url,semanticScholarUrl,openAccessPdf,githubUrl,workType,language,relevanceReason,abstract
1,2009,Complex brain networks: graph theoretical analysis of structural and functional systems,"E. Bullmore, O. Sporns",Nature Reviews Neuroscience,2009-03-01,11616,652,192.68,General Brain Science and Reviews,connectome,Positions Complex brain networks: graph theoretical analysis of structural and functional systems within General Brain Science and Reviews.,"high citation signal (11,616); recognized venue; open-access PDF metadata","Broad reviews can dominate citation-ranked lists while obscuring narrower empirical advances.; Taxonomy boundaries are imperfect because many brain papers combine methods, scales, and diseases.; Metadata-level ranking should be complemented with full-text expert review before strong claims are made.",10.1038/nrn2575,59cdf849049627e4c30f3bd866e3a7e03e893251,https://doi.org/10.1038/nrn2575,https://www.semanticscholar.org/paper/59cdf849049627e4c30f3bd866e3a7e03e893251,https://www.nature.com/articles/nrn2618.pdf,,Review; JournalArticle,unknown,brain; brain in title,
2,2009,A robust and high-throughput Cre reporting and characterization system for the whole mouse brain,"L. Madisen, T. Zwingman, S. Sunkin, S. W. Oh, Hatim A. Zariwala, Hong Gu, et al.",Nature Neuroscience,2009-12-20,6451,455,192.1,"Cellular, Molecular, and Synaptic Neuroscience",non-human,The Cre/lox system is widely used in mice to achieve cell-type-specific gene expression.,"high citation signal (6,451); recognized venue; open-access PDF metadata","Cellular mechanisms can be difficult to connect directly to whole-brain dynamics or human behavior.; Single-cell sampling, dissociation, alignment, and batch effects can bias inferred cell populations.; Non-human findings need careful translation to human brain organization and clinical outcomes.",10.1038/nn.2467,ed8d407bc8d06186ca2fd6b1cd4238b189f1903a,https://doi.org/10.1038/nn.2467,https://www.semanticscholar.org/paper/ed8d407bc8d06186ca2fd6b1cd4238b189f1903a,https://www.ncbi.nlm.nih.gov/pmc/articles/PMC2840225,,JournalArticle,unknown,brain; cortex; neuron; brain in title; neuroscience term,"The Cre/lox system is widely used in mice to achieve cell-type-specific gene expression. However, a strong and universally responding system to express genes under Cre control is still lacking. We have generated a set of Cre reporter mice with strong, ubiquitous expression of fluorescent proteins of different spectra. The robust native fluorescence of these reporters enables direct visualization of fine dendritic structures and axonal projections of the labeled neurons, which is useful in mapping neuronal circuitry, imaging and tracking specific cell populations in vivo. Using these reporters and a high-throughput in situ hybridization platform, we are systematically profiling Cre-directed gene expression throughout the mouse brain in several Cre-driver lines, including new Cre lines targeting different cell types in the cortex. Our expression data are displayed in a public online database to help researchers assess the utility of various Cre-driver lines for cell-type-specific genetic manipulation."
3,2009,Correspondence of the brain's functional architecture during activation and rest,"Stephen M. Smith, Peter T. Fox, K. Miller, D. Glahn, P. Fox, C. Mackay, et al.",Proceedings of the National Academy of Sciences of the United States of America,2009-08-04,5299,568,177.36,General Brain Science and Reviews,,Positions Correspondence of the brain's functional architecture during activation and rest within General Brain Science and Reviews.,"high citation signal (5,299); recognized venue; open-access PDF metadata","Broad reviews can dominate citation-ranked lists while obscuring narrower empirical advances.; Taxonomy boundaries are imperfect because many brain papers combine methods, scales, and diseases.; Metadata-level ranking should be complemented with full-text expert review before strong claims are made.",10.1073/pnas.0905267106,66cedab15c294a206785ffc8e797dca66813c906,https://doi.org/10.1073/pnas.0905267106,https://www.semanticscholar.org/paper/66cedab15c294a206785ffc8e797dca66813c906,https://europepmc.org/articles/pmc2722273?pdf=render,,JournalArticle,unknown,brain; brain in title,
4,2009,Emotion circuits in the brain.,Joseph E LeDoux,Annual Review of Neuroscience,2009-04-01,4397,425,171.0,General Brain Science and Reviews,,Positions Emotion circuits in the brain. within General Brain Science and Reviews.,"high citation signal (4,397); recognized venue","Broad reviews can dominate citation-ranked lists while obscuring narrower empirical advances.; Taxonomy boundaries are imperfect because many brain papers combine methods, scales, and diseases.; Metadata-level ranking should be complemented with full-text expert review before strong claims are made.",10.1176/FOC.7.2.FOC274,628992cf0818029f0624aad75e4a83f3ce3be1aa,https://doi.org/10.1176/foc.7.2.foc274,https://www.semanticscholar.org/paper/628992cf0818029f0624aad75e4a83f3ce3be1aa,,,Review; JournalArticle,unknown,brain; brain in title,
5,2009,Cancer-associated IDH1 mutations produce 2-hydroxyglutarate,"L. Dang, D. White, S. Gross, Bryson D. Bennett, M. Bittinger, E. Driggers, et al.",Nature,2009-12-10,4034,232,168.85,Clinical Neurology and Neurodegeneration,human;non-human,Mutations in the enzyme cytosolic isocitrate dehydrogenase 1 (IDH1) are a common feature of a major subset of primary human brain cancers.,"high citation signal (4,034); recognized venue; open-access PDF metadata; human evidence signal","Clinical cohorts often differ in disease stage, comorbidity, treatment history, and follow-up duration.; Biomarkers may not transfer cleanly across populations, scanners, care settings, or diagnostic criteria.; Non-human findings need careful translation to human brain organization and clinical outcomes.",10.1038/nature08617,d2cf3e93599561e919b1aa49734bead20075925d,https://doi.org/10.1038/nature08617,https://www.semanticscholar.org/paper/d2cf3e93599561e919b1aa49734bead20075925d,https://www.ncbi.nlm.nih.gov/pmc/articles/PMC2818760,,JournalArticle,unknown,brain,"Mutations in the enzyme cytosolic isocitrate dehydrogenase 1 (IDH1) are a common feature of a major subset of primary human brain cancers. These mutations occur at a single amino acid residue of the IDH1 active site, resulting in loss of the enzyme's ability to catalyse conversion of isocitrate to α-ketoglutarate. However, only a single copy of the gene is mutated in tumours, raising the possibility that the mutations do not result in a simple loss of function. Here we show that cancer-associated IDH1 mutations result in a new ability of the enzyme to catalyse the NADPH-dependent reduction of α-ketoglutarate to R(-)-2-hydroxyglutarate (2HG). Structural studies demonstrate that when arginine 132 is mutated to histidine, residues in the active site are shifted to produce structural changes consistent with reduced oxidative decarboxylation of isocitrate and acquisition of the ability to convert α-ketoglutarate to 2HG. Excess accumulation of 2HG has been shown to lead to an elevated risk of malignant brain tumours in patients with inborn errors of 2HG metabolism. Similarly, in human malignant gliomas harbouring IDH1 mutations, we find markedly elevated levels of 2HG. These data demonstrate that the IDH1 mutations result in production of the onco-metabolite 2HG, and indicate that the excess 2HG which accumulates in vivo contributes to the formation and malignant progression of gliomas."
6,2009,"Effects of stress throughout the lifespan on the brain, behaviour and cognition","S. Lupien, B. McEwen, M. Gunnar, Christine Marcelle Heim",Nature Reviews Neuroscience,2009-06-01,3966,102,169.14,General Brain Science and Reviews,,"Positions Effects of stress throughout the lifespan on the brain, behaviour and cognition within General Brain Science and Reviews.","high citation signal (3,966); recognized venue","Broad reviews can dominate citation-ranked lists while obscuring narrower empirical advances.; Taxonomy boundaries are imperfect because many brain papers combine methods, scales, and diseases.; Metadata-level ranking should be complemented with full-text expert review before strong claims are made.",10.1038/nrn2639,a0113241e6bbe11348ff3e758d627be26d370b8d,https://doi.org/10.1038/nrn2639,https://www.semanticscholar.org/paper/a0113241e6bbe11348ff3e758d627be26d370b8d,,,Review; JournalArticle,unknown,brain; brain in title,
7,2009,Where is the semantic system? A critical review and meta-analysis of 120 functional neuroimaging studies.,"J. Binder, Rutvik H. Desai, W. Graves, L. Conant",Cerebral Cortex,2009-12-01,3832,330,173.53,Neuroimaging and Brain Mapping,,Positions Where is the semantic system? A critical review and meta-analysis of 120 functional neuroimaging studies. within Neuroimaging and Brain Mapping.,"high citation signal (3,832); recognized venue; open-access PDF metadata; synthesis or review value","Scanner, protocol, site, and preprocessing variation can limit reproducibility across cohorts.; Associational imaging biomarkers often need stronger longitudinal or intervention evidence before causal claims are made.; Metadata-level ranking should be complemented with full-text expert review before strong claims are made.",10.1093/cercor/bhp055,f6865ed39f0fc55b43c5d6b93e8ca597a21a9ccb,https://doi.org/10.1093/cercor/bhp055,https://www.semanticscholar.org/paper/f6865ed39f0fc55b43c5d6b93e8ca597a21a9ccb,,,Review; MetaAnalysis; JournalArticle,unknown,neuroimaging,
8,2009,Inflammation and Its Discontents: The Role of Cytokines in the Pathophysiology of Major Depression,"Andrew H. Miller, V. Maletić, C. Raison",Biological Psychiatry,2009-01-15,3732,167,162.65,Cognitive and Systems Neuroscience,ECoG;human;non-human,Recognition that inflammation may represent a common mechanism of disease has been extended to include neuropsychiatric disorders including major depression.,"high citation signal (3,732); open-access PDF metadata; human evidence signal","Task designs can simplify cognition enough that ecological validity becomes uncertain.; Cross-species alignment between circuits, behavior, and subjective experience remains imperfect.; Non-human findings need careful translation to human brain organization and clinical outcomes.",10.1016/j.biopsych.2008.11.029,3a35e840564ff1b9f616dd537a27b35b5cace508,https://doi.org/10.1016/j.biopsych.2008.11.029,https://www.semanticscholar.org/paper/3a35e840564ff1b9f616dd537a27b35b5cace508,,,Review; JournalArticle,unknown,brain; neural; glia; ecog,"Recognition that inflammation may represent a common mechanism of disease has been extended to include neuropsychiatric disorders including major depression. Patients with major depression have been found to exhibit increased peripheral blood inflammatory biomarkers, including inflammatory cytokines, which have been shown to access the brain and interact with virtually every pathophysiologic domain known to be involved in depression, including neurotransmitter metabolism, neuroendocrine function, and neural plasticity. Indeed, activation of inflammatory pathways within the brain is believed to contribute to a confluence of decreased neurotrophic support and altered glutamate release/reuptake, as well as oxidative stress, leading to excitotoxicity and loss of glial elements, consistent with neuropathologic findings that characterize depressive disorders. Further instantiating the link between inflammation and depression are data demonstrating that psychosocial stress, a well-known precipitant of mood disorders, is capable of stimulating inflammatory signaling molecules, including nuclear factor kappa B, in part, through activation of sympathetic nervous system outflow pathways. Interestingly, depressed patients with increased inflammatory biomarkers have been found to be more likely to exhibit treatment resistance, and in several studies, antidepressant therapy has been associated with decreased inflammatory responses. Finally, preliminary data from patients with inflammatory disorders, as well as medically healthy depressed patients, suggest that inhibiting proinflammatory cytokines or their signaling pathways may improve depressed mood and increase treatment response to conventional antidepressant medication. Translational implications of these findings include the unique opportunity to identify relevant patient populations, apply immune-targeted therapies, and monitor therapeutic efficacy at the level of the immune system in addition to behavior."
9,2009,Accurate and Robust Brain Image Alignment using Boundary-based Registration,"D. Greve, B. Fischl",NeuroImage,2009-06-30,3491,242,177.45,Neuroimaging and Brain Mapping,fMRI;human;non-human,The fine spatial scales of the structures in the human brain represent an enormous challenge to the successful integration of information from different images for both within- and between-subject analysis.,"high citation signal (3,491); recognized venue; open-access PDF metadata; human evidence signal","Scanner, protocol, site, and preprocessing variation can limit reproducibility across cohorts.; Associational imaging biomarkers often need stronger longitudinal or intervention evidence before causal claims are made.; Non-human findings need careful translation to human brain organization and clinical outcomes.",10.1016/j.neuroimage.2009.06.060,c65d341e1313e153cbce97dc9de38bbf6b94bcfc,https://doi.org/10.1016/j.neuroimage.2009.06.060,https://www.semanticscholar.org/paper/c65d341e1313e153cbce97dc9de38bbf6b94bcfc,,,JournalArticle; Study,unknown,brain; fmri; mri; brain in title,"The fine spatial scales of the structures in the human brain represent an enormous challenge to the successful integration of information from different images for both within- and between-subject analysis. While many algorithms to register image pairs from the same subject exist, visual inspection shows that their accuracy and robustness to be suspect, particularly when there are strong intensity gradients and/or only part of the brain is imaged. This paper introduces a new algorithm called Boundary-Based Registration, or BBR. The novelty of BBR is that it treats the two images very differently. The reference image must be of sufficient resolution and quality to extract surfaces that separate tissue types. The input image is then aligned to the reference by maximizing the intensity gradient across tissue boundaries. Several lower quality images can be aligned through their alignment with the reference. Visual inspection and fMRI results show that BBR is more accurate than correlation ratio or normalized mutual information and is considerably more robust to even strong intensity inhomogeneities. BBR also excels at aligning partial brain images to whole brain images, a domain in which existing registration algorithms frequently fail. Even in the limit of registering a single slice, we show the BBR results to be robust and accurate."
10,2009,Epigenetic regulation of the glucocorticoid receptor in human brain associates with childhood abuse,"Patrick O. McGowan, Aya Sasaki, A. D'Alessio, Sergiy Dymov, B. Labonté, M. Szyf, et al.",Nature Neuroscience,2009-03-01,3385,112,181.69,"Cellular, Molecular, and Synaptic Neuroscience",human;non-human,Maternal care influences hypothalamic-pituitary-adrenal (HPA) function in the rat through epigenetic programming of glucocorticoid receptor expression.,"high citation signal (3,385); recognized venue; open-access PDF metadata; human evidence signal","Cellular mechanisms can be difficult to connect directly to whole-brain dynamics or human behavior.; Single-cell sampling, dissociation, alignment, and batch effects can bias inferred cell populations.; Non-human findings need careful translation to human brain organization and clinical outcomes.",10.1038/nn.2270,022c7a6f8ba921f08818d42db5c61985f0d7c9d5,https://doi.org/10.1038/nn.2270,https://www.semanticscholar.org/paper/022c7a6f8ba921f08818d42db5c61985f0d7c9d5,,,JournalArticle; Study,unknown,brain; neuron; hippocampus; brain in title; neuroscience term,"Maternal care influences hypothalamic-pituitary-adrenal (HPA) function in the rat through epigenetic programming of glucocorticoid receptor expression. In humans, childhood abuse alters HPA stress responses and increases the risk of suicide. We examined epigenetic differences in a neuron-specific glucocorticoid receptor (NR3C1) promoter between postmortem hippocampus obtained from suicide victims with a history of childhood abuse and those from either suicide victims with no childhood abuse or controls. We found decreased levels of glucocorticoid receptor mRNA, as well as mRNA transcripts bearing the glucocorticoid receptor 1F splice variant and increased cytosine methylation of an NR3C1 promoter. Patch-methylated NR3C1 promoter constructs that mimicked the methylation state in samples from abused suicide victims showed decreased NGFI-A transcription factor binding and NGFI-A-inducible gene transcription. These findings translate previous results from rat to humans and suggest a common effect of parental care on the epigenetic regulation of hippocampal glucocorticoid receptor expression."
11,2009,Stress signalling pathways that impair prefrontal cortex structure and function,A. Arnsten,Nature Reviews Neuroscience,2009-06-01,2934,222,172.72,General Brain Science and Reviews,,The prefrontal cortex (PFC) - the most evolved brain region - subserves our highest-order cognitive abilities.,"high citation signal (2,934); recognized venue; open-access PDF metadata","Broad reviews can dominate citation-ranked lists while obscuring narrower empirical advances.; Taxonomy boundaries are imperfect because many brain papers combine methods, scales, and diseases.; Metadata-level ranking should be complemented with full-text expert review before strong claims are made.",10.1038/nrn2648,0dc97e04c80a39062c9a0dc3810bd6b1ed86c05e,https://doi.org/10.1038/nrn2648,https://www.semanticscholar.org/paper/0dc97e04c80a39062c9a0dc3810bd6b1ed86c05e,,,Review; JournalArticle,unknown,brain; cortex; cortical; prefrontal; neuroscience term,"The prefrontal cortex (PFC) - the most evolved brain region - subserves our highest-order cognitive abilities. However, it is also the brain region that is most sensitive to the detrimental effects of stress exposure. Even quite mild acute uncontrollable stress can cause a rapid and dramatic loss of prefrontal cognitive abilities, and more prolonged stress exposure causes architectural changes in prefrontal dendrites. Recent research has begun to reveal the intracellular signalling pathways that mediate the effects of stress on the PFC. This research has provided clues as to why genetic or environmental insults that disinhibit stress signalling pathways can lead to symptoms of profound prefrontal cortical dysfunction in mental illness."
12,2009,"Cortical Hubs Revealed by Intrinsic Functional Connectivity: Mapping, Assessment of Stability, and Relation to Alzheimer's Disease","R. Buckner, J. Sepulcre, Tanveer Talukdar, Fenna M. Krienen, Hesheng Liu, T. Hedden, et al.",Journal of Neuroscience,2009-02-11,2855,245,180.23,"Brain Development, Plasticity, and Connectomics",MRI;fMRI;human;non-human;connectome,"Recent evidence suggests that some brain areas act as hubs interconnecting distinct, functionally specialized systems.","high citation signal (2,855); recognized venue; open-access PDF metadata; human evidence signal","Developmental and aging studies are sensitive to cohort composition, attrition, and longitudinal sampling intervals.; Network measures can depend heavily on parcellation, thresholding, and acquisition choices.; Non-human findings need careful translation to human brain organization and clinical outcomes.",10.1523/JNEUROSCI.5062-08.2009,33625011888a2f86233a4e5bd07643ad6f7041b7,https://doi.org/10.1523/jneurosci.5062-08.2009,https://www.semanticscholar.org/paper/33625011888a2f86233a4e5bd07643ad6f7041b7,,,JournalArticle; Study,unknown,brain; cerebral; cortex; cortical; prefrontal; neuroscience term,"Recent evidence suggests that some brain areas act as hubs interconnecting distinct, functionally specialized systems. These nexuses are intriguing because of their potential role in integration and also because they may augment metabolic cascades relevant to brain disease. To identify regions of high connectivity in the human cerebral cortex, we applied a computationally efficient approach to map the degree of intrinsic functional connectivity across the brain. Analysis of two separate functional magnetic resonance imaging datasets (each n = 24) demonstrated hubs throughout heteromodal areas of association cortex. Prominent hubs were located within posterior cingulate, lateral temporal, lateral parietal, and medial/lateral prefrontal cortices. Network analysis revealed that many, but not all, hubs were located within regions previously implicated as components of the default network. A third dataset (n = 12) demonstrated that the locations of hubs were present across passive and active task states, suggesting that they reflect a stable property of cortical network architecture. To obtain an accurate reference map, data were combined across 127 participants to yield a consensus estimate of cortical hubs. Using this consensus estimate, we explored whether the topography of hubs could explain the pattern of vulnerability in Alzheimer's disease (AD) because some models suggest that regions of high activity and metabolism accelerate pathology. Positron emission tomography amyloid imaging in AD (n = 10) compared with older controls (n = 29) showed high amyloid-β deposition in the locations of cortical hubs consistent with the possibility that hubs, while acting as critical way stations for information processing, may also augment the underlying pathological cascade in AD."
13,2009,Bayesian analysis of neuroimaging data in FSL,"M. Woolrich, S. Jbabdi, B. Patenaude, M. Chappell, S. Makni, Timothy Edward John Behrens, et al.",NeuroImage,2009-03-01,2675,337,156.06,Neuroimaging and Brain Mapping,,Positions Bayesian analysis of neuroimaging data in FSL within Neuroimaging and Brain Mapping.,"high citation signal (2,675); recognized venue","Scanner, protocol, site, and preprocessing variation can limit reproducibility across cohorts.; Associational imaging biomarkers often need stronger longitudinal or intervention evidence before causal claims are made.; Metadata-level ranking should be complemented with full-text expert review before strong claims are made.",10.1016/j.neuroimage.2008.10.055,8e0892fa44f6e873263343d3c9de1f695df2ca90,https://doi.org/10.1016/j.neuroimage.2008.10.055,https://www.semanticscholar.org/paper/8e0892fa44f6e873263343d3c9de1f695df2ca90,,,JournalArticle,unknown,neuroimaging,
14,2009,From the Triumvirate to the Ominous Octet: A New Paradigm for the Treatment of Type 2 Diabetes Mellitus,R. DeFronzo,Diabetes,2009-04-01,2660,63,151.36,"EEG, MEG, and Electrophysiology",ECoG;non-human,Insulin resistance in muscle and liver and β-cell failure represent the core pathophysiologic defects in type 2 diabetes.,"high citation signal (2,660); open-access PDF metadata","Low signal-to-noise ratio, artifacts, and source-localization uncertainty complicate interpretation.; Many studies rely on controlled tasks and may not generalize to everyday behavior or clinical monitoring.; Non-human findings need careful translation to human brain organization and clinical outcomes.",10.2337/db09-9028,7925837ed3c57ff87f49c4815059ef23d49e4625,https://doi.org/10.2337/db09-9028,https://www.semanticscholar.org/paper/7925837ed3c57ff87f49c4815059ef23d49e4625,,,paper,unknown,brain; ecog,"Insulin resistance in muscle and liver and β-cell failure represent the core pathophysiologic defects in type 2 diabetes. It now is recognized that the β-cell failure occurs much earlier and is more severe than previously thought. Subjects in the upper tertile of impaired glucose tolerance (IGT) are maximally/near-maximally insulin resistant and have lost over 80% of their β-cell function. In addition to the muscle, liver, and β-cell (triumvirate), the fat cell (accelerated lipolysis), gastrointestinal tract (incretin deficiency/resistance), α-cell (hyperglucagonemia), kidney (increased glucose reabsorption), and brain (insulin resistance) all play important roles in the development of glucose intolerance in type 2 diabetic individuals. Collectively, these eight players comprise the ominous octet and dictate that: 1 ) multiple drugs used in combination will be required to correct the multiple pathophysiological defects, 2 ) treatment should be based upon reversal of known pathogenic abnormalities and not simply on reducing the A1C, and 3 ) therapy must be started early to prevent/slow the progressive β-cell failure that already is well established in IGT subjects. A treatment paradigm shift is recommended in which combination therapy is initiated with diet/exercise, metformin (which improves insulin sensitivity and has antiatherogenic effects), a thiazolidinedione (TZD) (which improves insulin sensitivity, preserves β-cell function, and exerts antiatherogenic effects), and exenatide (which preserves β-cell function and promotes weight loss). Sulfonylureas are not recommended because, after an initial improvement in glycemic control, they are associated with a progressive rise in A1C and progressive loss of β-cell function. The natural history of type 2 diabetes has been well described in multiple populations (1-16) (rev. in (17,18). Individuals destined to develop type 2 diabetes inherit a set of genes from their parents that make their tissues resistant to insulin (1,16,19-24). In liver, the insulin resistance is manifested by …"
